OKRES	KODZASTUP	NAZEVZAST	COBVODU	POR_STR_HL	OSTRANA	VSTRANA	NAZEVCELK	ZKRATKAO30	ZKRATKAO8	POCSTR_SLO	SLOZENI	HLASY_STR	PROCHLSTR	MAND_STR
8103	599069	Orlová	1	1	768	768	ANO 2011	ANO 2011	ANO	1	768	46160	24.09	8
8103	599069	Orlová	1	2	53	53	Občanská demokratická strana	Občanská demokratická strana	ODS	1	053	13292	6.93	2
8103	599069	Orlová	1	3	1328	1328	Koalice politických hnutí NEZÁVISLÍ a Změna pro lidi	Koal.NEZÁVISLÍ+Změna pro lidi	NEZ+ZpL	2	088,1123	32491	16.96	6
8103	599069	Orlová	1	4	1	1	Křesťanská a demokratická unie - Československá strana lidová	Křesť.demokr.unie-Čs.str.lid.	KDU-ČSL	1	001	9011	4.7	0
8103	599069	Orlová	1	5	1114	1114	Svoboda a přímá demokracie - Tomio Okamura (SPD)	Svob.a př.dem.-T.Okamura (SPD)	SPD	1	1114	21000	10.96	4
8103	599069	Orlová	1	6	733	733	"""Volím Orlovou"""	"""Volím Orlovou"""	"""VO"""	1	733	15854	8.27	3
8103	599069	Orlová	1	7	724	724	Strana Práv Občanů ZEMANOVCI	Strana Práv Občanů ZEMANOVCI	SPOZ	1	724	10195	5.32	1
8103	599069	Orlová	1	8	7	7	Česká strana sociálně demokratická	Česká str.sociálně demokrat.	ČSSD	1	007	17534	9.15	3
8103	599069	Orlová	1	9	47	47	Komunistická strana Čech a Moravy	Komunistická str.Čech a Moravy	KSČM	1	047	26027	13.58	4