OKRES	KODZASTUP	NAZEVZAST	COBVODU	POR_STR_HL	OSTRANA	VSTRANA	NAZEVCELK	ZKRATKAO30	ZKRATKAO8	POCSTR_SLO	SLOZENI	HLASY_STR	PROCHLSTR	MAND_STR
2102	534285	Podbrdy	1	1	806	80	nezávislý kandidát Pavel Ševčík	Pavel Ševčík	NK	1	080			
2102	534285	Podbrdy	1	2	804	80	nezávislý kandidát Pavel Kisling	Pavel Kisling	NK	1	080			
2102	534285	Podbrdy	1	3	801	80	nezávislý kandidát Patrik Gottfried	Patrik Gottfried	NK	1	080			
2102	534285	Podbrdy	1	4	802	80	nezávislý kandidát Martin Čermák	Martin Čermák	NK	1	080			
2102	534285	Podbrdy	1	5	803	80	nezávislý kandidát Rostislav Čermák	Rostislav Čermák	NK	1	080			
2102	534285	Podbrdy	1	6	805	80	nezávislý kandidát Lenka Klimtová	Lenka Klimtová	NK	1	080			