OKRES	KODZASTUP	NAZEVZAST	COBVODU	POR_STR_HL	OSTRANA	VSTRANA	NAZEVCELK	ZKRATKAO30	ZKRATKAO8	POCSTR_SLO	SLOZENI	HLASY_STR	PROCHLSTR	MAND_STR
5203	573868	Náchod	1	1	364	364	Sdružení politické strany Strana zelených a nezávislých kandidátů	Sdružení SZ, NK		2	005,080	10878	6.45	2
5203	573868	Náchod	1	2	477	477	Patrioti města Náchoda-sdružení SSO a NK	Sdružení Svobodní, NK		2	080,714	25400	15.07	4
5203	573868	Náchod	1	3	470	470	SOS pro Náchod	"Sdružení ""NSK"", NK"		2	080,166	12904	7.65	2
5203	573868	Náchod	1	4	721	721	TOP 09	TOP 09	TOP 09	1	721	16963	10.06	3
5203	573868	Náchod	1	5	47	47	Komunistická strana Čech a Moravy	Komunistická str.Čech a Moravy	KSČM	1	047	15354	9.11	2
5203	573868	Náchod	1	6	339	339	Koalice pro město (KDU-ČSL a Nestraníci)	Koalice KDU-ČSL, Nestraníci		2	001,181	16236	9.63	3
5203	573868	Náchod	1	7	53	53	Občanská demokratická strana	Občanská demokratická strana	ODS	1	053	26103	15.49	4
5203	573868	Náchod	1	8	663	663	Volba pro Náchod-koal. Věcí veřejných,SNK-ED a Nezávislých kandidátů	Koalice SNK ED a VV		2	129,144	13593	8.06	2
5203	573868	Náchod	1	9	7	7	Česká strana sociálně demokratická	Česká str.sociálně demokrat.	ČSSD	1	007	31055	18.43	5