OKRES	KODZASTUP	NAZEVZAST	COBVODU	POR_STR_HL	OSTRANA	VSTRANA	NAZEVCELK	ZKRATKAO30	ZKRATKAO8	POCSTR_SLO	SLOZENI	HLASY_STR	PROCHLSTR	MAND_STR
4102	554995	Bečov nad Teplou	1	1	901	90	Sdružení nezávislých kandidátů v Bečově nad Teplou	Sdruž.nezáv.kand.v Bečově n/T.	SNK	1	080	1482	22.34	3
4102	554995	Bečov nad Teplou	1	2	112	112	HNUTÍ NEZÁVISLÝCH ZA HARMONICKÝ ROZVOJ OBCÍ A MĚST	HN.ZA HARM.ROZVOJ OBCÍ A MĚST	HNHRM	1	112	1747	26.34	4
4102	554995	Bečov nad Teplou	1	3	479	479	Volba pro Bečov	Sdružení KDU-ČSL, SZ, NK		3	001,005,080	2003	30.2	5
4102	554995	Bečov nad Teplou	1	4	47	47	Komunistická strana Čech a Moravy	Komunistická str.Čech a Moravy	KSČM	1	047	477	15.41	1
4102	554995	Bečov nad Teplou	1	5	724	724	Strana Práv Občanů ZEMANOVCI	Strana Práv Občanů ZEMANOVCI	SPOZ	1	724	846	12.75	2
4102	554995	Bečov nad Teplou	1	6	902	90	Náplava v Bečově nad Teplou	Náplava v Bečově nad Teplou	SNK	1	080	77	8.7	0