OKRES	KODZASTUP	NAZEVZAST	COBVODU	POR_STR_HL	OSTRANA	VSTRANA	NAZEVCELK	ZKRATKAO30	ZKRATKAO8	POCSTR_SLO	SLOZENI	HLASY_STR	PROCHLSTR	MAND_STR
5301	572314	Střemošice	1	1	807	80	Petr Študent, nezávislý kandidát	Petr Študent, NK	NK	1	080	66	95.85	1
5301	572314	Střemošice	1	2	806	80	Jan Prokop, nezávislý kandidát	Jan Prokop, NK	NK	1	080	78	113.27	1
5301	572314	Střemošice	1	3	805	80	Jiří Pilař, nezávislý kandidát	Jiří Pilař, NK	NK	1	080	62	90.04	1
5301	572314	Střemošice	1	4	802	80	Hana Pelcová, nezávislý kandidát	Hana Pelcová, NK	NK	1	080	65	94.39	1
5301	572314	Střemošice	1	5	804	80	Rudolf Lexa, nezávislý kandidát	Rudolf Lexa, NK	NK	1	080	67	97.3	1
5301	572314	Střemošice	1	6	803	80	Bc. Radek Janoušek, nezávislý kandidát	Bc. Radek Janoušek, NK	NK	1	080	66	95.85	1
5301	572314	Střemošice	1	7	801	80	Eliška Hlinecká, nezávislý kandidát	Eliška Hlinecká, NK	NK	1	080	78	113.27	1