OKRES	KODZASTUP	NAZEVZAST	COBVODU	POR_STR_HL	OSTRANA	VSTRANA	NAZEVCELK	ZKRATKAO30	ZKRATKAO8	POCSTR_SLO	SLOZENI	HLASY_STR	PROCHLSTR	MAND_STR
2105	531359	Horky	1	1	805	80	Jiřina Štemberová, nezávislý kandidát	Jiřina Štemberová, NK	NK	1	080	163	96.69	1
2105	531359	Horky	1	2	804	80	Luboš Kruml, nezávislý kandidát	Luboš Kruml, NK	NK	1	080	149	88.38	1
2105	531359	Horky	1	3	7	7	Česká strana sociálně demokratická	Česká str.sociálně demokrat.	ČSSD	1	007	479	94.71	3
2105	531359	Horky	1	4	803	80	Miloslav Miláček, nezávislý kandidát	Miloslav Miláček, NK	NK	1	080	157	93.13	1
2105	531359	Horky	1	5	802	80	Miloslava Koudelková, nezávislý kandidát	Miloslava Koudelková, NK	NK	1	080	75	44.49	0
2105	531359	Horky	1	6	801	80	Jaroslav Uhlíř, nezávislý kandidát	Jaroslav Uhlíř, NK	NK	1	080	157	93.13	1