OKRES	KODZASTUP	NAZEVZAST	COBVODU	POR_STR_HL	OSTRANA	VSTRANA	NAZEVCELK	ZKRATKAO30	ZKRATKAO8	POCSTR_SLO	SLOZENI	HLASY_STR	PROCHLSTR	MAND_STR
3204	578592	Třebčice	1	1	801	80	Pavel Trhlík, nezávislý kandidát	Pavel Trhlík, NK	NK	1	080	31	92.73	1
3204	578592	Třebčice	1	2	802	80	Miroslav Herout, nezávislý kandidát	Miroslav Herout, NK	NK	1	080	31	92.73	1
3204	578592	Třebčice	1	3	803	80	Jana Flanderová, nezávislý kandidát	Jana Flanderová, NK	NK	1	080	35	104.7	1
3204	578592	Třebčice	1	4	804	80	Stanislav Martínek, nezávislý kandidát	Stanislav Martínek, NK	NK	1	080	26	77.77	1
3204	578592	Třebčice	1	5	805	80	Václav Vokáč, nezávislý kandidát	Václav Vokáč, NK	NK	1	080	38	113.67	1
3204	578592	Třebčice	1	6	806	80	Jaroslav Vokáč, nezávislý kandidát	Jaroslav Vokáč, NK	NK	1	080	22	65.81	1
3204	578592	Třebčice	1	7	807	80	Svatava Malecká, nezávislý kandidát	Svatava Malecká, NK	NK	1	080	19	56.83	0
3204	578592	Třebčice	1	8	808	80	Marie Trhlíková, nezávislý kandidát	Marie Trhlíková, NK	NK	1	080	32	95.72	1