OKRES	KODZASTUP	NAZEVZAST	COBVODU	POR_STR_HL	OSTRANA	VSTRANA	NAZEVCELK	ZKRATKAO30	ZKRATKAO8	POCSTR_SLO	SLOZENI	HLASY_STR	PROCHLSTR	MAND_STR
6207	594989	Tulešice	1	1	803	80	Lubomír Valda, nezávislý kandidát	Lubomír Valda, NK	NK	1	080	40	102.18	1
6207	594989	Tulešice	1	2	802	80	Jan Pazdera, nezávislý kandidát	Jan Pazdera, NK	NK	1	080	39	99.63	1
6207	594989	Tulešice	1	3	804	80	Jan Rozmahel, nezávislý kandidát	Jan Rozmahel, NK	NK	1	080	44	112.4	1
6207	594989	Tulešice	1	4	801	80	Olga Doležalová, nezávislý kandidát	Olga Doležalová, NK	NK	1	080	38	97.08	1
6207	594989	Tulešice	1	5	806	80	Jitka Pokorná, nezávislý kandidát	Jitka Pokorná, NK	NK	1	080	40	102.18	1
6207	594989	Tulešice	1	6	807	80	Ladislav Vondrák, nezávislý kandidát	Ladislav Vondrák, NK	NK	1	080	39	99.63	1
6207	594989	Tulešice	1	7	805	80	Miloš Chaloupka, nezávislý kandidát	Miloš Chaloupka, NK	NK	1	080	34	86.86	1