OKRES	KODZASTUP	NAZEVZAST	COBVODU	POR_STR_HL	OSTRANA	VSTRANA	NAZEVCELK	ZKRATKAO30	ZKRATKAO8	POCSTR_SLO	SLOZENI	HLASY_STR	PROCHLSTR	MAND_STR
5302	576018	Vyšehněvice	1	1	809	80	TOMÁŠ KOLMAN, nezávislý kandidát	TOMÁŠ KOLMAN, NK	NK	1	080	67	56.84	0
5302	576018	Vyšehněvice	1	2	802	80	Daniel Černík DiS, nezávislý kandidát	Daniel Černík DiS, NK	NK	1	080	90	76.36	1
5302	576018	Vyšehněvice	1	3	804	80	Mgr. Ivana Tyllerová, nezávislý kandidát	Mgr. Ivana Tyllerová, NK	NK	1	080	106	89.93	1
5302	576018	Vyšehněvice	1	4	808	80	JOSEF ČERNÍK, nezávislý kandidát	Josef Černík, NK	NK	1	080	62	52.6	0
5302	576018	Vyšehněvice	1	5	807	80	Jana Bobková, nezávislý kandidát	Jana Bobková, NK	NK	1	080	81	68.72	1
5302	576018	Vyšehněvice	1	6	805	80	Luboš Petržilka, nezávislý kandidát	Luboš Petržilka, NK	NK	1	080	113	95.87	1
5302	576018	Vyšehněvice	1	7	806	80	Ing. Jana Exnerová, nezávislý kandidát	Ing. Jana Exnerová, NK	NK	1	080	123	104.36	1
5302	576018	Vyšehněvice	1	8	803	80	Jarmila Hándlová, nezávislý kandidát	Jarmila Hándlová, NK	NK	1	080	99	84	1
5302	576018	Vyšehněvice	1	9	801	80	Jiří Semelka, nezávislý kandidát	Jiří Semelka, NK	NK	1	080	84	71.27	1