OKRES	KODZASTUP	COBVODU	POR_STR_HL	OSTRANA	PORCISLO	JMENO	PRIJMENI	TITULPRED	TITULZA	VEK	POVOLANI	BYDLISTEN	PSTRANA	NSTRANA	PLATNOST	POHLAVI
2109	538604	1	1	901	1	Martin	Hakauf	Mgr.		35	starosta obce Panenské Břežany	Panenské Břežany	99	80	A	M
2109	538604	1	1	901	2	Mikuláš	Végh	Ing.		81	místostarosta obce Panenské Břežany	Panenské Břežany	99	80	A	M
2109	538604	1	1	901	3	Lenka	Obstová	Ing. arch.		37	architekt, středoškolský pedagog	Panenské Břežany	99	80	A	F
2109	538604	1	1	901	4	Ladislav	Fiala	MUDr.		69	lékař, člen zastupitelstva obce Panenské Břežany	Panenské Břežany	99	80	A	M
2109	538604	1	1	901	5	Markéta	Slabá	Mgr.		36	sociální pracovník	Panenské Břežany	99	80	A	F
2109	538604	1	1	901	6	Ladislav	Kotrba			64	technik, člen zastupitelstva obce Panenské Břežany	Panenské Břežany	99	80	A	M
2109	538604	1	1	901	7	Petr	Kondelík			69	automechanik, člen zastupitelstva obce Panenské Břežany	Panenské Břežany	99	80	A	M