OKRES	KODZASTUP	NAZEVZAST	COBVODU	POR_STR_HL	OSTRANA	VSTRANA	NAZEVCELK	ZKRATKAO30	ZKRATKAO8	POCSTR_SLO	SLOZENI	HLASY_STR	PROCHLSTR	MAND_STR
2111	564478	Narysov	1	1	804	80	Jana Nováková, nezávislý kandidát	Jana Nováková, NK	JNNK	1	080	42	42.94	0
2111	564478	Narysov	1	2	806	80	Radka Čápová, nezávislý kandidát	Radka Čápová, NK	RČNK	1	080	56	57.25	1
2111	564478	Narysov	1	3	802	80	Vlasta Petýrková, nezávislý kandidát	Vlasta Petýrková, NK	VPNK	1	080	93	95.09	1
2111	564478	Narysov	1	4	803	80	Václav Franz, nezávislý kandidát	Václav Franz, NK	VFNK	1	080	50	51.12	1
2111	564478	Narysov	1	5	805	80	Iva Čápová, nezávislý kandidát	Iva Čápová, NK	IČNK	1	080	44	44.98	0
2111	564478	Narysov	1	6	807	80	Jan Vošahlík, nezávislý kandidát	Jan Vošahlík, NK	JVNK	1	080	94	96.11	1
2111	564478	Narysov	1	7	808	80	Michaela Škvárová, nezávislý kandidát	Michaela Škvárová, NK	MČNK	1	080	63	64.41	1
2111	564478	Narysov	1	8	801	80	Petr Datel, nezávislý kandidát	Petr Datel, NK	PDNK	1	080	47	48.05	0