OKRES	KODZASTUP	NAZEVZAST	COBVODU	POR_STR_HL	OSTRANA	VSTRANA	NAZEVCELK	ZKRATKAO30	ZKRATKAO8	POCSTR_SLO	SLOZENI	HLASY_STR	PROCHLSTR	MAND_STR
8102	598364	Lhotka	1	1	802	80	Aleš Stonavský, nezávislý kandidát	Aleš Stonavský, NK	NK	1	080	160	82.77	1
8102	598364	Lhotka	1	2	803	80	Ing. Peter Solik, nezávislý kandidát	Ing.Peter Solik, NK	NK	1	080	165	85.36	1
8102	598364	Lhotka	1	3	801	80	Mgr. Eva Budínová, nezávislý kandidát	Mgr.Eva Budínová, NK	NK	1	080	143	73.98	1
8102	598364	Lhotka	1	4	805	80	Zdeněk Kubala, nezávislý kandidát	Zdeněk Kubala, NK	NK	1	080	150	77.6	1
8102	598364	Lhotka	1	5	804	80	Milan Mičulka, nezávislý kandidát	Milan Mičulka, NK	NK	1	080	164	84.84	1
8102	598364	Lhotka	1	6	806	80	Josef Krpec, nezávislý kandidát	Josef Krpec, NK	NK	1	080	98	50.7	0
8102	598364	Lhotka	1	7	809	80	Růžena Kopčáková, nezávislý kandidát	Růžena Kopčáková, NK	NK	1	080	170	87.95	1
8102	598364	Lhotka	1	8	808	80	Lenka Kalusová, nezávislý kandidát	Lenka Kalusová, NK	NK	1	080	132	68.29	0
8102	598364	Lhotka	1	9	807	80	Ivana Fulneková, nezávislý kandidát	Ivana Fulneková, NK	NK	1	080	171	88.47	1