OKRES	KODZASTUP	NAZEVZAST	COBVODU	POR_STR_HL	OSTRANA	VSTRANA	NAZEVCELK	ZKRATKAO30	ZKRATKAO8	POCSTR_SLO	SLOZENI	HLASY_STR	PROCHLSTR	MAND_STR
2101	530514	Psáře	1	1	806	80	Petra Kadlečková, nezávislý kandidát	Petra Kadlečková, NK	NK	1	080	49	91.58	1
2101	530514	Psáře	1	2	803	80	Josef Kokta, nezávislý kandidát	Josef Kokta, NK	NK	1	080	54	100.93	1
2101	530514	Psáře	1	3	805	80	František Škvor, nezávislý kandidát	František Škvor, NK	NK	1	080	55	102.8	1
2101	530514	Psáře	1	4	804	80	Miroslav Jirásek, nezávislý kandidát	Miroslav Jirásek, NK	NK	1	080	52	97.19	1
2101	530514	Psáře	1	5	801	80	Ladislav Kadleček, nezávislý kandidát	Ladislav Kadleček, NK	NK	1	080	60	112.14	1
2101	530514	Psáře	1	6	802	80	Miloslav Třešňák, nezávislý kandidát	Miloslav Třešňák, NK	NK	1	080	51	95.32	1