OKRES	KODZASTUP	NAZEVZAST	COBVODU	POR_STR_HL	OSTRANA	VSTRANA	NAZEVCELK	ZKRATKAO30	ZKRATKAO8	POCSTR_SLO	SLOZENI	HLASY_STR	PROCHLSTR	MAND_STR
7101	569356	Česká Ves	1	1	1	1	Křesťanská a demokratická unie - Československá strana lidová	Křesť.demokr.unie-Čs.str.lid.	KDU-ČSL	1	001	2026	15.21	2
7101	569356	Česká Ves	1	2	47	47	Komunistická strana Čech a Moravy	Komunistická str.Čech a Moravy	KSČM	1	047	1696	12.73	2
7101	569356	Česká Ves	1	3	902	90	Sdružení za rozvoj obce Česká Ves	Sdruž. za rozv. obce Česká Ves	Sdruž ČV	1	080	1366	10.25	1
7101	569356	Česká Ves	1	4	7	7	Česká strana sociálně demokratická	Česká str.sociálně demokrat.	ČSSD	1	007	4646	34.88	6
7101	569356	Česká Ves	1	5	901	90	Nezávislí pro Českou Ves	Nezávislí pro Českou Ves	NezProČV	1	080	3584	26.91	4