OKRES	KODZASTUP	NAZEVZAST	COBVODU	POR_STR_HL	OSTRANA	VSTRANA	NAZEVCELK	ZKRATKAO30	ZKRATKAO8	POCSTR_SLO	SLOZENI	HLASY_STR	PROCHLSTR	MAND_STR
6204	584975	Valtice	1	1	7	7	Česká strana sociálně demokratická	Česká str.sociálně demokrat.	ČSSD	1	007	6443	42.48	7
6204	584975	Valtice	1	2	1	1	Křesťanská a demokratická unie - Československá strana lidová	Křesť.demokr.unie-Čs.str.lid.	KDU-ČSL	1	001	1689	11.13	2
6204	584975	Valtice	1	3	901	90	MYSLIVECKÉ SDRUŽENÍ REISTNA VALTICE	MYS. SDRUŽ. REISTNA VALTICE	MSR Valtice	1	080	769	5.07	0
6204	584975	Valtice	1	4	53	53	Občanská demokratická strana	Občanská demokratická strana	ODS	1	053	2184	14.39	2
6204	584975	Valtice	1	5	449	449	Volba pro Valtice - sdružení politické strany SNK Evropští demokraté a nezávislých kandidátů	Volba pro Valtice - SNK ED, NK		2	080,129	2472	16.29	3
6204	584975	Valtice	1	6	47	47	Komunistická strana Čech a Moravy	Komunistická str.Čech a Moravy	KSČM	1	047	1610	10.61	1