OKRES	KODZASTUP	NAZEVZAST	COBVODU	POR_STR_HL	OSTRANA	VSTRANA	NAZEVCELK	ZKRATKAO30	ZKRATKAO8	POCSTR_SLO	SLOZENI	HLASY_STR	PROCHLSTR	MAND_STR
2109	538761	Sibřina	1	1	901	90	"Spolek ""Za obec krásnější"""	"Spolek ""Za obec krásnější"""	SNK	1	080	330	11.41	1
2109	538761	Sibřina	1	2	902	90	OKO, OTEVŘENÁ KULTURNÍ OBEC	OKO, OTEVŘENÁ KULTURNÍ OBEC	SNK	1	080	231	8.99	0
2109	538761	Sibřina	1	3	905	90	Sdružení pro Sibřinu a Stupice	Sdružení pro Sibřinu a Stupice	SNK	1	080	835	28.89	3
2109	538761	Sibřina	1	4	903	90	Stupicko-Sibřinský spolek	Stupicko-Sibřinský spolek	SNK	1	080	331	11.45	1
2109	538761	Sibřina	1	5	904	90	Sibřina a Stupice společně	Sibřina a Stupice společně	SNK	1	080	1163	40.24	4