OKRES	KODZASTUP	NAZEVZAST	COBVODU	POR_STR_HL	OSTRANA	VSTRANA	NAZEVCELK	ZKRATKAO30	ZKRATKAO8	POCSTR_SLO	SLOZENI	HLASY_STR	PROCHLSTR	MAND_STR
5202	573752	Vitiněves	1	1	803	80	Otto Malý, nezávislý kandidát	Otto Malý, NK	NK	1	080	106	107.38	1
5202	573752	Vitiněves	1	2	804	80	Jitka Heršálková, nezávislý kandidát	Jitka Heršálková, NK	NK	1	080	132	133.71	1
5202	573752	Vitiněves	1	3	802	80	Květoslava Krupičková, nezávislý kandidát	Květoslava Krupičková, NK	NK	1	080	84	85.09	1
5202	573752	Vitiněves	1	4	806	80	Zdeněk Fejfar, nezávislý kandidát	Zdeněk Fejfar, NK	NK	1	080	90	91.17	1
5202	573752	Vitiněves	1	5	805	80	Jiří Adamec, nezávislý kandidát	Jiří Adamec, NK	NK	1	080	85	86.1	1
5202	573752	Vitiněves	1	6	801	80	Josef Havránek, nezávislý kandidát	Josef Havránek, NK	NK	1	080	134	135.74	1
5202	573752	Vitiněves	1	7	807	80	Jiří Kubela, nezávislý kandidát	Jiří Kubela, NK	NK	1	080	60	60.78	1