OKRES	KODZASTUP	NAZEVZAST	COBVODU	POR_STR_HL	OSTRANA	VSTRANA	NAZEVCELK	ZKRATKAO30	ZKRATKAO8	POCSTR_SLO	SLOZENI	HLASY_STR	PROCHLSTR	MAND_STR
7104	513229	Dřevohostice	1	1	902	90	Za rozkvět obce	Za rozkvět obce	SNK	1	080	4422	48.69	8
7104	513229	Dřevohostice	1	2	901	90	Sdružení nezávislých kandidátů za prosperitu obce	Sdr.nez.kan.za prosperitu obce	SNK	1	080	2776	30.56	5
7104	513229	Dřevohostice	1	3	1	1	Křesťanská a demokratická unie - Československá strana lidová	Křesť.demokr.unie-Čs.str.lid.	KDU-ČSL	1	001	576	9.51	1
7104	513229	Dřevohostice	1	4	903	90	"""Pro Dřevohostice"""	"""Pro Dřevohostice"""	SNK	1	080	878	11.15	1
7104	513229	Dřevohostice	1	5	47	47	Komunistická strana Čech a Moravy	Komunistická str.Čech a Moravy	KSČM	1	047	429	8.85	0