OKRES	KODZASTUP	NAZEVZAST	COBVODU	POR_STR_HL	OSTRANA	VSTRANA	NAZEVCELK	ZKRATKAO30	ZKRATKAO8	POCSTR_SLO	SLOZENI	HLASY_STR	PROCHLSTR	MAND_STR
1199	500119	Praha 4	5	5	175	175	Česká strana národně socialistická	Česká str.národ.socialistická	ČSNS2005	1	175	368	0.61	0
1199	500119	Praha 4	5	4	5	5	Strana zelených	Strana zelených	SZ	1	005	8833	14.75	1
1199	500119	Praha 4	5	6	601	601	SONOB se Zelenými (www.zeleniasonob.cz)za ochranu bydlení a proti zdražování nájemného	SONOB se Zelenými za ochr.byd.		2	148,177	945	1.57	0
1199	500119	Praha 4	5	7	7	7	Česká strana sociálně demokratická	Česká str.sociálně demokrat.	ČSSD	1	007	9577	15.99	1
1199	500119	Praha 4	5	1	47	47	Komunistická strana Čech a Moravy	Komunistická str.Čech a Moravy	KSČM	1	047	4926	8.22	1
1199	500119	Praha 4	5	3	53	53	Občanská demokratická strana	Občanská demokratická strana	ODS	1	053	30937	51.67	6
1199	500119	Praha 4	5	2	609	609	Unie Prahy 4 (koalice KDU-ČSL, SNK-ED a US-DEU společně s občany Prahy 4)	Unie Prahy 4	Unie_P4	3	001,102,129	4285	7.15	0
1199	500119	Praha 4	2	6	171	171	STRANA ROVNOST ŠANCÍ	STRANA ROVNOST ŠANCÍ	SRŠ	1	171	445	1.02	0
1199	500119	Praha 4	3	7	55	55	Koruna Česká (monarchistická strana Čech, Moravy a Slezska)	Koruna Česká (monarch.strana)	KČ	1	055	179	1.08	0