OKRES	KODZASTUP	NAZEVZAST	COBVODU	POR_STR_HL	OSTRANA	VSTRANA	NAZEVCELK	ZKRATKAO30	ZKRATKAO8	POCSTR_SLO	SLOZENI	HLASY_STR	PROCHLSTR	MAND_STR
3205	558885	Horní Bříza	1	1	47	47	Komunistická strana Čech a Moravy	Komunistická str.Čech a Moravy	KSČM	1	047	3663	10.95	2
3205	558885	Horní Bříza	1	2	901	90	Sdružení nezávislých kandidátů HORNOBŘÍZŠTÍ OBČANÉ	Sdruž. nez.kand. HORNOB.OBČANÉ	SNK HO	1	080	13430	40.14	9
3205	558885	Horní Bříza	1	3	449	449	"SNK ED -sdružení nezávislých kandidátů ""Strana opravdových skutků"" SOS"	Sdružení SNK ED, NK SOS		2	080,129	4452	13.3	3
3205	558885	Horní Bříza	1	4	721	721	TOP 09	TOP 09	TOP 09	1	721	6025	18.01	4
3205	558885	Horní Bříza	1	5	53	53	Občanská demokratická strana	Občanská demokratická strana	ODS	1	053	1993	6.25	1
3205	558885	Horní Bříza	1	6	7	7	Česká strana sociálně demokratická	Česká str.sociálně demokrat.	ČSSD	1	007	3887	11.62	2