OKRES	KODZASTUP	NAZEVZAST	COBVODU	POR_STR_HL	OSTRANA	VSTRANA	NAZEVCELK	ZKRATKAO30	ZKRATKAO8	POCSTR_SLO	SLOZENI	HLASY_STR	PROCHLSTR	MAND_STR
7102	501476	Dlouhá Loučka	1	1	166	166	"""STAROSTOVÉ A NEZÁVISLÍ"""	"""STAROSTOVÉ A NEZÁVISLÍ"""	"""STAN"""	1	166	3702	33.98	6
7102	501476	Dlouhá Loučka	1	2	47	47	Komunistická strana Čech a Moravy	Komunistická str.Čech a Moravy	KSČM	1	047	1451	13.32	2
7102	501476	Dlouhá Loučka	1	3	1	1	Křesťanská a demokratická unie - Československá strana lidová	Křesť.demokr.unie-Čs.str.lid.	KDU-ČSL	1	001	1221	11.21	1
7102	501476	Dlouhá Loučka	1	4	103	103	Strana pro otevřenou společnost	Str.pro otevřenou společnost	SOS	1	103	1827	16.77	2
7102	501476	Dlouhá Loučka	1	5	7	7	Česká strana sociálně demokratická	Česká str.sociálně demokrat.	ČSSD	1	007	1282	11.77	2
7102	501476	Dlouhá Loučka	1	6	53	53	Občanská demokratická strana	Občanská demokratická strana	ODS	1	053	1409	12.93	2