OKRES	KODZASTUP	NAZEVZAST	COBVODU	POR_STR_HL	OSTRANA	VSTRANA	NAZEVCELK	ZKRATKAO30	ZKRATKAO8	POCSTR_SLO	SLOZENI	HLASY_STR	PROCHLSTR	MAND_STR
6101	568635	Golčův Jeníkov	1	1	477	477	GJ 365	GJ 365		2	080,714	3407	20.26	3
6101	568635	Golčův Jeníkov	1	2	47	47	Komunistická strana Čech a Moravy	Komunistická str.Čech a Moravy	KSČM	1	047	488	5.44	0
6101	568635	Golčův Jeníkov	1	3	1	1	Křesťanská a demokratická unie - Československá strana lidová	Křesť.demokr.unie-Čs.str.lid.	KDU-ČSL	1	001	992	5.9	1
6101	568635	Golčův Jeníkov	1	4	53	53	Občanská demokratická strana	Občanská demokratická strana	ODS	1	053	4830	28.72	5
6101	568635	Golčův Jeníkov	1	5	7	7	Česká strana sociálně demokratická	Česká str.sociálně demokrat.	ČSSD	1	007	1014	6.03	1
6101	568635	Golčův Jeníkov	1	6	901	90	Otevřené město Golčův Jeníkov	Otevřené město Golčův Jeníkov	SNK	1	080	4355	25.9	4
6101	568635	Golčův Jeníkov	1	7	449	449	SDRUŽENÍ OBČANŮ PRO MĚSTO GOLČŮV JENÍKOV	SO PRO MĚSTO GOLČŮV JENÍKOV		2	080,129	1726	10.26	1