OKRES	KODZASTUP	NAZEVZAST	COBVODU	POR_STR_HL	OSTRANA	VSTRANA	NAZEVCELK	ZKRATKAO30	ZKRATKAO8	POCSTR_SLO	SLOZENI	HLASY_STR	PROCHLSTR	MAND_STR
8105	597821	Sosnová	1	1	47	47	Komunistická strana Čech a Moravy	Komunistická str.Čech a Moravy	KSČM	1	047	250	18.42	1
8105	597821	Sosnová	1	2	801	80	Jaroslav Brázda, nezávislý kandidát	Jaroslav Brázda, NK	NK	1	080	44	19.45	0
8105	597821	Sosnová	1	3	802	80	Tomáš Soška, nezávislý kandidát	Tomáš Soška, NK	NK	1	080	80	35.37	0
8105	597821	Sosnová	1	4	901	90	Občanské sdružení nezávislých kandidátů obce Sosnová	Občanské SNK obce Sosnová	SNK	1	080	410	25.9	2
8105	597821	Sosnová	1	5	53	53	Občanská demokratická strana	Občanská demokratická strana	ODS	1	053	712	44.97	4
8105	597821	Sosnová	1	6	803	80	Ing. Jan Čech, nezávislý kandidát	Jan Čech, NK	NK	1	080	87	38.47	0