OKRES	KODZASTUP	NAZEVZAST	COBVODU	POR_STR_HL	OSTRANA	VSTRANA	NAZEVCELK	ZKRATKAO30	ZKRATKAO8	POCSTR_SLO	SLOZENI	HLASY_STR	PROCHLSTR	MAND_STR
7202	592412	Nedakonice	1	1	389	389	Sdružení Občanské demokratické strany a nezávislých kandidátů	Sdružení ODS, NK		2	053,080	1060	14.15	1
7202	592412	Nedakonice	1	2	129	129	SNK Evropští demokraté	SNK Evropští demokraté	SNK ED	1	129	4333	38.58	6
7202	592412	Nedakonice	1	3	7	7	Česká strana sociálně demokratická	Česká str.sociálně demokrat.	ČSSD	1	007	1754	18.02	2
7202	592412	Nedakonice	1	4	1	1	Křesťanská a demokratická unie - Československá strana lidová	Křesť.demokr.unie-Čs.str.lid.	KDU-ČSL	1	001	2651	23.6	4
7202	592412	Nedakonice	1	5	47	47	Komunistická strana Čech a Moravy	Komunistická str.Čech a Moravy	KSČM	1	047	1433	12.75	2