OKRES	KODZASTUP	NAZEVZAST	COBVODU	POR_STR_HL	OSTRANA	VSTRANA	NAZEVCELK	ZKRATKAO30	ZKRATKAO8	POCSTR_SLO	SLOZENI	HLASY_STR	PROCHLSTR	MAND_STR
5301	571491	Hrochův Týnec	1	1	129	129	SNK Evropští demokraté	SNK Evropští demokraté	SNK ED	1	129	1612	24.41	3
5301	571491	Hrochův Týnec	1	2	47	47	Komunistická strana Čech a Moravy	Komunistická str.Čech a Moravy	KSČM	1	047	780	7.87	1
5301	571491	Hrochův Týnec	1	3	901	90	SDRUŽENÍ NEZÁVISLÝCH KANDIDÁTEK	SDRUŽ. NEZ. KANDIDÁTEK, SNK	SNK	1	080	1426	14.39	2
5301	571491	Hrochův Týnec	1	4	902	90	Sdružení pro rozvoj obce a místních částí	Sd.pro rozvoj obce a m.č., SNK	SNK	1	080	1177	22.28	2
5301	571491	Hrochův Týnec	1	5	7	7	Česká strana sociálně demokratická	Česká str.sociálně demokrat.	ČSSD	1	007	1405	14.18	2
5301	571491	Hrochův Týnec	1	6	1	1	Křesťanská a demokratická unie - Československá strana lidová	Křesť.demokr.unie-Čs.str.lid.	KDU-ČSL	1	001	2138	21.58	3
5301	571491	Hrochův Týnec	1	7	53	53	Občanská demokratická strana	Občanská demokratická strana	ODS	1	053	1366	13.79	2