OKRES	KODZASTUP	NAZEVZAST	COBVODU	POR_STR_HL	OSTRANA	VSTRANA	NAZEVCELK	ZKRATKAO30	ZKRATKAO8	POCSTR_SLO	SLOZENI	HLASY_STR	PROCHLSTR	MAND_STR
7204	500011	Želechovice nad Dřevnicí	1	1	902	90	POCTIVÁ OBEC ŽELECHOVICE NAD DŘEVNICÍ	POCTIVÁ OBEC ŽELECHOVICE N. D.	SNK	1	080			
7204	500011	Želechovice nad Dřevnicí	1	2	470	470	SPOLEČNĚ PRO LEPŠÍ ŽELECHOVICE	SPOLEČNĚ PRO LEPŠÍ ŽELECHOVICE	STAN+NK	2	080,166			
7204	500011	Želechovice nad Dřevnicí	1	3	901	90	STRANA ZA ROZVOJ OBCE	STRANA ZA ROZVOJ OBCE	SNK	1	080			
7204	500011	Želechovice nad Dřevnicí	1	4	371	371	Obec pro všechny generace	Obec pro všechny generace	ČSSD+NK	2	007,080			
7204	500011	Želechovice nad Dřevnicí	1	5	1	1	KDU-ČSL	KDU-ČSL	KDU-ČSL	1	001			