OKRES	KODZASTUP	NAZEVZAST	COBVODU	POR_STR_HL	OSTRANA	VSTRANA	NAZEVCELK	ZKRATKAO30	ZKRATKAO8	POCSTR_SLO	SLOZENI	HLASY_STR	PROCHLSTR	MAND_STR
3204	540617	Líšina	1	1	802	80	Fedor Ostrovský, nezávislý kandidát	Fedor Ostrovský, NK	NK	1	080	58	75.32	1
3204	540617	Líšina	1	2	803	80	Petr Kalčík, nezávislý kandidát	Petr Kalčík, NK	NK	1	080	50	64.93	1
3204	540617	Líšina	1	3	804	80	Josef Langmajer, nezávislý kandidát	Josef Langmajer, NK	NK	1	080	71	92.2	1
3204	540617	Líšina	1	4	805	80	Václav Langmajer, nezávislý kandidát	Václav Langmajer, NK	NK	1	080	48	62.33	0
3204	540617	Líšina	1	5	801	80	Jindra Gröschlová, nezávislý kandidát	Jindra Gröschlová, NK	NK	1	080	57	74.02	1
3204	540617	Líšina	1	6	806	80	Zdeněk Hrdonka, nezávislý kandidát	Zdeněk Hrdonka, NK	NK	1	080	49	63.63	0
3204	540617	Líšina	1	7	807	80	Jiří Češka, nezávislý kandidát	Jiří Češka, NK	NK	1	080	52	67.53	1