OKRES	KODZASTUP	NAZEVZAST	COBVODU	POR_STR_HL	OSTRANA	VSTRANA	NAZEVCELK	ZKRATKAO30	ZKRATKAO8	POCSTR_SLO	SLOZENI	HLASY_STR	PROCHLSTR	MAND_STR
2111	598461	Kňovice	1	1	801	80	Jaroslava Pinkasová, nezávislý kandidát	Jaroslava Pinkasová, NK	NK	1	080	97	99.85	1
2111	598461	Kňovice	1	2	802	80	Radek Mandovec, nezávislý kandidát	Radek Mandovec, NK	NK	1	080	110	113.23	1
2111	598461	Kňovice	1	3	803	80	Jiří Sůsa, nezávislý kandidát	Jiří Sůsa, NK	NK	1	080	111	114.26	1
2111	598461	Kňovice	1	4	804	80	Miloslav Litoš, nezávislý kandidát	Miloslav Litoš, NK	NK	1	080	81	83.38	1
2111	598461	Kňovice	1	5	805	80	Petr Šimek, nezávislý kandidát	Petr Šimek, NK	NK	1	080	74	76.17	1
2111	598461	Kňovice	1	6	806	80	Luboš Částka, nezávislý kandidát	Luboš Částka, NK	NK	1	080	98	100.88	1
2111	598461	Kňovice	1	7	807	80	Tomáš Loch, nezávislý kandidát	Tomáš Loch, NK	NK	1	080	109	112.2	1