OKRES	KODZASTUP	NAZEVZAST	COBVODU	POR_STR_HL	OSTRANA	VSTRANA	NAZEVCELK	ZKRATKAO30	ZKRATKAO8	POCSTR_SLO	SLOZENI	HLASY_STR	PROCHLSTR	MAND_STR
7103	549983	Polomí	1	1	802	80	Alois Klváček, nezávislý kandidát	Alois Klváček, NK	NK	1	080	71	90.03	1
7103	549983	Polomí	1	2	806	80	Josef Rolenc, nezávislý kandidát	Josef Rolenc, NK	NK	1	080	41	51.99	0
7103	549983	Polomí	1	3	714	714	Strana svobodných občanů	Strana svobodných občanů	Svobodní	1	714	72	45.65	1
7103	549983	Polomí	1	4	807	80	Josef Machač, nezávislý kandidát	Josef Machač, NK	NK	1	080	76	96.37	1
7103	549983	Polomí	1	5	804	80	Stanislav Pišťák, nezávislý kandidát	Stanislav Pišťák, NK	NK	1	080	96	121.73	1
7103	549983	Polomí	1	6	801	80	Miroslav Čmel, nezávislý kandidát	Miroslav Čmel, NK	NK	1	080	52	65.94	1
7103	549983	Polomí	1	7	803	80	Leoš Pišťák, nezávislý kandidát	Leoš Pišťák, NK	NK	1	080	90	114.13	1
7103	549983	Polomí	1	8	805	80	Vlastimil Nemerád, nezávislý kandidát	Vlastimil Nemerád, NK	NK	1	080	54	68.47	1