OKRES	KODZASTUP	NAZEVZAST	COBVODU	POR_STR_HL	OSTRANA	VSTRANA	NAZEVCELK	ZKRATKAO30	ZKRATKAO8	POCSTR_SLO	SLOZENI	HLASY_STR	PROCHLSTR	MAND_STR
6202	551091	Brno-Starý Lískovec	1	1	172	172	NEZÁVISLÍ DEMOKRATÉ (předseda V.Železný)	NEZ.DEMOKRATÉ(předs.V.Železný)	NEZ/DEM	1	172	19942	22.61	5
6202	551091	Brno-Starý Lískovec	1	2	7	7	Česká strana sociálně demokratická	Česká str.sociálně demokrat.	ČSSD	1	007	16748	18.99	4
6202	551091	Brno-Starý Lískovec	1	3	1	1	Křesťanská a demokratická unie - Československá strana lidová	Křesť.demokr.unie-Čs.str.lid.	KDU-ČSL	1	001	11565	13.11	3
6202	551091	Brno-Starý Lískovec	1	4	53	53	Občanská demokratická strana	Občanská demokratická strana	ODS	1	053	30023	34.04	7
6202	551091	Brno-Starý Lískovec	1	5	47	47	Komunistická strana Čech a Moravy	Komunistická str.Čech a Moravy	KSČM	1	047	9904	11.23	2