OKRES	KODZASTUP	NAZEVZAST	COBVODU	POR_STR_HL	OSTRANA	VSTRANA	NAZEVCELK	ZKRATKAO30	ZKRATKAO8	POCSTR_SLO	SLOZENI	HLASY_STR	PROCHLSTR	MAND_STR
6202	551287	Brno-Líšeň	1	1	1	1	Křesťanská a demokratická unie - Československá strana lidová	Křesť.demokr.unie-Čs.str.lid.	KDU-ČSL	1	001	26582	13.27	4
6202	551287	Brno-Líšeň	1	2	7	7	Česká strana sociálně demokratická	Česká str.sociálně demokrat.	ČSSD	1	007	34972	17.46	5
6202	551287	Brno-Líšeň	1	3	364	364	Zelený blok pro Líšeň	ZB pro Líšeň		2	005,080	16586	8.28	2
6202	551287	Brno-Líšeň	1	4	411	411	LÍŠEŇSKÝ BLOK	LB		2	080,113	37091	18.52	5
6202	551287	Brno-Líšeň	1	5	53	53	Občanská demokratická strana	Občanská demokratická strana	ODS	1	053	66215	33.06	10
6202	551287	Brno-Líšeň	1	6	47	47	Komunistická strana Čech a Moravy	Komunistická str.Čech a Moravy	KSČM	1	047	18829	9.4	3