OKRES	KODZASTUP	NAZEVZAST	COBVODU	POR_STR_HL	OSTRANA	VSTRANA	NAZEVCELK	ZKRATKAO30	ZKRATKAO8	POCSTR_SLO	SLOZENI	HLASY_STR	PROCHLSTR	MAND_STR
3206	566845	Skomelno	1	1	801	80	Marcela Nedvědová, nezávislý kandidát	Marcela Nedvědová, NK	NK	1	080	32	34.83	0
3206	566845	Skomelno	1	2	805	80	Ladislav Jelínek, nezávislý kandidát	Ladislav Jelínek, NK	NK	1	080	62	67.49	1
3206	566845	Skomelno	1	3	806	80	Milan Bechyně, nezávislý kandidát	Milan Bechyně, NK	NK	1	080	85	92.53	1
3206	566845	Skomelno	1	4	807	80	Ladislav Jelínek, nezávislý kandidát	Ladislav Jelínek, NK	NK	1	080	30	32.65	0
3206	566845	Skomelno	1	5	808	80	Roman Majer, nezávislý kandidát	Roman Majer, NK	NK	1	080	91	99.06	1
3206	566845	Skomelno	1	6	802	80	Vladimír Štrunc, nezávislý kandidát	Vladimír Štrunc, NK	NK	1	080	85	92.53	1
3206	566845	Skomelno	1	7	803	80	Miloš Škopek, nezávislý kandidát	Miloš Škopek, NK	NK	1	080	86	93.62	1
3206	566845	Skomelno	1	8	804	80	Jana Novotná, nezávislý kandidát	Jana Novotná, NK	NK	1	080	83	90.35	1
3206	566845	Skomelno	1	9	809	80	Pavel Grüner, nezávislý kandidát	Pavel Grüner, NK	NK	1	080	89	96.88	1