OKRES	KODZASTUP	NAZEVZAST	COBVODU	POR_STR_HL	OSTRANA	VSTRANA	NAZEVCELK	ZKRATKAO30	ZKRATKAO8	POCSTR_SLO	SLOZENI	HLASY_STR	PROCHLSTR	MAND_STR
3104	549380	Drhovle	1	1	902	90	Sdružení nezávislých kandidátů Drhovle	SNK Drhovle	SNK	1	080	546	25.17	2
3104	549380	Drhovle	1	2	901	90	Sdružení nezávislých kandidátů Pamětice	SNK Pamětice	SNK	1	080	605	27.89	3
3104	549380	Drhovle	1	3	904	90	Sdružení nezávislých kandidátů Dubí Hora	SNK Dubí Hora	SNK	1	080	380	17.51	2
3104	549380	Drhovle	1	4	903	90	Sdružení nezávislých kandidátů Mlaka	SNK Mlaka	SNK	1	080	259	11.94	1
3104	549380	Drhovle	1	5	905	90	Sdružení nezávislých kandidátů Chlaponice	SNK Chlaponice	SNK	1	080	156	16.18	0
3104	549380	Drhovle	1	6	7	7	Česká strana sociálně demokratická	Česká str.sociálně demokrat.	ČSSD	1	007	223	13.21	1