OKRES	KODZASTUP	NAZEVZAST	COBVODU	POR_STR_HL	OSTRANA	VSTRANA	NAZEVCELK	ZKRATKAO30	ZKRATKAO8	POCSTR_SLO	SLOZENI	HLASY_STR	PROCHLSTR	MAND_STR
5202	573345	Podůlší	1	1	804	80	Žaneta Karbanová, nezávislý kandidát	Žaneta Karbanová, NK	NK	1	080	63	72.41	1
5202	573345	Podůlší	1	2	807	80	Miloš Pospíšil, nezávislý kandidát	Miloš Pospíšil, NK	NK	1	080	77	88.5	1
5202	573345	Podůlší	1	3	806	80	Jiří Louma, nezávislý kandidát	Jiří Louma, NK	NK	1	080	55	63.21	0
5202	573345	Podůlší	1	4	802	80	Jaroslava Pivrncová, nezávislý kandidát	Jaroslava Pivrncová, NK	NK	1	080	94	108.04	1
5202	573345	Podůlší	1	5	805	80	Vladimír Košíček, nezávislý kandidát	Vladimír Košíček, NK	NK	1	080	78	89.65	1
5202	573345	Podůlší	1	6	803	80	Petr Stryhal, nezávislý kandidát	Petr Stryhal, NK	NK	1	080	68	78.16	1
5202	573345	Podůlší	1	7	801	80	Zdeněk Žalský, nezávislý kandidát	Zdeněk Žalský, NK	NK	1	080	91	104.59	1
5202	573345	Podůlší	1	8	808	80	Zdeněk Král, nezávislý kandidát	Zdeněk Král, NK	NK	1	080	83	95.4	1