OKRES	KODZASTUP	NAZEVZAST	COBVODU	POR_STR_HL	OSTRANA	VSTRANA	NAZEVCELK	ZKRATKAO30	ZKRATKAO8	POCSTR_SLO	SLOZENI	HLASY_STR	PROCHLSTR	MAND_STR
8101	597988	Zátor	1	1	47	47	Komunistická strana Čech a Moravy	Komunistická str.Čech a Moravy	KSČM	1	047	354	8.23	0
8101	597988	Zátor	1	2	129	129	SNK Evropští demokraté	SNK Evropští demokraté	SNK ED	1	129	1960	45.59	5
8101	597988	Zátor	1	3	364	364	Strana zelených	Strana zelených	Zelení+NK	2	005,080	314	8.21	0
8101	597988	Zátor	1	4	902	90	OBČANÉ PRO ZÁTOR	SNK OBČANÉ PRO ZÁTOR	SNK	1	080	865	20.12	2
8101	597988	Zátor	1	5	901	90	Strana selského rozumu (SSR)	SNK Strana selského rozumu	SNK	1	080	806	18.74	2