OKRES	KODZASTUP	NAZEVZAST	COBVODU	POR_STR_HL	OSTRANA	VSTRANA	NAZEVCELK	ZKRATKAO30	ZKRATKAO8	POCSTR_SLO	SLOZENI	HLASY_STR	PROCHLSTR	MAND_STR
3203	557846	Chválenice	1	1	901	90	Pro klidný život v obci	Pro klidný život v obci	SNK	1	080	353	14.68	1
3203	557846	Chválenice	1	2	721	721	TOP 09	TOP 09	TOP 09	1	721	916	33.87	4
3203	557846	Chválenice	1	3	802	80	Milan Jan, nezávislý kandidát	Milan Jan, NK	NK	1	080	213	70.89	0
3203	557846	Chválenice	1	4	53	53	Občanská demokratická strana	Občanská demokratická strana	ODS	1	053	692	32.9	3
3203	557846	Chválenice	1	5	801	80	Jiří Basl, nezávislý kandidát	Jiří Basl, NK	NK	1	080	162	53.92	0
3203	557846	Chválenice	1	6	1	1	Křesťanská a demokratická unie - Československá strana lidová	Křesť.demokr.unie-Čs.str.lid.	KDU-ČSL	1	001	368	15.31	1