OKRES	KODZASTUP	NAZEVZAST	COBVODU	POR_STR_HL	OSTRANA	VSTRANA	NAZEVCELK	ZKRATKAO30	ZKRATKAO8	POCSTR_SLO	SLOZENI	HLASY_STR	PROCHLSTR	MAND_STR
3202	557536	Žihobce	1	1	901	90	SDRUŽENÍ NEZÁVISLÝCH KANDIDÁTŮ BÍLENICE	SNK BÍLENICE	SNK	1	080	596	25.38	2
3202	557536	Žihobce	1	2	904	90	Sdružení nezávislých kandidátů Kadešice	SNK Kadešice	SNK	1	080	557	17.25	2
3202	557536	Žihobce	1	3	902	90	Žihobce I	Žihobce I	SNK	1	080	1698	38.56	6
3202	557536	Žihobce	1	4	903	90	Sdružení nezávislých kandidátů Rozsedly	SNK Rozsedly	SNK	1	080	1037	23.55	4
3202	557536	Žihobce	1	5	905	90	ŽIHOBCE - OBEC PRO OBČANY	ŽIHOBCE - OBEC PRO OBČANY	SNK	1	080	515	13.49	1