OKRES	KODZASTUP	NAZEVZAST	COBVODU	POR_STR_HL	OSTRANA	VSTRANA	NAZEVCELK	ZKRATKAO30	ZKRATKAO8	POCSTR_SLO	SLOZENI	HLASY_STR	PROCHLSTR	MAND_STR
4102	555304	Krásné Údolí	1	1	805	80	Miloslava Vytisková, nezávislý kandidát	Miloslava Vytisková, NK	NK	1	080	122	112.15	1
4102	555304	Krásné Údolí	1	2	803	80	Ing. Martin Frank, nezávislý kandidát	Ing. Martin Frank, NK	NK	1	080	159	146.16	1
4102	555304	Krásné Údolí	1	3	807	80	Vladimír Ježek, nezávislý kandidát	Vladimír Ježek, NK	NK	1	080	95	87.33	1
4102	555304	Krásné Údolí	1	4	801	80	Horst Schleicher, nezávislý kandidát	Horst Schleicher, NK	NK	1	080	113	103.88	1
4102	555304	Krásné Údolí	1	5	808	80	Hana Drbalová, nezávislý kandidát	Hana Drbalová, NK	NK	1	080	95	87.33	1
4102	555304	Krásné Údolí	1	6	806	80	Marie Lakomá, nezávislý kandidát	Marie Lakomá, NK	NK	1	080	89	81.81	1
4102	555304	Krásné Údolí	1	7	809	80	Zdeněk Dvořák, nezávislý kandidát	Zdeněk Dvořák, NK	NK	1	080	116	106.63	1
4102	555304	Krásné Údolí	1	8	804	80	Jaroslav Slabý, nezávislý kandidát	Jaroslav Slabý, NK	NK	1	080	85	78.14	1
4102	555304	Krásné Údolí	1	9	802	80	Mgr. Romana Prášilová, nezávislý kandidát	Mgr. Romana Prášilová, NK	NK	1	080	105	96.52	1