OKRES	KODZASTUP	NAZEVZAST	COBVODU	POR_STR_HL	OSTRANA	VSTRANA	NAZEVCELK	ZKRATKAO30	ZKRATKAO8	POCSTR_SLO	SLOZENI	HLASY_STR	PROCHLSTR	MAND_STR
3103	508357	Kostelní Vydří	1	1	806	80	Helena Kadlecová, nezávislý kandidát	Helena Kadlecová, NK	NK	1	080	46	57.09	0
3103	508357	Kostelní Vydří	1	2	807	80	Jiří Kadlec, nezávislý kandidát	Jiří Kadlec, NK	NK	1	080	78	96.8	1
3103	508357	Kostelní Vydří	1	3	803	80	Andrea Přibylová, nezávislý kandidát	Andrea Přibylová, NK	NK	1	080	86	106.73	1
3103	508357	Kostelní Vydří	1	4	808	80	Jan Karásek, nezávislý kandidát	Jan Karásek, NK	NK	1	080	67	83.15	1
3103	508357	Kostelní Vydří	1	5	802	80	Marie Petrželová, nezávislý kandidát	Marie Petrželová, NK	NK	1	080	63	78.19	1
3103	508357	Kostelní Vydří	1	6	801	80	Miloslav Fiala, nezávislý kandidát	Miloslav Fiala, NK	NK	1	080	75	93.08	1
3103	508357	Kostelní Vydří	1	7	804	80	Miroslav Matějka, nezávislý kandidát	Miroslav Matějka, NK	NK	1	080	58	71.98	1
3103	508357	Kostelní Vydří	1	8	805	80	Ivan Tetour, nezávislý kandidát	Ivan Tetour, NK	NK	1	080	91	112.94	1