OKRES	KODZASTUP	NAZEVZAST	COBVODU	POR_STR_HL	OSTRANA	VSTRANA	NAZEVCELK	ZKRATKAO30	ZKRATKAO8	POCSTR_SLO	SLOZENI	HLASY_STR	PROCHLSTR	MAND_STR
6206	593516	Račice-Pístovice	1	1	801	80	Mgr. Petr Valter, nezávislý kandidát	Mgr. Petr Valter, NK	NK	1	080	120	28.43	0
6206	593516	Račice-Pístovice	1	2	47	47	Komunistická strana Čech a Moravy	Komunistická str.Čech a Moravy	KSČM	1	047	1657	26.17	4
6206	593516	Račice-Pístovice	1	3	1	1	Křesťanská a demokratická unie - Československá strana lidová	Křesť.demokr.unie-Čs.str.lid.	KDU-ČSL	1	001	1406	22.21	3
6206	593516	Račice-Pístovice	1	4	7	7	Česká strana sociálně demokratická	Česká str.sociálně demokrat.	ČSSD	1	007	2036	32.16	5
6206	593516	Račice-Pístovice	1	5	83	83	Moravané	Moravané	M	1	083	1111	17.55	3