OKRES	KODZASTUP	NAZEVZAST	COBVODU	POR_STR_HL	OSTRANA	VSTRANA	NAZEVCELK	ZKRATKAO30	ZKRATKAO8	POCSTR_SLO	SLOZENI	HLASY_STR	PROCHLSTR	MAND_STR
3207	541559	Kočov	1	1	807	80	Jan Mlynár, nezávislý kandidát	Jan Mlynár, NK	NK	1	080	55	67.42	1
3207	541559	Kočov	1	2	804	80	Václav Kalivoda, nezávislý kandidát	Václav Kalivoda, NK	NK	1	080	62	76	1
3207	541559	Kočov	1	3	802	80	Miroslav Pešek, nezávislý kandidát	Miroslav Pešek, NK	NK	1	080	102	125.04	1
3207	541559	Kočov	1	4	805	80	Iveta Šichevičová, nezávislý kandidát	Iveta Šichevičová, NK	NK	1	080	73	89.49	1
3207	541559	Kočov	1	5	803	80	Bohumil Frouz, nezávislý kandidát	Bohumil Frouz, NK	NK	1	080	24	29.42	0
3207	541559	Kočov	1	6	806	80	Stanislav Vlasák, nezávislý kandidát	Stanislav Vlasák, NK	NK	1	080	82	100.52	1
3207	541559	Kočov	1	7	801	80	David Strejček, nezávislý kandidát	David Strejček, NK	NK	1	080	62	76	1
3207	541559	Kočov	1	8	809	80	Antonín Majer, nezávislý kandidát	Antonín Majer, NK	NK	1	080	36	44.13	0
3207	541559	Kočov	1	9	808	80	Miroslav Ziegloser, nezávislý kandidát	Miroslav Ziegloser, NK	NK	1	080	75	91.94	1