OKRES	KODZASTUP	NAZEVZAST	COBVODU	POR_STR_HL	OSTRANA	VSTRANA	NAZEVCELK	ZKRATKAO30	ZKRATKAO8	POCSTR_SLO	SLOZENI	HLASY_STR	PROCHLSTR	MAND_STR
4202	563412	Veliká Ves	1	1	902	90	Sdružení nezávislých kandidátů Patrioti	SNK Patrioti	SNK	1	080	247	24.57	2
4202	563412	Veliká Ves	1	2	470	470	Krásné obce Veliké Vsi	Krásné obce Veliké Vsi		2	080,166	422	32.66	3
4202	563412	Veliká Ves	1	3	903	90	Občané pro obec	Občané pro obec	SNK	1	080	466	40.57	4
4202	563412	Veliká Ves	1	4	901	90	Sdružení nezávislých kandidátů I.	SNK I.	SNK	1	080	104	14.48	0
4202	563412	Veliká Ves	1	5	904	90	OBČANÉ	OBČANÉ	SNK	1	080	53	9.22	0