OKRES	KODZASTUP	NAZEVZAST	COBVODU	POR_STR_HL	OSTRANA	VSTRANA	NAZEVCELK	ZKRATKAO30	ZKRATKAO8	POCSTR_SLO	SLOZENI	HLASY_STR	PROCHLSTR	MAND_STR
5303	578703	Rudná	1	1	806	80	Václav Najman, nezávislý kandidát	Václav Najman, NK	NK	1	080	42	85.96	1
5303	578703	Rudná	1	2	803	80	Vladimír Žváček, nezávislý kandidát	Vladimír Žváček, NK	NK	1	080	58	118.71	1
5303	578703	Rudná	1	3	807	80	František Štilárek, nezávislý kandidát	František Štilárek, NK	NK	1	080	1	2.04	0
5303	578703	Rudná	1	4	808	80	Josef Újezdský, nezávislý kandidát	Josef Újezdský, NK	NK	1	080	43	88.01	1
5303	578703	Rudná	1	5	805	80	Karel Pandula, nezávislý kandidát	Karel Pandula, NK	NK	1	080	61	124.85	1
5303	578703	Rudná	1	6	801	80	Regina Vašíčková, nezávislý kandidát	Regina Vašíčková, NK	NK	1	080	41	83.91	1
5303	578703	Rudná	1	7	804	80	Lukáš Vašíček, nezávislý kandidát	Lukáš Vašíček, NK	NK	1	080	51	104.38	1
5303	578703	Rudná	1	8	802	80	Jan Vašíček, nezávislý kandidát	Jan Vašíček, NK	NK	1	080	45	92.1	1