OKRES	KODZASTUP	NAZEVZAST	COBVODU	POR_STR_HL	OSTRANA	VSTRANA	NAZEVCELK	ZKRATKAO30	ZKRATKAO8	POCSTR_SLO	SLOZENI	HLASY_STR	PROCHLSTR	MAND_STR
3202	578410	Maňovice	1	1	804	80	Josef Pač, nezávislý kandidát	Josef Pač, NK	NK	1	080	32	104.34	1
3202	578410	Maňovice	1	2	807	80	Karel Klozar, nezávislý kandidát	Karel Klozar, NK	NK	1	080	18	58.69	1
3202	578410	Maňovice	1	3	806	80	Josef Jirsa, nezávislý kandidát	Josef Jirsa, NK	NK	1	080	29	94.56	1
3202	578410	Maňovice	1	4	803	80	Miroslav Panuška, nezávislý kandidát	Miroslav Panuška, NK	NK	1	080	18	58.69	0
3202	578410	Maňovice	1	5	801	80	Jana Ďuricová, nezávislý kandidát	Jana Ďuricová, NK	NK	1	080	14	45.65	0
3202	578410	Maňovice	1	6	802	80	Miloš Zetek, nezávislý kandidát	Miloš Zetek, NK	NK	1	080	32	104.34	1
3202	578410	Maňovice	1	7	808	80	Hana Zdeňková, nezávislý kandidát	Hana Zdeňková, NK	NK	1	080	20	65.21	1
3202	578410	Maňovice	1	8	805	80	Jana Halíková, nezávislý kandidát	Jana Halíková, NK	NK	1	080	21	68.47	1