OKRES	KODZASTUP	NAZEVZAST	COBVODU	POR_STR_HL	OSTRANA	VSTRANA	NAZEVCELK	ZKRATKAO30	ZKRATKAO8	POCSTR_SLO	SLOZENI	HLASY_STR	PROCHLSTR	MAND_STR
2105	531341	Drobovice	1	1	801	80	Josef Slavík, nezávislý kandidát	Josef Slavík, NK	NK	1	080	108	83.44	1
2105	531341	Drobovice	1	2	802	80	Stanislav Hamsa, nezávislý kandidát	Stanislav Hamsa, NK	NK	1	080	106	81.89	1
2105	531341	Drobovice	1	3	808	80	Vlastimil Miláček, nezávislý kandidát	Vlastimil Miláček, NK	NK	1	080	117	90.39	1
2105	531341	Drobovice	1	4	806	80	Eva Pokorná, nezávislý kandidát	Eva Pokorná, NK	NK	1	080	132	101.98	1
2105	531341	Drobovice	1	5	804	80	Stanislava Hamsová, nezávislý kandidát	Stanislava Hamsová, NK	NK	1	080	121	93.48	1
2105	531341	Drobovice	1	6	805	80	Jiří Jandus, nezávislý kandidát	Jiří Jandus, NK	NK	1	080	57	44.03	0
2105	531341	Drobovice	1	7	807	80	Michal Louda, nezávislý kandidát	Michal Louda, NK	NK	1	080	141	108.94	1
2105	531341	Drobovice	1	8	803	80	Jiří Zajíc, nezávislý kandidát	Jiří Zajíc, NK	NK	1	080	124	95.8	1