OKRES	KODZASTUP	NAZEVZAST	COBVODU	POR_STR_HL	OSTRANA	VSTRANA	NAZEVCELK	ZKRATKAO30	ZKRATKAO8	POCSTR_SLO	SLOZENI	HLASY_STR	PROCHLSTR	MAND_STR
3201	553671	Horšovský Týn	1	1	411	411	Volba pro město Horšovský Týn a nezávislí kandidáti	Volba pro město Horš.Týn a NK		2	080,113	3298	12.5	2
3201	553671	Horšovský Týn	1	2	482	482	Demokratická strana zelených a nezávislí kandidáti - sdružení DSZ a NK	Sdružení DSZ a NK		2	080,715	187	2.41	0
3201	553671	Horšovský Týn	1	3	7	7	Česká strana sociálně demokratická	Česká str.sociálně demokrat.	ČSSD	1	007	3155	11.96	2
3201	553671	Horšovský Týn	1	4	47	47	Komunistická strana Čech a Moravy	Komunistická str.Čech a Moravy	KSČM	1	047	3181	12.06	2
3201	553671	Horšovský Týn	1	5	53	53	Občanská demokratická strana	Občanská demokratická strana	ODS	1	053	4604	17.46	3
3201	553671	Horšovský Týn	1	6	901	90	NEZÁVISLÍ HORŠOVSKÝ TÝN	SNK Nezávislí Horšovský Týn	SNK	1	080	6038	22.9	4
3201	553671	Horšovský Týn	1	7	470	470	Sdružení nezávislých kandidátů pro Horšovský Týn	Sdr.nezáv.kand. pro Horšov.Týn		2	080,166	5900	22.37	4