OKRES	KODZASTUP	NAZEVZAST	COBVODU	POR_STR_HL	OSTRANA	VSTRANA	NAZEVCELK	ZKRATKAO30	ZKRATKAO8	POCSTR_SLO	SLOZENI	HLASY_STR	PROCHLSTR	MAND_STR
7201	588644	Kvasice	1	1	901	90	Sdružení nezávislých kandidátů za městečko Kvasice	SNK za městečko Kvasice	SNKZMK	1	080	4033	27.01	4
7201	588644	Kvasice	1	2	1	1	Křesťanská a demokratická unie - Československá strana lidová	Křesť.demokr.unie-Čs.str.lid.	KDU-ČSL	1	001	2285	15.3	2
7201	588644	Kvasice	1	3	47	47	Komunistická strana Čech a Moravy	Komunistická str.Čech a Moravy	KSČM	1	047	2020	13.53	2
7201	588644	Kvasice	1	4	53	53	Občanská demokratická strana	Občanská demokratická strana	ODS	1	053	4417	29.58	5
7201	588644	Kvasice	1	5	7	7	Česká strana sociálně demokratická	Česká str.sociálně demokrat.	ČSSD	1	007	2173	14.55	2