OKRES	KODZASTUP	NAZEVZAST	COBVODU	POR_STR_HL	OSTRANA	VSTRANA	NAZEVCELK	ZKRATKAO30	ZKRATKAO8	POCSTR_SLO	SLOZENI	HLASY_STR	PROCHLSTR	MAND_STR
4102	538159	Hájek	1	1	803	80	Petr Stibor, nezávislý kandidát	Petr Stibor, NK	NK	1	080	89	107.22	1
4102	538159	Hájek	1	2	805	80	Petr Ticháček, nezávislý kandidát	Petr Ticháček, NK	NK	1	080	77	92.77	1
4102	538159	Hájek	1	3	807	80	Jaroslava Táborská, nezávislý kandidát	Jaroslava Táborská, NK	NK	1	080	71	85.54	1
4102	538159	Hájek	1	4	802	80	Mgr. Zděnka Holečková, nezávislý kandidát	Zděnka Holečková, NK	NK	1	080	78	93.97	1
4102	538159	Hájek	1	5	804	80	Jaroslav Surovec, nezávislý kandidát	Jaroslav Surovec, NK	NK	1	080	78	93.97	1
4102	538159	Hájek	1	6	806	80	Jaroslav Lhoták, nezávislý kandidát	Jaroslav Lhoták, NK	NK	1	080	80	96.38	1
4102	538159	Hájek	1	7	801	80	Ing. Vít Hromádko, nezávislý kandidát	Vít Hromádko, NK	NK	1	080	108	130.12	1