OKRES	KODZASTUP	NAZEVZAST	COBVODU	POR_STR_HL	OSTRANA	VSTRANA	NAZEVCELK	ZKRATKAO30	ZKRATKAO8	POCSTR_SLO	SLOZENI	HLASY_STR	PROCHLSTR	MAND_STR
2105	534307	Pertoltice	1	1	7	7	Česká strana sociálně demokratická	Česká str.sociálně demokrat.	ČSSD	1	007	248	70.28	4
2105	534307	Pertoltice	1	2	802	80	Petr Chaloupka, nezávislý kandidát	Petr Chaloupka, nez. kand.	NK	1	080	52	73.68	1
2105	534307	Pertoltice	1	3	803	80	MARTINA PAJEROVÁ, nezávislý kandidát	MARTINA PAJEROVÁ, nez. kand.	NK	1	080	44	62.34	0
2105	534307	Pertoltice	1	4	804	80	Vladimír Veleta, nezávislý kandidát	Vladimír Veleta, nez. kand.	NK	1	080	63	89.27	1
2105	534307	Pertoltice	1	5	805	80	PAVEL KALINA, nezávislý kandidát	PAVEL KALINA, nez. kand.	NK	1	080	69	97.77	1
2105	534307	Pertoltice	1	6	801	80	Ondřej Matějka, nezávislý kandidát	Ondřej Matějka, nez. kand.	NK	1	080	18	25.5	0