OKRES	KODZASTUP	NAZEVZAST	COBVODU	POR_STR_HL	OSTRANA	VSTRANA	NAZEVCELK	ZKRATKAO30	ZKRATKAO8	POCSTR_SLO	SLOZENI	HLASY_STR	PROCHLSTR	MAND_STR
2107	572012	Kovanec	1	1	802	80	Romana Kopecká, nezávislý kandidát	Romana Kopecká, NK	NK	1	080	32	49.68	0
2107	572012	Kovanec	1	2	803	80	Pavla Bláhová, nezávislý kandidát	Pavla Bláhová, NK	NK	1	080	58	90.06	1
2107	572012	Kovanec	1	3	804	80	Ladislav Spejchlík, nezávislý kandidát	Ladislav Spejchlík, NK	NK	1	080	42	65.21	1
2107	572012	Kovanec	1	4	805	80	Milan Kopecký, nezávislý kandidát	Milan Kopecký, NK	NK	1	080	53	82.29	1
2107	572012	Kovanec	1	5	808	80	Martin Veverka, nezávislý kandidát	Martin Veverka, NK	NK	1	080	7	10.86	0
2107	572012	Kovanec	1	6	807	80	František Pokorný, nezávislý kandidát	František Pokorný, NK	NK	1	080	27	41.92	0
2107	572012	Kovanec	1	7	801	80	Vratislav Řezáč, nezávislý kandidát	Vratislav Řezáč, NK	NK	1	080	57	88.5	1
2107	572012	Kovanec	1	8	806	80	Regina Seidlová, nezávislý kandidát	Regina Seidlová, NK	NK	1	080	46	71.42	1