OKRES	KODZASTUP	NAZEVZAST	COBVODU	POR_STR_HL	OSTRANA	VSTRANA	NAZEVCELK	ZKRATKAO30	ZKRATKAO8	POCSTR_SLO	SLOZENI	HLASY_STR	PROCHLSTR	MAND_STR
2101	532843	Dunice	1	1	807	80	Vlastimil Chmel, nezávislý kandidát	Vlastimil Chmel, NK	NK	1	080	30	88.98	1
2101	532843	Dunice	1	2	806	80	Magda Veselá, nezávislý kandidát	Magda Veselá, NK	NK	1	080	15	44.49	0
2101	532843	Dunice	1	3	808	80	Vladimír Burda, nezávislý kandidát	Vladimír Burda, NK	NK	1	080	24	71.18	1
2101	532843	Dunice	1	4	801	80	František Vopěnka, nezávislý kandidát	František Vopěnka, NK	NK	1	080	33	97.88	1
2101	532843	Dunice	1	5	802	80	František Hlaváček, nezávislý kandidát	František Hlaváček, NK	NK	1	080	30	88.98	1
2101	532843	Dunice	1	6	804	80	Karel Urbánek, nezávislý kandidát	Karel Urbánek, NK	NK	1	080	35	103.81	1
2101	532843	Dunice	1	7	805	80	Radek Vorel, nezávislý kandidát	Radek Vorel, NK	NK	1	080	39	115.67	1
2101	532843	Dunice	1	8	803	80	Josef Průša, nezávislý kandidát	Josef Průša, NK	NK	1	080	30	88.98	1