OKRES	KODZASTUP	NAZEVZAST	COBVODU	POR_STR_HL	OSTRANA	VSTRANA	NAZEVCELK	ZKRATKAO30	ZKRATKAO8	POCSTR_SLO	SLOZENI	HLASY_STR	PROCHLSTR	MAND_STR
3201	553654	Holýšov	1	1	768	768	ANO 2011	ANO 2011	ANO 2011	1	768	4885	21.82	4
3201	553654	Holýšov	1	2	7	7	Česká strana sociálně demokratická	Česká str.sociálně demokrat.	ČSSD	1	007	4576	20.44	3
3201	553654	Holýšov	1	3	47	47	Komunistická strana Čech a Moravy	Komunistická str.Čech a Moravy	KSČM	1	047	2209	9.86	1
3201	553654	Holýšov	1	4	53	53	Občanská demokratická strana	Občanská demokratická strana	ODS	1	053	3273	14.62	2
3201	553654	Holýšov	1	5	470	470	Sdružení pro otevřenou společnost	Sdruž.pro otevřenou společnost		2	080,166	7318	32.69	5
3201	553654	Holýšov	1	6	482	482	Demokratická strana zelených a nezávislí kandidáti - sdružení DSZ a NK	Sdružení DSZ a NK		2	080,715	121	2.02	0