OKRES	KODZASTUP	NAZEVZAST	COBVODU	POR_STR_HL	OSTRANA	VSTRANA	NAZEVCELK	ZKRATKAO30	ZKRATKAO8	POCSTR_SLO	SLOZENI	HLASY_STR	PROCHLSTR	MAND_STR
6201	582247	Ráječko	1	1	901	90	Sdružení společenských aktivit Ráječko - sdružení nezávislých kandidátů	Sdruž.společen.aktivit Ráječko	SNK-SpAR	1	080	1455	19.06	3
6201	582247	Ráječko	1	2	415	415	Sdružení politické strany a nezávislých kandidátů - Vaše volba	Sdr.pol.strany a NK-Vaše volba		2	024,080	1071	14.03	2
6201	582247	Ráječko	1	3	7	7	Česká strana sociálně demokratická	Česká str.sociálně demokrat.	ČSSD	1	007	1333	17.46	3
6201	582247	Ráječko	1	4	903	90	Sdružení nezávislých kandidátů - Za Ráječko krásnější . . .	SNK - Za Ráječko krásnější ...	SNK-zaRK	1	080	1260	16.5	3
6201	582247	Ráječko	1	5	47	47	Komunistická strana Čech a Moravy	Komunistická str.Čech a Moravy	KSČM	1	047	1259	16.49	2
6201	582247	Ráječko	1	6	902	90	RÁJEČKOVSKÉ  ŽENY-sdružení nezávislých kandidátů	RÁJEČKOVSKÉ  ŽENY - SNK	RŽEN-SNK	1	080	1254	16.43	2