OKRES	KODZASTUP	NAZEVZAST	COBVODU	POR_STR_HL	OSTRANA	VSTRANA	NAZEVCELK	ZKRATKAO30	ZKRATKAO8	POCSTR_SLO	SLOZENI	HLASY_STR	PROCHLSTR	MAND_STR
3107	552143	Budislav	1	1	901	90	Sdružení nezávislých kandidátů Budislav,Hlavňov, Záluží	SNK Budislav,Hlavňov,Záluží	SNK	1	080	503	27.29	3
3107	552143	Budislav	1	2	903	90	Sdružení nezávislých kandidátů  Budislav 2010	SNK Budislav 2010	SNK	1	080	467	25.33	2
3107	552143	Budislav	1	3	1	1	Křesťanská a demokratická unie - Československá strana lidová	Křesť.demokr.unie-Čs.str.lid.	KDU-ČSL	1	001	310	16.82	1
3107	552143	Budislav	1	4	902	90	Sdružení nezávislých kandidátů  VOLBY - PODZIM 2010	SNK VOLBY - PODZIM 2010	SNK	1	080	545	29.57	3
3107	552143	Budislav	1	5	801	80	Jiří Matoušek, nezávislý kandidát	Jiří Matoušek, NK	NK	1	080	18	8.79	0