OKRES	KODZASTUP	NAZEVZAST	COBVODU	POR_STR_HL	OSTRANA	VSTRANA	NAZEVCELK	ZKRATKAO30	ZKRATKAO8	POCSTR_SLO	SLOZENI	HLASY_STR	PROCHLSTR	MAND_STR
8103	599051	Bohumín	1	1	47	47	Komunistická strana Čech a Moravy	Komunistická str.Čech a Moravy	KSČM	1	047	15949	9.98	2
8103	599051	Bohumín	1	2	681	681	Koalice NEZÁVISLÍ a Strana Práv Občanů ZEMANOVCI	Koalice NEZÁVISLÍ a SPOZ		2	088,724	5737	3.59	0
8103	599051	Bohumín	1	3	720	720	Česká pirátská strana	Česká pirátská strana	ČPS	1	720	276	3.97	0
8103	599051	Bohumín	1	4	7	7	Česká strana sociálně demokratická	Česká str.sociálně demokrat.	ČSSD	1	007	100835	63.12	17
8103	599051	Bohumín	1	5	53	53	Občanská demokratická strana	Občanská demokratická strana	ODS	1	053	21613	13.53	3
8103	599051	Bohumín	1	6	721	721	TOP 09	TOP 09	TOP 09	1	721	8865	5.55	1
8103	599051	Bohumín	1	7	1	1	Křesťanská a demokratická unie - Československá strana lidová	Křesť.demokr.unie-Čs.str.lid.	KDU-ČSL	1	001	6332	3.96	0
8103	599051	Bohumín	1	8	98	98	Volte Pravý Blok www.cibulka.net	Volte Pr.Blok www.cibulka.net	PB	1	098	120	1.72	0