OKRES	KODZASTUP	NAZEVZAST	COBVODU	POR_STR_HL	OSTRANA	VSTRANA	NAZEVCELK	ZKRATKAO30	ZKRATKAO8	POCSTR_SLO	SLOZENI	HLASY_STR	PROCHLSTR	MAND_STR
5303	577944	Čistá	1	1	903	90	VOLEBNÍ SDRUŽENÍ PRO OBEC ČISTÁ	VOL. SDR. PRO OBEC ČISTÁ,SNK	SNK	1	080	788	14.49	2
5303	577944	Čistá	1	2	904	90	SDRUŽENÍ NEZÁVISLÝCH KANDIDÁTŮ ČISTÁ 2014	SNK ČISTÁ 2014	SNK	1	080	1941	35.71	6
5303	577944	Čistá	1	3	902	90	"""Občané občanům II"""	"""Občané občanům II"", SNK"	SNK	1	080	600	11.03	1
5303	577944	Čistá	1	4	901	90	"""Občané občanům I"""	"""Občané občanům I"", SNK"	SNK	1	080	970	17.84	3
5303	577944	Čistá	1	5	905	90	VOLEBNÍ SDRUŽENÍ NEZÁVISLÝCH KANDIDÁTŮ ČISTÁ	VOL.SDR.NEZ.KAND. ČISTÁ, SNK	SNK	1	080	1136	20.9	3