OKRES	KODZASTUP	NAZEVZAST	COBVODU	POR_STR_HL	OSTRANA	VSTRANA	NAZEVCELK	ZKRATKAO30	ZKRATKAO8	POCSTR_SLO	SLOZENI	HLASY_STR	PROCHLSTR	MAND_STR
3202	557528	Železná Ruda	1	1	902	90	Sdružení nezávislých kandidátů za obvod Železnorudska	SNK za obvod Železnorudska	SNK	1	080	1556	18.61	2
3202	557528	Železná Ruda	1	2	7	7	Česká strana sociálně demokratická	Česká str.sociálně demokrat.	ČSSD	1	007	2409	28.82	4
3202	557528	Železná Ruda	1	3	721	721	TOP 09	TOP 09	TOP 09	1	721	1016	12.15	1
3202	557528	Železná Ruda	1	4	901	90	Sdružení nezávislých kandidátů pro Železnou Rudu	SNK pro Železnou Rudu	SNK	1	080	1249	14.94	2
3202	557528	Železná Ruda	1	5	53	53	Občanská demokratická strana	Občanská demokratická strana	ODS	1	053	2127	25.45	4