OKRES	KODZASTUP	NAZEVZAST	COBVODU	POR_STR_HL	OSTRANA	VSTRANA	NAZEVCELK	ZKRATKAO30	ZKRATKAO8	POCSTR_SLO	SLOZENI	HLASY_STR	PROCHLSTR	MAND_STR
5202	573345	Podůlší	1	1	807	80	Jiří Louma, nezávislý kandidát	Jiří Louma, NK	NK	1	080	75	65.62	1
5202	573345	Podůlší	1	2	808	80	Radomír Kvapil st., nezávislý kandidát	Radomír Kvapil st., NK	NK	1	080	96	84	1
5202	573345	Podůlší	1	3	804	80	Roman Abel st., nezávislý kandidát	Roman Abel st., NK	NK	1	080	66	57.75	0
5202	573345	Podůlší	1	4	809	80	Zdeněk Král, nezávislý kandidát	Zdeněk Král, NK	NK	1	080	104	91	1
5202	573345	Podůlší	1	5	802	80	Radek Žalský, nezávislý kandidát	Radek Žalský, NK	NK	1	080	74	64.75	0
5202	573345	Podůlší	1	6	806	80	Ing. Zdeněk Žalský, nezávislý kandidát	Ing. Zdeněk Žalský, NK	NK	1	080	107	93.62	1
5202	573345	Podůlší	1	7	803	80	Žaneta Karbanová, nezávislý kandidát	Žaneta Karbanová, NK	NK	1	080	76	66.5	1
5202	573345	Podůlší	1	8	801	80	Ing. Jaroslava Pivrncová, nezávislý kandidát	Ing. Jaroslava Pivrncová, NK	NK	1	080	114	99.75	1
5202	573345	Podůlší	1	9	805	80	Vladimír Košíček, nezávislý kandidát	Vladimír Košíček, NK	NK	1	080	88	77	1