OKRES	KODZASTUP	NAZEVZAST	COBVODU	POR_STR_HL	OSTRANA	VSTRANA	NAZEVCELK	ZKRATKAO30	ZKRATKAO8	POCSTR_SLO	SLOZENI	HLASY_STR	PROCHLSTR	MAND_STR
8102	549665	Raškovice	1	1	167	167	Hnutí na podporu dobrovolných hasičů a dalších dobrovolníků	Hn.na podporu dobrovol.hasičů	HNPD	1	167	226	10.51	0
8102	549665	Raškovice	1	2	7	7	Česká strana sociálně demokratická	Česká str.sociálně demokrat.	ČSSD	1	007	617	14.34	1
8102	549665	Raškovice	1	3	47	47	Komunistická strana Čech a Moravy	Komunistická str.Čech a Moravy	KSČM	1	047	828	16.5	1
8102	549665	Raškovice	1	4	1	1	Křesťanská a demokratická unie - Československá strana lidová	Křesť.demokr.unie-Čs.str.lid.	KDU-ČSL	1	001	1022	20.37	1
8102	549665	Raškovice	1	5	902	90	Sdružení nezávislých kandidátů - Za zodpovědnou správu obce	SNK - Za zodpověd. správu obce	SNK	1	080	1155	23.02	2
8102	549665	Raškovice	1	6	901	90	Sdružení nezávislých kandidátů 2006	Sdruž.nezávislých kandid. 2006	SNK 2006	1	080	1169	23.3	2