OKRES	KODZASTUP	NAZEVZAST	COBVODU	POR_STR_HL	OSTRANA	VSTRANA	NAZEVCELK	ZKRATKAO30	ZKRATKAO8	POCSTR_SLO	SLOZENI	HLASY_STR	PROCHLSTR	MAND_STR
2107	535443	Bělá pod Bezdězem	1	1	721	721	TOP 09	TOP 09	TOP 09	1	721	5252	16.09	3
2107	535443	Bělá pod Bezdězem	1	2	901	90	Občané za rozvoj a budoucnost města	Obč.za rozvoj a budoucn.města	SNK	1	080	9281	28.44	6
2107	535443	Bělá pod Bezdězem	1	3	47	47	Komunistická strana Čech a Moravy	Komunistická str.Čech a Moravy	KSČM	1	047	2264	11.2	1
2107	535443	Bělá pod Bezdězem	1	4	7	7	Česká strana sociálně demokratická	Česká str.sociálně demokrat.	ČSSD	1	007	6690	20.5	5
2107	535443	Bělá pod Bezdězem	1	5	53	53	Občanská demokratická strana	Občanská demokratická strana	ODS	1	053	9146	28.02	6