OKRES	KODZASTUP	NAZEVZAST	COBVODU	POR_STR_HL	OSTRANA	VSTRANA	NAZEVCELK	ZKRATKAO30	ZKRATKAO8	POCSTR_SLO	SLOZENI	HLASY_STR	PROCHLSTR	MAND_STR
5202	573540	Střevač	1	1	801	80	Jaromír Valenta, nezávislý kandidát	Jaromír Valenta, NK	NK	1	080	51	136.2	1
5202	573540	Střevač	1	2	809	80	Zdeňka Havířová, nezávislý kandidát	Zdeňka Havířová, NK	NK	1	080	25	66.76	1
5202	573540	Střevač	1	3	802	80	Roman Krupka, nezávislý kandidát	Roman Krupka, NK	NK	1	080	33	88.13	1
5202	573540	Střevač	1	4	803	80	Miloš Havelka, nezávislý kandidát	Miloš Havelka, NK	NK	1	080	37	98.81	1
5202	573540	Střevač	1	5	807	80	Jaroslava Rychnová, nezávislý kandidát	Jaroslava Rychnová, NK	NK	1	080	52	138.87	1
5202	573540	Střevač	1	6	805	80	Libor Liska, nezávislý kandidát	Libor Liska, NK	NK	1	080	39	104.15	1
5202	573540	Střevač	1	7	806	80	Josef Hlaváček, nezávislý kandidát	Josef Hlaváček, NK	NK	1	080	36	96.14	1
5202	573540	Střevač	1	8	804	80	Tomáš Kubáček, nezávislý kandidát	Tomáš Kubáček, NK	NK	1	080	25	66.76	1
5202	573540	Střevač	1	9	808	80	Jiří Slavík, nezávislý kandidát	Jiří Slavík, NK	NK	1	080	39	104.15	1