OKRES	KODZASTUP	NAZEVZAST	COBVODU	POR_STR_HL	OSTRANA	VSTRANA	NAZEVCELK	ZKRATKAO30	ZKRATKAO8	POCSTR_SLO	SLOZENI	HLASY_STR	PROCHLSTR	MAND_STR
2111	513571	Občov	1	1	804	80	Petr Švec, nezávislý kandidát	Petr Švec, NK	PŠNK	1	080	55	78.73	1
2111	513571	Občov	1	2	803	80	Václav Černý, nezávislý kandidát	Václav Černý, NK	VČNK	1	080	44	62.98	0
2111	513571	Občov	1	3	806	80	Jaroslav Kosán, nezávislý kandidát	Jaroslav Kosán, NK	JKNK	1	080	55	78.73	1
2111	513571	Občov	1	4	807	80	Lubomír Kuba, nezávislý kandidát	Lubomír Kuba, NK	LKNK	1	080	51	73	1
2111	513571	Občov	1	5	53	53	Občanská demokratická strana	Občanská demokratická strana	ODS	1	053	143	29.24	3
2111	513571	Občov	1	6	805	80	Miloslava Racková, nezávislý kandidát	Miloslava Racková, NK	MRNK	1	080	43	61.55	0
2111	513571	Občov	1	7	802	80	Josef Obraz, nezávislý kandidát	Josef Obraz, NK	JONK	1	080	52	74.43	1
2111	513571	Občov	1	8	801	80	Josef Vacek, nezávislý kandidát	Josef Vacek, NK	JVNK	1	080	46	65.84	0