OKRES	KODZASTUP	NAZEVZAST	COBVODU	POR_STR_HL	OSTRANA	VSTRANA	NAZEVCELK	ZKRATKAO30	ZKRATKAO8	POCSTR_SLO	SLOZENI	HLASY_STR	PROCHLSTR	MAND_STR
8106	554332	Hošťálkovice	1	1	47	47	Komunistická strana Čech a Moravy	Komunistická str.Čech a Moravy	KSČM	1	047	701	11.23	1
8106	554332	Hošťálkovice	1	2	129	129	SNK Evropští demokraté	SNK Evropští demokraté	SNK ED	1	129	1770	28.36	3
8106	554332	Hošťálkovice	1	3	7	7	Česká strana sociálně demokratická	Česká str.sociálně demokrat.	ČSSD	1	007	443	7.09	0
8106	554332	Hošťálkovice	1	4	53	53	Občanská demokratická strana	Občanská demokratická strana	ODS	1	053	1389	22.25	2
8106	554332	Hošťálkovice	1	5	901	90	Sdružení občanů Hošťálkovic (SOHO)	Sdruž.nezáv.kand.	SNK	1	080	1232	19.74	2
8106	554332	Hošťálkovice	1	6	1	1	Křesťanská a demokratická unie - Československá strana lidová	Křesť.demokr.unie-Čs.str.lid.	KDU-ČSL	1	001	705	11.29	1