OKRES	KODZASTUP	NAZEVZAST	COBVODU	POR_STR_HL	OSTRANA	VSTRANA	NAZEVCELK	ZKRATKAO30	ZKRATKAO8	POCSTR_SLO	SLOZENI	HLASY_STR	PROCHLSTR	MAND_STR
5205	579637	Rtyně v Podkrkonoší	1	1	1	1	Křesťanská a demokratická unie - Československá strana lidová	Křesť.demokr.unie-Čs.str.lid.	KDU-ČSL	1	001	3808	20.27	3
5205	579637	Rtyně v Podkrkonoší	1	2	47	47	Komunistická strana Čech a Moravy	Komunistická str.Čech a Moravy	KSČM	1	047	2232	11.88	2
5205	579637	Rtyně v Podkrkonoší	1	3	902	90	Sdružení nezávislých kandidátů - MĚSTA RTYNĚ V PODKRKONOŠÍ	SNK- MĚSTA RTYNĚ V PODKRKONOŠÍ	SNK-CELK	1	080	3133	16.68	2
5205	579637	Rtyně v Podkrkonoší	1	4	901	90	Sdružení nezávislých kandidátů	Sdruž.nezáv.kand.	SNK-CELK	1	080	5688	30.28	5
5205	579637	Rtyně v Podkrkonoší	1	5	53	53	Občanská demokratická strana	Občanská demokratická strana	ODS	1	053	3921	20.87	3