OKRES	KODZASTUP	NAZEVZAST	COBVODU	POR_STR_HL	OSTRANA	VSTRANA	NAZEVCELK	ZKRATKAO30	ZKRATKAO8	POCSTR_SLO	SLOZENI	HLASY_STR	PROCHLSTR	MAND_STR
5303	578509	Osík	1	1	901	90	Sdružení nezávislých kandidátů Osík v pohybu	Sdruž. nez. kan. Osík v pohybu	SNK	1	080	1210	22.66	2
5303	578509	Osík	1	2	53	53	Občanská demokratická strana	Občanská demokratická strana	ODS	1	053	1404	26.29	3
5303	578509	Osík	1	3	156	156	Dělnická strana sociální spravedlnosti	Dělnic.str.sociální spravedl.	DSSS	1	156	63	12.97	0
5303	578509	Osík	1	4	339	339	Sdružení Osík 3000	Sdružení Osík 3000	KDU-ČSL+Nestran	2	001,181	2239	41.93	5
5303	578509	Osík	1	5	47	47	Komunistická strana Čech a Moravy	Komunistická str.Čech a Moravy	KSČM	1	047	423	7.92	1