OKRES	KODZASTUP	NAZEVZAST	COBVODU	POR_STR_HL	OSTRANA	VSTRANA	NAZEVCELK	ZKRATKAO30	ZKRATKAO8	POCSTR_SLO	SLOZENI	HLASY_STR	PROCHLSTR	MAND_STR
2106	535397	Želízy	1	1	804	80	Drahomír Steinz, nezávislý kandidát	Drahomír Steinz, NK	NK	1	080	121	119.97	1
2106	535397	Želízy	1	2	803	80	Milan Zajíček, nezávislý kandidát	Milan Zajíček, NK	NK	1	080	104	103.11	1
2106	535397	Želízy	1	3	808	80	Bc. František Staněk, nezávislý kandidát	Bc. František Staněk, NK	NK	1	080	100	99.15	1
2106	535397	Želízy	1	4	802	80	Michaela Duchačová, nezávislý kandidát	Michaela Duchačová, NK	NK	1	080	87	86.26	1
2106	535397	Želízy	1	5	807	80	Stanislav Veselý, nezávislý kandidát	Stanislav Veselý, NK	NK	1	080	87	86.26	1
2106	535397	Želízy	1	6	801	80	Lucie Zikmundová, nezávislý kandidát	Lucie Zikmundová, NK	NK	1	080	80	79.32	1
2106	535397	Želízy	1	7	805	80	Jiří Krejza, nezávislý kandidát	Jiří Krejza, NK	NK	1	080	64	63.45	1
2106	535397	Želízy	1	8	806	80	Fuchs Rudýn, nezávislý kandidát	Fuchs Rudýn, NK	NK	1	080	63	62.46	0