OKRES	KODZASTUP	NAZEVZAST	COBVODU	POR_STR_HL	OSTRANA	VSTRANA	NAZEVCELK	ZKRATKAO30	ZKRATKAO8	POCSTR_SLO	SLOZENI	HLASY_STR	PROCHLSTR	MAND_STR
8104	599549	Klimkovice	1	1	1	1	Křesťanská a demokratická unie - Československá strana lidová	Křesť.demokr.unie-Čs.str.lid.	KDU-ČSL	1	001	3175	12.49	2
8104	599549	Klimkovice	1	2	47	47	Komunistická strana Čech a Moravy	Komunistická str.Čech a Moravy	KSČM	1	047	2924	11.5	2
8104	599549	Klimkovice	1	3	129	129	SNK Evropští demokraté	SNK Evropští demokraté	SNK ED	1	129	3609	14.2	2
8104	599549	Klimkovice	1	4	53	53	Občanská demokratická strana	Občanská demokratická strana	ODS	1	053	7469	29.39	5
8104	599549	Klimkovice	1	5	7	7	Česká strana sociálně demokratická	Česká str.sociálně demokrat.	ČSSD	1	007	8231	32.39	6