OKRES	KODZASTUP	NAZEVZAST	COBVODU	POR_STR_HL	OSTRANA	VSTRANA	NAZEVCELK	ZKRATKAO30	ZKRATKAO8	POCSTR_SLO	SLOZENI	HLASY_STR	PROCHLSTR	MAND_STR
5201	570222	Lejšovka	1	1	807	80	Monika Kindlová, nezávislý kandidát	Monika Kindlová, NK	NK	1	080	54	95.69	1
5201	570222	Lejšovka	1	2	803	80	Jan Šlesingr, nezávislý kandidát	Jan Šlesingr, NK	NK	1	080	66	116.96	1
5201	570222	Lejšovka	1	3	801	80	Ing. Jitka Němcová, nezávislý kandidát	Ing. Jitka Němcová, NK	NK	1	080	54	95.69	1
5201	570222	Lejšovka	1	4	806	80	Martin Jílek, nezávislý kandidát	Martin Jílek, NK	NK	1	080	59	104.55	1
5201	570222	Lejšovka	1	5	802	80	Boleslav Niedoba, nezávislý kandidát	Boleslav Niedoba, NK	NK	1	080	57	101.01	1
5201	570222	Lejšovka	1	6	804	80	Ing. Milada Buštová, nezávislý kandidát	Ing. Milada Buštová, NK	NK	1	080	51	90.37	1
5201	570222	Lejšovka	1	7	805	80	Josef Fabián, nezávislý kandidát	Josef Fabián, NK	NK	1	080	54	95.69	1