OKRES	KODZASTUP	NAZEVZAST	COBVODU	POR_STR_HL	OSTRANA	VSTRANA	NAZEVCELK	ZKRATKAO30	ZKRATKAO8	POCSTR_SLO	SLOZENI	HLASY_STR	PROCHLSTR	MAND_STR
6105	595292	Bohdalov	1	1	903	90	Sdružení nezávislých kandidátů pro Bohdalov a Chroustov	SNK pro Bohdalov a Chroustov	SNK 3	1	080	1986	35.42	4
6105	595292	Bohdalov	1	2	1	1	Křesťanská a demokratická unie - Československá strana lidová	Křesť.demokr.unie-Čs.str.lid.	KDU-ČSL	1	001	690	15.04	1
6105	595292	Bohdalov	1	3	902	90	Sdružení nezávislých kandidátů Bohdalov 2	SNK Bohdalov 2	SNK 2	1	080	1263	22.52	3
6105	595292	Bohdalov	1	4	901	90	Sdružení nezávislých kandidátů Bohdalov 1	SNK Bohdalov 1	SNK 1	1	080	986	17.58	2
6105	595292	Bohdalov	1	5	7	7	Česká strana sociálně demokratická	Česká str.sociálně demokrat.	ČSSD	1	007	682	12.16	1