OKRES	KODZASTUP	NAZEVZAST	COBVODU	POR_STR_HL	OSTRANA	VSTRANA	NAZEVCELK	ZKRATKAO30	ZKRATKAO8	POCSTR_SLO	SLOZENI	HLASY_STR	PROCHLSTR	MAND_STR
6203	583774	Rebešovice	1	1	7	7	Česká strana sociálně demokratická	Česká str.sociálně demokrat.	ČSSD	1	007	196	6.31	0
6203	583774	Rebešovice	1	2	1	1	Křesťanská a demokratická unie - Československá strana lidová	Křesť.demokr.unie-Čs.str.lid.	KDU-ČSL	1	001	175	5.63	0
6203	583774	Rebešovice	1	3	902	90	Sdružení nezávislých kandidátů Rebešovice 2	Sdruž.nezáv.kand.Rebešovice 2	SNKR2	1	080	515	16.58	1
6203	583774	Rebešovice	1	4	901	90	Sdružení nezávislých kandidátů Rebešovice 1	Sdruž.nezáv.kand. Rebeš. 1	SNKR1	1	080	1108	35.68	3
6203	583774	Rebešovice	1	5	53	53	Občanská demokratická strana	Občanská demokratická strana	ODS	1	053	594	19.13	2
6203	583774	Rebešovice	1	6	903	90	Sdružení nezávislých kandidátů za Rebešovice krásné a moderní	SNK za Rebeš. krásné a moderní	SNKZRKM	1	080	517	19.42	1