OKRES	KODZASTUP	NAZEVZAST	COBVODU	POR_STR_HL	OSTRANA	VSTRANA	NAZEVCELK	ZKRATKAO30	ZKRATKAO8	POCSTR_SLO	SLOZENI	HLASY_STR	PROCHLSTR	MAND_STR
3107	552224	Dobronice u Bechyně	1	1	805	80	Marie Beranová, nezávislý kandidát	Marie Beranová, NK	NK	1	080	22	39.67	0
3107	552224	Dobronice u Bechyně	1	2	806	80	Zdeněk Bárta, nezávislý kandidát	Zdeněk Bárta, NK	NK	1	080	40	72.14	0
3107	552224	Dobronice u Bechyně	1	3	801	80	Hana Buriánková, nezávislý kandidát	Hana Buriánková, NK	NK	1	080	50	90.18	1
3107	552224	Dobronice u Bechyně	1	4	802	80	Josef Radvan, nezávislý kandidát	Josef Radvan, NK	NK	1	080	53	95.59	1
3107	552224	Dobronice u Bechyně	1	5	803	80	Antonín Hejlek, nezávislý kandidát	Antonín Hejlek, NK	NK	1	080	56	101	1
3107	552224	Dobronice u Bechyně	1	6	47	47	Komunistická strana Čech a Moravy	Komunistická str.Čech a Moravy	KSČM	1	047	225	81.16	5
3107	552224	Dobronice u Bechyně	1	7	804	80	Luboš Koliha, nezávislý kandidát	Luboš Koliha, NK	NK	1	080	53	95.59	1