OKRES	KODZASTUP	NAZEVZAST	COBVODU	POR_STR_HL	OSTRANA	VSTRANA	NAZEVCELK	ZKRATKAO30	ZKRATKAO8	POCSTR_SLO	SLOZENI	HLASY_STR	PROCHLSTR	MAND_STR
4201	562858	Šluknov	1	1	47	47	Komunistická strana Čech a Moravy	Komunistická str.Čech a Moravy	KSČM	1	047	3089	16.16	2
4201	562858	Šluknov	1	2	7	7	Česká strana sociálně demokratická	Česká str.sociálně demokrat.	ČSSD	1	007	5087	26.61	4
4201	562858	Šluknov	1	3	119	119	Unie pro sport a zdraví	Unie pro sport a zdraví	USZ	1	119	3614	18.91	3
4201	562858	Šluknov	1	4	901	90	"""Království"""	"""Království"""	SNKK	1	080	3246	16.98	3
4201	562858	Šluknov	1	5	801	80	Pavel Papež, nezávislý kandidát	Pavel Papež, NK	NK	1	080	135	10.59	0
4201	562858	Šluknov	1	6	88	88	NEZÁVISLÍ	NEZÁVISLÍ	NEZ	1	088	3940	20.61	3