OKRES	KODZASTUP	NAZEVZAST	COBVODU	POR_STR_HL	OSTRANA	VSTRANA	NAZEVCELK	ZKRATKAO30	ZKRATKAO8	POCSTR_SLO	SLOZENI	HLASY_STR	PROCHLSTR	MAND_STR
8102	598020	Bílá	1	1	904	90	Sdružení nezávislých kandidátů Bílá všech	Sdr.nezáv.kand.Bílá všech	SNK	1	080	72	7.9	0
8102	598020	Bílá	1	2	907	90	Sdružení nezávislých kandidátů BESKYDY	Sdr.nezáv.kand.BESKYDY	SNK	1	080	141	13.26	1
8102	598020	Bílá	1	3	905	90	Sdružení nezávislých kandidátů OD KONEČNÉ PO BUMBÁLKU	SNK OD KONEČNÉ PO BUMBÁLKU	SNK	1	080	162	17.77	1
8102	598020	Bílá	1	4	902	90	Sdružení nezávislých kandidátů STABILITA A ROZVOJ OBCE	SNK STABILITA A ROZVOJ OBCE	SNK	1	080	161	21.2	1
8102	598020	Bílá	1	5	901	90	Sdružení nezávislých kandidátů BÍLÁ 2006	Sdruž.nezáv.kand.BÍLÁ 2006	SNK	1	080	200	18.81	2
8102	598020	Bílá	1	6	903	90	Sdružení nezávislých kandidátů MLADOBÍLANI	SNK MLADOBÍLANI	SNK	1	080	76	8.34	0
8102	598020	Bílá	1	7	906	90	Sdružení nezávislých kandidátů Střed a enklávy	Sdr.nezáv.kand.Střed a enklávy	SNK	1	080	251	27.54	2