OKRES	KODZASTUP	NAZEVZAST	COBVODU	POR_STR_HL	OSTRANA	VSTRANA	NAZEVCELK	ZKRATKAO30	ZKRATKAO8	POCSTR_SLO	SLOZENI	HLASY_STR	PROCHLSTR	MAND_STR
4201	562912	Velký Šenov	1	1	902	90	Sdružení nezávislých kandidátů SK Velký Šenov-fotbalový oddíl	SK Velký Šenov-fotbalový oddíl	SNK	1	080	584	5.02	0
4201	562912	Velký Šenov	1	2	167	167	Fair play - HNPD	Fair play - HNPD	HNPD	1	167	928	7.98	1
4201	562912	Velký Šenov	1	3	47	47	Komunistická strana Čech a Moravy	Komunistická str.Čech a Moravy	KSČM	1	047	773	6.65	1
4201	562912	Velký Šenov	1	4	904	90	Sdružení nezávislých kandidátů PRO ŠENOV	SNK PRO ŠENOV	SNK	1	080	2364	20.35	3
4201	562912	Velký Šenov	1	5	903	90	Sdružení nezávislých kandidátů ŠENOVŠTÍ OBČANÉ	SNK ŠENOVŠTÍ OBČANÉ	SNK	1	080	1125	9.68	1
4201	562912	Velký Šenov	1	6	905	90	Sdružení nezávislých kandidátů TJ Jiskra Velký Šenov	SNK TJ Jiskra Velký Šenov	SNK	1	080	2387	20.54	4
4201	562912	Velký Šenov	1	7	901	90	Sdružení nezávislých kandidátů - Život na severu	SNK Život na severu	SNK	1	080	1521	13.09	2
4201	562912	Velký Šenov	1	8	7	7	Česká strana sociálně demokratická	Česká str.sociálně demokrat.	ČSSD	1	007	1934	16.64	3