OKRES	KODZASTUP	NAZEVZAST	COBVODU	POR_STR_HL	OSTRANA	VSTRANA	NAZEVCELK	ZKRATKAO30	ZKRATKAO8	POCSTR_SLO	SLOZENI	HLASY_STR	PROCHLSTR	MAND_STR
6206	593001	Drnovice	1	1	901	90	ANO 2011 - ZA OBEC KRÁSNĚJŠÍ	ANO 2011 - ZA OBEC KRÁSNĚJŠÍ	SNK	1	080	3553	23.66	4
6206	593001	Drnovice	1	2	53	53	Občanská demokratická strana	Občanská demokratická strana	ODS	1	053	4499	29.96	5
6206	593001	Drnovice	1	3	47	47	Komunistická strana Čech a Moravy	Komunistická str.Čech a Moravy	KSČM	1	047	1407	9.37	1
6206	593001	Drnovice	1	4	7	7	Česká strana sociálně demokratická	Česká str.sociálně demokrat.	ČSSD	1	007	3173	21.13	3
6206	593001	Drnovice	1	5	355	355	Křesťanská a demokratická unie - Československá strana lidová + Aktivní Drnováci	KDU-ČSL + Aktivní Drnováci	NA	2	001,080	2381	15.85	2