OKRES	KODZASTUP	NAZEVZAST	COBVODU	POR_STR_HL	OSTRANA	VSTRANA	NAZEVCELK	ZKRATKAO30	ZKRATKAO8	POCSTR_SLO	SLOZENI	HLASY_STR	PROCHLSTR	MAND_STR
7102	552186	Červenka	1	1	1	1	Křesťanská a demokratická unie - Československá strana lidová	Křesť.demokr.unie-Čs.str.lid.	KDU-ČSL	1	001	934	16.02	1
7102	552186	Červenka	1	2	181	181	Nestraníci	Nestraníci	Nestran.	1	181	1075	18.43	2
7102	552186	Červenka	1	3	902	90	NEZÁVISLÍ ČERVENCE	Nezávislí Července	SNK	1	080	613	10.51	1
7102	552186	Červenka	1	4	103	103	Strana pro otevřenou společnost	Str.pro otevřenou společnost	SOS	1	103	643	11.02	1
7102	552186	Červenka	1	5	901	90	Sdružení nezávislých kandidátů Volby 2014	Sdruž. nez. kandid. Volby 2014	SNK	1	080	1924	33	3
7102	552186	Červenka	1	6	7	7	Česká strana sociálně demokratická	Česká str.sociálně demokrat.	ČSSD	1	007	641	10.99	1