OKRES	KODZASTUP	NAZEVZAST	COBVODU	POR_STR_HL	OSTRANA	VSTRANA	NAZEVCELK	ZKRATKAO30	ZKRATKAO8	POCSTR_SLO	SLOZENI	HLASY_STR	PROCHLSTR	MAND_STR
3103	547166	Slavonice	1	1	389	389	Sdružení Občanské demokratické strany a nezávislých kandidátů	Sdružení ODS a NK		2	053,080	1930	15.71	2
3103	547166	Slavonice	1	2	47	47	Komunistická strana Čech a Moravy	Komunistická str.Čech a Moravy	KSČM	1	047	3789	30.85	5
3103	547166	Slavonice	1	3	7	7	Česká strana sociálně demokratická	Česká str.sociálně demokrat.	ČSSD	1	007	1545	12.58	2
3103	547166	Slavonice	1	4	901	90	Sportovci a občané Slavonic	Sportovci a občané Slavonic	SNK	1	080	1616	13.15	2
3103	547166	Slavonice	1	5	166	166	STAROSTOVÉ A NEZÁVISLÍ	STAROSTOVÉ A NEZÁVISLÍ	STAN	1	166	323	9.86	0
3103	547166	Slavonice	1	6	902	90	Sdružení pro změnu 2010	Sdružení pro změnu 2010	SNK	1	080	3077	25.05	4