OKRES	KODZASTUP	NAZEVZAST	COBVODU	POR_STR_HL	OSTRANA	VSTRANA	NAZEVCELK	ZKRATKAO30	ZKRATKAO8	POCSTR_SLO	SLOZENI	HLASY_STR	PROCHLSTR	MAND_STR
3201	553867	Loučim	1	1	806	80	Jaroslav Široký, nezávislý kandidát	Jaroslav Široký, NK	NK	1	080	37	66.24	1
3201	553867	Loučim	1	2	47	47	Komunistická strana Čech a Moravy	Komunistická str.Čech a Moravy	KSČM	1	047	27	48.33	0
3201	553867	Loučim	1	3	803	80	Zdeněk Huspek, nezávislý kandidát	Zdeněk Huspek, NK	NK	1	080	37	66.24	0
3201	553867	Loučim	1	4	807	80	Josef Šváb, nezávislý kandidát	Josef Šváb, NK	NK	1	080	47	84.14	1
3201	553867	Loučim	1	5	805	80	Dušan Siran, nezávislý kandidát	Dušan Siran, NK	NK	1	080	37	66.24	1
3201	553867	Loučim	1	6	801	80	Drahoslava Blahutová, nezávislý kandidát	Drahoslava Blahutová, NK	NK	1	080	51	91.3	1
3201	553867	Loučim	1	7	804	80	Milan Jung, nezávislý kandidát	Milan Jung, NK	NK	1	080	45	80.56	1
3201	553867	Loučim	1	8	808	80	Milan Zimmermann, nezávislý kandidát	Milan Zimmermann, NK	NK	1	080	54	96.67	1
3201	553867	Loučim	1	9	802	80	Jana Dirriglová, nezávislý kandidát	Jana Dirriglová, NK	NK	1	080	56	100.25	1