OKRES	KODZASTUP	NAZEVZAST	COBVODU	POR_STR_HL	OSTRANA	VSTRANA	NAZEVCELK	ZKRATKAO30	ZKRATKAO8	POCSTR_SLO	SLOZENI	HLASY_STR	PROCHLSTR	MAND_STR
5302	557072	Pardubice V	1	1	467	467	Zelená pro Pardubice - sdružení politické strany Strany zelených, politického hnutí NEZÁVISLÍ a nezávislých kandidátů	Zelená pro Pard.,SZ+NEZ+nez.k.		3	005,080,088	6078	8.08	1
5302	557072	Pardubice V	1	2	53	53	Občanská demokratická strana	Občanská demokratická strana	ODS	1	053	31511	41.93	7
5302	557072	Pardubice V	1	3	339	339	Koalice pro Pardubice (KDU-ČSL a NESTRANÍCI)	Koal.pro Pard.,KDU-ČSL+Nestran		2	001,181	4191	5.57	1
5302	557072	Pardubice V	1	4	47	47	Komunistická strana Čech a Moravy	Komunistická str.Čech a Moravy	KSČM	1	047	11650	15.5	2
5302	557072	Pardubice V	1	5	172	172	NEZÁVISLÍ DEMOKRATÉ (předseda V.Železný)	NEZ.DEMOKRATÉ(předs.V.Železný)	NEZ/DEM	1	172	445	1.26	0
5302	557072	Pardubice V	1	6	449	449	Sdružení pro Pardubice - sdružení politické strany SNK Evropští demokraté a nezávislých kandidátů	Sdruž. pro Pard.,SNK ED+nez.k.		2	080,129	9509	12.65	2
5302	557072	Pardubice V	1	7	7	7	Česká strana sociálně demokratická	Česká str.sociálně demokrat.	ČSSD	1	007	11765	15.65	2