OKRES	KODZASTUP	NAZEVZAST	COBVODU	POR_STR_HL	OSTRANA	VSTRANA	NAZEVCELK	ZKRATKAO30	ZKRATKAO8	POCSTR_SLO	SLOZENI	HLASY_STR	PROCHLSTR	MAND_STR
5301	572225	Seč	1	1	129	129	SNK Evropští demokraté	SNK Evropští demokraté-SNK ED	SNK ED	1	129	1158	10.08	1
5301	572225	Seč	1	2	902	90	Sdružení nezávislých kandidátů pro rozvoj Seče a okolí	Sd.nez.kan.pro rozv. Seče, SNK	SNK	1	080	1753	15.26	2
5301	572225	Seč	1	3	7	7	Česká strana sociálně demokratická	Česká str.sociálně demokrat.	ČSSD	1	007	640	6.43	1
5301	572225	Seč	1	4	903	90	SEČSKÁ LILIE	SEČSKÁ LILIE, SNK	SNK	1	080	2547	22.18	4
5301	572225	Seč	1	5	47	47	Komunistická strana Čech a Moravy	Komun.str.Čech a Moravy - KSČM	KSČM	1	047	1902	16.56	3
5301	572225	Seč	1	6	901	90	Občanské sdružení Seče, Kraskova, Hoješína, Žďárce, Počátek a okolí	Občan.sdruž.Seče a okolí, SNK	SNK	1	080	1249	10.87	1
5301	572225	Seč	1	7	53	53	Občanská demokratická strana	Občan.demokrat.strana - ODS	ODS	1	053	2234	19.45	3