OKRES	KODZASTUP	COBVODU	POR_STR_HL	OSTRANA	PORCISLO	JMENO	PRIJMENI	TITULPRED	TITULZA	VEK	POVOLANI	BYDLISTEN	PSTRANA	NSTRANA	PLATNOST	POHLAVI
2109	538566	1	1	901	1	Martin	Šubrt			49	současný člen zastupit. obce, úředník ÚMČ Praha 14	Nový Vestec	99	80	0	M
2109	538566	1	1	901	2	Renata	Hájková			52	současná členka zastupitelstva obce, účetní	Nový Vestec	99	80	0	F
2109	538566	1	1	901	3	Jana	Štěpánková			49	současná členka zastupitelstva obce, živnostník	Nový Vestec	99	80	0	F
2109	538566	1	1	901	4	Zdeněk	Rataj			45	současný člen zastupitelstva obce, živnostník	Nový Vestec	99	80	0	M
2109	538566	1	1	901	5	Miroslav	Smolík			49	současný člen zastupitelsva obce,operátor-technik	Nový Vestec	99	80	0	M
2109	538566	1	1	901	6	Bronislav	Bodlák			35	instalatér	Nový Vestec	99	80	0	M
2109	538566	1	1	901	7	Jiří	Lubert			36	disponent dopravy	Nový Vestec	99	80	0	M