OKRES	KODZASTUP	NAZEVZAST	COBVODU	POR_STR_HL	OSTRANA	VSTRANA	NAZEVCELK	ZKRATKAO30	ZKRATKAO8	POCSTR_SLO	SLOZENI	HLASY_STR	PROCHLSTR	MAND_STR
3106	551970	Volyně	1	1	47	47	Komunistická strana Čech a Moravy	Komunistická str.Čech a Moravy	KSČM	1	047	2781	16.56	2
3106	551970	Volyně	1	2	7	7	Česká strana sociálně demokratická	Česká str.sociálně demokrat.	ČSSD	1	007	2292	18.61	2
3106	551970	Volyně	1	3	181	181	Nestraníci	Nestraníci	Nestran.	1	181	4385	26.11	4
3106	551970	Volyně	1	4	1	1	Křesťanská a demokratická unie - Československá strana lidová	Křesť.demokr.unie-Čs.str.lid.	KDU-ČSL	1	001	2963	17.64	3
3106	551970	Volyně	1	5	53	53	Občanská demokratická strana	Občanská demokratická strana	ODS	1	053	4370	26.02	4