OKRES	KODZASTUP	NAZEVZAST	COBVODU	POR_STR_HL	OSTRANA	VSTRANA	NAZEVCELK	ZKRATKAO30	ZKRATKAO8	POCSTR_SLO	SLOZENI	HLASY_STR	PROCHLSTR	MAND_STR
6104	550612	Horní Smrčné	1	1	805	80	Pavel Láník, nezávislý kandidát	Pavel Láník, NK	NK	1	080	35	91.3	1
6104	550612	Horní Smrčné	1	2	807	80	Radek Hřib, nezávislý kandidát	Radek Hřib, NK	NK	1	080	14	36.52	0
6104	550612	Horní Smrčné	1	3	808	80	František Pekárek, nezávislý kandidát	František Pekárek, NK	NK	1	080	37	96.52	1
6104	550612	Horní Smrčné	1	4	806	80	Milan Caha, nezávislý kandidát	Milan Caha, NK	NK	1	080	6	15.65	0
6104	550612	Horní Smrčné	1	5	804	80	Jaromír Křivánek, nezávislý kandidát	Jaromír Křivánek, NK	NK	1	080	38	99.13	1
6104	550612	Horní Smrčné	1	6	801	80	Pavel Němec, nezávislý kandidát	Pavel Němec, NK	NK	1	080	31	80.86	1
6104	550612	Horní Smrčné	1	7	803	80	Miroslav Kružík, nezávislý kandidát	Miroslav Kružík, NK	NK	1	080	39	101.73	1
6104	550612	Horní Smrčné	1	8	809	80	Iveta Vítková, nezávislý kandidát	Iveta Vítková, NK	NK	1	080	10	26.08	0
6104	550612	Horní Smrčné	1	9	802	80	Vlastimil Němec, nezávislý kandidát	Vlastimil Němec, NK	NK	1	080	20	52.17	1