OKRES	KODZASTUP	NAZEVZAST	COBVODU	POR_STR_HL	OSTRANA	VSTRANA	NAZEVCELK	ZKRATKAO30	ZKRATKAO8	POCSTR_SLO	SLOZENI	HLASY_STR	PROCHLSTR	MAND_STR
2110	539759	Třebotov	1	1	53	53	Občanská demokratická strana (ODS)	Občanská demokratická strana	ODS	1	053	446	19.33	1
2110	539759	Třebotov	1	2	903	90	T Ř E B O T O V	SNK - TŘEBOTOV	SNK-TREB	1	080	1315	31.67	3
2110	539759	Třebotov	1	3	902	90	Za rozvoj technické infrastruktury obce	SNK - Za rozvoj infrastruktury	SNK-ZRI	1	080	732	31.74	1
2110	539759	Třebotov	1	4	47	47	Komunistická strana Čech a Moravy	Komunistická str.Čech a Moravy	KSČM	1	047	413	12.79	1
2110	539759	Třebotov	1	5	801	80	Nezávislý kandidát	Jan Náprstek, NK	NK	1	080	119	25.8	0
2110	539759	Třebotov	1	6	901	90	Sdružení hasičů Třebotov	SNK - Sdružení hasičů Třebotov	SNK-SHT	1	080	1126	27.12	3