OKRES	KODZASTUP	NAZEVZAST	COBVODU	POR_STR_HL	OSTRANA	VSTRANA	NAZEVCELK	ZKRATKAO30	ZKRATKAO8	POCSTR_SLO	SLOZENI	HLASY_STR	PROCHLSTR	MAND_STR
5304	573426	Anenská Studánka	1	1	805	80	Alois Ptáček, nezávislý kandidát	Alois Ptáček, NK	NK	1	080	14	22.08	0
5304	573426	Anenská Studánka	1	2	801	80	Růžena Motlová, nezávislý kandidát	Růžena Motlová, NK	NK	1	080	29	45.74	0
5304	573426	Anenská Studánka	1	3	803	80	Jitka Danišová, nezávislý kandidát	Jitka Danišová, NK	NK	1	080	9	14.19	0
5304	573426	Anenská Studánka	1	4	802	80	Rudolf Zadražil, nezávislý kandidát	Rudolf Zadražil, NK	NK	1	080	25	39.43	0
5304	573426	Anenská Studánka	1	5	902	90	Za obec krásnější II.	Za obec krásnější II., SNK	SNK	1	080	135	42.58	3
5304	573426	Anenská Studánka	1	6	804	80	Petr Motl, nezávislý kandidát	Petr Motl, NK	NK	1	080	7	11.04	0
5304	573426	Anenská Studánka	1	7	901	90	Za obec krásnější I.	Za obec krásnější I., SNK	SNK	1	080	98	30.91	2