OKRES	KODZASTUP	NAZEVZAST	COBVODU	POR_STR_HL	OSTRANA	VSTRANA	NAZEVCELK	ZKRATKAO30	ZKRATKAO8	POCSTR_SLO	SLOZENI	HLASY_STR	PROCHLSTR	MAND_STR
6203	545295	Skalička	1	1	803	80	Dobromila Holemá, nezávislý kandidát	Dobromila Holemá, NK	NK	1	080	59	85.86	1
6203	545295	Skalička	1	2	805	80	Antonín Klíma, nezávislý kandidát	Antonín Klíma, NK	NK	1	080	16	23.28	0
6203	545295	Skalička	1	3	804	80	Miroslav Pařízek, nezávislý kandidát	Miroslav Pařízek, NK	NK	1	080	77	112.05	1
6203	545295	Skalička	1	4	801	80	Milan Krapka, nezávislý kandidát	Milan Krapka, NK	NK	1	080	46	66.94	1
6203	545295	Skalička	1	5	806	80	Pavel Klíma, nezávislý kandidát	Pavel Klíma, NK	NK	1	080	64	93.13	1
6203	545295	Skalička	1	6	809	80	Marcela Kratochvílová, nezávislý kandidát	Marcela Kratochvílová, NK	NK	1	080	43	62.57	1
6203	545295	Skalička	1	7	802	80	Martin Kočí, nezávislý kandidát	Martin Kočí, NK	NK	1	080	76	110.6	1
6203	545295	Skalička	1	8	808	80	Marie Dvořáková, nezávislý kandidát	Marie Dvořáková, NK	NK	1	080	63	91.68	1
6203	545295	Skalička	1	9	807	80	Leoš Kratochvíl, nezávislý kandidát	Leoš Kratochvíl, NK	NK	1	080	37	53.84	0