OKRES	KODZASTUP	NAZEVZAST	COBVODU	POR_STR_HL	OSTRANA	VSTRANA	NAZEVCELK	ZKRATKAO30	ZKRATKAO8	POCSTR_SLO	SLOZENI	HLASY_STR	PROCHLSTR	MAND_STR
2108	537951	Vlkov pod Oškobrhem	1	1	808	80	Josef Ouředníček, nezávislý kandidát	Josef Ouředníček, NK	NK 8	1	080	49	85.96	1
2108	537951	Vlkov pod Oškobrhem	1	2	801	80	Miloslava Poborská, nezávislý kandidát	Miloslava Poborská, NK	NK 1	1	080	21	36.84	0
2108	537951	Vlkov pod Oškobrhem	1	3	807	80	Věra Střelcová, nezávislý kandidát	Věra Střelcová, NK	NK 7	1	080	28	49.12	0
2108	537951	Vlkov pod Oškobrhem	1	4	806	80	Rudolf Lukavec, nezávislý kandidát	Rudolf Lukavec, NK	NK 6	1	080	36	63.15	1
2108	537951	Vlkov pod Oškobrhem	1	5	803	80	František Beitler, nezávislý kandidát	František Beitler, NK	NK 3	1	080	46	80.7	1
2108	537951	Vlkov pod Oškobrhem	1	6	804	80	Václav Fiala, nezávislý kandidát	Václav Fiala, NK	NK 4	1	080	47	82.45	1
2108	537951	Vlkov pod Oškobrhem	1	7	805	80	Ilonka Glogičová, nezávislý kandidát	Ilonka Glogičová, NK	NK 5	1	080	9	15.78	0
2108	537951	Vlkov pod Oškobrhem	1	8	802	80	Vladimíra Bartůňková, nezávislý kandidát	Vladimíra Bartůňková, NK	NK 2	1	080	49	85.96	1