OKRES	KODZASTUP	NAZEVZAST	COBVODU	POR_STR_HL	OSTRANA	VSTRANA	NAZEVCELK	ZKRATKAO30	ZKRATKAO8	POCSTR_SLO	SLOZENI	HLASY_STR	PROCHLSTR	MAND_STR
3102	545619	Malonty	1	1	901	90	SDRUŽENÍ NEZÁVISLÝCH KANDIDÁTŮ SPORTOVCI	SNK SPORTOVCI	SNK	1	080	614	11.1	1
3102	545619	Malonty	1	2	902	90	Pro další rozvoj obce	Pro další rozvoj obce	SNK	1	080	2078	37.57	5
3102	545619	Malonty	1	3	47	47	Komunistická strana Čech a Moravy	Komunistická str.Čech a Moravy	KSČM	1	047	1080	19.52	2
3102	545619	Malonty	1	4	903	90	"""MLADÍ NEZÁVISLÍ"""	"""MLADÍ NEZÁVISLÍ"""	SNK	1	080	674	12.18	1
3102	545619	Malonty	1	5	904	90	Nezávislí kandidáti obce Malonty a přidružených částí	NKobce Malonty a přidruž.částí	SNK	1	080	477	8.62	1
3102	545619	Malonty	1	6	7	7	Česká strana sociálně demokratická	Česká str.sociálně demokrat.	ČSSD	1	007	608	10.99	1