OKRES	KODZASTUP	NAZEVZAST	COBVODU	POR_STR_HL	OSTRANA	VSTRANA	NAZEVCELK	ZKRATKAO30	ZKRATKAO8	POCSTR_SLO	SLOZENI	HLASY_STR	PROCHLSTR	MAND_STR
2102	533203	Králův Dvůr	1	1	449	449	"""Králodvoráci za slušnou politiku"" - SNK Evropští demokraté"	"""Králodv. za sluš. pol.-SNK ED"		2	080,129	4148	15.53	2
2102	533203	Králův Dvůr	1	2	47	47	Komunistická strana Čech a Moravy	Komunistická str.Čech a Moravy	KSČM	1	047	3461	12.96	2
2102	533203	Králův Dvůr	1	3	7	7	Česká strana sociálně demokratická	Česká str.sociálně demokrat.	ČSSD	1	007	6756	25.3	4
2102	533203	Králův Dvůr	1	4	53	53	Občanská demokratická strana	Občanská demokratická strana	ODS	1	053	7542	28.24	4
2102	533203	Králův Dvůr	1	5	901	90	Občanské sdružení Králova Dvora	Občanské sdr.Králova Dvora	OSKD	1	080	4793	17.95	3