OKRES	KODZASTUP	NAZEVZAST	COBVODU	POR_STR_HL	OSTRANA	VSTRANA	NAZEVCELK	ZKRATKAO30	ZKRATKAO8	POCSTR_SLO	SLOZENI	HLASY_STR	PROCHLSTR	MAND_STR
6104	587664	Dolní Lažany	1	1	804	80	Jiřina Krotká, nezávislý kandidát	Jiřina Krotká, NK	NK	1	080	23	83.41	1
6104	587664	Dolní Lažany	1	2	803	80	Pavel Roupec, nezávislý kandidát	Pavel Roupec, NK	NK	1	080	38	137.82	1
6104	587664	Dolní Lažany	1	3	802	80	Milena Vojtěchová, nezávislý kandidát	Milena Vojtěchová, NK	NK	1	080	16	58.03	1
6104	587664	Dolní Lažany	1	4	806	80	Eva Krotká, nezávislý kandidát	Eva Krotká, NK	NK	1	080	19	68.91	1
6104	587664	Dolní Lažany	1	5	801	80	František Hruška, nezávislý kandidát	František Hruška, NK	NK	1	080	23	83.41	1
6104	587664	Dolní Lažany	1	6	805	80	Filip Durda, nezávislý kandidát	Filip Durda, NK	NK	1	080	47	170.46	1
6104	587664	Dolní Lažany	1	7	807	80	Božena Bílá, nezávislý kandidát	Božena Bílá, NK	NK	1	080	27	97.92	1