OKRES	KODZASTUP	NAZEVZAST	COBVODU	POR_STR_HL	OSTRANA	VSTRANA	NAZEVCELK	ZKRATKAO30	ZKRATKAO8	POCSTR_SLO	SLOZENI	HLASY_STR	PROCHLSTR	MAND_STR
7105	540773	Postřelmov	1	1	181	181	Nestraníci	Nestraníci	Nestran.	1	181	6118	36.83	6
7105	540773	Postřelmov	1	2	724	724	Strana Práv Občanů ZEMANOVCI	Strana Práv Občanů ZEMANOVCI	SPOZ	1	724	681	4.09	0
7105	540773	Postřelmov	1	3	901	90	Volba pro Postřelmov	Volba pro Postřelmov	SNK	1	080	4398	26.47	4
7105	540773	Postřelmov	1	4	47	47	Komunistická strana Čech a Moravy	Komunistická str.Čech a Moravy	KSČM	1	047	2114	12.72	2
7105	540773	Postřelmov	1	5	1	1	Křesťanská a demokratická unie - Československá strana lidová	Křesť.demokr.unie-Čs.str.lid.	KDU-ČSL	1	001	3300	19.86	3