OKRES	KODZASTUP	NAZEVZAST	COBVODU	POR_STR_HL	OSTRANA	VSTRANA	NAZEVCELK	ZKRATKAO30	ZKRATKAO8	POCSTR_SLO	SLOZENI	HLASY_STR	PROCHLSTR	MAND_STR
6203	583839	Říčany	1	1	47	47	Komunistická strana Čech a Moravy	Komunistická str.Čech a Moravy	KSČM	1	047	1151	10.51	1
6203	583839	Říčany	1	2	7	7	Česká strana sociálně demokratická	Česká str.sociálně demokrat.	ČSSD	1	007	1393	12.72	2
6203	583839	Říčany	1	3	901	90	Říčanská mládež, sdružení nezávislých kandidátů	Říčanská mládež, SNK	ŘM, SNK	1	080	1825	16.66	2
6203	583839	Říčany	1	4	902	90	Sdružení nezávislých kandidátů	Sdružení nezávislých kandidátů	SNK	1	080	2460	22.46	3
6203	583839	Říčany	1	5	53	53	Občanská demokratická strana	Občanská demokratická strana	ODS	1	053	2488	22.71	3
6203	583839	Říčany	1	6	1	1	Křesťanská a demokratická unie - Československá strana lidová	Křesť.demokr.unie-Čs.str.lid.	KDU-ČSL	1	001	1634	14.92	2