OKRES	KODZASTUP	NAZEVZAST	COBVODU	POR_STR_HL	OSTRANA	VSTRANA	NAZEVCELK	ZKRATKAO30	ZKRATKAO8	POCSTR_SLO	SLOZENI	HLASY_STR	PROCHLSTR	MAND_STR
3202	542148	Modrava	1	1	807	80	Jiří Steins, nezávislý kandidát	Jiří Steins, NK	NK	1	080	19	86.92	1
3202	542148	Modrava	1	2	801	80	Vratislava Pavlíková, nezávislý kandidát	Vratislava Pavlíková, NK	NK	1	080	23	105.22	1
3202	542148	Modrava	1	3	805	80	Jiří Valečka, nezávislý kandidát	Jiří Valečka, NK	NK	1	080	22	100.65	1
3202	542148	Modrava	1	4	802	80	Michaela Lyer, nezávislý kandidát	Michaela Lyer, NK	NK	1	080	20	91.5	1
3202	542148	Modrava	1	5	803	80	Antonín Schubert, nezávislý kandidát	Antonín Schubert, NK	NK	1	080	27	123.52	1
3202	542148	Modrava	1	6	806	80	Pavel Korčák, nezávislý kandidát	Pavel Korčák, NK	NK	1	080	21	96.07	1
3202	542148	Modrava	1	7	804	80	Jaroslav Doležal, nezávislý kandidát	Jaroslav Doležal, NK	NK	1	080	21	96.07	1