OKRES	KODZASTUP	NAZEVZAST	COBVODU	POR_STR_HL	OSTRANA	VSTRANA	NAZEVCELK	ZKRATKAO30	ZKRATKAO8	POCSTR_SLO	SLOZENI	HLASY_STR	PROCHLSTR	MAND_STR
8106	554219	Nová Bělá	1	1	47	47	Komunistická strana Čech a Moravy	Komunistická str.Čech a Moravy	KSČM	1	047	3006	26.4	4
8106	554219	Nová Bělá	1	2	7	7	Česká strana sociálně demokratická	Česká str.sociálně demokrat.	ČSSD	1	007	2235	19.63	3
8106	554219	Nová Bělá	1	3	1	1	Křesťanská a demokratická unie - Československá strana lidová a nezávislí kandidáti	KDU-ČSL a nezávislí kandidáti	KDU-ČSL	1	001	3357	29.48	4
8106	554219	Nová Bělá	1	4	53	53	Občanská demokratická strana	Občanská demokratická strana	ODS	1	053	2032	17.84	3
8106	554219	Nová Bělá	1	5	714	714	Strana svobodných občanů	Strana svobodných občanů	Svobodní	1	714	755	12.43	1