OKRES	KODZASTUP	NAZEVZAST	COBVODU	POR_STR_HL	OSTRANA	VSTRANA	NAZEVCELK	ZKRATKAO30	ZKRATKAO8	POCSTR_SLO	SLOZENI	HLASY_STR	PROCHLSTR	MAND_STR
3201	553441	Bělá nad Radbuzou	1	1	1114	1114	Svoboda a přímá demokracie (SPD)	Svoboda a př. demokracie (SPD)	SPD	1	1114			
3201	553441	Bělá nad Radbuzou	1	2	47	47	Komunistická strana Čech a Moravy	Komunistická str.Čech a Moravy	KSČM	1	047			
3201	553441	Bělá nad Radbuzou	1	3	901	90	Pro naše občany	Pro naše občany	SNK	1	080			
3201	553441	Bělá nad Radbuzou	1	4	902	90	Sdružení nezávislých kandidátů VIZE 2026	SNK VIZE 2026	SNK	1	080			
3201	553441	Bělá nad Radbuzou	1	5	1404	1404	Hnutí STAROSTOVÉ A NEZÁVISLÍ a KDU-ČSL	Hnutí STAN a KDU-ČSL	KDU-ČSL+STAN+NK	3	001,080,166			