OKRES	KODZASTUP	NAZEVZAST	COBVODU	POR_STR_HL	OSTRANA	VSTRANA	NAZEVCELK	ZKRATKAO30	ZKRATKAO8	POCSTR_SLO	SLOZENI	HLASY_STR	PROCHLSTR	MAND_STR
5304	580031	Česká Třebová	1	1	1103	1103	KOALICE PRO ČESKOU TŘEBOVOU	KOALICE KDU-ČSL, SZ, SNK ED		3	001,005,129	29961	25.32	7
5304	580031	Česká Třebová	1	2	47	47	Komunistická strana Čech a Moravy	Komunistická str.Čech a Moravy	KSČM	1	047	4105	6.69	1
5304	580031	Česká Třebová	1	3	181	181	NESTRANÍCI s podporou TOP 09	NESTRANÍCI s podporou TOP 09	Nestran.	1	181	40019	33.83	9
5304	580031	Česká Třebová	1	4	53	53	Občanská demokratická strana	Občanská demokratická strana	ODS	1	053	9025	7.62	2
5304	580031	Česká Třebová	1	5	1083	1083	Třebováci PRO Sport a Zdraví	Třebováci, Koalice SZSP a PSZ		2	142,785	10350	8.75	2
5304	580031	Česká Třebová	1	6	7	7	Česká strana sociálně demokratická	Česká str.sociálně demokrat.	ČSSD	1	007	24825	20.98	6