OKRES	KODZASTUP	NAZEVZAST	COBVODU	POR_STR_HL	OSTRANA	VSTRANA	NAZEVCELK	ZKRATKAO30	ZKRATKAO8	POCSTR_SLO	SLOZENI	HLASY_STR	PROCHLSTR	MAND_STR
5103	564117	Chrastava	1	1	7	7	Česká strana sociálně demokratická	Česká str.sociálně demokrat.	ČSSD	1	007	5062	14.44	3
5103	564117	Chrastava	1	2	901	90	Pro změnu v Chrastavě	Pro změnu v Chrastavě	SNK	1	080	6365	18.16	3
5103	564117	Chrastava	1	3	53	53	Občanská demokratická strana	Občanská demokratická strana	ODS	1	053	5896	16.82	3
5103	564117	Chrastava	1	4	703	703	Starostové pro Liberecký kraj	Starostové pro Liberecký kraj	SLK	1	703	14053	40.09	8
5103	564117	Chrastava	1	5	47	47	Komunistická strana Čech a Moravy	Komunistická str.Čech a Moravy	KSČM	1	047	3673	10.47	2