OKRES	KODZASTUP	NAZEVZAST	COBVODU	POR_STR_HL	OSTRANA	VSTRANA	NAZEVCELK	ZKRATKAO30	ZKRATKAO8	POCSTR_SLO	SLOZENI	HLASY_STR	PROCHLSTR	MAND_STR
5304	579971	Bystřec	1	1	1	1	Křesťanská a demokratická unie - Československá strana lidová	Křesť.demokr.unie-Čs.str.lid.	KDU-ČSL	1	001	1337	43.25	4
5304	579971	Bystřec	1	2	801	80	Václav Matějka, DiS.	Václav Matějka	NK	1	080	256	66.25	0
5304	579971	Bystřec	1	3	902	90	Sdružení nezávislých kandidátů za další rozvoj obce Bystřec	SNK za další roz. obce Bystřec	SNK	1	080	2249	52.91	6
5304	579971	Bystřec	1	4	802	80	Petr Havlena	Petr Havlena	NK	1	080	198	51.24	0
5304	579971	Bystřec	1	5	901	90	Sdružení nezávislých kandidátů obce Bystřec	SNK obce Bystřec	SNK	1	080	1756	56.8	5