OKRES	KODZASTUP	NAZEVZAST	COBVODU	POR_STR_HL	OSTRANA	VSTRANA	NAZEVCELK	ZKRATKAO30	ZKRATKAO8	POCSTR_SLO	SLOZENI	HLASY_STR	PROCHLSTR	MAND_STR
4103	511587	Josefov	1	1	47	47	Komunistická strana Čech a Moravy	Komunistická str.Čech a Moravy	KSČM	1	047	257	38.3	2
4103	511587	Josefov	1	2	901	90	Sdružení Nezávislých Kandidátů	Sdruž. Nezáv. Kandidátů - SNK	SNK	1	080	305	45.45	2
4103	511587	Josefov	1	3	902	90	Sdružení Nezávislých Kandidátů 2, pro obec krásnější	SNK - SNK2, pro obec krásnější	SNK	1	080	109	27.07	1
4103	538337	Krásno	1	1	902	90	Sdružení nezávislých kandidátů	Sdruž.nezáv.kand.	SNK	1	080	619	16.29	2
4103	538337	Krásno	1	2	7	7	Česká strana sociálně demokratická	Česká str.sociálně demokrat.	ČSSD	1	007	229	9.47	0
4103	538337	Krásno	1	3	903	90	Sdružení nezávislých kandidátů Volba pro Krásno	SNK - Volba pro Krásno	SNK	1	080	865	22.76	3
4103	538337	Krásno	1	4	904	90	Sdružení nezávislých kandidátů - ženy	Sdruž.nezáv.kand.- ženy	SNK	1	080	687	18.08	2
4103	538337	Krásno	1	5	901	90	Sdružení nezávislých kandidátů - Hasiči pro Krásno	SNK - Hasiči pro Krásno	SNK	1	080	485	12.76	1
4103	538337	Krásno	1	6	905	90	Sdružení nezávislých kandidátů Změna je život	SNK Změna je život	SNK	1	080	914	24.05	3
4103	538396	Šabina	1	1	53	53	Občanská demokratická strana	Občanská demokratická strana	ODS	1	053	567	34.95	3
4103	538396	Šabina	1	2	801	80	Jan Bína, nezávislý kandidát	Jan Bína, NK	NK	1	080	18	9.98	0
4103	538396	Šabina	1	3	901	90	"""Sdružení nezávislých kandidátů 2006"" - sdružení nezávislých kandidátů"	"""Sdruž.nezáv.kand.2006"" - SNK"	SNK	1	080	237	16.43	1
4103	538396	Šabina	1	4	902	90	Sdružení nezávislých kandidátů Šabiny - sdružení nezávislých kandidátů	Sdruž.nezáv.kand.Šabiny - SNK	SNK	1	080	800	49.32	5
4103	538434	Svatava	1	1	1	1	Křesťanská a demokratická unie - Československá strana lidová	Křesť.demokr.unie-Čs.str.lid.	KDU-ČSL	1	001	1273	23.18	2
4103	538434	Svatava	1	2	7	7	Česká strana sociálně demokratická	Česká str.sociálně demokrat.	ČSSD	1	007	2614	47.61	6
4103	538434	Svatava	1	3	47	47	Komunistická strana Čech a Moravy	Komunistická str.Čech a Moravy	KSČM	1	047	1603	29.19	3
4103	538591	Dolní Rychnov	1	1	47	47	Komunistická strana Čech a Moravy	Komunistická str.Čech a Moravy	KSČM	1	047	1747	62.01	6
4103	538591	Dolní Rychnov	1	2	1	1	Křesťanská a demokratická unie - Československá strana lidová	Křesť.demokr.unie-Čs.str.lid.	KDU-ČSL	1	001	1070	37.98	3
4103	538663	Tatrovice	1	1	901	90	Sdružení nezávislých kandidátů - Za Tatrovice krásnější	SNK- Za Tatrovice krásnější	SNK	1	080	393	65.28	5
4103	538663	Tatrovice	1	2	53	53	Občanská demokratická strana	Občanská demokratická strana	ODS	1	053	188	31.22	2
4103	538663	Tatrovice	1	3	1	1	Křesťanská a demokratická unie - Československá strana lidová	Křesť.demokr.unie-Čs.str.lid.	KDU-ČSL	1	001	21	24.41	0
4103	560286	Sokolov	1	1	129	129	SNK Evropští demokraté	SNK Evropští demokraté	SNK ED	1	129	3218	2.5	0
4103	560286	Sokolov	1	2	53	53	Občanská demokratická strana	Občanská demokratická strana	ODS	1	053	48187	34.66	10
4103	560286	Sokolov	1	3	5	5	Strana zelených	Strana zelených	SZ	1	005	10956	8.18	2
4103	560286	Sokolov	1	4	47	47	Komunistická strana Čech a Moravy	Komunistická str.Čech a Moravy	KSČM	1	047	22410	16.74	5
4103	560286	Sokolov	1	5	7	7	Česká strana sociálně demokratická	Česká str.sociálně demokrat.	ČSSD	1	007	33816	24.32	7
4103	560286	Sokolov	1	6	1	1	Křesťanská a demokratická unie - Československá strana lidová	Křesť.demokr.unie-Čs.str.lid.	KDU-ČSL	1	001	3204	2.3	0
4103	560286	Sokolov	1	7	407	407	Radnice Středu	Radnice Středu		2	080,103	17203	12.37	3
4103	560294	Březová	1	1	5	5	Strana zelených	Strana zelených	SZ	1	005	769	11.42	1
4103	560294	Březová	1	2	7	7	Česká strana sociálně demokratická	Česká str.sociálně demokrat.	ČSSD	1	007	1915	26.07	3
4103	560294	Březová	1	3	47	47	Komunistická strana Čech a Moravy	Komunistická str.Čech a Moravy	KSČM	1	047	2464	26.83	4
4103	560294	Březová	1	4	53	53	Občanská demokratická strana	Občanská demokratická strana	ODS	1	053	4034	43.93	7
4103	560308	Bublava	1	1	903	90	Bublava pro obyvatele	Bublava pro obyvatele	BPO	1	080	606	47.82	4
4103	560308	Bublava	1	2	801	80	Mgr. Michala Hrádková, nezávislý kandidát	Mgr. Michala Hrádková, NK	NK	1	080	53	29.28	0
4103	560308	Bublava	1	3	902	90	"SNK ""Bublava 2010"""	"SNK ""Bublava 2010"""	SNK	1	080	370	29.2	2
4103	560308	Bublava	1	4	47	47	Komunistická strana Čech a Moravy	Komunistická str.Čech a Moravy	KSČM	1	047	94	7.41	0
4103	560308	Bublava	1	5	901	90	Budoucnost a prosperita	Budoucnost a prosperita	SNK	1	080	144	11.36	1
4103	560316	Bukovany	1	1	902	90	Sdružení nezávislých kandidátů za rozvoj obce	Sdruž.nezáv.kand.	SNK	1	080	1990	43.64	5
4103	560316	Bukovany	1	2	901	90	Sdružení nezávislých kandidátů	Sdruž.nezáv.kand.	SNK	1	080	1192	26.14	3
4103	560316	Bukovany	1	3	7	7	Česká strana sociálně demokratická	Česká str.sociálně demokrat.	ČSSD	1	007	1378	30.21	3
4103	560324	Citice	1	1	901	90	"""Pro naši obec"" - sdružení nezávislých kandidátů"	"""Pro naši obec"" - SNK"	SNK	1	080	1319	100	11
4103	560332	Dasnice	1	1	53	53	Občanská demokratická strana	Občanská demokratická strana	ODS	1	053	175	23.48	1
4103	560332	Dasnice	1	2	7	7	Česká strana sociálně demokratická	Česká str.sociálně demokrat.	ČSSD	1	007	570	76.51	4
4103	560341	Dolní Nivy	1	1	901	90	Pro spokojené občany - sdružení nezávislých kandidátů	Pro spokojené občany - SNK	SNK	1	080	801	82.66	8
4103	560341	Dolní Nivy	1	2	902	90	Sdružení nezávislých kandidátů	Sdruž.nezáv.kand.	SNK	1	080	168	26	1
4103	560359	Habartov	1	1	88	88	NEZÁVISLÍ	NEZÁVISLÍ	NEZ	1	088	4797	19.3	4
4103	560359	Habartov	1	2	53	53	Občanská demokratická strana	Občanská demokratická strana	ODS	1	053	8430	33.92	8
4103	560359	Habartov	1	3	172	172	NEZÁVISLÍ DEMOKRATÉ (předseda V.Železný)	NEZ.DEMOKRATÉ(předs.V.Železný)	NEZ/DEM	1	172	1487	5.98	1
4103	560359	Habartov	1	4	7	7	Česká strana sociálně demokratická	Česká str.sociálně demokrat.	ČSSD	1	007	6065	24.4	5
4103	560359	Habartov	1	5	47	47	Komunistická strana Čech a Moravy	Komunistická str.Čech a Moravy	KSČM	1	047	4071	16.38	3
4103	560367	Horní Slavkov	1	1	88	88	NEZÁVISLÍ	NEZÁVISLÍ	NEZ	1	088	3086	16.2	2
4103	560367	Horní Slavkov	1	2	7	7	Česká strana sociálně demokratická	Česká str.sociálně demokrat.	ČSSD	1	007	3481	18.28	3
4103	560367	Horní Slavkov	1	3	47	47	Komunistická strana Čech a Moravy	Komunistická str.Čech a Moravy	KSČM	1	047	3763	19.76	3
4103	560367	Horní Slavkov	1	4	5	5	Strana zelených	Strana zelených	SZ	1	005	4252	22.33	3
4103	560367	Horní Slavkov	1	5	53	53	Občanská demokratická strana	Občanská demokratická strana	ODS	1	053	4457	23.4	4
4103	560375	Chlum Svaté Maří	1	1	7	7	Česká strana sociálně demokratická	Česká str.sociálně demokrat.	ČSSD	1	007	315	50.23	4
4103	560375	Chlum Svaté Maří	1	2	1	1	Křesťanská a demokratická unie - Československá strana lidová	Křesť.demokr.unie-Čs.str.lid.	KDU-ČSL	1	001	124	46.14	1
4103	560375	Chlum Svaté Maří	1	3	901	90	Chlum Svaté Máří - Naše obec, sdružení nezávislých kandidátů	Chlum Svaté Máří-Naše obec,SNK	SNK	1	080	188	69.96	2
4103	560383	Chodov	1	1	47	47	Komunistická strana Čech a Moravy	Komunistická str.Čech a Moravy	KSČM	1	047	6968	11.35	2
4103	560383	Chodov	1	2	270	270	Koalice KDU-ČSL, US-DEU	Koalice KDU-ČSL, US-DEU		2	001,102	5107	8.32	2
4103	560383	Chodov	1	3	7	7	Česká strana sociálně demokratická	Česká str.sociálně demokrat.	ČSSD	1	007	6281	10.23	2
4103	560383	Chodov	1	4	113	113	Volba pro město	Volba pro město	VPM	1	113	3983	6.49	1
4103	560383	Chodov	1	5	112	112	Hnutí nezávislých za harmonický rozvoj obcí a měst	Hn.za harm.rozvoj obcí a měst	HNHRM	1	112	25219	41.11	9
4103	560383	Chodov	1	6	53	53	Občanská demokratická strana	Občanská demokratická strana	ODS	1	053	13784	22.47	5
4103	560413	Jindřichovice	1	1	901	90	"sdružení nezávislých kandidátů ""JINDŘICHOVICKO"""	"SNK ""JINDŘICHOVICKO"""	SNK	1	080	184	12.12	0
4103	560413	Jindřichovice	1	2	53	53	Občanská demokratická strana	Občanská demokratická strana	ODS	1	053	40	15.81	0
4103	560413	Jindřichovice	1	3	47	47	Komunistická strana Čech a Moravy	Komunistická str.Čech a Moravy	KSČM	1	047	419	23.65	2
4103	560413	Jindřichovice	1	4	902	90	"""Porozumění"""	"""Porozumění"""	SNK	1	080	819	46.24	4
4103	560413	Jindřichovice	1	5	7	7	Česká strana sociálně demokratická	Česká str.sociálně demokrat.	ČSSD	1	007	309	17.44	1
4103	560421	Kaceřov	1	1	805	80	Jana Martinovská, nezávislý kandidát	Jana Martinovská, NK	NK	1	080	57	43.58	0
4103	560421	Kaceřov	1	2	807	80	Bohumil Pokorný, nezávislý kandidát	Bohumil Pokorný, NK	NK	1	080	95	72.64	1
4103	560421	Kaceřov	1	3	811	80	Gašpar Balog, nezávislý kandidát	Gašpar Balog, NK	NK	1	080	118	90.22	1
4103	560421	Kaceřov	1	4	812	80	Robert Hamouz, nezávislý kandidát	Robert Hamouz, NK	NK	1	080	42	32.11	0
4103	560421	Kaceřov	1	5	801	80	Vladimír Hamouz, nezávislý kandidát	Vladimír Hamouz, NK	NK	1	080	95	72.64	1
4103	560421	Kaceřov	1	6	802	80	Miroslava Zadražilová, nezávislý kandidát	Miroslava Zadražilová, NK	NK	1	080	143	109.34	1
4103	560421	Kaceřov	1	7	809	80	Miroslav Püchner, nezávislý kandidát	Miroslav Püchner, NK	NK	1	080	128	97.87	1
4103	560421	Kaceřov	1	8	803	80	Veronika Kunzová, nezávislý kandidát	Veronika Kunzová, NK	NK	1	080	126	96.34	1
4103	560421	Kaceřov	1	9	808	80	Tomáš Havránek, nezávislý kandidát	Tomáš Havránek, NK	NK	1	080	76	58.11	0
4103	560421	Kaceřov	1	10	804	80	Vítězslav Balog, nezávislý kandidát	Vítězslav Balog, NK	NK	1	080	102	77.99	1
4103	560421	Kaceřov	1	11	810	80	Ervín Wallisch, nezávislý kandidát	Ervín Wallisch, NK	NK	1	080	102	77.99	1
4103	560421	Kaceřov	1	12	806	80	Miroslav Hamouz, nezávislý kandidát	Miroslav Hamouz, NK	NK	1	080	93	71.11	1
4103	560456	Krajková	1	1	901	90	Sdružení nezávislých kandidátů Krajková	Sdruž.nezáv.kand.Krajková	SNK	1	080	1757	57.17	5
4103	560456	Krajková	1	2	112	112	Hnutí nezávislých za harmonický rozvoj obcí a měst	Hn.za harm.rozvoj obcí a měst	HNHRM	1	112	1316	42.82	4
4103	560464	Královské Poříčí	1	1	102	102	Unie svobody - Demokratická unie	Unie svobody-Demokratická unie	US-DEU	1	102	1952	76.63	7
4103	560464	Královské Poříčí	1	2	53	53	Občanská demokratická strana	Občanská demokratická strana	ODS	1	053	595	23.36	2
4103	560472	Kraslice	1	1	129	129	SNK Evropští demokraté	SNK Evropští demokraté	SNK ED	1	129	3491	11.75	2
4103	560472	Kraslice	1	2	407	407	Cesta změny - sdružení Strany pro otevřenou společnost a nezávislých kandidátů	Cesta změny - Sdružení SOS, NK		2	080,103	3592	12.09	2
4103	560472	Kraslice	1	3	47	47	Komunistická strana Čech a Moravy	Komunistická str.Čech a Moravy	KSČM	1	047	3149	10.6	2
4103	560472	Kraslice	1	4	171	171	STRANA ROVNOST ŠANCÍ	STRANA ROVNOST ŠANCÍ	SRŠ	1	171	1533	5.16	1
4103	560472	Kraslice	1	5	88	88	NEZÁVISLÍ	NEZÁVISLÍ	NEZ	1	088	1486	5.31	1
4103	560472	Kraslice	1	6	113	113	Volba pro město	Volba pro město	VPM	1	113	3467	11.67	2
4103	560472	Kraslice	1	7	7	7	Česká strana sociálně demokratická	Česká str.sociálně demokrat.	ČSSD	1	007	2783	9.37	2
4103	560472	Kraslice	1	8	450	450	Sdružení  pro město - vaše šance	Sdružení  pro město-vaše šance		2	080,138	2883	9.7	2
4103	560472	Kraslice	1	9	142	142	Sdružení pro zdraví, sport a prosperitu	Sdr.pro zdr.,sport a prosper.	SZSP	1	142	863	2.9	0
4103	560472	Kraslice	1	10	165	165	Strana drobných živnostníků a podnikatelů	Str.drobn.živnost.a podnikat.	SDŽP	1	165	1648	5.54	1
4103	560472	Kraslice	1	11	55	55	Koruna Česká (monarchistická strana Čech, Moravy a Slezska)	Koruna Česká (monarch.strana)	KČ	1	055	761	7.26	0
4103	560472	Kraslice	1	12	53	53	Občanská demokratická strana	Občanská demokratická strana	ODS	1	053	4042	13.61	2
4103	560499	Kynšperk nad Ohří	1	1	901	90	Sdružení nezávislých kandidátů	Sdruž.nezáv.kand.	SNK	1	080	3462	12.14	3
4103	560499	Kynšperk nad Ohří	1	2	407	407	Sdružení Strany pro otevřenou společnost a nezávislých kandidátů	Sdružení SOS, NK		2	080,103	1234	4.32	0
4103	560499	Kynšperk nad Ohří	1	3	903	90	"Sdružení nezávislých kandidátů ""Zelená pro Kynšperk n.O."" - sdružení nezávislých kandidátů"	"SNK ""Zelená pro Kynšperk n.O."""	SNK	1	080	1631	5.72	1
4103	560499	Kynšperk nad Ohří	1	4	7	7	Česká strana sociálně demokratická	Česká str.sociálně demokrat.	ČSSD	1	007	3142	11.02	2
4103	560499	Kynšperk nad Ohří	1	5	902	90	Sdružení nezávislých kandidátů Občané pro rozvoj města - sdružení nezávislých kandidátů	SNKObčané pro rozvoj města	SNK	1	080	1441	5.05	1
4103	560499	Kynšperk nad Ohří	1	6	5	5	Strana zelených	Strana zelených	SZ	1	005	1065	3.73	0
4103	560499	Kynšperk nad Ohří	1	7	129	129	SNK Evropští demokraté	SNK Evropští demokraté	SNK ED	1	129	744	2.6	0
4103	560499	Kynšperk nad Ohří	1	8	1	1	Křesťanská a demokratická unie - Československá strana lidová	Křesť.demokr.unie-Čs.str.lid.	KDU-ČSL	1	001	583	2.04	0
4103	560499	Kynšperk nad Ohří	1	9	47	47	Komunistická strana Čech a Moravy	Komunistická str.Čech a Moravy	KSČM	1	047	3717	13.03	3
4103	560499	Kynšperk nad Ohří	1	10	172	172	NEZÁVISLÍ DEMOKRATÉ (předseda V.Železný)	NEZ.DEMOKRATÉ(předs.V.Železný)	NEZ/DEM	1	172	1112	3.9	0
4103	560499	Kynšperk nad Ohří	1	11	88	88	NEZÁVISLÍ	NEZÁVISLÍ	NEZ	1	088	2401	8.42	2
4103	560499	Kynšperk nad Ohří	1	12	53	53	Občanská demokratická strana	Občanská demokratická strana	ODS	1	053	7977	27.98	7
4103	560502	Libavské Údolí	1	1	902	90	Sdružení nezávislých kandidátů Obec pro 21. století	SNK Obec pro 21. století	SNK	1	080	325	16.78	1
4103	560502	Libavské Údolí	1	2	903	90	Sdružení pro obec Libavské Údolí a osadu Kolovou	Sdr.pro obec LÚ a os.Kolovou	SNK	1	080	419	21.64	2
4103	560502	Libavské Údolí	1	3	901	90	SDRUŽENÍ NEZÁVISLÝCH KANDIDÁTŮ	SNK	SNK	1	080	930	48.03	5
4103	560502	Libavské Údolí	1	4	53	53	Občanská demokratická strana	Občanská demokratická strana	ODS	1	053	262	13.53	1
4103	560537	Loket	1	1	7	7	Česká strana sociálně demokratická	Česká str.sociálně demokrat.	ČSSD	1	007	1821	14.28	2
4103	560537	Loket	1	2	79	79	Právo a Spravedlnost - ANO tradiční rodině, NE korupci a kriminalitě	Právo a Spravedlnost	PaS	1	079	1967	15.43	2
4103	560537	Loket	1	3	24	24	Konzervativní strana	Konzervativní strana	KONS	1	024	1333	10.45	2
4103	560537	Loket	1	4	88	88	NEZÁVISLÍ	NEZÁVISLÍ	NEZ	1	088	918	7.2	1
4103	560537	Loket	1	5	413	413	Loketské fórum - Sdružení US-DEU, NK	Loketské fórum-sdruž.US-DEU,NK		2	080,102	2457	19.27	3
4103	560537	Loket	1	6	53	53	Občanská demokratická strana	Občanská demokratická strana	ODS	1	053	2248	17.63	3
4103	560537	Loket	1	7	171	171	STRANA ROVNOST ŠANCÍ	STRANA ROVNOST ŠANCÍ	SRŠ	1	171	559	4.38	0
4103	560537	Loket	1	8	47	47	Komunistická strana Čech a Moravy	Komunistická str.Čech a Moravy	KSČM	1	047	719	7.69	1
4103	560537	Loket	1	9	5	5	Strana zelených	Strana zelených	SZ	1	005	724	5.68	1
4103	560545	Lomnice	1	1	903	90	Sdružení nezávislých kandidátů ZA DALŠÍ ROZVOJ OBCE LOMNICE	SNK za další roz. obce Lomnice	SNK	1	080	1586	22.47	3
4103	560545	Lomnice	1	2	47	47	Komunistická strana Čech a Moravy	Komunistická str.Čech a Moravy	KSČM	1	047	613	22.58	1
4103	560545	Lomnice	1	3	902	90	Sdružení nezávislých kandidátů PRO SPOKOJENÉ OBČANY	SNK pro spokojené občany	SNK	1	080	3240	45.9	6
4103	560545	Lomnice	1	4	901	90	Sdružení nezávislých kandidátů za zájmy a práva občanů	SNK za zájmy a práva občanů	SNK	1	080	1619	22.93	3
4103	560561	Nová Ves	1	1	801	80	Bc. Jiří Pýcha, nezávislý kandidát	Bc. Jiří Pýcha, NK	NK	1	080	28	39.1	0
4103	560561	Nová Ves	1	2	47	47	Komunistická strana Čech a Moravy	Komunistická str.Čech a Moravy	KSČM	1	047	116	40.5	2
4103	560561	Nová Ves	1	3	901	90	Sdružení nezávislých kandidátů	Sdruž.nezáv.kand.	SNK	1	080	214	59.77	3
4103	560570	Nové Sedlo	1	1	7	7	Česká strana sociálně demokratická	Česká str.sociálně demokrat.	ČSSD	1	007	3207	38.96	7
4103	560570	Nové Sedlo	1	2	902	90	NONEK - sdružení nezávislých kandidátů	NONEK - SNK	SNK	1	080	1081	16.41	2
4103	560570	Nové Sedlo	1	3	47	47	Komunistická strana Čech a Moravy	Komunistická str.Čech a Moravy	KSČM	1	047	518	10.48	1
4103	560570	Nové Sedlo	1	4	903	90	Sdružení pro Nové Sedlo - sdružení nezávislých kandidátů	Sdružení pro Nové Sedlo - SNK	SNK	1	080	800	16.19	1
4103	560570	Nové Sedlo	1	5	53	53	Občanská demokratická strana	Občanská demokratická strana	ODS	1	053	1768	23.01	3
4103	560570	Nové Sedlo	1	6	901	90	Za bezpečnost a prosperitu - sdružení nezávislých kandidátů	Za bezpečnost a prosperitu-SNK	SNK	1	080	857	17.35	1
4103	560588	Oloví	1	1	7	7	Česká strana sociálně demokratická	Česká str.sociálně demokrat.	ČSSD	1	007	873	17.33	2
4103	560588	Oloví	1	2	5	5	Strana zelených	Strana zelených	SZ	1	005	407	8.08	1
4103	560588	Oloví	1	3	172	172	NEZÁVISLÍ DEMOKRATÉ (předseda V.Železný)	NEZ.DEMOKRATÉ(předs.V.Železný)	NEZ/DEM	1	172	596	11.83	1
4103	560588	Oloví	1	4	2	2	Česká strana národně sociální	Česká strana národně sociální	ČSNS	1	002	646	12.83	1
4103	560588	Oloví	1	5	129	129	SNK Evropští demokraté	SNK Evropští demokraté	SNK ED	1	129	486	9.65	1
4103	560588	Oloví	1	6	1	1	Křesťanská a demokratická unie - Československá strana lidová	Křesť.demokr.unie-Čs.str.lid.	KDU-ČSL	1	001	465	9.23	1
4103	560588	Oloví	1	7	102	102	Unie svobody - Demokratická unie	Unie svobody-Demokratická unie	US-DEU	1	102	474	9.41	1
4103	560588	Oloví	1	8	53	53	Občanská demokratická strana	Občanská demokratická strana	ODS	1	053	382	9.75	0
4103	560588	Oloví	1	9	47	47	Komunistická strana Čech a Moravy	Komunistická str.Čech a Moravy	KSČM	1	047	499	9.91	1
4103	560588	Oloví	1	10	112	112	Hnutí nezávislých za harmonický rozvoj obcí a měst	Hn.za harm.rozvoj obcí a měst	HNHRM	1	112	207	4.11	0
4103	560596	Přebuz	1	1	805	80	František Lukeš, nezávislý kandidát	František Lukeš, NK	NK	1	080	27	64.5	1
4103	560596	Přebuz	1	2	811	80	Vlastimil Šneiberg, nezávislý kandidát	Vlastimil Šneiberg, NK	NK	1	080	27	64.5	1
4103	560596	Přebuz	1	3	804	80	Jaroslav Cichra, nezávislý kandidát	Jaroslav Cichra, NK	NK	1	080	26	62.11	1
4103	560596	Přebuz	1	4	807	80	Daniela Malá, nezávislý kandidát	Daniela Malá, NK	NK	1	080	37	88.39	1
4103	560596	Přebuz	1	5	803	80	Antonín Čouka, nezávislý kandidát	Antonín Čouka, NK	NK	1	080	41	97.95	1
4103	560596	Přebuz	1	6	806	80	Karel Žentek, nezávislý kandidát	Karel Žentek, NK	NK	1	080	28	66.89	1
4103	560596	Přebuz	1	7	801	80	Kamil Kerula, nezávislý kandidát	Kamil Kerula, NK	NK	1	080	31	74.06	1
4103	560596	Přebuz	1	8	809	80	Mária Stiborová, nezávislý kandidát	Mária Stiborová, NK	NK	1	080	16	38.22	0
4103	560596	Přebuz	1	9	802	80	Miroslav Seidenglanz, nezávislý kandidát	Miroslav Seidenglanz, NK	NK	1	080	20	47.78	0
4103	560596	Přebuz	1	10	808	80	Jan Šneiberg, nezávislý kandidát	Jan Šneiberg, NK	NK	1	080	23	54.94	0
4103	560596	Přebuz	1	11	810	80	Irena Straubová, nezávislý kandidát	Irena Straubová, NK	NK	1	080	17	40.61	0
4103	560600	Rotava	1	1	901	90	Sdružení nezávislých kandidátů Rotavy	SNK Rotavy	SNK	1	080	3370	24.69	4
4103	560600	Rotava	1	2	47	47	Komunistická strana Čech a Moravy	Komunistická str.Čech a Moravy	KSČM	1	047	4646	34.04	6
4103	560600	Rotava	1	3	53	53	Občanská demokratická strana	Občanská demokratická strana	ODS	1	053	5630	41.25	7
4103	560618	Rovná	1	1	804	80	Jaroslav Janda, nezávislý kandidát	Jaroslav Janda, NK	NK	1	080	69	91.55	1
4103	560618	Rovná	1	2	803	80	Martina Šteklová, nezávislý kandidát	Martina Šteklová, NK	NK	1	080	47	62.36	0
4103	560618	Rovná	1	3	901	90	"""Sdružení za obnovu obce Rovná"" - sdružení nezávislých kandidátů"	"""Sdruž.za obn. obce Rovná""-SNK"	SNK	1	080	189	50.15	4
4103	560618	Rovná	1	4	805	80	Pavel Suchý, nezávislý kandidát	Pavel Suchý, NK	NK	1	080	35	46.44	0
4103	560618	Rovná	1	5	801	80	Jana Polívková, nezávislý kandidát	Jana Polívková, NK	NK	1	080	63	83.59	1
4103	560618	Rovná	1	6	807	80	Ing. Josef Staněk, nezávislý kandidát	Ing. Josef Staněk, NK	NK	1	080	98	130.03	1
4103	560618	Rovná	1	7	808	80	František Horník, nezávislý kandidát	František Horník, NK	NK	1	080	42	55.72	0
4103	560618	Rovná	1	8	810	80	Danuše Kovaříková, nezávislý kandidát	Danuše Kovaříková, NK	NK	1	080	59	78.28	1
4103	560618	Rovná	1	9	809	80	Hana Košťálová, nezávislý kandidát	Hana Košťálová, NK	NK	1	080	42	55.72	0
4103	560618	Rovná	1	10	811	80	Ing. Andrej Kuricyn, nezávislý kandidát	Ing. Andrej Kuricyn, NK	NK	1	080	58	76.96	1
4103	560618	Rovná	1	11	802	80	Jaroslav Parůžek, nezávislý kandidát	Jaroslav Parůžek, NK	NK	1	080	73	96.86	1
4103	560618	Rovná	1	12	806	80	Ludomír Košťál, nezávislý kandidát	Ludomír Košťál, NK	NK	1	080	54	71.65	1
4103	560642	Staré Sedlo	1	1	7	7	Česká strana sociálně demokratická	Česká str.sociálně demokrat.	ČSSD	1	007	1139	42.62	4
4103	560642	Staré Sedlo	1	2	53	53	Občanská demokratická strana	Občanská demokratická strana	ODS	1	053	879	32.89	3
4103	560642	Staré Sedlo	1	3	901	90	Sdružení Nezávislých Kandidátů	Sdružení Nezávislých Kandidátů	SNK	1	080	488	18.26	2
4103	560642	Staré Sedlo	1	4	1	1	Křesťanská a demokratická unie - Československá strana lidová	Křesť.demokr.unie-Čs.str.lid.	KDU-ČSL	1	001	166	18.63	0
4103	560651	Stříbrná	1	1	801	80	Stanislav Buřil, nezávislý kandidát	Stanislav Buřil, NK	NK	1	080	21	10.47	0
4103	560651	Stříbrná	1	2	129	129	SNK Evropští demokraté	SNK Evropští demokraté	SNK ED	1	129	581	32.18	3
4103	560651	Stříbrná	1	3	901	90	Č1	Č1	Č1	1	080	1203	66.64	6
4103	560677	Šindelová	1	1	7	7	Česká strana sociálně demokratická	Česká str.sociálně demokrat.	ČSSD	1	007	404	34.58	3
4103	560677	Šindelová	1	2	902	90	Za obec krásnější	Za obec krásnější	SNK	1	080	501	42.89	4
4103	560677	Šindelová	1	3	901	90	Sdružení nezávislých kandidátů pro rozvoj obce	SNK pro rozvoj obce	SNK	1	080	263	22.51	2
4103	560685	Vintířov	1	1	901	90	"""Za obec krásnější"""	"""Za obec krásnější"" - SNK"	SNK	1	080	1834	100	11
4103	560707	Vřesová	1	1	803	80	Pavla Siváková, nezávislý kandidát	Pavla Siváková, NK	NK	1	080	14	11.37	0
4103	560707	Vřesová	1	2	902	90	Porozumění-Vřesová	Porozumění-Vřesová	SNK-CELK	1	080	689	62.18	7
4103	560707	Vřesová	1	3	802	80	Petr Rafael Banda, nezávislý kandidát	Petr Rafael Banda, NK	NK	1	080	12	9.74	0
4103	560707	Vřesová	1	4	810	80	Anna Sándorová, nezávislý kandidát	Anna Sándorová, NK	NK	1	080	31	25.18	0
4103	560707	Vřesová	1	5	808	80	Jana Sedláková, nezávislý kandidát	Jana Sedláková, NK	NK	1	080	11	8.93	0
4103	560707	Vřesová	1	6	806	80	Žaneta Gubčová, nezávislý kandidát	Žaneta Gubčová, NK	NK	1	080	5	4.06	0
4103	560707	Vřesová	1	7	804	80	František Hock, nezávislý kandidát	František Hock, NK	NK	1	080	34	27.61	0
4103	560707	Vřesová	1	8	809	80	Jiřina Žáková, nezávislý kandidát	Jiřina Žáková, NK	NK	1	080	2	1.62	0
4103	560707	Vřesová	1	9	901	90	Za řešení bytové problematiky a pořádek v obci	Za řeš.byt.prob.a poř.v obci	SNK-CELK	1	080	269	24.27	2
4103	560707	Vřesová	1	10	807	80	Zlata Pelcová, nezávislý kandidát	Zlata Pelcová, NK	NK	1	080	18	14.62	0
4103	560707	Vřesová	1	11	801	80	Věra Zigmundová, nezávislý kandidát	Věra Zigmundová, NK	NK	1	080	11	8.93	0
4103	560707	Vřesová	1	12	805	80	Otto Klobušický, nezávislý kandidát	Otto Klobušický, NK	NK	1	080	12	9.74	0
4103	579360	Těšovice	1	1	1	1	Křesťanská a demokratická unie - Československá strana lidová	Křesť.demokr.unie-Čs.str.lid.	KDU-ČSL	1	001	138	19.85	1
4103	579360	Těšovice	1	2	901	90	"""Pro Těšovice"" - sdružení nezávislých kandidátů"	"""Pro Těšovice"" - SNK"	SNK	1	080	557	80.14	6