OKRES	KODZASTUP	NAZEVZAST	COBVODU	POR_STR_HL	OSTRANA	VSTRANA	NAZEVCELK	ZKRATKAO30	ZKRATKAO8	POCSTR_SLO	SLOZENI	HLASY_STR	PROCHLSTR	MAND_STR
3105	550396	Němčice	1	1	801	80	Michal Veselý, nezávislý kandidát	Michal Veselý, NK	NK	1	080	66	86.35	1
3105	550396	Němčice	1	2	803	80	Ivana Čížková, nezávislý kandidát	Ivana Čížková, NK	NK	1	080	45	58.87	0
3105	550396	Němčice	1	3	807	80	Antonín Benák, nezávislý kandidát	Antonín Benák, NK	NK	1	080	78	102.05	1
3105	550396	Němčice	1	4	804	80	Radek Rypota, nezávislý kandidát	Radek Rypota, NK	NK	1	080	93	121.68	1
3105	550396	Němčice	1	5	805	80	Václav Šustr, nezávislý kandidát	Václav Šustr, NK	NK	1	080	77	100.74	1
3105	550396	Němčice	1	6	806	80	Pavel Kocina, nezávislý kandidát	Pavel Kocina, NK	NK	1	080	63	82.42	1
3105	550396	Němčice	1	7	808	80	Tomáš Kříž, nezávislý kandidát	Tomáš Kříž, NK	NK	1	080	61	79.81	1
3105	550396	Němčice	1	8	802	80	František Hondlík, nezávislý kandidát	František Hondlík, NK	NK	1	080	52	68.03	1