OKRES	KODZASTUP	NAZEVZAST	COBVODU	POR_STR_HL	OSTRANA	VSTRANA	NAZEVCELK	ZKRATKAO30	ZKRATKAO8	POCSTR_SLO	SLOZENI	HLASY_STR	PROCHLSTR	MAND_STR
3106	551627	Předmíř	1	1	801	80	Jindřich Zíb, nezávislý kandidát	Jindřich Zíb, NK	NK	1	080	62	43.09	0
3106	551627	Předmíř	1	2	803	80	František Hop, nezávislý kandidát	František Hop, NK	NK	1	080	67	46.57	0
3106	551627	Předmíř	1	3	802	80	Ilona Jíchová, nezávislý kandidát	Ilona Jíchová, NK	NK	1	080	63	43.79	0
3106	551627	Předmíř	1	4	807	80	Pavla Krejčí, nezávislý kandidát	Pavla Krejčí, NK	NK	1	080	26	18.07	0
3106	551627	Předmíř	1	5	805	80	Václav Matoušek, nezávislý kandidát	Václav Matoušek, NK	NK	1	080	76	52.83	0
3106	551627	Předmíř	1	6	806	80	Zdeněk Lukáš, nezávislý kandidát	Zdeněk Lukáš, NK	NK	1	080	82	57	0
3106	551627	Předmíř	1	7	804	80	Tomáš Palivec, nezávislý kandidát	Tomáš Palivec, NK	NK	1	080	28	19.46	0
3106	551627	Předmíř	1	8	901	90	Sdružení nezávislých kandidátů pro rozvoj obcí	Sdr.nez.kan.pro rozvoj obcí	SNK	1	080	511	50.74	6
3106	551627	Předmíř	1	9	808	80	Karel Palivec, nezávislý kandidát	Karel Palivec, NK	NK	1	080	92	63.95	1