OKRES	KODZASTUP	NAZEVZAST	COBVODU	POR_STR_HL	OSTRANA	VSTRANA	NAZEVCELK	ZKRATKAO30	ZKRATKAO8	POCSTR_SLO	SLOZENI	HLASY_STR	PROCHLSTR	MAND_STR
5304	580902	Seč	1	1	805	80	Martin Novotný, nezávislý kandidát	Martin Novotný, NK	NK	1	080	63	93.63	1
5304	580902	Seč	1	2	807	80	Jaroslav Šeda, nezávislý kandidát	Jaroslav Šeda, NK	NK	1	080	67	99.57	1
5304	580902	Seč	1	3	803	80	Roman Jedlička, nezávislý kandidát	Roman Jedlička, NK	NK	1	080	67	99.57	1
5304	580902	Seč	1	4	801	80	Ing. Jaroslav Dostálek, nezávislý kandidát	Ing. Jaroslav Dostálek, NK	NK	1	080	67	99.57	1
5304	580902	Seč	1	5	802	80	Dana Janoušková, nezávislý kandidát	Dana Janoušková, NK	NK	1	080	70	104.03	1
5304	580902	Seč	1	6	806	80	Josef Podhájecký, nezávislý kandidát	Josef Podhájecký, NK	NK	1	080	70	104.03	1
5304	580902	Seč	1	7	804	80	František Jiřele, nezávislý kandidát	František Jiřele, NK	NK	1	080	67	99.57	1