OKRES	KODZASTUP	NAZEVZAST	COBVODU	POR_STR_HL	OSTRANA	VSTRANA	NAZEVCELK	ZKRATKAO30	ZKRATKAO8	POCSTR_SLO	SLOZENI	HLASY_STR	PROCHLSTR	MAND_STR
3201	553981	Mrákov	1	1	53	53	Občanská demokratická strana	Občanská demokratická strana	ODS	1	053	819	14.85	1
3201	553981	Mrákov	1	2	1	1	Křesťanská a demokratická unie - Československá strana lidová	Křesť.demokr.unie-Čs.str.lid.	KDU-ČSL	1	001	3072	55.73	6
3201	553981	Mrákov	1	3	47	47	Komunistická strana Čech a Moravy	Komunistická str.Čech a Moravy	KSČM	1	047	609	14.2	1
3201	553981	Mrákov	1	4	7	7	Česká strana sociálně demokratická	Česká str.sociálně demokrat.	ČSSD	1	007	973	17.65	1
3201	553981	Mrákov	1	5	689	689	Suverenita-blok Jany Bobošíkové, strana zdravého rozumu a Demokratická strana zelených	Koalice Suveren. a DSZ		2	137,715	39	1.27	0