OKRES	KODZASTUP	NAZEVZAST	COBVODU	POR_STR_HL	OSTRANA	VSTRANA	NAZEVCELK	ZKRATKAO30	ZKRATKAO8	POCSTR_SLO	SLOZENI	HLASY_STR	PROCHLSTR	MAND_STR
3106	550817	Bělčice	1	1	902	90	Sdružení nezávislých kandidátů	Sdruž.nezáv.kand.	SNK	1	080	626	21.42	1
3106	550817	Bělčice	1	2	1	1	Křesťanská a demokratická unie - Československá strana lidová	Křesť.demokr.unie-Čs.str.lid.	KDU-ČSL	1	001	598	17.9	1
3106	550817	Bělčice	1	3	901	90	Sdružení nezávislých kandidátů Bělčicka	Sdruž.nezáv.kand. Bělčicka	SNK	1	080	1974	42.98	6
3106	550817	Bělčice	1	4	903	90	Sdružení nezávislých kandidátů Závišín	Sdruž.nezáv.kand. Závišín	SNK	1	080	478	11.45	1
3106	550817	Bělčice	1	5	47	47	Komunistická strana Čech a Moravy	Komunistická str.Čech a Moravy	KSČM	1	047	916	19.94	2