OKRES	KODZASTUP	NAZEVZAST	COBVODU	POR_STR_HL	OSTRANA	VSTRANA	NAZEVCELK	ZKRATKAO30	ZKRATKAO8	POCSTR_SLO	SLOZENI	HLASY_STR	PROCHLSTR	MAND_STR
7202	592102	Buchlovice	1	1	47	47	Komunistická strana Čech a Moravy	Komunistická str.Čech a Moravy	KSČM	1	047	2673	16.11	2
7202	592102	Buchlovice	1	2	7	7	Česká strana sociálně demokratická	Česká str.sociálně demokrat.	ČSSD	1	007	2609	15.72	2
7202	592102	Buchlovice	1	3	901	90	Sdružení nezávislých kandidátů Buchlovice	Sdruž.nezáv.kand.Buchlovice	SNK	1	080	3489	21.03	3
7202	592102	Buchlovice	1	4	1	1	Křesťanská a demokratická unie - Československá strana lidová	Křesť.demokr.unie-Čs.str.lid.	KDU-ČSL	1	001	3333	20.09	3
7202	592102	Buchlovice	1	5	53	53	Občanská demokratická strana	Občanská demokratická strana	ODS	1	053	4484	27.03	5