OKRES	KODZASTUP	NAZEVZAST	COBVODU	POR_STR_HL	OSTRANA	VSTRANA	NAZEVCELK	ZKRATKAO30	ZKRATKAO8	POCSTR_SLO	SLOZENI	HLASY_STR	PROCHLSTR	MAND_STR
2101	529788	Chmelná	1	1	802	80	Václava Vlachová, nezávislý kandidát	Václava Vlachová, NK	NK	1	080	33	62.09	1
2101	529788	Chmelná	1	2	801	80	Tomáš Lhotka, nezávislý kandidát	Tomáš Lhotka, NK	NK	1	080	43	80.91	1
2101	529788	Chmelná	1	3	804	80	Tomáš Kučera, nezávislý kandidát	Tomáš Kučera, NK	NK	1	080	41	77.15	1
2101	529788	Chmelná	1	4	806	80	Pavel Novák, nezávislý kandidát	Pavel Novák, NK	NK	1	080	55	103.49	1
2101	529788	Chmelná	1	5	805	80	Ladislav Kamarýt, nezávislý kandidát	Ladislav Kamarýt, NK	NK	1	080	64	120.43	1
2101	529788	Chmelná	1	6	803	80	Tomáš Martínek, nezávislý kandidát	Tomáš Martínek, NK	NK	1	080	63	118.54	1
2101	529788	Chmelná	1	7	808	80	Pavel Filip, nezávislý kandidát	Pavel Filip, NK	NK	1	080	49	92.2	1
2101	529788	Chmelná	1	8	807	80	Petr Filip, nezávislý kandidát	Petr Filip, NK	NK	1	080	24	45.16	0