2105	534650	Žehušice	1	11	805	80	Luděna Šulcová, nezávislý kandidát	Luděna Šulcová, NK	NK	1	080	182	75.2	1
2105	534650	Žehušice	1	12	801	80	Josef Hrubeš, nezávislý kandidát	Josef Hrubeš, NK	NK	1	080	156	64.46	1
2105	534650	Žehušice	1	13	812	80	Ing.Karel Vilím, nezávislý kandidát	Ing.Karel Vilím, NK	NK	1	080	105	43.38	0
2105	534650	Žehušice	1	14	815	80	Ing.Zuzana Havlíková Heřmánková, nezávislý kandidát	Ing.Zuz. Havlík.Heřmánková,NK	NK	1	080	142	58.67	1
2105	534650	Žehušice	1	15	813	80	Dušan Línek, nezávislý kandidát	Dušan Línek, NK	NK	1	080	127	52.47	1
2105	534650	Žehušice	1	16	803	80	Hubert Houska, nezávislý kandidát	Hubert Houska, NK	NK	1	080	127	52.47	0
2105	534668	Žleby	1	1	7	7	Česká strana sociálně demokratická	Česká str.sociálně demokrat.	ČSSD	1	007	1759	33.83	4
2105	534668	Žleby	1	2	53	53	Občanská demokratická strana	Občanská demokratická strana	ODS	1	053	706	24.89	1
2105	534668	Žleby	1	3	901	90	Sdružení nezávislých kandidátů	Sdruž.nezáv.kand.	SNK	1	080	1759	33.83	4
2105	534668	Žleby	1	4	47	47	Komunistická strana Čech a Moravy	Komunistická str.Čech a Moravy	KSČM	1	047	915	17.59	2
2105	534668	Žleby	1	5	144	144	Věci veřejné	Věci veřejné	VV	1	144	60	12.69	0
2105	551465	Košice	1	1	801	80	Miroslava Klečáková, nezávislý kandidát	Miroslava Klečáková, NK	NK	1	080	22	91.66	1
2105	551465	Košice	1	2	804	80	Josef Opasek, nezávislý kandidát	Josef Opasek, NK	NK	1	080	25	104.16	1
2105	551465	Košice	1	3	802	80	Dagmar Laubová, nezávislý kandidát	Dagmar Laubová, NK	NK	1	080	21	87.5	1
2105	551465	Košice	1	4	803	80	Martina Nováková, nezávislý kandidát	Martina Nováková, NK	NK	1	080	19	79.16	1
2105	551465	Košice	1	5	805	80	Dagmar Toušková, nezávislý kandidát	Dagmar Toušková, NK	NK	1	080	14	58.33	0
2105	551465	Košice	1	6	806	80	Luboš Smetana, nezávislý kandidát	Luboš Smetana, NK	NK	1	080	19	79.16	1
2105	571741	Třebonín	1	1	805	80	Irena Tejkalová, nezávislý kandidát	Irena Tejkalová, NK	NK	1	080	60	108.69	1
2105	571741	Třebonín	1	2	803	80	Tomáš Malík, nezávislý kandidát	Tomáš Malík, NK	NK	1	080	42	76.08	1
2105	571741	Třebonín	1	3	801	80	Jan Mikula, nezávislý kandidát	Jan Mikula, NK	NK	1	080	53	96.01	1
2105	571741	Třebonín	1	4	804	80	Hana Nováková, nezávislý kandidát	Hana Nováková, NK	NK	1	080	39	70.65	1
2105	571741	Třebonín	1	5	802	80	Marie Francová, nezávislý kandidát	Marie Francová, NK	NK	1	080	54	97.82	1
2105	571741	Třebonín	1	6	806	80	Jitka Zálabáková, nezávislý kandidát	Jitka Zálabáková, NK	NK	1	080	28	50.72	0