OKRES	KODZASTUP	NAZEVZAST	COBVODU	POR_STR_HL	OSTRANA	VSTRANA	NAZEVCELK	ZKRATKAO30	ZKRATKAO8	POCSTR_SLO	SLOZENI	HLASY_STR	PROCHLSTR	MAND_STR
3201	554154	Puclice	1	1	903	90	PRO NAŠE OBCE NEZÁVISLÍ	PRO NAŠE OBCE NEZÁVISLÍ	SNK	1	080			
3201	554154	Puclice	1	2	905	90	Sdružení nezávislých kandidátů I.	SNK I.	SNK	1	080			
3201	554154	Puclice	1	3	902	90	NEZÁVISLÍ	NEZÁVISLÍ	SNK	1	080			
3201	554154	Puclice	1	4	901	90	JISTOTA	JISTOTA	SNK	1	080			
3201	554154	Puclice	1	5	904	90	Sdružení nezávislých kandidátů II.	SNK II.	SNK	1	080			