OKRES	KODZASTUP	NAZEVZAST	COBVODU	POR_STR_HL	OSTRANA	VSTRANA	NAZEVCELK	ZKRATKAO30	ZKRATKAO8	POCSTR_SLO	SLOZENI	HLASY_STR	PROCHLSTR	MAND_STR
6104	591556	Radonín	1	1	807	80	Zdeňka Číhalová, nezávislý kandidát	Zdeňka Číhalová, NK	NK	1	080	31	96.44	1
6104	591556	Radonín	1	2	806	80	Jan Fila, nezávislý kandidát	Jan Fila, NK	NK	1	080	32	99.55	1
6104	591556	Radonín	1	3	802	80	František Vrtal, nezávislý kandidát	František Vrtal, NK	NK	1	080	33	102.66	1
6104	591556	Radonín	1	4	803	80	Stanislav Hrůza, nezávislý kandidát	Stanislav Hrůza, NK	NK	1	080	32	99.55	1
6104	591556	Radonín	1	5	804	80	Zdeněk Číhal, nezávislý kandidát	Zdeněk Číhal, NK	NK	1	080	33	102.66	1
6104	591556	Radonín	1	6	801	80	Věra Kudrnová, nezávislý kandidát	Věra Kudrnová, NK	NK	1	080	36	112	1
6104	591556	Radonín	1	7	805	80	Antonín Vrtal, nezávislý kandidát	Antonín Vrtal, NK	NK	1	080	28	87.11	1