OKRES	KODZASTUP	NAZEVZAST	COBVODU	POR_STR_HL	OSTRANA	VSTRANA	NAZEVCELK	ZKRATKAO30	ZKRATKAO8	POCSTR_SLO	SLOZENI	HLASY_STR	PROCHLSTR	MAND_STR
4203	564591	Bohušovice nad Ohří	1	1	902	90	Občané pro změnu	Občané pro změnu	SNK	1	080	2189	17.46	3
4203	564591	Bohušovice nad Ohří	1	2	470	470	Sdružení nezávislých kandidátů Bohušovice nad Ohří	SNK Bohušovice nad Ohří		2	080,166	5342	42.62	7
4203	564591	Bohušovice nad Ohří	1	3	7	7	Česká strana sociálně demokratická	Česká str.sociálně demokrat.	ČSSD	1	007	967	7.71	1
4203	564591	Bohušovice nad Ohří	1	4	1114	1114	Svoboda a přímá demokracie - Tomio Okamura (SPD)	Svob.a př.dem.-T.Okamura (SPD)	SPD	1	1114	466	3.71	0
4203	564591	Bohušovice nad Ohří	1	5	901	90	MĚSTO PRO VÁS	MĚSTO PRO VÁS	SNK	1	080	2493	19.88	3
4203	564591	Bohušovice nad Ohří	1	6	47	47	Komunistická strana Čech a Moravy	Komunistická str.Čech a Moravy	KSČM	1	047	1077	8.59	1