OKRES	KODZASTUP	NAZEVZAST	COBVODU	POR_STR_HL	OSTRANA	VSTRANA	NAZEVCELK	ZKRATKAO30	ZKRATKAO8	POCSTR_SLO	SLOZENI	HLASY_STR	PROCHLSTR	MAND_STR
6203	583936	Syrovice	1	1	532	532	Koalice politického hnutí ANO 2011 + Nezávislí kandidáti	Koalice.pol.hnutí ANO 2011+ NK		2	080,768	1116	15.64	2
6203	583936	Syrovice	1	2	901	90	Sdružení nezávislých kandidátů pro lepší život v obci 2014	SNKpro lepší život v obci 2014	SNK	1	080	3403	47.69	6
6203	583936	Syrovice	1	3	53	53	Občanská demokratická strana	Občanská demokratická strana	ODS	1	053	703	9.85	1
6203	583936	Syrovice	1	4	371	371	Koalice České strany sociálně demokratické a nezávislých kandidátů	Koalice ČSSD a NK		2	007,080	944	13.23	1
6203	583936	Syrovice	1	5	1	1	Křesťanská a demokratická unie - Československá strana lidová	Křesť.demokr.unie-Čs.str.lid.	KDU-ČSL	1	001	969	13.58	1