OKRES	KODZASTUP	COBVODU	POR_STR_HL	OSTRANA	PORCISLO	JMENO	PRIJMENI	POHLAVI	TITULPRED	TITULZA	VEK	POVOLANI	BYDLISTEN	PSTRANA	NSTRANA	PLATNOST
3202	553531	1	1	802	1	Václav	Rejcha	M			26	OSVČ IT programátor	Černíkov	99	80	A
3202	553531	1	2	801	1	Jiří	Šmídl	M			43	technik Podhoran Černíkov a.s.	Rudoltice	99	80	A
3202	553531	1	3	803	1	Petr	Kučera	M			38	kvalitář výroby IAC GROUP Přeštice	Černíkov	99	80	A
3202	553531	1	4	806	1	Jiří	Velíšek	M	Ing.		52	náměstek generálního ředitele SÚSPK	Černíkov	99	80	A
3202	553531	1	5	805	1	Kateřina	Tomášková	F			73	důchodkyně	Vílov	99	80	A
3202	553531	1	6	804	1	Miroslav	Sušický	M			58	vedoucí střediska SÚSPK Domažlice	Vílov	99	80	A
3202	553531	1	7	807	1	Jan	Hladík	M			56	ředitel TS města Nýrska	Černíkov	99	80	A
3202	553531	1	8	808	1	Dagmar	Krásnická	F			36	vedoucí prodejny	Slavíkovice	99	80	A