OKRES	KODZASTUP	NAZEVZAST	COBVODU	POR_STR_HL	OSTRANA	VSTRANA	NAZEVCELK	ZKRATKAO30	ZKRATKAO8	POCSTR_SLO	SLOZENI	HLASY_STR	PROCHLSTR	MAND_STR
5301	571831	Miřetice	1	1	716	716	Strana soukromníků České republiky	Strana soukromníků ČR	Soukromníci	1	716	317	7.63	0
5301	571831	Miřetice	1	2	1	1	Křesťanská a demokratická unie - Československá strana lidová	Křesť.demokr.unie-Čs.str.lid.	KDU-ČSL	1	001	835	14.62	2
5301	571831	Miřetice	1	3	901	90	Nezávislí	Nezávislí	SNK	1	080	2910	50.96	6
5301	571831	Miřetice	1	4	7	7	Česká strana sociálně demokratická	Česká str.sociálně demokrat.	ČSSD	1	007	1395	24.43	3
5301	571831	Miřetice	1	5	47	47	Komunistická strana Čech a Moravy	Komunistická str.Čech a Moravy	KSČM	1	047	253	12.18	0