OKRES	KODZASTUP	NAZEVZAST	COBVODU	POR_STR_HL	OSTRANA	VSTRANA	NAZEVCELK	ZKRATKAO30	ZKRATKAO8	POCSTR_SLO	SLOZENI	HLASY_STR	PROCHLSTR	MAND_STR
6105	587516	Meziříčko	1	1	801	80	Markéta Březková, nezávislý kandidát	Markéta Březková, NK	NK	1	080	62	119.48	1
6105	587516	Meziříčko	1	2	807	80	Jan Zeman, nezávislý kandidát	Jan Zeman, NK	NK	1	080	71	136.83	1
6105	587516	Meziříčko	1	3	803	80	Petr Slabý, nezávislý kandidát	Petr Slabý, NK	NK	1	080	48	92.5	1
6105	587516	Meziříčko	1	4	901	90	SNK Meziříčko	SNK Meziříčko	SNK	1	080	74	71.3	2
6105	587516	Meziříčko	1	5	804	80	Jiří Janeček, nezávislý kandidát	Jiří Janeček, NK	NK	1	080	46	88.65	1
6105	587516	Meziříčko	1	6	806	80	Jan Mokrejš, nezávislý kandidát	Jan Mokrejš, NK	NK	1	080	61	117.55	1
6105	587516	Meziříčko	1	7	802	80	Milan Březka, nezávislý kandidát	Milan Březka, NK	NK	1	080	52	100.21	1
6105	587516	Meziříčko	1	8	805	80	Roman Seknička, nezávislý kandidát	Roman Seknička, NK	NK	1	080	53	102.14	1