OKRES	KODZASTUP	NAZEVZAST	COBVODU	POR_STR_HL	OSTRANA	VSTRANA	NAZEVCELK	ZKRATKAO30	ZKRATKAO8	POCSTR_SLO	SLOZENI	HLASY_STR	PROCHLSTR	MAND_STR
6201	513695	Horní Smržov	1	1	808	80	Milan Tyralík, nezávislý kandidát	Milan Tyralík, NK	NK	1	080	25	40.41	0
6201	513695	Horní Smržov	1	2	802	80	Petr Poláček, nezávislý kandidát	Petr Poláček, NK	NK	1	080	58	93.76	1
6201	513695	Horní Smržov	1	3	807	80	Daniel Toul, nezávislý kandidát	Daniel Toul, NK	NK	1	080	39	63.04	1
6201	513695	Horní Smržov	1	4	805	80	Milena Nečasová, nezávislý kandidát	Milena Nečasová, NK	NK	1	080	52	84.06	1
6201	513695	Horní Smržov	1	5	801	80	Dana Prudilová, nezávislý kandidát	Dana Prudilová, NK	NK	1	080	61	98.61	1
6201	513695	Horní Smržov	1	6	804	80	Ing. Michal Táborský, nezávislý kandidát	Ing. Michal Táborský, NK	NK	1	080	64	103.46	1
6201	513695	Horní Smržov	1	7	806	80	Jiří Toul, nezávislý kandidát	Jiří Toul, NK	NK	1	080	29	46.88	0
6201	513695	Horní Smržov	1	8	803	80	Jarmila Havránková, nezávislý kandidát	Jarmila Havránková, NK	NK	1	080	46	74.36	1
6201	513695	Horní Smržov	1	9	809	80	Bohuslav Pospíšil, nezávislý kandidát	Bohuslav Pospíšil, NK	NK	1	080	59	95.38	1