OKRES	KODZASTUP	NAZEVZAST	COBVODU	POR_STR_HL	OSTRANA	VSTRANA	NAZEVCELK	ZKRATKAO30	ZKRATKAO8	POCSTR_SLO	SLOZENI	HLASY_STR	PROCHLSTR	MAND_STR
2105	530832	Brambory	1	1	804	80	Miroslav Štoček, nezávislý kandidát	Miroslav Štoček, NK	NK	1	080	70	103.37	1
2105	530832	Brambory	1	2	807	80	Radek Toman, nezávislý kandidát	Radek Toman, NK	NK	1	080	68	100.42	1
2105	530832	Brambory	1	3	801	80	Jiří Zahradník, nezávislý kandidát	Jiří Zahradník, NK	NK	1	080	43	63.5	1
2105	530832	Brambory	1	4	806	80	Josef Semerád, nezávislý kandidát	Josef Semerád, NK	NK	1	080	60	88.6	1
2105	530832	Brambory	1	5	809	80	Martin Skačan, nezávislý kandidát	Martin Skačan, NK	NK	1	080	56	82.7	1
2105	530832	Brambory	1	6	803	80	Pavel Šolta,ml. nezávislý kandidát	Pavel Šolta, NK	NK	1	080	17	25.1	0
2105	530832	Brambory	1	7	805	80	Jiří Stránský, nezávislý kandidát	Jiří Stránský, NK	NK	1	080	65	95.99	1
2105	530832	Brambory	1	8	802	80	Pavel Šolta,st. nezávislý kandidát	Pavel Šolta, NK	NK	1	080	55	81.22	1
2105	530832	Brambory	1	9	808	80	Radovan Novák, nezávislý kandidát	Radovan Novák, NK	NK	1	080	40	59.07	0