OKRES	KODZASTUP	NAZEVZAST	COBVODU	POR_STR_HL	OSTRANA	VSTRANA	NAZEVCELK	ZKRATKAO30	ZKRATKAO8	POCSTR_SLO	SLOZENI	HLASY_STR	PROCHLSTR	MAND_STR
3205	566748	Slatina	1	1	808	80	Lumír Vávra, nezávislý kandidát	Lumír Vávra, NK	NK	1	080	38	94.21	1
3205	566748	Slatina	1	2	809	80	Václav Macák, nezávislý kandidát	Václav Macák, NK	NK	1	080	17	42.14	0
3205	566748	Slatina	1	3	803	80	Jaroslav Chroustovský, nezávislý kandidát	Jaroslav Chroustovský, NK	NK	1	080	18	44.62	0
3205	566748	Slatina	1	4	806	80	Jaromír Štícha, nezávislý kandidát	Jaromír Štícha, NK	NK	1	080	18	44.62	0
3205	566748	Slatina	1	5	807	80	Herbert Kleissl, nezávislý kandidát	Herbert Kleissl, NK	NK	1	080	31	76.85	1
3205	566748	Slatina	1	6	805	80	Jiří Stupka, nezávislý kandidát	Jiří Stupka, NK	NK	1	080	24	59.5	1
3205	566748	Slatina	1	7	802	80	Andrea Chroustovská, nezávislý kandidát	Andrea Chroustovská, NK	NK	1	080	37	91.73	1
3205	566748	Slatina	1	8	801	80	Miloslav Konopásek, nezávislý kandidát	Miloslav Konopásek, NK	NK	1	080	40	99.17	1
3205	566748	Slatina	1	9	804	80	Josef Fekete, nezávislý kandidát	Josef Fekete, NK	NK	1	080	19	47.1	1