OKRES	KODZASTUP	NAZEVZAST	COBVODU	POR_STR_HL	OSTRANA	VSTRANA	NAZEVCELK	ZKRATKAO30	ZKRATKAO8	POCSTR_SLO	SLOZENI	HLASY_STR	PROCHLSTR	MAND_STR
6205	586102	Čejkovice	1	1	901	90	Nezávislí kandidáti Čejkovice I	Nezávislí kan. Čejkovice I	SNK	1	080	4454	35.98	5
6205	586102	Čejkovice	1	2	903	90	Sdružení nezávislých kandidátů - vinaři	Sdruž. nez. kan. - vinaři	SNK	1	080	1812	14.63	2
6205	586102	Čejkovice	1	3	904	90	Mladí pro Čejkovice	Mladí pro Čejkovice	SNK	1	080	1598	24.2	2
6205	586102	Čejkovice	1	4	902	90	Nezávislí kandidáti Čejkovice II	Nezávislí kan. Čejkovice II	SNK	1	080	2973	24.01	4
6205	586102	Čejkovice	1	5	1	1	Křesťanská a demokratická unie - Československá strana lidová	Křesť.demokr.unie-Čs.str.lid.	KDU-ČSL	1	001	1542	12.45	2