OKRES	KODZASTUP	NAZEVZAST	COBVODU	POR_STR_HL	OSTRANA	VSTRANA	NAZEVCELK	ZKRATKAO30	ZKRATKAO8	POCSTR_SLO	SLOZENI	HLASY_STR	PROCHLSTR	MAND_STR
3104	549592	Mirovice	1	1	53	53	Občanská demokratická strana	Občanská demokratická strana	ODS	1	053	832	19.35	1
3104	549592	Mirovice	1	2	1	1	Křesťanská a demokratická unie - Československá strana lidová	Křesť.demokr.unie-Čs.str.lid.	KDU-ČSL	1	001	1778	22.05	4
3104	549592	Mirovice	1	3	129	129	SNK Evropští demokraté	SNK Evropští demokraté	SNK ED	1	129	3454	42.84	7
3104	549592	Mirovice	1	4	47	47	Komunistická strana Čech a Moravy	Komunistická str.Čech a Moravy	KSČM	1	047	1733	21.49	3
3104	549592	Mirovice	1	5	801	80	Josef Krušina, nezávislý kandidát	Josef Krušina, NK		1	080	265	49.3	0