OKRES	KODZASTUP	NAZEVZAST	COBVODU	POR_STR_HL	OSTRANA	VSTRANA	NAZEVCELK	ZKRATKAO30	ZKRATKAO8	POCSTR_SLO	SLOZENI	HLASY_STR	PROCHLSTR	MAND_STR
4102	537934	Mírová	1	1	902	90	ZA PERSPEKTIVNÍ MÍROVOU	ZA PERSPEKTIVNÍ MÍROVOU	SNK	1	080	398	45.85	4
4102	537934	Mírová	1	2	801	80	Josef Macák, nezávislý kandidát	Josef Macák, NK	NK	1	080	28	22.58	0
4102	537934	Mírová	1	3	802	80	Bc. Josef Domin, nezávislý kandidát	Bc. Josef Domin, NK	NK	1	080	53	42.74	0
4102	537934	Mírová	1	4	901	90	Společně o krok dále	Společně o krok dále	SNK	1	080	346	39.86	3
4102	537934	Mírová	1	5	803	80	Alois Adamovic, nezávislý kandidát	Alois Adamovic, NK	NK	1	080	43	34.67	0