OKRES	KODZASTUP	NAZEVZAST	COBVODU	POR_STR_HL	OSTRANA	VSTRANA	NAZEVCELK	ZKRATKAO30	ZKRATKAO8	POCSTR_SLO	SLOZENI	HLASY_STR	PROCHLSTR	MAND_STR
6205	586561	Starý Poddvorov	1	1	470	470	ROVNOST, POCTIVOST A TRVALÉ HODNOTY	ROVNOST, POCTIV. A TRV. HODN.		2	080,166	1122	25.27	2
6205	586561	Starý Poddvorov	1	2	1	1	Křesťanská a demokratická unie - Československá strana lidová	Křesť.demokr.unie-Čs.str.lid.	KDU-ČSL	1	001	860	19.36	2
6205	586561	Starý Poddvorov	1	3	7	7	Česká strana sociálně demokratická	Česká str.sociálně demokrat.	ČSSD	1	007	792	17.83	1
6205	586561	Starý Poddvorov	1	4	480	480	Devítka pro Poddvorov	Devítka pro Poddvorov		2	080,721	796	17.92	2
6205	586561	Starý Poddvorov	1	5	181	181	Nestraníci	Nestraníci	Nestran.	1	181	870	19.59	2