OKRES	KODZASTUP	NAZEVZAST	COBVODU	POR_STR_HL	OSTRANA	VSTRANA	NAZEVCELK	ZKRATKAO30	ZKRATKAO8	POCSTR_SLO	SLOZENI	HLASY_STR	PROCHLSTR	MAND_STR
5205	579629	Radvanice	1	1	47	47	Komunistická strana Čech a Moravy	Komunistická str.Čech a Moravy	KSČM	1	047	193	10.44	0
5205	579629	Radvanice	1	2	7	7	Česká strana sociálně demokratická	Česká str.sociálně demokrat.	ČSSD	1	007	439	14.85	1
5205	579629	Radvanice	1	3	901	90	"""JISTOTA - SDRUŽENÍ NAZÁVISLÝCH KANDIDÁTŮ"""	"""JISTOTA - SNK"""	SNK-CELK	1	080	1543	46.4	5
5205	579629	Radvanice	1	4	902	90	Sbor dobrovolných hasičů Radvanice	Sbor dobrov. hasičů  Radvanice	SNK-CELK	1	080	386	11.6	1
5205	579629	Radvanice	1	5	903	90	Za lidi a pro lidi	Za lidi a pro lidi	SNK-CELK	1	080	764	22.97	2