OKRES	KODZASTUP	NAZEVZAST	COBVODU	POR_STR_HL	OSTRANA	VSTRANA	NAZEVCELK	ZKRATKAO30	ZKRATKAO8	POCSTR_SLO	SLOZENI	HLASY_STR	PROCHLSTR	MAND_STR
4203	564877	Hoštka	1	1	901	90	Pro sport a zdraví	Pro sport a zdraví	P.s.a z.	1	080	1021	11.29	1
4203	564877	Hoštka	1	2	129	129	SNK Evropští demokraté	SNK Evropští demokraté	SNK ED	1	129	2561	28.33	5
4203	564877	Hoštka	1	3	53	53	Občanská demokratická strana	Občanská demokratická strana	ODS	1	053	1291	23.8	2
4203	564877	Hoštka	1	4	47	47	Komunistická strana Čech a Moravy	Komunistická str.Čech a Moravy	KSČM	1	047	2489	27.53	4
4203	564877	Hoštka	1	5	112	112	Hnutí nezávislých za harmonický rozvoj obcí a měst	Hn.za harm.rozvoj obcí a měst	HNHRM	1	112	1677	18.55	3