OKRES	KODZASTUP	NAZEVZAST	COBVODU	POR_STR_HL	OSTRANA	VSTRANA	NAZEVCELK	ZKRATKAO30	ZKRATKAO8	POCSTR_SLO	SLOZENI	HLASY_STR	PROCHLSTR	MAND_STR
8102	507237	Komorní Lhotka	1	1	47	47	Komunistická strana Čech a Moravy	Komunistická str.Čech a Moravy	KSČM	1	047	445	6.67	0
8102	507237	Komorní Lhotka	1	2	902	90	Nezávislí	Nezávislí	SNK	1	080	1026	15.39	2
8102	507237	Komorní Lhotka	1	3	7	7	Česká strana sociálně demokratická	Česká str.sociálně demokrat.	ČSSD	1	007	461	6.91	0
8102	507237	Komorní Lhotka	1	4	904	90	VEŘEJNOST PRO OBNOVU HODNOT OBCE	VEŘEJNOST PRO OBN. HODNOT OBCE	SNK	1	080	783	11.74	1
8102	507237	Komorní Lhotka	1	5	901	90	Nezávislí pro Komorní Lhotku	Nezávislí pro Komorní Lhotku	SNK	1	080	3015	45.24	6
8102	507237	Komorní Lhotka	1	6	903	90	SDRUŽENÍ NEZÁVISLÝCH KANDIDÁTŮ	SDRUŽENÍ NEZÁVISLÝCH KANDIDÁTŮ	SNK	1	080	934	14.01	2