OKRES	KODZASTUP	NAZEVZAST	COBVODU	POR_STR_HL	OSTRANA	VSTRANA	NAZEVCELK	ZKRATKAO30	ZKRATKAO8	POCSTR_SLO	SLOZENI	HLASY_STR	PROCHLSTR	MAND_STR
6104	591564	Radošov	1	1	807	80	František Veselý, nezávislý kandidát	František Veselý, NK	NK	1	080	50	85.87	1
6104	591564	Radošov	1	2	801	80	Vladimír Neuman, nezávislý kandidát	Vladimír Neuman, NK	NK	1	080	56	96.18	1
6104	591564	Radošov	1	3	806	80	Karel Peštál, nezávislý kandidát	Karel Peštál, NK	NK	1	080	55	94.46	1
6104	591564	Radošov	1	4	805	80	Pavel Pařízek, nezávislý kandidát	Pavel Pařízek, NK	NK	1	080	71	121.94	1
6104	591564	Radošov	1	5	808	80	Jiří Kremláček, nezávislý kandidát	Jiří Kremláček, NK	NK	1	080	37	63.54	1
6104	591564	Radošov	1	6	804	80	František Semrád, nezávislý kandidát	František Semrád, NK	NK	1	080	58	99.61	1
6104	591564	Radošov	1	7	809	80	Bohumil Křeček, nezávislý kandidát	Bohumil Křeček, NK	NK	1	080	65	111.64	1
6104	591564	Radošov	1	8	803	80	Libor Jirovský, nezávislý kandidát	Libor Jirovský, NK	NK	1	080	66	113.35	1
6104	591564	Radošov	1	9	802	80	Libor Caha, nezávislý kandidát	Libor Caha, NK	NK	1	080	66	113.35	1