OKRES	KODZASTUP	NAZEVZAST	COBVODU	POR_STR_HL	OSTRANA	VSTRANA	NAZEVCELK	ZKRATKAO30	ZKRATKAO8	POCSTR_SLO	SLOZENI	HLASY_STR	PROCHLSTR	MAND_STR
2102	534404	Lužce	1	1	801	80	František Kučina, nezávislý kandidát	František Kučina, NK	NK	1	080	62	105.08	1
2102	534404	Lužce	1	2	802	80	Antonín Mařánek, nezávislý kandidát	Antonín Mařánek, NK	NK	1	080	55	93.22	1
2102	534404	Lužce	1	3	803	80	František Nodl, nezávislý kandidát	František Nodl, NK	NK	1	080	60	101.69	1
2102	534404	Lužce	1	4	804	80	Petr Dudáček, nezávislý kandidát	Petr Dudáček, NK	NK	1	080	57	96.61	1
2102	534404	Lužce	1	5	805	80	Jaroslav Sojka, nezávislý kandidát	Jaroslav Sojka, NK	NK	1	080	61	103.38	1