OKRES	KODZASTUP	NAZEVZAST	COBVODU	POR_STR_HL	OSTRANA	VSTRANA	NAZEVCELK	ZKRATKAO30	ZKRATKAO8	POCSTR_SLO	SLOZENI	HLASY_STR	PROCHLSTR	MAND_STR
6101	569321	Přibyslav	1	1	53	53	Občanská demokratická strana	Občanská demokratická strana	ODS	1	053	6308	28.72	4
6101	569321	Přibyslav	1	2	901	90	Sdružení nezávislých kandidátů - Přibyslav	Sdruž.nezáv.kand.-Přibyslav	SNK-CELK	1	080	4481	20.4	3
6101	569321	Přibyslav	1	3	47	47	Komunistická strana Čech a Moravy	Komunistická str.Čech a Moravy	KSČM	1	047	2946	13.41	2
6101	569321	Přibyslav	1	4	7	7	Česká strana sociálně demokratická	Česká str.sociálně demokrat.	ČSSD	1	007	4038	18.38	3
6101	569321	Přibyslav	1	5	1	1	Křesťanská a demokratická unie - Československá strana lidová	Křesť.demokr.unie-Čs.str.lid.	KDU-ČSL	1	001	4185	19.05	3