OKRES	KODZASTUP	NAZEVZAST	COBVODU	POR_STR_HL	OSTRANA	VSTRANA	NAZEVCELK	ZKRATKAO30	ZKRATKAO8	POCSTR_SLO	SLOZENI	HLASY_STR	PROCHLSTR	MAND_STR
5203	574511	Šonov	1	1	801	80	Jaroslav Grusmann, nezávislý kandidát	Jaroslav Grusmann, NK	NK	1	080	83	53.2	0
5203	574511	Šonov	1	2	47	47	Komunistická strana Čech a Moravy	Komunistická str.Čech a Moravy	KSČM	1	047	228	20.87	2
5203	574511	Šonov	1	3	802	80	Jiří Kučera, nezávislý kandidát	Jiří Kučera, NK	NK	1	080	15	9.61	0
5203	574511	Šonov	1	4	371	371	Sdružení ČSSD, NK	Sdružení ČSSD, NK		2	007,080	247	22.61	2
5203	574511	Šonov	1	5	901	90	Sdružení nezávislých kandidátů - Změna je život	SNK - Změna je život	SNK-CELK	1	080	455	41.66	3
5203	574511	Šonov	1	6	803	80	Jaroslav Veverka, nezávislý kandidát	Jaroslav Veverka, NK	NK	1	080	64	41.02	0