OKRES	KODZASTUP	NAZEVZAST	COBVODU	POR_STR_HL	OSTRANA	VSTRANA	NAZEVCELK	ZKRATKAO30	ZKRATKAO8	POCSTR_SLO	SLOZENI	HLASY_STR	PROCHLSTR	MAND_STR
7202	592013	Babice	1	1	47	47	Komunistická strana Čech a Moravy	Komunistická str.Čech a Moravy	KSČM	1	047	1434	12.69	2
7202	592013	Babice	1	2	901	90	Občané Babic	Občané Babic	SNK	1	080	2360	20.88	3
7202	592013	Babice	1	3	355	355	VOLBA PRO BABICE (KDU-ČSL A NEZÁVISLÍ KANDIDÁTI)	VOLBA PRO BABICE		2	001,080	1211	10.71	1
7202	592013	Babice	1	4	902	90	SDRUŽENÍ NEZÁVISLÝCH OBCE BABICE OD ROKU 1998	SDRUŽENÍ NEZÁV. OBCE BABICE	SNK	1	080	1798	15.91	2
7202	592013	Babice	1	5	903	90	SDRUŽENÍ PRO BABICE	SDRUŽENÍ PRO BABICE	SNK	1	080	4497	39.79	7