OKRES	KODZASTUP	NAZEVZAST	COBVODU	POR_STR_HL	OSTRANA	VSTRANA	NAZEVCELK	ZKRATKAO30	ZKRATKAO8	POCSTR_SLO	SLOZENI	HLASY_STR	PROCHLSTR	MAND_STR
6101	569593	Štoky	1	1	902	90	"SNK Za všestranný rozvoj městyse"""	"SNK Za všestr.rozvoj městyse"""	SNK	1	080	1692	16.19	2
6101	569593	Štoky	1	2	47	47	Komunistická strana Čech a Moravy	Komunistická str.Čech a Moravy	KSČM	1	047	2703	25.86	4
6101	569593	Štoky	1	3	901	90	Mladí za lepší Štoky - Sdružení nezávislých kandidátů	Mladí za lepší Štoky - SNK	SNK	1	080	2421	23.16	4
6101	569593	Štoky	1	4	7	7	Česká strana sociálně demokratická	Česká str.sociálně demokrat.	ČSSD	1	007	657	6.28	1
6101	569593	Štoky	1	5	1	1	Křesťanská a demokratická unie - Československá strana lidová	Křesť.demokr.unie-Čs.str.lid.	KDU-ČSL	1	001	1354	12.95	2
6101	569593	Štoky	1	6	903	90	"Hasiči za bezpečné Štoky a osady"""	"Hasiči za bez. Štoky a osady"""	SNK	1	080	1622	15.52	2