OKRES	KODZASTUP	NAZEVZAST	COBVODU	POR_STR_HL	OSTRANA	VSTRANA	NAZEVCELK	ZKRATKAO30	ZKRATKAO8	POCSTR_SLO	SLOZENI	HLASY_STR	PROCHLSTR	MAND_STR
2105	530981	Třebešice	1	1	809	80	Zdeněk Zvoníček, nezávislý kandidát	Zdeněk Zvoníček, NK	NK	1	080	64	78.45	1
2105	530981	Třebešice	1	2	804	80	Jaroslav Havránek, nezávislý kandidát	Jaroslav Havránek, NK	NK	1	080	75	91.94	1
2105	530981	Třebešice	1	3	807	80	Jiří Ondráček, nezávislý kandidát	Jiří Ondráček, NK	NK	1	080	74	90.71	1
2105	530981	Třebešice	1	4	802	80	Jaroslav Doležal, nezávislý kandidát	Jaroslav Doležal, NK	NK	1	080	43	52.71	0
2105	530981	Třebešice	1	5	803	80	Alice Doležalová, nezávislý kandidát	Alice Doležalová, NK	NK	1	080	47	57.61	0
2105	530981	Třebešice	1	6	808	80	Zdeněk Luňák, nezávislý kandidát	Zdeněk Luňák, NK	NK	1	080	64	78.45	1
2105	530981	Třebešice	1	7	806	80	Jiří Lang, nezávislý kandidát	Jiří Lang, NK	NK	1	080	63	77.23	1
2105	530981	Třebešice	1	8	805	80	Bohumil Jelínek, nezávislý kandidát	Bohumil Jelínek, NK	NK	1	080	84	102.97	1
2105	530981	Třebešice	1	9	801	80	Jiří Ambrož, nezávislý kandidát	Jiří Ambrož, NK	NK	1	080	57	69.87	1