OKRES	KODZASTUP	NAZEVZAST	COBVODU	POR_STR_HL	OSTRANA	VSTRANA	NAZEVCELK	ZKRATKAO30	ZKRATKAO8	POCSTR_SLO	SLOZENI	HLASY_STR	PROCHLSTR	MAND_STR
5204	576182	Častolovice	1	1	129	129	SNK Evropští demokraté	SNK Evropští demokraté	SNK ED	1	129	2821	24.02	4
5204	576182	Častolovice	1	2	1	1	Křesťanská a demokratická unie - Československá strana lidová	Křesť.demokr.unie-Čs.str.lid.	KDU-ČSL	1	001	1898	16.16	2
5204	576182	Častolovice	1	3	53	53	Občanská demokratická strana	Občanská demokratická strana	ODS	1	053	2370	20.18	3
5204	576182	Častolovice	1	4	411	411	Sdružení VPM, NK Volba pro Častolovice	Sdruž.VPM, NK Volba pro Častol		2	080,113	2994	25.5	4
5204	576182	Častolovice	1	5	47	47	Komunistická strana Čech a Moravy	Komunistická str.Čech a Moravy	KSČM	1	047	1657	14.11	2