OKRES	KODZASTUP	NAZEVZAST	COBVODU	POR_STR_HL	OSTRANA	VSTRANA	NAZEVCELK	ZKRATKAO30	ZKRATKAO8	POCSTR_SLO	SLOZENI	HLASY_STR	PROCHLSTR	MAND_STR
6206	593516	Račice-Pístovice	1	1	902	90	Sdružení nezávislých kandidátů Račice-Pístovice	SNK Račice-Pístovice	SNK	1	080	1381	19.72	3
6206	593516	Račice-Pístovice	1	2	7	7	Česká strana sociálně demokratická	Česká str.sociálně demokrat.	ČSSD	1	007	1343	19.18	3
6206	593516	Račice-Pístovice	1	3	1190	1190	Moravské zemské hnutí	Moravské zemské hnutí	"MZH"""	1	1190	687	9.81	1
6206	593516	Račice-Pístovice	1	4	47	47	Komunistická strana Čech a Moravy	Komunistická str.Čech a Moravy	KSČM	1	047	1311	18.72	3
6206	593516	Račice-Pístovice	1	5	901	90	Občané Račic - Pístovic	Občané Račic - Pístovic	SNK	1	080	1399	19.98	3
6206	593516	Račice-Pístovice	1	6	1	1	Křesťanská a demokratická unie - Československá strana lidová	Křesť.demokr.unie-Čs.str.lid.	KDU-ČSL	1	001	881	12.58	2