OKRES	KODZASTUP	NAZEVZAST	COBVODU	POR_STR_HL	OSTRANA	VSTRANA	NAZEVCELK	ZKRATKAO30	ZKRATKAO8	POCSTR_SLO	SLOZENI	HLASY_STR	PROCHLSTR	MAND_STR
5204	576131	Borohrádek	1	1	901	90	Sdružení nezávislých kandidátů: SPRÁVNÁ VOLBA 2010	SNK: SPRÁVNÁ VOLBA 2010	SNK	1	080	1228	11.43	1
5204	576131	Borohrádek	1	2	902	90	Sdružení nezávislých kandidátů VOLBA PRO BOROHRÁDEK	SNK VOLBA PRO BOROHRÁDEK	SNK	1	080	3126	29.11	5
5204	576131	Borohrádek	1	3	129	129	SNK Evropští demokraté	SNK Evropští demokraté	SNK ED	1	129	5046	47	8
5204	576131	Borohrádek	1	4	47	47	Komunistická strana Čech a Moravy	Komunistická str.Čech a Moravy	KSČM	1	047	1239	11.54	1
5204	576131	Borohrádek	1	5	716	716	"""Strana soukromníků České republiky"""	"""Strana soukromníků ČR"""	SsČR	1	716	97	2.71	0