OKRES	KODZASTUP	NAZEVZAST	COBVODU	POR_STR_HL	OSTRANA	VSTRANA	NAZEVCELK	ZKRATKAO30	ZKRATKAO8	POCSTR_SLO	SLOZENI	HLASY_STR	PROCHLSTR	MAND_STR
3204	539929	Týniště	1	1	804	80	Lubomír Kasl, nezávislý kandidát	Lubomír Kasl, NK	NK	1	080	28	101.81	1
3204	539929	Týniště	1	2	805	80	Václava Rašpličková, nezávislý kandidát	Václava Rašpličková, NK	NK	1	080	23	83.63	1
3204	539929	Týniště	1	3	808	80	Jiří Voráček, nezávislý kandidát	Jiří Voráček, NK	NK	1	080	18	65.45	1
3204	539929	Týniště	1	4	806	80	Olga Rybárová, nezávislý kandidát	Olga Rybárová, NK	NK	1	080	16	58.18	0
3204	539929	Týniště	1	5	801	80	Hana Bláhová, nezávislý kandidát	Hana Bláhová, NK	NK	1	080	15	54.54	0
3204	539929	Týniště	1	6	802	80	Věra Gőgl, nezávislý kandidát	Věra Gőgl, NK	NK	1	080	21	76.36	1
3204	539929	Týniště	1	7	803	80	Daniel Chmelík, nezávislý kandidát	Daniel Chmelík, NK	NK	1	080	20	72.72	1
3204	539929	Týniště	1	8	807	80	Dana Sýkorová, nezávislý kandidát	Dana Sýkorová, NK	NK	1	080	24	87.27	1