OKRES	KODZASTUP	NAZEVZAST	COBVODU	POR_STR_HL	OSTRANA	VSTRANA	NAZEVCELK	ZKRATKAO30	ZKRATKAO8	POCSTR_SLO	SLOZENI	HLASY_STR	PROCHLSTR	MAND_STR
8101	551813	Staré Heřminovy	1	1	901	90	Zdravý rozum	Sdružení nezávislých kandidátů	SNK	1	080	156	24.84	2
8101	551813	Staré Heřminovy	1	2	47	47	Komunistická strana Čech a Moravy	Komunistická str.Čech a Moravy	KSČM	1	047	58	9.23	0
8101	551813	Staré Heřminovy	1	3	470	470	Staré Heřminovy - dobrá adresa!	Sdružení STAN, NK		2	080,166	158	31.44	2
8101	551813	Staré Heřminovy	1	4	902	90	Myslivecký spolek Staré Heřminovy	Sdružení nezávislých kandidátů	SNK	1	080	77	12.26	0
8101	551813	Staré Heřminovy	1	5	903	90	Ženy za obec ještě krásnější	Sdružení nezávislých kandidátů	SNK	1	080	145	23.08	1
8101	551813	Staré Heřminovy	1	6	801	80	Vladimír Blahuta, nezávislý kandidát	Vladimír Blahuta, NK	NK	1	080	34	27.07	0