OKRES	KODZASTUP	NAZEVZAST	COBVODU	POR_STR_HL	OSTRANA	VSTRANA	NAZEVCELK	ZKRATKAO30	ZKRATKAO8	POCSTR_SLO	SLOZENI	HLASY_STR	PROCHLSTR	MAND_STR
7104	552780	Křtomil	1	1	902	90	"""Perspektiva pro Křtomil"""	"""Perspektiva pro Křtomil"""	SNK	1	080	78	6.64	0
7104	552780	Křtomil	1	2	903	90	STRANA PRO ROZVOJ OBCE	STRANA PRO ROZVOJ OBCE	SNK	1	080	640	38.92	3
7104	552780	Křtomil	1	3	470	470	PRO Křtomil SPOLEČNĚ A SPOLU !	PRO Křtomil SPOLEČNĚ A SPOLU !		2	080,166	194	11.8	1
7104	552780	Křtomil	1	4	901	90	"""Za Křtomil společně"""	"""Za Křtomil společně"""	SNK	1	080	296	18	1
7104	552780	Křtomil	1	5	1	1	Křesťanská a demokratická unie - Československá strana lidová	Křesť.demokr.unie-Čs.str.lid.	KDU-ČSL	1	001	436	26.52	2