OKRES	KODZASTUP	NAZEVZAST	COBVODU	POR_STR_HL	OSTRANA	VSTRANA	NAZEVCELK	ZKRATKAO30	ZKRATKAO8	POCSTR_SLO	SLOZENI	HLASY_STR	PROCHLSTR	MAND_STR
5102	563811	Smržovka	1	1	1	1	Křesťanská a demokratická unie - Československá strana lidová	Křesť.demokr.unie-Čs.str.lid.	KDU-ČSL	1	001	1172	12.45	1
5102	563811	Smržovka	1	2	901	90	Sdružení nezávislých Smržovky	Sdružení nezávislých Smržovky	SN SMRŽ	1	080	4848	30.3	5
5102	563811	Smržovka	1	3	47	47	Komunistická strana Čech a Moravy	Komunistická str.Čech a Moravy	KSČM	1	047	930	16.47	1
5102	563811	Smržovka	1	4	53	53	Občanská demokratická strana	Občanská demokratická strana	ODS	1	053	8968	56.06	10
5102	563811	Smržovka	1	5	175	175	Česká strana národně socialistická	Česká str.národ.socialistická	ČSNS2005	1	175	79	8.39	0