OKRES	KODZASTUP	NAZEVZAST	COBVODU	POR_STR_HL	OSTRANA	VSTRANA	NAZEVCELK	ZKRATKAO30	ZKRATKAO8	POCSTR_SLO	SLOZENI	HLASY_STR	PROCHLSTR	MAND_STR
2101	532886	Chářovice	1	1	806	80	Slavomír Kubásek, nezávislý kandidát	Slavomír Kubásek, NK	NK	1	080	83	81.85	1
2101	532886	Chářovice	1	2	802	80	Jiří Dvořák, nezávislý kandidát	Jiří Dvořák, NK	NK	1	080	43	42.4	0
2101	532886	Chářovice	1	3	801	80	Ladislav Kalaš, nezávislý kandidát	Ladislav Kalaš, NK	NK	1	080	97	95.66	1
2101	532886	Chářovice	1	4	804	80	Hana Kubásková, nezávislý kandidát	Hana Kubásková, NK	NK	1	080	77	75.93	1
2101	532886	Chářovice	1	5	805	80	Mgr. Zuzana Krajánková, nezávislý kandidát	Mgr. Zuzana Krajánková, NK	NK	1	080	85	83.82	1
2101	532886	Chářovice	1	6	803	80	Martin Škvor, nezávislý kandidát	Martin Škvor, NK	NK	1	080	34	33.53	0
2101	532886	Chářovice	1	7	807	80	Jaromír Svoboda, nezávislý kandidát	Jaromír Svoboda, NK	NK	1	080	88	86.78	1