OKRES	KODZASTUP	NAZEVZAST	COBVODU	POR_STR_HL	OSTRANA	VSTRANA	NAZEVCELK	ZKRATKAO30	ZKRATKAO8	POCSTR_SLO	SLOZENI	HLASY_STR	PROCHLSTR	MAND_STR
6101	568996	Leškovice	1	1	808	80	Luděk Červencl, nezávislý kandidát	Luděk Červencl, NK	NK	1	080	27	85.52	1
6101	568996	Leškovice	1	2	801	80	Marie Filipiová, nezávislý kandidát	Marie Filipiová, NK	NK	1	080	29	91.85	1
6101	568996	Leškovice	1	3	802	80	Jan Hroch, nezávislý kandidát	Jan Hroch, NK	NK	1	080	27	85.52	1
6101	568996	Leškovice	1	4	803	80	Zdenka Kolářová, nezávislý kandidát	Zdenka Kolářová, NK	NK	1	080	27	85.52	1
6101	568996	Leškovice	1	5	807	80	Jan Tirmantinger, nezávislý kandidát	Jan Tirmantinger, NK	NK	1	080	35	110.85	1
6101	568996	Leškovice	1	6	804	80	Magdaléna Šrámková, nezávislý kandidát	Magdaléna Šrámková, NK	NK	1	080	32	101.35	1
6101	568996	Leškovice	1	7	805	80	Václav Prajzner, nezávislý kandidát	Václav Prajzner, NK	NK	1	080	0	0	0
6101	568996	Leškovice	1	8	806	80	Kamil Michal, nezávislý kandidát	Kamil Michal, NK	NK	1	080	44	139.36	1