OKRES	KODZASTUP	NAZEVZAST	COBVODU	POR_STR_HL	OSTRANA	VSTRANA	NAZEVCELK	ZKRATKAO30	ZKRATKAO8	POCSTR_SLO	SLOZENI	HLASY_STR	PROCHLSTR	MAND_STR
5304	580651	Mladkov	1	1	470	470	Pro územní rozvoj obce	"Pro úz. rozv. obce; ""STAN"", NK"		2	080,166	787	30.86	3
5304	580651	Mladkov	1	2	902	90	Sdružení nezávislých kandidátů Mladkov	Sdruž.nezáv.kand. Mladkov	SNK	1	080	367	14.39	1
5304	580651	Mladkov	1	3	47	47	Komunistická strana Čech a Moravy	Komunistická str.Čech a Moravy	KSČM	1	047	240	9.41	1
5304	580651	Mladkov	1	4	1	1	Křesťanská a demokratická unie - Československá strana lidová	Křesť.demokr.unie-Čs.str.lid.	KDU-ČSL	1	001	267	13.46	1
5304	580651	Mladkov	1	5	901	90	Sdružení nezávislých kandidátů 1	Sdruž.nezáv.kand. 1	SNK	1	080	589	23.09	2
5304	580651	Mladkov	1	6	903	90	Sdružení nezávislých kandidátů Mladí Mladkov	Sdruž.nez.kand. Mladí Mladkov	SNK	1	080	300	11.76	1