OKRES	KODZASTUP	NAZEVZAST	COBVODU	POR_STR_HL	OSTRANA	VSTRANA	NAZEVCELK	ZKRATKAO30	ZKRATKAO8	POCSTR_SLO	SLOZENI	HLASY_STR	PROCHLSTR	MAND_STR
5304	553760	Běstovice	1	1	803	80	Tomáš Lustyk, nezávislý kandidát	Tomáš Lustyk, NK	NK	1	080	166	83.65	1
5304	553760	Běstovice	1	2	809	80	Ivana Malochová, nezávislý kandidát	Ivana Malochová, NK	NK	1	080	132	66.52	1
5304	553760	Běstovice	1	3	806	80	Bc. Zdeňka Fassnerová, nezávislý kandidát	Bc. Zdeňka Fassnerová, NK	NK	1	080	194	97.76	1
5304	553760	Běstovice	1	4	801	80	Petr Kopsa, nezávislý kandidát	Petr Kopsa, NK	NK	1	080	203	102.3	1
5304	553760	Běstovice	1	5	804	80	Jaromír Konárek, nezávislý kandidát	Jaromír Konárek, NK	NK	1	080	171	86.17	1
5304	553760	Běstovice	1	6	802	80	David Absolon, nezávislý kandidát	David Absolon, NK	NK	1	080	168	84.66	1
5304	553760	Běstovice	1	7	808	80	Radek Kašpar, nezávislý kandidát	Radek Kašpar, NK	NK	1	080	121	60.97	0
5304	553760	Běstovice	1	8	807	80	Oldřich Kašpar, nezávislý kandidát	Oldřich Kašpar, NK	NK	1	080	87	43.84	0
5304	553760	Běstovice	1	9	805	80	Jan Chleboun, nezávislý kandidát	Jan Chleboun, NK	NK	1	080	147	74.08	1