OKRES	KODZASTUP	NAZEVZAST	COBVODU	POR_STR_HL	OSTRANA	VSTRANA	NAZEVCELK	ZKRATKAO30	ZKRATKAO8	POCSTR_SLO	SLOZENI	HLASY_STR	PROCHLSTR	MAND_STR
5203	574571	Velké Petrovice	1	1	808	80	Jiří Vaisar, nezávislý kandidát	Jiří Vaisar, NK	NK	1	080	99	88.39	1
5203	574571	Velké Petrovice	1	2	809	80	Luděk Vajsar, nezávislý kandidát	Luděk Vajsar, NK	NK	1	080	94	83.92	1
5203	574571	Velké Petrovice	1	3	805	80	Basil Richter, nezávislý kandidát	Basil Richter, NK	NK	1	080	113	100.89	1
5203	574571	Velké Petrovice	1	4	801	80	Martin Čáp, nezávislý kandidát	Martin Čáp, NK	NK	1	080	115	102.67	1
5203	574571	Velké Petrovice	1	5	802	80	Vladislav Friml, nezávislý kandidát	Vladislav Friml, NK	NK	1	080	148	132.14	1
5203	574571	Velké Petrovice	1	6	804	80	Milan Matys, nezávislý kandidát	Milan Matys, NK	NK	1	080	110	98.21	1
5203	574571	Velké Petrovice	1	7	806	80	Josef Šolc, nezávislý kandidát	Josef Šolc, NK	NK	1	080	111	99.1	1
5203	574571	Velké Petrovice	1	8	807	80	Josef Teuner, nezávislý kandidát	Josef Teuner, NK	NK	1	080	98	87.5	1
5203	574571	Velké Petrovice	1	9	803	80	Hana Lecnarová, nezávislý kandidát	Hana Lecnarová, NK	NK	1	080	120	107.14	1