OKRES	KODZASTUP	NAZEVZAST	COBVODU	POR_STR_HL	OSTRANA	VSTRANA	NAZEVCELK	ZKRATKAO30	ZKRATKAO8	POCSTR_SLO	SLOZENI	HLASY_STR	PROCHLSTR	MAND_STR
2108	534919	Netřebice	1	1	801	80	Miluše Líbalová, nezávislý kandidát	Miluše Líbalová, NK	NK	1	080	55	55.07	0
2108	534919	Netřebice	1	2	7	7	Česká strana sociálně demokratická	Česká str.sociálně demokrat.	ČSSD	1	007	25	25.03	0
2108	534919	Netřebice	1	3	803	80	Jana Krupičková, nezávislý kandidát	Jana Krupičková, NK	NK	1	080	70	70.1	1
2108	534919	Netřebice	1	4	53	53	Občanská demokratická strana	Občanská demokratická strana	ODS	1	053	90	30.04	1
2108	534919	Netřebice	1	5	1	1	Křesťanská a demokratická unie - Československá strana lidová	Křesť.demokr.unie-Čs.str.lid.	KDU-ČSL	1	001	16	16.02	0
2108	534919	Netřebice	1	6	721	721	TOP 09	TOP 09	TOP 09	1	721	104	52.07	1
2108	534919	Netřebice	1	7	804	80	Milan Krupička, nezávislý kandidát	Milan Krupička, NK	NK	1	080	58	58.08	1
2108	534919	Netřebice	1	8	47	47	Komunistická strana Čech a Moravy	Komunistická str.Čech a Moravy	KSČM	1	047	230	46.06	3
2108	534919	Netřebice	1	9	802	80	Ladislav Líbal, nezávislý kandidát	Ladislav Líbal, NK	NK	1	080	51	51.07	0