OKRES	KODZASTUP	NAZEVZAST	COBVODU	POR_STR_HL	OSTRANA	VSTRANA	NAZEVCELK	ZKRATKAO30	ZKRATKAO8	POCSTR_SLO	SLOZENI	HLASY_STR	PROCHLSTR	MAND_STR
5103	564044	Hejnice	1	1	901	90	Za lepší Hejnice	Za lepší Hejnice	SNK	1	080	6104	44.89	8
5103	564044	Hejnice	1	2	407	407	Strana pro otevřenou společnost a nezávislí kandidáti	SOS a NK		2	080,103	457	7.2	0
5103	564044	Hejnice	1	3	53	53	Občanská demokratická strana	Občanská demokratická strana	ODS	1	053	4269	31.39	5
5103	564044	Hejnice	1	4	902	90	PRO OBČANY, ROZVOJ A HEJNICE	PRO OBČANY, ROZVOJ A HEJNICE	SNK	1	080	1247	12.5	1
5103	564044	Hejnice	1	5	903	90	Sdružení pro sport a volný čas	Sdružení pro sport a volný čas	SNK	1	080	1520	11.17	1