OKRES	KODZASTUP	NAZEVZAST	COBVODU	POR_STR_HL	OSTRANA	VSTRANA	NAZEVCELK	ZKRATKAO30	ZKRATKAO8	POCSTR_SLO	SLOZENI	HLASY_STR	PROCHLSTR	MAND_STR
3206	560251	Volduchy	1	1	902	90	Sdružení pro rozvoj obce Volduchy	Sdruž. pro roz. obce Volduchy	SNK	1	080	703	15.18	1
3206	560251	Volduchy	1	2	901	90	Sdružení nezávislých kandidátů PATRIOTI VOLDUCH	SNK PATRIOTI VOLDUCH	SNK	1	080	818	17.67	2
3206	560251	Volduchy	1	3	721	721	TOP 09	TOP 09	TOP 09	1	721	874	18.88	2
3206	560251	Volduchy	1	4	47	47	Komunistická strana Čech a Moravy	Komunistická str.Čech a Moravy	KSČM	1	047	677	14.62	1
3206	560251	Volduchy	1	5	7	7	Česká strana sociálně demokratická	Česká str.sociálně demokrat.	ČSSD	1	007	1557	33.63	3