OKRES	KODZASTUP	NAZEVZAST	COBVODU	POR_STR_HL	OSTRANA	VSTRANA	NAZEVCELK	ZKRATKAO30	ZKRATKAO8	POCSTR_SLO	SLOZENI	HLASY_STR	PROCHLSTR	MAND_STR
8102	552569	Staříč	1	1	901	90	Sdružení nezávislých kandidátů Staříč	Sdruž.nezáv.kand.Staříč	SNKSTAŘ.	1	080	815	14.68	1
8102	552569	Staříč	1	2	47	47	Komunistická strana Čech a Moravy	Komunistická str.Čech a Moravy	KSČM	1	047	619	9.55	0
8102	552569	Staříč	1	3	53	53	Občanská demokratická strana	Občanská demokratická strana	ODS	1	053	2074	32.03	3
8102	552569	Staříč	1	4	1	1	Křesťanská a demokratická unie - Československá strana lidová	Křesť.demokr.unie-Čs.str.lid.	KDU-ČSL	1	001	1293	19.96	1
8102	552569	Staříč	1	5	7	7	Česká strana sociálně demokratická	Česká str.sociálně demokrat.	ČSSD	1	007	1674	25.85	2