OKRES	KODZASTUP	NAZEVZAST	COBVODU	POR_STR_HL	OSTRANA	VSTRANA	NAZEVCELK	ZKRATKAO30	ZKRATKAO8	POCSTR_SLO	SLOZENI	HLASY_STR	PROCHLSTR	MAND_STR
5301	571610	Kočí	1	1	808	80	ŠTEFAN ĎURIŠ, nezávislý kandidát	ŠTEFAN ĎURIŠ, NK	NK	1	080	125	61.57	0
5301	571610	Kočí	1	2	806	80	Vladimír Dostál, nezávislý kandidát	Vladimír Dostál, NK	NK	1	080	174	85.71	1
5301	571610	Kočí	1	3	804	80	Otakar Krušina, nezávislý kandidát	Otakar Krušina, NK	NK	1	080	183	90.14	1
5301	571610	Kočí	1	4	805	80	Iveta Mrázková, nezávislý kandidát	Iveta Mrázková, NK	NK	1	080	189	93.1	1
5301	571610	Kočí	1	5	807	80	DANA PAVLASOVÁ, nezávislý kandidát	DANA PAVLASOVÁ, NK	NK	1	080	175	86.2	1
5301	571610	Kočí	1	6	803	80	Ing. Jiří Kraus, nezávislý kandidát	Ing. Jiří Kraus, NK	NK	1	080	160	78.81	1
5301	571610	Kočí	1	7	801	80	Jan Bakeš, nezávislý kandidát	Jan Bakeš, NK	NK	1	080	196	96.55	1
5301	571610	Kočí	1	8	802	80	Ing. Václav Pravda, nezávislý kandidát	Ing. Václav Pravda, NK	NK	1	080	219	107.88	1