OKRES	KODZASTUP	NAZEVZAST	COBVODU	POR_STR_HL	OSTRANA	VSTRANA	NAZEVCELK	ZKRATKAO30	ZKRATKAO8	POCSTR_SLO	SLOZENI	HLASY_STR	PROCHLSTR	MAND_STR
6204	584541	Klentnice	1	1	802	80	Andrea Lukášková, nezávislý kandidát	Andrea Lukášková, NK	A.L.	1	080	35	16.34	0
6204	584541	Klentnice	1	2	47	47	Komunistická strana Čech a Moravy	Komunistická str.Čech a Moravy	KSČM	1	047	141	9.4	0
6204	584541	Klentnice	1	3	801	80	Miroslav Křižák, nezávislý kandidát	Miroslav Křižák, NK	NK M.Kři	1	080	83	38.75	0
6204	584541	Klentnice	1	4	902	90	Sdružení nezávislých kandidátů občanů Klentnice	Sdruž.nezáv.kand.občanů Klentn	SNKo.Kl.	1	080	383	25.55	2
6204	584541	Klentnice	1	5	7	7	Česká strana sociálně demokratická	Česká str.sociálně demokrat.	ČSSD	1	007	305	23.73	2
6204	584541	Klentnice	1	6	901	90	Sdružení nezávislých kandidátů I.	Sdruž.nezáv.kand.I.	SNK I.	1	080	552	36.82	3