OKRES	KODZASTUP	NAZEVZAST	COBVODU	POR_STR_HL	OSTRANA	VSTRANA	NAZEVCELK	ZKRATKAO30	ZKRATKAO8	POCSTR_SLO	SLOZENI	HLASY_STR	PROCHLSTR	MAND_STR
6104	591238	Nimpšov	1	1	805	80	Ing. Tomáš Růžička, nezávislý kandidát	Ing. Tomáš Růžička, NK	NK	1	080	24	72.41	1
6104	591238	Nimpšov	1	2	806	80	Jan Bastl, nezávislý kandidát	Jan Bastl, NK	NK	1	080	32	96.55	1
6104	591238	Nimpšov	1	3	803	80	Božena Novotná, nezávislý kandidát	Božena Novotná, NK	NK	1	080	28	84.48	1
6104	591238	Nimpšov	1	4	802	80	Natálie Tejralová, nezávislý kandidát	Natálie Tejralová, NK	NK	1	080	20	60.34	0
6104	591238	Nimpšov	1	5	801	80	Alena Bastlová, nezávislý kandidát	Alena Bastlová, NK	NK	1	080	28	84.48	1
6104	591238	Nimpšov	1	6	809	80	Pavel Blatný, nezávislý kandidát	Pavel Blatný, NK	NK	1	080	28	84.48	1
6104	591238	Nimpšov	1	7	807	80	Marie Boudná, nezávislý kandidát	Marie Boudná, NK	NK	1	080	18	54.31	0
6104	591238	Nimpšov	1	8	804	80	Josef Růžička, nezávislý kandidát	Josef Růžička, NK	NK	1	080	26	78.44	1
6104	591238	Nimpšov	1	9	808	80	Roman Boudný, nezávislý kandidát	Roman Boudný, NK	NK	1	080	28	84.48	1