OKRES	KODZASTUP	NAZEVZAST	COBVODU	POR_STR_HL	OSTRANA	VSTRANA	NAZEVCELK	ZKRATKAO30	ZKRATKAO8	POCSTR_SLO	SLOZENI	HLASY_STR	PROCHLSTR	MAND_STR
2101	571415	Xaverov	1	1	801	80	Jan Pohořal, nezávislý kandidát	Jan Pohořal, NK	NK	1	080	19	86.36	1
2101	571415	Xaverov	1	2	805	80	Jiří Hervert, nezávislý kandidát	Jiří Hervert, NK	NK	1	080	24	109.09	1
2101	571415	Xaverov	1	3	802	80	Petra Novotná, nezávislý kandidát	Petra Novotná, NK	NK	1	080	22	100	1
2101	571415	Xaverov	1	4	804	80	Mgr. Jiřina Svobodová, nezávislý kandidát	Mgr. Jiřina Svobodová, NK	NK	1	080	22	100	1
2101	571415	Xaverov	1	5	803	80	František Hervert, nezávislý kandidát	František Hervert, NK	NK	1	080	23	104.54	1