OKRES	KODZASTUP	NAZEVZAST	COBVODU	POR_STR_HL	OSTRANA	VSTRANA	NAZEVCELK	ZKRATKAO30	ZKRATKAO8	POCSTR_SLO	SLOZENI	HLASY_STR	PROCHLSTR	MAND_STR
6207	594385	Lubnice	1	1	803	80	Jitka Janoušková, nezávislý kandidát	Jitka Janoušková, NK	NK	1	080	23	75.65	1
6207	594385	Lubnice	1	2	802	80	Antonín Svoboda, nezávislý kandidát	Antonín Svoboda, NK	NK	1	080	21	69.07	0
6207	594385	Lubnice	1	3	805	80	Jindřiška Jedličková, nezávislý kandidát	Jindřiška Jedličková, NK	NK	1	080	26	85.52	1
6207	594385	Lubnice	1	4	804	80	Helena Hroudná, nezávislý kandidát	Helena Hroudná, NK	NK	1	080	27	88.81	1
6207	594385	Lubnice	1	5	801	80	František Komenda, nezávislý kandidát	František Komenda, NK	NK	1	080	32	105.26	1
6207	594385	Lubnice	1	6	806	80	Jana Gritschová, nezávislý kandidát	Jana Gritschová, NK	NK	1	080	23	75.65	1