OKRES	KODZASTUP	NAZEVZAST	COBVODU	POR_STR_HL	OSTRANA	VSTRANA	NAZEVCELK	ZKRATKAO30	ZKRATKAO8	POCSTR_SLO	SLOZENI	HLASY_STR	PROCHLSTR	MAND_STR
2106	535303	Vraňany	1	1	801	80	Alexander Galyás, nezávislý kandidát	Alexander Galyás, NK	NK	1	080	24	6.99	0
2106	535303	Vraňany	1	2	53	53	Občanská demokratická strana	Občanská demokratická strana	ODS	1	053	1422	46.06	5
2106	535303	Vraňany	1	3	802	80	Vladimír Horák, nezávislý kandidát	Vladimír Horák, NK	NK	1	080	132	38.48	0
2106	535303	Vraňany	1	4	901	90	Sdružení nezávislých kandidátů	Sdružení nezávislých kandidátů	SNK	1	080	670	21.7	2
2106	535303	Vraňany	1	5	47	47	Komunistická strana Čech a Moravy	Komunistická str.Čech a Moravy	KSČM	1	047	839	27.17	2