OKRES	KODZASTUP	NAZEVZAST	COBVODU	POR_STR_HL	OSTRANA	VSTRANA	NAZEVCELK	ZKRATKAO30	ZKRATKAO8	POCSTR_SLO	SLOZENI	HLASY_STR	PROCHLSTR	MAND_STR
8106	554235	Stará Bělá	1	1	47	47	Komunistická strana Čech a Moravy	Komunistická str.Čech a Moravy	KSČM	1	047	2965	12.69	2
8106	554235	Stará Bělá	1	2	724	724	Strana Práv Občanů ZEMANOVCI	Strana Práv Občanů ZEMANOVCI	SPOZ	1	724	397	1.69	0
8106	554235	Stará Bělá	1	3	901	90	Sdružení nezávislých kandidátů - Všichni dobří sousedé	Sdruž.nezáv.kand.	SNK	1	080	2533	10.84	2
8106	554235	Stará Bělá	1	4	7	7	Česká strana sociálně demokratická	Česká str.sociálně demokrat.	ČSSD	1	007	2664	11.4	2
8106	554235	Stará Bělá	1	5	53	53	Občanská demokratická strana	Občanská demokratická strana	ODS	1	053	4838	20.71	3
8106	554235	Stará Bělá	1	6	1	1	Křesťanská a demokratická unie - Československá strana lidová	Křesť.demokr.unie-Čs.str.lid.	KDU-ČSL	1	001	4076	17.44	3
8106	554235	Stará Bělá	1	7	721	721	TOP 09	TOP 09	TOP 09	1	721	2087	8.93	1
8106	554235	Stará Bělá	1	8	902	90	Sdružení nezávislých kandidátů Stará Bělá 2010	Sdruž.nezáv.kand.	SNK	1	080	3799	16.26	2