OKRES	KODZASTUP	NAZEVZAST	COBVODU	POR_STR_HL	OSTRANA	VSTRANA	NAZEVCELK	ZKRATKAO30	ZKRATKAO8	POCSTR_SLO	SLOZENI	HLASY_STR	PROCHLSTR	MAND_STR
3205	558800	Dolní Hradiště	1	1	807	80	Stanislav Šleis, nezávislý kandidát	Stanislav Šleis, NK	NK	1	080	15	60	1
3205	558800	Dolní Hradiště	1	2	801	80	Alena Šleisová, nezávislý kandidát	Alena Šleisová, NK	NK	1	080	24	96	1
3205	558800	Dolní Hradiště	1	3	805	80	Jaromír Bech, nezávislý kandidát	Jaromír Bech, NK	NK	1	080	18	72	1
3205	558800	Dolní Hradiště	1	4	802	80	Martin Vlk, nezávislý kandidát	Martin Vlk, NK	NK	1	080	9	36	0
3205	558800	Dolní Hradiště	1	5	806	80	Bartoloměj Štěrba, nezávislý kandidát	Bartoloměj Štěrba, NK	NK	1	080	25	100	1
3205	558800	Dolní Hradiště	1	6	803	80	Ivana Kubišová, nezávislý kandidát	Ivana Kubišová, NK	NK	1	080	12	48	0
3205	558800	Dolní Hradiště	1	7	804	80	Jana Bechová, nezávislý kandidát	Jana Bechová, NK	NK	1	080	22	88	1