OKRES	KODZASTUP	NAZEVZAST	COBVODU	POR_STR_HL	OSTRANA	VSTRANA	NAZEVCELK	ZKRATKAO30	ZKRATKAO8	POCSTR_SLO	SLOZENI	HLASY_STR	PROCHLSTR	MAND_STR
6206	593117	Ivanovice na Hané	1	1	53	53	Občanská demokratická strana	Občanská demokratická strana	ODS	1	053	3461	21.99	3
6206	593117	Ivanovice na Hané	1	2	47	47	Komunistická strana Čech a Moravy	Komunistická str.Čech a Moravy	KSČM	1	047	4297	27.3	4
6206	593117	Ivanovice na Hané	1	3	1	1	Křesťanská a demokratická unie - Československá strana lidová	Křesť.demokr.unie-Čs.str.lid.	KDU-ČSL	1	001	2585	16.42	2
6206	593117	Ivanovice na Hané	1	4	7	7	Česká strana sociálně demokratická	Česká str.sociálně demokrat.	ČSSD	1	007	2751	17.48	3
6206	593117	Ivanovice na Hané	1	5	181	181	Nestraníci	Nestraníci	Nestran.	1	181	2641	16.78	3