OKRES	KODZASTUP	NAZEVZAST	COBVODU	POR_STR_HL	OSTRANA	VSTRANA	NAZEVCELK	ZKRATKAO30	ZKRATKAO8	POCSTR_SLO	SLOZENI	HLASY_STR	PROCHLSTR	MAND_STR
5301	572454	Vápenný Podol	1	1	804	80	Jan Motl, nezávislý kandidát	Jan Motl, NK	NK	1	080	116	120.83	1
5301	572454	Vápenný Podol	1	2	807	80	Karel Vilímovský, nezávislý kandidát	Karel Vilímovský, NK	NK	1	080	60	62.5	0
5301	572454	Vápenný Podol	1	3	806	80	Jiřina Špelinová, nezávislý kandidát	Jiřina Špelinová, NK	NK	1	080	95	98.95	1
5301	572454	Vápenný Podol	1	4	809	80	Jan Kotaška, nezávislý kandidát	Jan Kotaška, NK	NK	1	080	68	70.83	1
5301	572454	Vápenný Podol	1	5	808	80	Zdeněk Žmolík, nezávislý kandidát	Zdeněk Žmolík, NK	NK	1	080	23	23.95	0
5301	572454	Vápenný Podol	1	6	805	80	Karel Rais, nezávislý kandidát	Karel Rais, NK	NK	1	080	76	79.16	1
5301	572454	Vápenný Podol	1	7	802	80	Jiří Doležal, nezávislý kandidát	Jiří Doležal, NK	NK	1	080	67	69.79	1
5301	572454	Vápenný Podol	1	8	803	80	Blanka Makešová, nezávislý kandidát	Blanka Makešová, NK	NK	1	080	100	104.16	1
5301	572454	Vápenný Podol	1	9	801	80	Jitka Bauerová, nezávislý kandidát	Jitka Bauerová, NK	NK	1	080	67	69.79	1