OKRES	KODZASTUP	NAZEVZAST	COBVODU	POR_STR_HL	OSTRANA	VSTRANA	NAZEVCELK	ZKRATKAO30	ZKRATKAO8	POCSTR_SLO	SLOZENI	HLASY_STR	PROCHLSTR	MAND_STR
3202	578517	Domoraz	1	1	801	80	Jiří Přibyl, nezávislý kandidát	Jiří Přibyl, NK	NK	1	080	35	95.33	1
3202	578517	Domoraz	1	2	802	80	Václav Šobr, nezávislý kandidát	Václav Šobr, NK	NK	1	080	40	108.94	1
3202	578517	Domoraz	1	3	803	80	Jiří Turek, nezávislý kandidát	Jiří Turek, NK	NK	1	080	36	98.05	1
3202	578517	Domoraz	1	4	808	80	Marek Vlk, nezávislý kandidát	Marek Vlk, NK	NK	1	080	25	68.09	0
3202	578517	Domoraz	1	5	805	80	Petr Jírovec, nezávislý kandidát	Petr Jírovec, NK	NK	1	080	29	78.98	1
3202	578517	Domoraz	1	6	806	80	Bohumil Kůrka, nezávislý kandidát	Bohumil Kůrka, NK	NK	1	080	26	70.81	1
3202	578517	Domoraz	1	7	807	80	Josef Hozman, nezávislý kandidát	Josef Hozman, NK	NK	1	080	30	81.71	1
3202	578517	Domoraz	1	8	804	80	František Dlouhý, nezávislý kandidát	František Dlouhý, NK	NK	1	080	36	98.05	1