OKRES	KODZASTUP	NAZEVZAST	COBVODU	POR_STR_HL	OSTRANA	VSTRANA	NAZEVCELK	ZKRATKAO30	ZKRATKAO8	POCSTR_SLO	SLOZENI	HLASY_STR	PROCHLSTR	MAND_STR
6203	581321	Běleč	1	1	805	80	Tomáš Přikryl, nezávislý kandidát	Tomáš Přikryl, NK	NK	1	080	92	87.97	1
6203	581321	Běleč	1	2	801	80	Bohuslav Pustina, nezávislý kandidát	Bohuslav Pustina, NK	NK	1	080	72	68.85	1
6203	581321	Běleč	1	3	808	80	Monika Přikrylová, nezávislý kandidát	Monika Přikrylová, NK	NK	1	080	58	55.46	0
6203	581321	Běleč	1	4	804	80	Dana Přikrylová, nezávislý kandidát	Dana Přikrylová, NK	NK	1	080	68	65.02	1
6203	581321	Běleč	1	5	807	80	Dominik Bracek, nezávislý kandidát	Dominik Bracek, NK	NK	1	080	85	81.28	1
6203	581321	Běleč	1	6	802	80	Ing. Bc. Jana Přikrylová, nezávislý kandidát	Ing. Bc. Jana Přikrylová, NK	NK	1	080	104	99.45	1
6203	581321	Běleč	1	7	809	80	Marcela Štouračová, nezávislý kandidát	Marcela Štouračová, NK	NK	1	080	58	55.46	0
6203	581321	Běleč	1	8	806	80	Luboš Pařízek, nezávislý kandidát	Luboš Pařízek, NK	NK	1	080	94	89.89	1
6203	581321	Běleč	1	9	803	80	Roman Štefka, nezávislý kandidát	Roman Štefka, NK	NK	1	080	101	96.58	1