OKRES	KODZASTUP	NAZEVZAST	COBVODU	POR_STR_HL	OSTRANA	VSTRANA	NAZEVCELK	ZKRATKAO30	ZKRATKAO8	POCSTR_SLO	SLOZENI	HLASY_STR	PROCHLSTR	MAND_STR
7202	592170	Hluk	1	1	901	90	HLUČANÉ	HLUČANÉ	SNK	1	080	6144	20.09	4
7202	592170	Hluk	1	2	53	53	Občanská demokratická strana	Občanská demokratická strana	ODS	1	053	6959	22.76	5
7202	592170	Hluk	1	3	7	7	Česká strana sociálně demokratická	Česká str.sociálně demokrat.	ČSSD	1	007	4167	13.63	3
7202	592170	Hluk	1	4	47	47	Komunistická strana Čech a Moravy	Komunistická str.Čech a Moravy	KSČM	1	047	4406	14.41	3
7202	592170	Hluk	1	5	1	1	Křesťanská a demokratická unie - Československá strana lidová	Křesť.demokr.unie-Čs.str.lid.	KDU-ČSL	1	001	8895	29.09	6