OKRES	KODZASTUP	NAZEVZAST	COBVODU	POR_STR_HL	OSTRANA	VSTRANA	NAZEVCELK	ZKRATKAO30	ZKRATKAO8	POCSTR_SLO	SLOZENI	HLASY_STR	PROCHLSTR	MAND_STR
3105	537420	Chvalovice	1	1	808	80	Růžena Nováková, nezávislý kandidát	Růžena Nováková, NK	NK	1	080	64	94.51	1
3105	537420	Chvalovice	1	2	804	80	Miluše Divišová, nezávislý kandidát	Miluše Divišová, NK	NK	1	080	42	62.02	0
3105	537420	Chvalovice	1	3	803	80	Petr Borovka, nezávislý kandidát	Petr Borovka, NK	NK	1	080	54	79.74	1
3105	537420	Chvalovice	1	4	802	80	Anna Mačková, nezávislý kandidát	Anna Mačková, NK	NK	1	080	53	78.27	1
3105	537420	Chvalovice	1	5	807	80	František Novák, nezávislý kandidát	František Novák, NK	NK	1	080	29	42.82	0
3105	537420	Chvalovice	1	6	805	80	Luboš Pöschl, nezávislý kandidát	Luboš Pöschl, NK	NK	1	080	59	87.13	1
3105	537420	Chvalovice	1	7	801	80	Jaroslava Tejmlová, nezávislý kandidát	Jaroslava Tejmlová, NK	NK	1	080	65	95.99	1
3105	537420	Chvalovice	1	8	806	80	Romana Pöschlová, nezávislý kandidát	Romana Pöschlová, NK	NK	1	080	63	93.03	1
3105	537420	Chvalovice	1	9	809	80	Marcela Mrázová, nezávislý kandidát	Marcela Mrázová, NK	NK	1	080	45	66.45	1