OKRES	KODZASTUP	NAZEVZAST	COBVODU	POR_STR_HL	OSTRANA	VSTRANA	NAZEVCELK	ZKRATKAO30	ZKRATKAO8	POCSTR_SLO	SLOZENI	HLASY_STR	PROCHLSTR	MAND_STR
8101	551929	Andělská Hora	1	1	904	90	Za lepší soužití mezi námi	SNK Za lepší soužití mezi námi	SNK	1	080	561	44.1	4
8101	551929	Andělská Hora	1	2	905	90	Správná cesta	SNK Správná cesta	SNK	1	080	237	18.63	1
8101	551929	Andělská Hora	1	3	901	90	Anděláci	SNK Anděláci	SNK	1	080	232	18.23	1
8101	551929	Andělská Hora	1	4	903	90	Za lepší město	SNK Za lepší město	SNK	1	080	101	7.94	0
8101	551929	Andělská Hora	1	5	902	90	Podpora rozvoje města Andělská Hora	Podpora rozv. m. Anděl. Hora	SNK	1	080	141	11.08	1