OKRES	KODZASTUP	NAZEVZAST	COBVODU	POR_STR_HL	OSTRANA	VSTRANA	NAZEVCELK	ZKRATKAO30	ZKRATKAO8	POCSTR_SLO	SLOZENI	HLASY_STR	PROCHLSTR	MAND_STR
7103	589969	Rakůvka	1	1	806	80	Pavel Mikulka, nezávislý kandidát	Pavel Mikulka, NK	NK	1	080	39	68.25	1
7103	589969	Rakůvka	1	2	801	80	Petr Tomek, nezávislý kandidát	Petr Tomek, NK	NK	1	080	29	50.75	0
7103	589969	Rakůvka	1	3	807	80	Miroslav Muzikant, nezávislý kandidát	Miroslav Muzikant, NK	NK	1	080	45	78.75	1
7103	589969	Rakůvka	1	4	803	80	Zdeněk Okleštěk, nezávislý kandidát	Zdeněk Okleštěk, NK	NK	1	080	33	57.75	0
7103	589969	Rakůvka	1	5	804	80	Josef Mikulka, nezávislý kandidát	Josef Mikulka, NK	NK	1	080	60	105	1
7103	589969	Rakůvka	1	6	802	80	Pavlína Freibergová, nezávislý kandidát	Pavlína Freibergová, NK	NK	1	080	46	80.5	1
7103	589969	Rakůvka	1	7	808	80	Jaroslav Žítek, nezávislý kandidát	Jaroslav Žítek, NK	NK	1	080	44	77	1
7103	589969	Rakůvka	1	8	805	80	Jan Vogl, nezávislý kandidát	Jan Vogl, NK	NK	1	080	54	94.5	1
7103	589969	Rakůvka	1	9	809	80	Petr Muzikant, nezávislý kandidát	Petr Muzikant, NK	NK	1	080	50	87.5	1