OKRES	KODZASTUP	NAZEVZAST	COBVODU	POR_STR_HL	OSTRANA	VSTRANA	NAZEVCELK	ZKRATKAO30	ZKRATKAO8	POCSTR_SLO	SLOZENI	HLASY_STR	PROCHLSTR	MAND_STR
5303	578380	Městečko Trnávka	1	1	7	7	Česká strana sociálně demokratická	Česká str.sociálně demokrat.	ČSSD	1	007	2450	26.08	4
5303	578380	Městečko Trnávka	1	2	53	53	Občanská demokratická strana	Občanská demokratická strana	ODS	1	053	162	5.17	0
5303	578380	Městečko Trnávka	1	3	88	88	NEZÁVISLÍ	NEZÁVISLÍ	NEZ	1	088	4250	45.25	8
5303	578380	Městečko Trnávka	1	4	47	47	Komunistická strana Čech a Moravy	Komunistická str.Čech a Moravy	KSČM	1	047	1563	16.64	2
5303	578380	Městečko Trnávka	1	5	1	1	Křesťanská a demokratická unie - Československá strana lidová	Křesť.demokr.unie-Čs.str.lid.	KDU-ČSL	1	001	966	14.02	1