OKRES	KODZASTUP	NAZEVZAST	COBVODU	POR_STR_HL	OSTRANA	VSTRANA	NAZEVCELK	ZKRATKAO30	ZKRATKAO8	POCSTR_SLO	SLOZENI	HLASY_STR	PROCHLSTR	MAND_STR
6105	596868	Svratka	1	1	901	90	PRO SVRATKU - OD KRITIKY K ČINŮM	Pro Svratku-od kritiky k činům	SNK	1	080	2125	22.26	3
6105	596868	Svratka	1	2	47	47	Komunistická strana Čech a Moravy	Komunistická str.Čech a Moravy	KSČM	1	047	1241	11.26	2
6105	596868	Svratka	1	3	53	53	Občanská demokratická strana	Občanská demokratická strana	ODS	1	053	4241	38.5	6
6105	596868	Svratka	1	4	7	7	Česká strana sociálně demokratická	Česká str.sociálně demokrat.	ČSSD	1	007	1836	16.67	2
6105	596868	Svratka	1	5	1	1	Křesťanská a demokratická unie - Československá strana lidová	Křesť.demokr.unie-Čs.str.lid.	KDU-ČSL	1	001	1570	14.25	2