OKRES	KODZASTUP	NAZEVZAST	COBVODU	POR_STR_HL	OSTRANA	VSTRANA	NAZEVCELK	ZKRATKAO30	ZKRATKAO8	POCSTR_SLO	SLOZENI	HLASY_STR	PROCHLSTR	MAND_STR
2101	530409	Petroupim	1	1	806	80	Alena Šturcová, nezávislý kandidát	Alena Šturcová, NK	NK	1	080	80	89.88	1
2101	530409	Petroupim	1	2	802	80	Jaroslava Škvorová, nezávislý kandidát	Jaroslava Škvorová, NK	NK	1	080	79	88.76	1
2101	530409	Petroupim	1	3	804	80	Jiří Černý, nezávislý kandidát	Jiří Černý, NK	NK	1	080	95	106.74	1
2101	530409	Petroupim	1	4	805	80	Jana Fraňková, nezávislý kandidát	Jana Fraňková, NK	NK	1	080	94	105.61	1
2101	530409	Petroupim	1	5	807	80	Bc. Jana Černá, nezávislý kandidát	Bc.Jana Černá, NK	NK	1	080	91	102.24	1
2101	530409	Petroupim	1	6	801	80	Petr Hruška, nezávislý kandidát	Petr Hruška, NK	NK	1	080	90	101.12	1
2101	530409	Petroupim	1	7	803	80	Libor Šilínek, nezávislý kandidát	Libor Šilínek, NK	NK	1	080	94	105.61	1