OKRES	KODZASTUP	NAZEVZAST	COBVODU	POR_STR_HL	OSTRANA	VSTRANA	NAZEVCELK	ZKRATKAO30	ZKRATKAO8	POCSTR_SLO	SLOZENI	HLASY_STR	PROCHLSTR	MAND_STR
5301	574007	Kněžice	1	1	901	90	Občané Kněžic	Občané Kněžic, SNK	SNK	1	080	452	77.66	7
5301	574007	Kněžice	1	2	802	80	Miloš Bačkora, nezávislý kandidát	Miloš Bačkora, NK	NK	1	080	30	36.08	0
5301	574007	Kněžice	1	3	803	80	Milada Dibelková, nezávislý kandidát	Milada Dibelková, NK	NK	1	080	24	28.86	0
5301	574007	Kněžice	1	4	804	80	Miluše Miláčková, nezávislý kandidát	Miluše Miláčková, NK	NK	1	080	15	18.04	0
5301	574007	Kněžice	1	5	806	80	Miloslav Vašíček, nezávislý kandidát	Miloslav Vašíček, NK	NK	1	080	7	8.41	0
5301	574007	Kněžice	1	6	805	80	Ladislav Miláček, nezávislý kandidát	Ladislav Miláček, NK	NK	1	080	8	9.62	0
5301	574007	Kněžice	1	7	801	80	Martin Vašíček, nezávislý kandidát	Martin Vašíček, NK	NK	1	080	33	39.69	0
5301	574007	Kněžice	1	8	807	80	Jitka Vašíčková, nezávislý kandidát	Jitka Vašíčková, NK	NK	1	080	8	9.62	0
5301	574007	Kněžice	1	9	53	53	Občanská demokratická strana	Občan. demokr. strana - ODS	ODS	1	053	5	6.01	0