OKRES	KODZASTUP	NAZEVZAST	COBVODU	POR_STR_HL	OSTRANA	VSTRANA	NAZEVCELK	ZKRATKAO30	ZKRATKAO8	POCSTR_SLO	SLOZENI	HLASY_STR	PROCHLSTR	MAND_STR
3107	562955	Košín	1	1	806	80	Jaroslav Krejčí, nezávislý kandidát	Jaroslav Krejčí, NK	NK	1	080	38	110.37	1
3107	562955	Košín	1	2	802	80	Věra Nováková, nezávislý kandidát	Věra Nováková, NK	NK	1	080	34	98.75	1
3107	562955	Košín	1	3	803	80	Josef Turek, nezávislý kandidát	Josef Turek, NK	NK	1	080	19	55.18	1
3107	562955	Košín	1	4	807	80	David Mišík, nezávislý kandidát	David Mišík, NK	NK	1	080	37	107.46	1
3107	562955	Košín	1	5	805	80	Alena Ševčíková, nezávislý kandidát	Alena Ševčíková, NK	NK	1	080	10	29.04	0
3107	562955	Košín	1	6	808	80	Luděk Burian, nezávislý kandidát	Luděk Burian, NK	NK	1	080	28	81.32	1
3107	562955	Košín	1	7	804	80	Marta Viktorinová, nezávislý kandidát	Marta Viktorinová, NK	NK	1	080	38	110.37	1
3107	562955	Košín	1	8	801	80	Pavel Bratránek, nezávislý kandidát	Pavel Bratránek, NK	NK	1	080	37	107.46	1