OKRES	KODZASTUP	NAZEVZAST	COBVODU	POR_STR_HL	OSTRANA	VSTRANA	NAZEVCELK	ZKRATKAO30	ZKRATKAO8	POCSTR_SLO	SLOZENI	HLASY_STR	PROCHLSTR	MAND_STR
4102	555169	Horní Blatná	1	1	804	80	Robert Petro, nezávislý kandidát	Robert Petro, NK	NK	1	080	119	160.19	1
4102	555169	Horní Blatná	1	2	803	80	Vlastimil Vítek, nezávislý kandidát	Vlastimil Vítek, NK	NK	1	080	79	106.34	1
4102	555169	Horní Blatná	1	3	801	80	Karel Hendl, nezávislý kandidát	Karel Hendl, NK	NK	1	080	37	49.8	1
4102	555169	Horní Blatná	1	4	805	80	Tereza Susková, nezávislý kandidát	Tereza Susková, NK	NK	1	080	48	64.61	1
4102	555169	Horní Blatná	1	5	806	80	Petr Suchan, nezávislý kandidát	Petr Suchan, NK	NK	1	080	16	21.53	1
4102	555169	Horní Blatná	1	6	802	80	Zdeněk Fuchs, nezávislý kandidát	Zdeněk Fuchs, NK	NK	1	080	97	130.57	1
4102	555169	Horní Blatná	1	7	807	80	Tomislav Dáňa, nezávislý kandidát	Tomislav Dáňa, NK	NK	1	080	109	146.73	1
4102	555169	Horní Blatná	1	8	808	80	Alžběta Petrová, nezávislý kandidát	Alžběta Petrová, NK	NK	1	080	15	20.19	0