OKRES	KODZASTUP	NAZEVZAST	COBVODU	POR_STR_HL	OSTRANA	VSTRANA	NAZEVCELK	ZKRATKAO30	ZKRATKAO8	POCSTR_SLO	SLOZENI	HLASY_STR	PROCHLSTR	MAND_STR
7202	592633	Stupava	1	1	47	47	Komunistická strana Čech a Moravy	Komunistická str.Čech a Moravy	KSČM	1	047	27	33.87	0
7202	592633	Stupava	1	2	901	90	SDRUŽENÍ NEZÁVISLÝCH KANDIDÁTŮ PRO ROZVOJ OBCE	SDRUŽ NEZ KAN. PRO ROZVOJ OBCE	SNK	1	080	275	49.28	4
7202	592633	Stupava	1	3	903	90	SDRUŽENÍ NEZÁVISLÝCH KANDIDÁTŮ OBCE STUPAVA	SDRUŽ NEZ. KAND.OBCE STUPAVA	SNK	1	080	122	25.5	2
7202	592633	Stupava	1	4	902	90	Sdružení za aktivní rozvoj obce	Sdruž. za aktivní rozvoj obce	SNK	1	080	117	20.96	1
7202	592633	Stupava	1	5	801	80	Petr Maštalíř, Nezávislý kandidát	Petr Maštalíř, NK	NK	1	080	17	21.32	0