OKRES	KODZASTUP	NAZEVZAST	COBVODU	POR_STR_HL	OSTRANA	VSTRANA	NAZEVCELK	ZKRATKAO30	ZKRATKAO8	POCSTR_SLO	SLOZENI	HLASY_STR	PROCHLSTR	MAND_STR
3101	544256	České Budějovice	1	1	454	454	Nezávislí pro lidi, pro město	Nezávislí pro lidi, pro město		2	080,172	38854	3.39	0
3101	544256	České Budějovice	1	2	98	98	Pravý Blok-strana za ODVOLAT.politiků, NÍZKÉ daně, MIN.byrokracie, SPRAV.justici, REFER.a PŘÍMOU demokr. WWW.CIBULKA.NET	Pravý Blok	PB	1	098	548	1.07	0
3101	544256	České Budějovice	1	3	129	129	SNK Evropští demokraté	SNK Evropští demokraté	SNK ED	1	129	62367	5.44	2
3101	544256	České Budějovice	1	4	47	47	Komunistická strana Čech a Moravy	Komunistická str.Čech a Moravy	KSČM	1	047	149522	13.06	6
3101	544256	České Budějovice	1	5	53	53	Občanská demokratická strana	Občanská demokratická strana	ODS	1	053	530845	46.38	23
3101	544256	České Budějovice	1	6	292	292	Zelení a otevřená společnost	Zelení a otevřená společnost		2	005,103	85745	7.49	3
3101	544256	České Budějovice	1	7	7	7	Česká strana sociálně demokratická	Česká str.sociálně demokrat.	ČSSD	1	007	181222	15.83	7
3101	544256	České Budějovice	1	8	1	1	Křesťanská a demokratická unie - Československá strana lidová	Křesť.demokr.unie-Čs.str.lid.	KDU-ČSL	1	001	95304	8.32	4