OKRES	KODZASTUP	NAZEVZAST	COBVODU	POR_STR_HL	OSTRANA	VSTRANA	NAZEVCELK	ZKRATKAO30	ZKRATKAO8	POCSTR_SLO	SLOZENI	HLASY_STR	PROCHLSTR	MAND_STR
4101	554511	Drmoul	1	1	142	142	Strana Zdraví Sportu Prosperity	Str.Zdraví Sportu Prosperity	SZSP	1	142	1804	58.15	6
4101	554511	Drmoul	1	2	5	5	Strana zelených	Strana zelených	SZ	1	005	326	10.5	1
4101	554511	Drmoul	1	3	721	721	TOP 09	TOP 09	TOP 09	1	721	488	15.73	1
4101	554511	Drmoul	1	4	167	167	Hnutí na podporu dobrovolných hasičů a dalších dobrovolníků	Hn.na podporu dobrovol.hasičů	HNPD	1	167	282	9.09	1
4101	554511	Drmoul	1	5	724	724	Strana Práv Občanů ZEMANOVCI	Strana Práv Občanů ZEMANOVCI	SPOZ	1	724	202	14.65	0