OKRES	KODZASTUP	NAZEVZAST	COBVODU	POR_STR_HL	OSTRANA	VSTRANA	NAZEVCELK	ZKRATKAO30	ZKRATKAO8	POCSTR_SLO	SLOZENI	HLASY_STR	PROCHLSTR	MAND_STR
8105	569097	Moravice	1	1	802	80	Lubomír Vícha, nezávislý kandidát	Lubomír Vícha, NK	NK	1	080	37	108.36	1
8105	569097	Moravice	1	2	806	80	Josef Dus, nezávislý kandidát	Josef Dus, NK	NK	1	080	48	140.58	1
8105	569097	Moravice	1	3	807	80	Miroslav Vícha, nezávislý kandidát	Miroslav Vícha, NK	NK	1	080	36	105.43	1
8105	569097	Moravice	1	4	803	80	Jiří Jašek, nezávislý kandidát	Jiří Jašek, NK	NK	1	080	33	96.65	1
8105	569097	Moravice	1	5	804	80	Josef Knob, nezávislý kandidát	Josef Knob, NK	NK	1	080	28	82	1
8105	569097	Moravice	1	6	805	80	František Rucký, nezávislý kandidát	František Rucký, NK	NK	1	080	27	79.07	1
8105	569097	Moravice	1	7	801	80	Oldřich Holý, nezávislý kandidát	Oldřich Holý, NK	NK	1	080	30	87.86	1