OKRES	KODZASTUP	NAZEVZAST	COBVODU	POR_STR_HL	OSTRANA	VSTRANA	NAZEVCELK	ZKRATKAO30	ZKRATKAO8	POCSTR_SLO	SLOZENI	HLASY_STR	PROCHLSTR	MAND_STR
6203	583910	Střelice	1	1	53	53	Občanská demokratická strana	Občanská demokratická strana	ODS	1	053	1679	9.12	1
6203	583910	Střelice	1	2	47	47	Komunistická strana Čech a Moravy	Komunistická str.Čech a Moravy	KSČM	1	047	813	4.73	0
6203	583910	Střelice	1	3	355	355	Křesťanská a demokratická unie - Československá strana lidová a nestraníci	KDU-ČSL a nestraníci		2	001,080	6784	36.88	6
6203	583910	Střelice	1	4	902	90	Sdružení občanů Střeličník	Sdružení občanů Střeličník	SNK	1	080	2836	15.42	2
6203	583910	Střelice	1	5	901	90	Sdružení nezávislých kandidátů Střelice	SNK Střelice	SNK	1	080	6278	34.13	6