OKRES	KODZASTUP	NAZEVZAST	COBVODU	POR_STR_HL	OSTRANA	VSTRANA	NAZEVCELK	ZKRATKAO30	ZKRATKAO8	POCSTR_SLO	SLOZENI	HLASY_STR	PROCHLSTR	MAND_STR
7204	585106	Bratřejov	1	1	1	1	Křesťanská a demokratická unie - Československá strana lidová	Křesť.demokr.unie-Čs.str.lid.	KDU-ČSL	1	001	1128	32	3
7204	585106	Bratřejov	1	2	47	47	Komunistická strana Čech a Moravy	Komunistická str.Čech a Moravy	KSČM	1	047	607	17.22	1
7204	585106	Bratřejov	1	3	7	7	Česká strana sociálně demokratická	Česká str.sociálně demokrat.	ČSSD	1	007	438	12.42	1
7204	585106	Bratřejov	1	4	901	90	Nezávislí	Nezávislí	Nezávisl	1	080	984	31.41	3
7204	585106	Bratřejov	1	5	181	181	Nestraníci	Nestraníci	Nestran.	1	181	367	10.41	1