OKRES	KODZASTUP	NAZEVZAST	COBVODU	POR_STR_HL	OSTRANA	VSTRANA	NAZEVCELK	ZKRATKAO30	ZKRATKAO8	POCSTR_SLO	SLOZENI	HLASY_STR	PROCHLSTR	MAND_STR
4103	560383	Chodov	1	1	40	40	Klub angažovaných nestraníků	Klub angažovaných nestraníků	KAN	1	040	4070	8.08	1
4103	560383	Chodov	1	2	716	716	Strana soukromníků České republiky	Strana soukromníků ČR	Soukromníci	1	716	1518	3.95	0
4103	560383	Chodov	1	3	1	1	Křesťanská a demokratická unie - Československá strana lidová	Křesť.demokr.unie-Čs.str.lid.	KDU-ČSL	1	001	338	2.81	0
4103	560383	Chodov	1	4	785	785	PRO Zdraví a Sport	PRO Zdraví a Sport	PRO Zdraví	1	785	4354	8.64	2
4103	560383	Chodov	1	5	7	7	Česká strana sociálně demokratická	Česká str.sociálně demokrat.	ČSSD	1	007	4005	7.95	1
4103	560383	Chodov	1	6	112	112	HNUTÍ NEZÁVISLÝCH ZA HARMONICKÝ ROZVOJ OBCÍ A MĚST	HN.ZA HARM.ROZVOJ OBCÍ A MĚST	HNHRM	1	112	36061	71.62	17