OKRES	KODZASTUP	NAZEVZAST	COBVODU	POR_STR_HL	OSTRANA	VSTRANA	NAZEVCELK	ZKRATKAO30	ZKRATKAO8	POCSTR_SLO	SLOZENI	HLASY_STR	PROCHLSTR	MAND_STR
2109	538574	Odolena Voda	1	1	449	449	Sdružení pro Odolenu Vodu, Dolínek a Čenkov	Sd.pro O.Vodu,Dolínek a Čenkov		2	080,129	6351	24.98	4
2109	538574	Odolena Voda	1	2	470	470	SPOLEČNĚ	SPOLEČNĚ		2	080,166	7404	29.12	5
2109	538574	Odolena Voda	1	3	7	7	Česká strana sociálně demokratická	Česká str.sociálně demokrat.	ČSSD	1	007	2503	9.84	1
2109	538574	Odolena Voda	1	4	389	389	ODS a nezávislí kandidáti	ODS a nezávislí kandidáti		2	053,080	4109	16.16	2
2109	538574	Odolena Voda	1	5	1301	1301	VODOLÁCI	VODOLÁCI	SPDV+NK	2	080,1041	5056	19.88	3