OKRES	KODZASTUP	NAZEVZAST	COBVODU	POR_STR_HL	OSTRANA	VSTRANA	NAZEVCELK	ZKRATKAO30	ZKRATKAO8	POCSTR_SLO	SLOZENI	HLASY_STR	PROCHLSTR	MAND_STR
5201	573531	Puchlovice	1	1	803	80	Petra Poláčková, nezávislý kandidát	Petra Poláčková, NK	NK	1	080	41	96.95	1
5201	573531	Puchlovice	1	2	804	80	Lukáš Dundr, nezávislý kandidát	Lukáš Dundr, NK	NK	1	080	37	87.5	1
5201	573531	Puchlovice	1	3	806	80	Josef Podrazil, nezávislý kandidát	Josef Podrazil, NK	NK	1	080	37	87.5	1
5201	573531	Puchlovice	1	4	807	80	Martina Holasová, nezávislý kandidát	Martina Holasová, NK	NK	1	080	43	101.68	1
5201	573531	Puchlovice	1	5	801	80	Marta Mikolandová, nezávislý kandidát	Marta Mikolandová, NK	NK	1	080	44	104.05	1
5201	573531	Puchlovice	1	6	805	80	Vladimíra Hromasová, nezávislý kandidát	Vladimíra Hromasová, NK	NK	1	080	43	101.68	1
5201	573531	Puchlovice	1	7	802	80	Josef Pavlíček, nezávislý kandidát	Josef Pavlíček, NK	NK	1	080	51	120.6	1