OKRES	KODZASTUP	NAZEVZAST	COBVODU	POR_STR_HL	OSTRANA	VSTRANA	NAZEVCELK	ZKRATKAO30	ZKRATKAO8	POCSTR_SLO	SLOZENI	HLASY_STR	PROCHLSTR	MAND_STR
2104	533831	Velim	1	1	1	1	KŘESŤANSKÁ A DEMOKRATICKÁ UNIE - ČESKOSLOVENSKÁ STRANA LIDOVÁ	KŘES.DEM.UNIE-ČESK.STR.LIDOVÁ	KDU-ČSL	1	001	1432	13.64	1
2104	533831	Velim	1	2	901	90	Velimáci	Velimáci	Velimáci	1	080	2533	24.13	3
2104	533831	Velim	1	3	53	53	Občanská demokratická strana (ODS)	Občanská dem. strana (ODS)	ODS	1	053	2213	21.08	2
2104	533831	Velim	1	4	7	7	Česká strana sociálně demokratická	Česká str.sociálně demokrat.	ČSSD	1	007	3339	31.81	4
2104	533831	Velim	1	5	47	47	Komunistická strana Čech a Moravy	Komunistická str.Čech a Moravy	KSČM	1	047	979	9.32	1