OKRES	KODZASTUP	NAZEVZAST	COBVODU	POR_STR_HL	OSTRANA	VSTRANA	NAZEVCELK	ZKRATKAO30	ZKRATKAO8	POCSTR_SLO	SLOZENI	HLASY_STR	PROCHLSTR	MAND_STR
6204	585009	Velké Němčice	1	1	905	90	Sdružení nezávislých kandidátů MĚSTYS VELKÉ NĚMČICE 2010	SNK MĚSTYS V. NĚMČICE 2010	SNK	1	080	2039	16.83	3
6204	585009	Velké Němčice	1	2	903	90	VELKÉ NĚMČICE 2010	VELKÉ NĚMČICE 2010	SNK	1	080	1589	13.11	2
6204	585009	Velké Němčice	1	3	902	90	HASIČI VELKÉ NĚMČICE	HASIČI VELKÉ NĚMČICE	SNK	1	080	868	7.16	1
6204	585009	Velké Němčice	1	4	904	90	Sdružení nezávislých kandidátů TJ Sokol Velké Němčice	SNK TJ Sokol Velké Němčice	SNK	1	080	1380	11.39	2
6204	585009	Velké Němčice	1	5	801	80	Oldřich Prokeš, nezávislý kandidát	Oldřich Prokeš, nezáv.kand.	NK	1	080	49	6.06	0
6204	585009	Velké Němčice	1	6	1	1	Křesťanská a demokratická unie - Československá strana lidová	Křesť.demokr.unie-Čs.str.lid.	KDU-ČSL	1	001	3740	30.87	5
6204	585009	Velké Němčice	1	7	906	90	Sdružení pro obec Velké Němčice - Sdružení nezávislých kandidátů	Sdruž. pro obec V.Němčice-SNK	SNK	1	080	1170	9.65	1
6204	585009	Velké Němčice	1	8	901	90	Ženy pro obec	Ženy pro obec	SNK	1	080	1278	10.55	1