OKRES	KODZASTUP	NAZEVZAST	COBVODU	POR_STR_HL	OSTRANA	VSTRANA	NAZEVCELK	ZKRATKAO30	ZKRATKAO8	POCSTR_SLO	SLOZENI	HLASY_STR	PROCHLSTR	MAND_STR
2101	531049	Zvěstov	1	1	801	80	Nezávislý kandidát Jan Štícha	Nezávislý kandidát Jan Štícha	NK	1	080			
2101	531049	Zvěstov	1	2	805	80	Nezávislý kandidát Blanka Volková	Nezáv. kandidát Blanka Volková	NK	1	080			
2101	531049	Zvěstov	1	3	802	80	Nezávislý kandidát Aleš Svatoš	Nezávislý kandidát Aleš Svatoš	NK	1	080			
2101	531049	Zvěstov	1	4	806	80	Nezávislý kandidát Karel Novotný	Nezáv. kandidát Karel Novotný	NK	1	080			
2101	531049	Zvěstov	1	5	807	80	Nezávislý kandidát Josef Daněk	Nezávislý kandidát Josef Daněk	NK	1	080			
2101	531049	Zvěstov	1	6	808	80	Nezávislý kandidát Drahomíra Beránková	Nez. kand. Drahomíra Beránková	NK	1	080			
2101	531049	Zvěstov	1	7	803	80	Nezávislý kandidát Karel Babický	Nezáv. kandidát Karel Babický	NK	1	080			
2101	531049	Zvěstov	1	8	804	80	Nezávislý kandidát Miroslav Šimon	Nezáv. kandidát Miroslav Šimon	NK	1	080			