OKRES	KODZASTUP	NAZEVZAST	COBVODU	POR_STR_HL	OSTRANA	VSTRANA	NAZEVCELK	ZKRATKAO30	ZKRATKAO8	POCSTR_SLO	SLOZENI	HLASY_STR	PROCHLSTR	MAND_STR
6206	593214	Křenovice	1	1	53	53	Občanská demokratická strana	Občanská demokratická strana	ODS	1	053	3481	35.87	4
6206	593214	Křenovice	1	2	1	1	Křesťanská a demokratická unie - Československá strana lidová	Křesť.demokr.unie-Čs.str.lid.	KDU-ČSL	1	001	1864	19.2	2
6206	593214	Křenovice	1	3	47	47	Komunistická strana Čech a Moravy	Komunistická str.Čech a Moravy	KSČM	1	047	932	9.6	1
6206	593214	Křenovice	1	4	7	7	Česká strana sociálně demokratická	Česká str.sociálně demokrat.	ČSSD	1	007	1754	18.07	2
6206	593214	Křenovice	1	5	166	166	"""STAROSTOVÉ A NEZÁVISLÍ"""	"""STAROSTOVÉ A NEZÁVISLÍ"""	"""STAN"""	1	166	1673	17.24	2