OKRES	KODZASTUP	NAZEVZAST	COBVODU	POR_STR_HL	OSTRANA	VSTRANA	NAZEVCELK	ZKRATKAO30	ZKRATKAO8	POCSTR_SLO	SLOZENI	HLASY_STR	PROCHLSTR	MAND_STR
3106	510068	Čečelovice	1	1	901	90	Za hezčí venkov	Za hezčí venkov	SNK	1	080	404	48.09	4
3106	510068	Čečelovice	1	2	902	90	Za obec Čečelovice	SNK - Za obec Čečelovice	SNK	1	080	436	51.9	5
3106	529966	Buzice	1	1	901	90	Sdružení nezávislých kandidátů : Pro rozvoj Buzic.	SNK : Pro rozvoj Buzic.	SNK	1	080	439	100	7
3106	529982	Chlum	1	1	902	90	Za ozdravění Chlumu	Za ozdravění Chlumu	SNK	1	080	452	45.79	4
3106	529982	Chlum	1	2	901	90	Sdružení nezávislých kandidátů - C.	Sdružení nez.kandidátů - C.	SNK	1	080	219	22.18	2
3106	529982	Chlum	1	3	903	90	Sdružení nezávislých kandidátů - A	Sdružení nez.kandidátů - A	SNK	1	080	316	32.01	3
3106	530018	Březí	1	1	801	80	Ing.Josef Pinta, nezávislý kandidát	Ing.Josef Pinta, NK	NK	1	080	25	60.76	0
3106	530018	Březí	1	2	804	80	Vlastimil Sloup, nezávislý kandidát	Vlastimil Sloup, NK	NK	1	080	35	85.06	1
3106	530018	Březí	1	3	808	80	Tomáš Kodat, nezávislý kandidát	Tomáš Kodat, NK	NK	1	080	32	77.77	1
3106	530018	Březí	1	4	803	80	Antonín Fiala, nezávislý kandidát	Antonín Fiala, NK	NK	1	080	12	29.16	0
3106	530018	Březí	1	5	807	80	Jaroslava Benadiková, nezávislý kandidát	Jaroslava Benadiková, NK	NK	1	080	20	48.61	0
3106	530018	Březí	1	6	802	80	Zdeněk Jeníček, nezávislý kandidát	Zdeněk Jeníček, NK	NK	1	080	24	58.33	0
3106	530018	Březí	1	7	901	90	Za Březí krásnější	Za Březí krásnější	SNK	1	080	86	41.8	3
3106	530018	Březí	1	8	806	80	Dana Malá, nezávislý kandidát	Dana Malá, NK	NK	1	080	29	70.48	1
3106	530018	Březí	1	9	805	80	Miloslav Straka, nezávislý kandidát	Miloslav Straka, NK	NK	1	080	25	60.76	1
3106	530034	Stožice	1	1	902	90	Sdružení nezávislých kandidátů II.	Sdruž.nezáv.kand. II.	SNK	1	080	402	27.53	3
3106	530034	Stožice	1	2	903	90	Sdružení nezávislých kandidátů III.	Sdruž.nezáv.kand. III.	SNK	1	080	248	16.98	1
3106	530034	Stožice	1	3	53	53	Občanská demokratická strana	Občanská demokratická strana	ODS	1	053	303	20.75	2
3106	530034	Stožice	1	4	901	90	Sdružení nezávislých kandidátů I.	Sdruž.nezáv.kand. I.	SNK	1	080	507	34.72	3
3106	536342	Krajníčko	1	1	805	80	Václav Přib	Václav Přib	NK	1	080	30	68.4	1
3106	536342	Krajníčko	1	2	801	80	Vladimír Hanžl	Vladimír Hanžl	NK	1	080	46	104.88	1
3106	536342	Krajníčko	1	3	809	80	Milan Weinar	Milan Weinar	NK	1	080	34	77.52	1
3106	536342	Krajníčko	1	4	802	80	Jaroslav Dušek	Jaroslav Dušek	NK	1	080	31	70.68	1
3106	536342	Krajníčko	1	5	806	80	Romana Píchová	Romana Píchová	NK	1	080	37	84.36	1
3106	536342	Krajníčko	1	6	804	80	Josef Pýcha	Josef Pýcha	NK	1	080	38	86.64	1
3106	536342	Krajníčko	1	7	803	80	Markéta Dušková	Markéta Dušková	NK	1	080	19	43.32	0
3106	536342	Krajníčko	1	8	807	80	Vladislav Pícha	Vladislav Pícha	NK	1	080	48	109.44	1
3106	536342	Krajníčko	1	9	808	80	Hana Krsová	Hana Krsová	NK	1	080	24	54.72	0
3106	536369	Hornosín	1	1	811	80	Hana Červenková, nezávislý kandidát	Hana Červenková, NK	NK	1	080	36	77.3	1
3106	536369	Hornosín	1	2	805	80	Jiří Vonášek, nezávislý kandidát	Jiří Vonášek, NK	NK	1	080	35	75.15	1
3106	536369	Hornosín	1	3	807	80	Václav Machovec, nezávislý kandidát	Václav Machovec, NK	NK	1	080	30	64.41	1
3106	536369	Hornosín	1	4	802	80	Lenka Ježková, nezávislý kandidát	Lenka Ježková, NK	NK	1	080	21	45.09	0
3106	536369	Hornosín	1	5	808	80	Josef Hrdina, nezávislý kandidát	Josef Hrdina, NK	NK	1	080	43	92.33	1
3106	536369	Hornosín	1	6	803	80	Anna Mašková, nezávislý kandidát	Anna Mašková, NK	NK	1	080	25	53.68	1
3106	536369	Hornosín	1	7	804	80	Ing.František Vrbský, nezávislý kandidát	Ing.František Vrbský, NK	NK	1	080	37	79.44	1
3106	536369	Hornosín	1	8	801	80	Marie Bendová, nezávislý kandidát	Marie Bendová, NK	NK	1	080	20	42.94	0
3106	536369	Hornosín	1	9	810	80	Vlastimil Ježek, nezávislý kandidát	Vlastimil Ježek, NK	NK	1	080	34	73	1
3106	536369	Hornosín	1	10	809	80	Libor Kumhera, nezávislý kandidát	Libor Kumhera, NK	NK	1	080	22	47.23	0
3106	536369	Hornosín	1	11	806	80	Zdeněk Vrbský, nezávislý kandidát	Zdeněk Vrbský, NK	NK	1	080	23	49.38	0
3106	536415	Měkynec	1	1	902	90	Sdružení nezávislých kandidátů B	Sdruž.nezáv.kand. B	SNK-CELK	1	080	32	59.25	2
3106	536415	Měkynec	1	2	901	90	Sdružení nezávislých kandidátů A	Sdruž.nezáv.kand.A	SNK	1	080	58	80.55	3
3106	536423	Radějovice	1	1	901	90	Živá prosperující obec	Živá prosperující obec	SNK	1	080	105	100	5
3106	536466	Mačkov	1	1	902	90	SNK - B	SNK - B	SNK	1	080	217	55.76	3
3106	536466	Mačkov	1	2	901	90	SNK - A	SNK - A	SNK	1	080	237	60.9	4
3106	536474	Němčice	1	1	902	90	Sdružení nezávislých kandidátů	Sdruž.nezáv.kand.	SNK	1	080	355	78.02	6
3106	536474	Němčice	1	2	901	90	SDRUŽENÍ NEZÁVISLÝCH KANDIDÁTŮ OBCE NĚMČICE	SNK OBCE NĚMČICE	SNK	1	080	100	21.97	1
3106	536482	Zahorčice	1	1	901	90	Sdružení nezávislých kandidátů	Sdruž.nezáv.kand.	SNK	1	080	121	100	5
3106	536504	Vacovice	1	1	1	1	Křesťanská a demokratická unie - Československá strana lidová	Křesť.demokr.unie-Čs.str.lid.	KDU-ČSL	1	001	81	63.98	2
3106	536504	Vacovice	1	2	901	90	OBČANÉ SOBĚ	OBČANÉ SOBĚ	SNK	1	080	130	77.01	3
3106	536512	Truskovice	1	1	721	721	TOP 09	TOP 09	TOP 09	1	721	96	19.21	1
3106	536512	Truskovice	1	2	901	90	Strana za zkrášlení obce	Strana za zkrášlení obce	SNK	1	080	487	83.53	6
3106	536539	Milejovice	1	1	1	1	Křesťanská a demokratická unie - Československá strana lidová	Křesť.demokr.unie-Čs.str.lid.	KDU-ČSL	1	001	250	100	7
3106	536547	Přechovice	1	1	901	90	SDRUŽENÍ NEZÁVISLÝCH KANDIDÁTŮ ,,A''	SDRUŽ.NEZÁV.KAND. ,,A''	SNK	1	080	264	100	7
3106	536555	Krty-Hradec	1	1	801	80	Miroslav Zemen, nezávislý kandidát	Miroslav Zemen, NK	NK	1	080	46	60.29	1
3106	536555	Krty-Hradec	1	2	802	80	Ing. Miloslav Samec, nezávislý kandidát	Ing. Miloslav Samec, NK	NK	1	080	74	97	1
3106	536555	Krty-Hradec	1	3	809	80	Pavel Drnek, nezávislý kandidát	Pavel Drnek, NK	NK	1	080	50	65.54	1
3106	536555	Krty-Hradec	1	4	807	80	Luboš Hoch, nezávislý kandidát	Luboš Hoch, NK	NK	1	080	22	28.83	0
3106	536555	Krty-Hradec	1	5	805	80	Karel Buzín, nezávislý kandidát	Karel Buzín, NK	NK	1	080	35	45.88	0
3106	536555	Krty-Hradec	1	6	810	80	Josef Matašovský, nezávislý kandidát	Josef Matašovský, NK	NK	1	080	50	65.54	1
3106	536555	Krty-Hradec	1	7	808	80	Dagmar Zelenková, nezávislý kandidát	Dagmar Zelenková, NK	NK	1	080	17	22.28	0
3106	536555	Krty-Hradec	1	8	803	80	Bohumil Melichar, nezávislý kandidát	Bohumil Melichar, NK	NK	1	080	36	47.19	0
3106	536555	Krty-Hradec	1	9	813	80	Alena Kalkušová, nezávislý kandidát	Alena Kalkušová, NK	NK	1	080	4	5.24	0
3106	536555	Krty-Hradec	1	10	812	80	Miroslav Přibyl, nezávislý kandidát	Miroslav Přibyl, NK	NK	1	080	37	48.5	1
3106	536555	Krty-Hradec	1	11	811	80	Zdeněk Matašovský, nezávislý kandidát	Zdeněk Matašovský, NK	NK	1	080	26	34.08	0
3106	536555	Krty-Hradec	1	12	804	80	Petr Taubr, nezávislý kandidát	Petr Taubr, NK	NK	1	080	36	47.19	0
3106	536555	Krty-Hradec	1	13	806	80	Karel Kohout, nezávislý kandidát	Karel Kohout, NK	NK	1	080	42	55.05	1
3106	536555	Krty-Hradec	1	14	814	80	Lenka Samcová, nezávislý kandidát	Lenka Samcová, NK	NK	1	080	59	77.34	1
3106	536563	Mnichov	1	1	808	80	Milan Pavlovič, nezávislý kandidát	Milan Pavlovič, NK	NK	1	080	121	107.18	1
3106	536563	Mnichov	1	2	811	80	Petr Samec, nezávislý kandidát	Petr Samec, NK	NK	1	080	76	67.32	1
3106	536563	Mnichov	1	3	804	80	Josef Křivanec, nezávislý kandidát	Josef Křivanec, NK	NK	1	080	98	86.81	1
3106	536563	Mnichov	1	4	805	80	Olga Jánská, nezávislý kandidát	Olga Jánská, NK	NK	1	080	108	95.66	1
3106	536563	Mnichov	1	5	806	80	Miroslav Matašovský, nezávislý kandidát	Miroslav Matašovský, NK	NK	1	080	90	79.72	1
3106	536563	Mnichov	1	6	801	80	Ing. František Kruml, MBA, nezávislý kandidát	Ing. František Kruml, MBA, NK	NK	1	080	125	110.72	1
3106	536563	Mnichov	1	7	807	80	Václav Jirsa, nezávislý kandidát	Václav Jirsa, NK	NK	1	080	32	28.34	0
3106	536563	Mnichov	1	8	809	80	Božena Kroupová, nezávislý kandidát	Božena Kroupová, NK	NK	1	080	90	79.72	1
3106	536563	Mnichov	1	9	802	80	Mgr. Miloslava Malá, nezávislý kandidát	Mgr. Miloslava Malá, NK	NK	1	080	113	100.09	1
3106	536563	Mnichov	1	10	803	80	Miroslav Milčic, nezávislý kandidát	Miroslav Milčic, NK	NK	1	080	90	79.72	1
3106	536563	Mnichov	1	11	810	80	Josef Jirsa, nezávislý kandidát	Josef Jirsa, NK	NK	1	080	73	64.66	0
3106	536598	Tchořovice	1	1	803	80	Tereza Ptáčníková, nezávislý kandidát	Tereza Ptáčníková, NK	NK	1	080	25	17.3	0
3106	536598	Tchořovice	1	2	805	80	Mgr.Eva Křivancová, nezávislý kandidát	Mgr.Eva Křivancová, NK	NK	1	080	108	74.77	1
3106	536598	Tchořovice	1	3	812	80	František Machovec, nezávislý kandidát	František Machovec, NK	NK	1	080	42	29.08	0
3106	536598	Tchořovice	1	4	817	80	RSDr.Václav Keller, nezávislý kandidát	RSDr.Václav Keller, NK	NK	1	080	34	23.54	0
3106	536598	Tchořovice	1	5	801	80	Růžena Tetauerová, nezávislý kandidát	Růžena Tetauerová, NK	NK	1	080	36	24.92	0
3106	536598	Tchořovice	1	6	815	80	Ivana Machovcová, nezávislý kandidát	Ivana Machovcová, NK	NK	1	080	98	67.85	1
3106	536598	Tchořovice	1	7	808	80	Martina Čadková, nezávislý kandidát	Martina Čadková, NK	NK	1	080	54	37.38	0
3106	536598	Tchořovice	1	8	814	80	Michael Bolina, nezávislý kandidát	Michael Bolina, NK	NK	1	080	82	56.77	1
3106	536598	Tchořovice	1	9	806	80	Jaroslav Čadek, nezávislý kandidát	Jaroslav Čadek, NK	NK	1	080	17	11.77	0
3106	536598	Tchořovice	1	10	809	80	Vlastimil Končelík, nezávislý kandidát	Vlastimil Končelík, NK	NK	1	080	70	48.46	1
3106	536598	Tchořovice	1	11	810	80	Jaroslav Čadek, nezávislý kandidát	Jaroslav Čadek, NK	NK	1	080	48	33.23	0
3106	536598	Tchořovice	1	12	811	80	Pavel Šeda, nezávislý kandidát	Pavel Šeda, NK	NK	1	080	109	75.46	1
3106	536598	Tchořovice	1	13	816	80	Miroslav Říkovský, nezávislý kandidát	Miroslav Říkovský, NK	NK	1	080	62	42.92	0
3106	536598	Tchořovice	1	14	813	80	Alena Dušková, nezávislý kandidát	Alena Dušková, NK	NK	1	080	21	14.54	0
3106	536598	Tchořovice	1	15	802	80	Josef Končelík, nezávislý kandidát	Josef Končelík, NK	NK	1	080	18	12.46	0
3106	536598	Tchořovice	1	16	804	80	Jan Křivanec, nezávislý kandidát	Jan Křivanec, NK	NK	1	080	79	54.69	1
3106	536598	Tchořovice	1	17	807	80	Miroslav Cihla, nezávislý kandidát	Miroslav Cihla, NK	NK	1	080	108	74.77	1
3106	536601	Kocelovice	1	1	802	80	Václav Barnáš, nezávislý kandidát	Václav Barnáš, NK	NK	1	080	71	72.04	1
3106	536601	Kocelovice	1	2	901	90	Sdružení za lepší obec Kocelovice	Sdr.za lepší obec Kocelovice	SNK	1	080	317	64.32	4
3106	536601	Kocelovice	1	3	803	80	Bohuslava Antonyová, nezávislý kandidát	Bohuslava Antonyová, NK	NK	1	080	70	71.02	1
3106	536601	Kocelovice	1	4	806	80	Ing.Karel Lukáš, nezávislý kandidát	Ing.Karel Lukáš, NK	NK	1	080	73	74.06	1
3106	536601	Kocelovice	1	5	804	80	Josef Vonášek, nezávislý kandidát	Josef Vonášek, NK	NK	1	080	55	55.8	0
3106	536601	Kocelovice	1	6	805	80	Štěpánka Vonášková, nezávislý kandidát	Štěpánka Vonášková, NK	NK	1	080	78	79.14	1
3106	536601	Kocelovice	1	7	807	80	Martin Lukáš, nezávislý kandidát	Martin Lukáš, NK	NK	1	080	39	39.57	0
3106	536601	Kocelovice	1	8	808	80	Václav Čadek, nezávislý kandidát	Václav Čadek, NK	NK	1	080	67	67.98	1
3106	536601	Kocelovice	1	9	801	80	Ladislav Mach, nezávislý kandidát	Ladislav Mach, NK	NK	1	080	63	63.92	0
3106	536601	Kocelovice	1	10	809	80	Václav Říský, nezávislý kandidát	Václav Říský, NK	NK	1	080	54	54.79	0
3106	536628	Hlupín	1	1	901	90	Hlupín 2012	Hlupín 2012	SNK	1	080	204	100	5
3106	536644	Nebřehovice	1	1	902	90	Nebřehovice 2.	Nebřehovice 2.	SNK	1	080	248	68.43	3
3106	536644	Nebřehovice	1	2	901	90	Nebřehovice 1.	Nebřehovice 1.	SNK	1	080	205	45.25	2
3106	536679	Třešovice	1	1	812	80	Jana Šedivá, nezávislý kandidát	Jana Šedivá, NK	NK	1	080	16	28.28	0
3106	536679	Třešovice	1	2	807	80	Jana Marková, nezávislý kandidát	Jana Marková, NK	NK	1	080	11	19.44	0
3106	536679	Třešovice	1	3	808	80	Olga Turková, nezávislý kandidát	Olga Turková, NK	NK	1	080	23	40.65	0
3106	536679	Třešovice	1	4	801	80	Marie Sklenářová, nezávislý kandidát	Marie Sklenářová, NK	NK	1	080	54	95.45	1
3106	536679	Třešovice	1	5	804	80	Věra Hynková, nezávislý kandidát	Věra Hynková, NK	NK	1	080	17	30.05	0
3106	536679	Třešovice	1	6	803	80	Vladimír Soukup, nezávislý kandidát	Vladimír Soukup, NK	NK	1	080	37	65.4	1
3106	536679	Třešovice	1	7	809	80	Vladimír Turek, nezávislý kandidát	Vladimír Turek, NK	NK	1	080	42	74.24	1
3106	536679	Třešovice	1	8	811	80	Libor Průcha, nezávislý kandidát	Libor Průcha, NK	NK	1	080	25	44.19	0
3106	536679	Třešovice	1	9	805	80	František Hynek, nezávislý kandidát	František Hynek, NK	NK	1	080	10	17.67	0
3106	536679	Třešovice	1	10	813	80	Václav Turek, nezávislý kandidát	Václav Turek, NK	NK	1	080	25	44.19	1
3106	536679	Třešovice	1	11	806	80	Jana Vohryzková, nezávislý kandidát	Jana Vohryzková, NK	NK	1	080	36	63.63	1
3106	536679	Třešovice	1	12	810	80	Hana Havlasová, nezávislý kandidát	Hana Havlasová, NK	NK	1	080	25	44.19	0
3106	536679	Třešovice	1	13	802	80	Petr Čejka, nezávislý kandidát	Petr Čejka, NK	NK	1	080	27	47.72	1
3106	536679	Třešovice	1	14	814	80	Josef Kloud, nezávislý kandidát	Josef Kloud, NK	NK	1	080	48	84.84	1
3106	536695	Úlehle	1	1	901	90	SDRUŽENÍ NEZÁVISLÝCH KANDIDÁTŮ	Sdruž.nezáv.kand.	SNK	1	080	477	100	7
3106	536725	Němětice	1	1	902	90	NEZÁVISLÍ KANDIDÁTI	NEZÁVISLÍ KANDIDÁTI	SNK	1	080	137	42.15	2
3106	536725	Němětice	1	2	901	90	NEZÁVISLÍ NĚMĚTICE	NEZÁVISLÍ NĚMĚTICE	SNK	1	080	188	72.3	3
3106	536741	Velká Turná	1	1	901	90	Pro rozvoj obce Velká Turná	Pro rozvoj obce Velká Turná	SNK	1	080	367	100	5
3106	536750	Kváskovice	1	1	801	80	Zdeněk Tesař, nezávislý kandidát	Zdeněk Tesař, NK	NK	1	080	47	94.54	1
3106	536750	Kváskovice	1	2	806	80	Stanislav Hranička, nezávislý kandidát	Stanislav Hranička, NK	NK	1	080	31	62.35	0
3106	536750	Kváskovice	1	3	807	80	Václav Hejdánek, nezávislý kandidát	Václav Hejdánek, NK	NK	1	080	32	64.36	1
3106	536750	Kváskovice	1	4	803	80	Jana Květoňová, nezávislý kandidát	Jana Květoňová, NK	NK	1	080	37	74.42	1
3106	536750	Kváskovice	1	5	805	80	Ing. Jan Chyla, nezávislý kandidát	Ing. Jan Chyla, NK	NK	1	080	44	88.5	1
3106	536750	Kváskovice	1	6	809	80	Jakub Havlík, nezávislý kandidát	Jakub Havlík, NK	NK	1	080	22	44.25	0
3106	536750	Kváskovice	1	7	804	80	Ing. Petr Chyla, nezávislý kandidát	Ing. Petr Chyla, NK	NK	1	080	49	98.56	1
3106	536750	Kváskovice	1	8	808	80	Lenka Zochová, nezávislý kandidát	Lenka Zochová, NK	NK	1	080	35	70.4	1
3106	536750	Kváskovice	1	9	802	80	Josef Zoch, nezávislý kandidát	Josef Zoch, NK	NK	1	080	51	102.58	1
3106	536776	Slaník	1	1	901	90	Sdružení nezávislých kandidátů	Sdruž.nezáv.kand.	SNK	1	080	431	100	9
3106	536784	Strunkovice nad Volyňkou	1	1	803	80	Ing. Luděk Saxl, nezávislý kandidát	Ing. Luděk Saxl, NK	NK	1	080	45	68.47	1
3106	536784	Strunkovice nad Volyňkou	1	2	804	80	Miloslav Houska, nezávislý kandidát	Miloslav Houska, NK	NK	1	080	45	68.47	1
3106	536784	Strunkovice nad Volyňkou	1	3	809	80	Jana Tíková, nezávislý kandidát	Jana Tíková, NK	NK	1	080	49	74.56	1
3106	536784	Strunkovice nad Volyňkou	1	4	806	80	Ivo Nosek, nezávislý kandidát	Ivo Nosek, NK	NK	1	080	58	88.26	1
3106	536784	Strunkovice nad Volyňkou	1	5	807	80	Blanka Menčíková, nezávislý kandidát	Blanka Menčíková, NK	NK	1	080	41	62.39	1
3106	536784	Strunkovice nad Volyňkou	1	6	801	80	Vlasta Mesiariková, nezávislý kandidát	Vlasta Mesiariková, NK	NK	1	080	48	73.04	1
3106	536784	Strunkovice nad Volyňkou	1	7	802	80	Mgr. Zdeněk Filip, nezávislý kandidát	Mgr. Zdeněk Filip, NK	NK	1	080	61	92.82	1
3106	536784	Strunkovice nad Volyňkou	1	8	805	80	Ing. Josef Růžička, nezávislý kandidát	Ing. Josef Růžička, NK	NK	1	080	32	48.69	0
3106	536784	Strunkovice nad Volyňkou	1	9	808	80	Jiří Starec, nezávislý kandidát	Jiří Starec, NK	NK	1	080	31	47.17	0
3106	536784	Strunkovice nad Volyňkou	1	10	810	80	Jiří Benedikt, nezávislý kandidát	Jiří Benedikt, NK	NK	1	080	25	38.04	0
3106	536784	Strunkovice nad Volyňkou	1	11	53	53	Občanská demokratická strana	Občanská demokratická strana	ODS	1	053	25	38.04	0
3106	536792	Přední Zborovice	1	1	805	80	Karel Houska, nezávislý kandidát	Karel Houska, NK	NK	1	080	24	50.63	0
3106	536792	Přední Zborovice	1	2	803	80	Josef Kubovec, nezávislý kandidát	Josef Kubovec, NK	NK	1	080	45	94.93	1
3106	536792	Přední Zborovice	1	3	807	80	Karel Kubeš, nezávislý kandidát	Karel Kubeš, NK	NK	1	080	39	82.27	1
3106	536792	Přední Zborovice	1	4	808	80	Karel Pešek, nezávislý kandidát	Karel Pešek, NK	NK	1	080	12	25.31	0
3106	536792	Přední Zborovice	1	5	804	80	Ing. Jana Švecová, nezávislý kandidát	Ing. Jana Švecová, NK	NK	1	080	38	80.16	1
3106	536792	Přední Zborovice	1	6	802	80	Blanka Lomová, nezávislý kandidát	Blanka Lomová, NK	NK	1	080	20	42.19	0
3106	536792	Přední Zborovice	1	7	801	80	JUDr. Július Lovás, nezávislý kandidát	JUDr. Július Lovás, NK	NK	1	080	31	65.4	1
3106	536792	Přední Zborovice	1	8	806	80	Václav Strnad, nezávislý kandidát	Václav Strnad, NK	NK	1	080	28	59.07	1
3106	536806	Krašlovice	1	1	801	80	Jiří Kub	Jiří Kub	NK	1	080	40	66.82	0
3106	536806	Krašlovice	1	2	1	1	Křesťanská a demokratická unie - Československá strana lidová	Křesť.demokr.unie-Čs.str.lid.	KDU-ČSL	1	001	379	90.45	7
3106	536822	Lom	1	1	811	80	Václav Kafka, nezávislý kandidát	Václav Kafka, NK	NK	1	080	60	97.44	1
3106	536822	Lom	1	2	804	80	Jaroslava Brožová, nezávislý kandidát	Jaroslava Brožová, NK	NK	1	080	41	66.58	1
3106	536822	Lom	1	3	803	80	Jiří Himl, nezávislý kandidát	Jiří Himl, NK	NK	1	080	47	76.33	1
3106	536822	Lom	1	4	807	80	Jiří Mlíčko, nezávislý kandidát	Jiří Mlíčko, NK	NK	1	080	43	69.83	1
3106	536822	Lom	1	5	806	80	František Svojše, nezávislý kandidát	František Svojše, NK	NK	1	080	40	64.96	1
3106	536822	Lom	1	6	810	80	František Mařík, nezávislý kandidát	František Mařík, NK	NK	1	080	48	77.95	1
3106	536822	Lom	1	7	808	80	Miroslava Němcová, nezávislý kandidát	Miroslava Němcová, NK	NK	1	080	13	21.11	0
3106	536822	Lom	1	8	805	80	Milan Batysta, nezávislý kandidát	Milan Batysta, NK	NK	1	080	54	87.7	1
3106	536822	Lom	1	9	802	80	Jiří Suchý, nezávislý kandidát	Jiří Suchý, NK	NK	1	080	21	34.1	0
3106	536822	Lom	1	10	809	80	Jaroslav Batysta, nezávislý kandidát	Jaroslav Batysta, NK	NK	1	080	35	56.84	0
3106	536822	Lom	1	11	801	80	Eva Chramostová, nezávislý kandidát	Eva Chramostová, NK	NK	1	080	29	47.09	0
3106	536831	Libětice	1	1	901	90	Sdružení nezávislých kandidátů	Sdruž.nezáv.kand.	SNK	1	080	290	100	7
3106	536849	Řepice	1	1	801	80	Věra Mráčková, nezávislý kandidát	Věra Mráčková, NK	NK	1	080	139	91.36	1
3106	536849	Řepice	1	2	802	80	Věra Samcová, nezávislý kandidát	Věra Samcová, NK	NK	1	080	124	81.5	1
3106	536849	Řepice	1	3	808	80	Karel Krejčí, nezávislý kandidát	Karel Krejčí, NK	NK	1	080	153	100.56	1
3106	536849	Řepice	1	4	807	80	Martina Mrázová, nezávislý kandidát	Martina Mrázová, NK	NK	1	080	140	92.01	1
3106	536849	Řepice	1	5	809	80	Ing. Martin Vysoký, nezávislý kandidát	Ing. Martin Vysoký, NK	NK	1	080	133	87.41	1
3106	536849	Řepice	1	6	806	80	Pavel Samec, nezávislý kandidát	Pavel Samec, NK	NK	1	080	145	95.3	1
3106	536849	Řepice	1	7	803	80	Tomáš Holý, DiS., nezávislý kandidát	Tomáš Holý, Dis.,NK	NK	1	080	61	40.09	0
3106	536849	Řepice	1	8	804	80	Václav Bláha, nezávislý kandidát	Václav Bláha, NK	NK	1	080	56	36.8	0
3106	536849	Řepice	1	9	805	80	Ing. Miloslav Tomášek, nezávislý kandidát	Ing. Miloslav Tomášek, NK	NK	1	080	114	74.92	1
3106	536865	Rovná	1	1	901	90	Nezávislí kandidáti	Nezávislí kandidáti	SNK	1	080	705	57.64	6
3106	536865	Rovná	1	2	53	53	Občanská demokratická strana	Občanská demokratická strana	ODS	1	053	350	42.92	2
3106	536865	Rovná	1	3	47	47	Komunistická strana Čech a Moravy	Komunistická str.Čech a Moravy	KSČM	1	047	168	20.6	1
3106	536873	Zvotoky	1	1	901	90	SNK Zvotoky	SNK Zvotoky	SNK	1	080	209	100	5
3106	536881	Horní Poříčí	1	1	901	90	Sdružení nezávislých kandidátů - I	Sdruž.nezáv.kand. - I	SNK	1	080	1146	100	7
3106	536890	Uzeničky	1	1	901	90	Demokracie názoru	Demokracie názoru	SNK	1	080	312	100	7
3106	536903	Chobot	1	1	901	90	Sdružení nezávislých kandidátů	Sdružení nezávislých kandidátů	SNK	1	080	215	100	7
3106	536911	Pohorovice	1	1	901	90	Sdružení nezávislých kandidátů	Sdruž.nezáv.kand.	SNK	1	080	255	100	7
3106	536920	Štěchovice	1	1	902	90	Štěchovice 1	Štěchovice 1	SNK	1	080	405	50.43	4
3106	536920	Štěchovice	1	2	901	90	Štěchovice 2	Štěchovice 2	SNK	1	080	398	49.56	3
3106	536946	Kalenice	1	1	902	90	Tradice a obnova Kalenic	Tradice a obnova Kalenic	SNK	1	080	146	28.4	2
3106	536946	Kalenice	1	2	901	90	KALENICE 2010	KALENICE 2010	SNK	1	080	368	71.59	5
3106	536954	Krejnice	1	1	901	90	Sdružení nezávislých kandidátů	Sdruž.nezáv.kand.	SNK	1	080	201	59.82	4
3106	536954	Krejnice	1	2	1	1	Křesťanská a demokratická unie - Československá strana lidová	Křesť.demokr.unie-Čs.str.lid.	KDU-ČSL	1	001	135	40.17	3
3106	536962	Nišovice	1	1	903	90	Sdružení nezávislých kandidátů číslo dva	Sdruž.nezáv.kand. číslo dva	SNK	1	080	339	40.64	3
3106	536962	Nišovice	1	2	901	90	SDRUŽENÍ NEZÁVISLÝCH KANDIDÁTŮ ČÍSLO TŘI	SDRUŽ.NEZÁV.KAND. ČÍSLO TŘI	SNK	1	080	236	39.61	2
3106	536962	Nišovice	1	3	902	90	Sdružení nezávislých kandidátů číslo jedna	Sdruž.nezáv.kand. číslo jedna	SNK	1	080	259	36.23	2
3106	537063	Bratronice	1	1	901	90	Rozvoj obce	Rozvoj obce	SNK	1	080	160	100	5
3106	550787	Strakonice	1	1	113	113	Volba pro město	Volba pro město	VPM	1	113	11759	8.06	2
3106	550787	Strakonice	1	2	742	742	Strakonická Veřejnost	Strakonická Veřejnost	SV	1	742	10998	7.53	2
3106	550787	Strakonice	1	3	1	1	Křesťanská a demokratická unie - Československá strana lidová	Křesť.demokr.unie-Čs.str.lid.	KDU-ČSL	1	001	4771	3.27	0
3106	550787	Strakonice	1	4	53	53	Občanská demokratická strana	Občanská demokratická strana	ODS	1	053	18449	12.64	3
3106	550787	Strakonice	1	5	721	721	TOP 09	TOP 09	TOP 09	1	721	19098	13.09	3
3106	550787	Strakonice	1	6	178	178	4 VIZE - www.4vize.cz	4 vize - www.4vize.cz	4 VIZE	1	178	3192	2.7	0
3106	550787	Strakonice	1	7	7	7	Česká strana sociálně demokratická	Česká str.sociálně demokrat.	ČSSD	1	007	24106	16.52	4
3106	550787	Strakonice	1	8	47	47	Komunistická strana Čech a Moravy	Komunistická str.Čech a Moravy	KSČM	1	047	14892	10.2	2
3106	550787	Strakonice	1	9	88	88	NEZÁVISLÍ	NEZÁVISLÍ	NEZ	1	088	3876	2.65	0
3106	550787	Strakonice	1	10	5	5	Strana zelených	Strana zelených	SZ	1	005	473	1.7	0
3106	550787	Strakonice	1	11	137	137	Suverenita - blok Jany Bobošíkové, strana zdravého rozumu	Suverenita-blok J.Bobošíkové	Suveren.	1	137	5090	3.48	0
3106	550787	Strakonice	1	12	901	90	Slušnost a jistoty pro Strakonice	Slušnost a jist.pro Strakonice	SNK	1	080	29176	20	5
3106	550809	Bavorov	1	1	47	47	Komunistická strana Čech a Moravy	Komunistická str.Čech a Moravy	KSČM	1	047	2326	27.53	4
3106	550809	Bavorov	1	2	101	101	Strana venkova - spojené občanské síly	Str.venkova-spoj.občan.síly	SV SOS	1	101	1484	17.56	2
3106	550809	Bavorov	1	3	7	7	Česká strana sociálně demokratická	Česká str.sociálně demokrat.	ČSSD	1	007	1982	23.46	4
3106	550809	Bavorov	1	4	53	53	Občanská demokratická strana	Občanská demokratická strana	ODS	1	053	1613	19.09	3
3106	550809	Bavorov	1	5	129	129	SNK Evropští demokraté	SNK Evropští demokraté	SNK ED	1	129	1043	12.34	2
3106	550817	Bělčice	1	1	902	90	Sdružení nezávislých kandidátů 2010	Sdružení nez.kandidátů 2010	SNK	1	080	1092	22.23	2
3106	550817	Bělčice	1	2	47	47	Komunistická strana Čech a Moravy	Komunistická str.Čech a Moravy	KSČM	1	047	1274	25.93	3
3106	550817	Bělčice	1	3	901	90	Sdružení nezávislých kandidátů Bělčicka.	Sdružení nezáv.kand.Bělčicka.	SNK	1	080	2546	51.83	6
3106	550833	Bílsko	1	1	902	90	Sdružení nezávislých kandidátů II.	Sdruž.nezáv.kand.II.	SNK	1	080	243	72.1	4
3106	550833	Bílsko	1	2	901	90	Sdružení nezávislých kandidátů I.	Sdruž.nezáv.kand. I.	SNK	1	080	94	34.86	1
3106	550850	Blatná	1	1	53	53	Občanská demokratická strana	Občanská demokratická strana	ODS	1	053	4926	15.03	3
3106	550850	Blatná	1	2	721	721	TOP 09	TOP 09	TOP 09	1	721	568	8.66	0
3106	550850	Blatná	1	3	7	7	Česká strana sociálně demokratická	Česká str.sociálně demokrat.	ČSSD	1	007	5462	16.67	3
3106	550850	Blatná	1	4	129	129	SNK Evropští demokraté	SNK Evropští demokraté	SNK ED	1	129	4761	14.53	2
3106	550850	Blatná	1	5	163	163	Nezávislá volba	Nezávislá volba	NV	1	163	2886	8.8	1
3106	550850	Blatná	1	6	902	90	Sdružení hasičů pro město Blatná	Sdruž. hasičů pro město Blatná	SNK	1	080	2265	6.91	1
3106	550850	Blatná	1	7	901	90	"""Ženy nejen dětem"""	"""Ženy nejen dětem"""	SNK	1	080	3000	9.15	1
3106	550850	Blatná	1	8	47	47	Komunistická strana Čech a Moravy	Komunistická str.Čech a Moravy	KSČM	1	047	3264	9.96	1
3106	550850	Blatná	1	9	113	113	Volba pro město	Volba pro město	VPM	1	113	5628	17.17	3
3106	550906	Cehnice	1	1	901	90	Sdružení nezávislých kandidátů za obec Cehnice	Sdruž.nezáv.kand.	SNK	1	080	1198	100	7
3106	550922	Čejetice	1	1	905	90	Sdružení nezávislých kandidátů Čejetice - Sudoměř	SNK Čejetice - Sudoměř	SNK	1	080	400	10.4	1
