OKRES	KODZASTUP	NAZEVZAST	COBVODU	POR_STR_HL	OSTRANA	VSTRANA	NAZEVCELK	ZKRATKAO30	ZKRATKAO8	POCSTR_SLO	SLOZENI	HLASY_STR	PROCHLSTR	MAND_STR
8104	599921	Studénka	1	1	1	1	Křesťanská a demokratická unie - Československá strana lidová	Křesť.demokr.unie-Čs.str.lid.	KDU-ČSL	1	001	7181	12.2	2
8104	599921	Studénka	1	2	721	721	TOP 09	TOP 09	TOP 09	1	721	5012	9.93	2
8104	599921	Studénka	1	3	47	47	Komunistická strana Čech a Moravy	Komunistická str.Čech a Moravy	KSČM	1	047	11366	19.32	4
8104	599921	Studénka	1	4	7	7	Česká strana sociálně demokratická	Česká str.sociálně demokrat.	ČSSD	1	007	6982	11.86	2
8104	599921	Studénka	1	5	901	90	DVACET JEDNA PRO STUDÉNKU	DVACET JEDNA PRO STUDÉNKU	SNK	1	080	14370	24.42	6
8104	599921	Studénka	1	6	902	90	Studeňáci pro Studénku	Studeňáci pro Studénku	SNK	1	080	13918	23.65	5