OKRES	KODZASTUP	NAZEVZAST	COBVODU	POR_STR_HL	OSTRANA	VSTRANA	NAZEVCELK	ZKRATKAO30	ZKRATKAO8	POCSTR_SLO	SLOZENI	HLASY_STR	PROCHLSTR	MAND_STR
7101	541249	Vápenná	1	1	7	7	Česká strana sociálně demokratická	Česká str.sociálně demokrat.	ČSSD	1	007	641	8.24	1
7101	541249	Vápenná	1	2	904	90	Nová volba pro Vápennou	Nová volba pro Vápennou	SNK	1	080	704	9.05	1
7101	541249	Vápenná	1	3	47	47	Komunistická strana Čech a Moravy	Komunistická str.Čech a Moravy	KSČM	1	047	580	12.42	1
7101	541249	Vápenná	1	4	1	1	Křesťanská a demokratická unie - Československá strana lidová	Křesť.demokr.unie-Čs.str.lid.	KDU-ČSL	1	001	343	4.4	0
7101	541249	Vápenná	1	5	721	721	TOP 09	TOP 09	TOP 09	1	721	2068	26.58	5
7101	541249	Vápenná	1	6	901	90	Nezávislí pro obec a volnočasové aktivity	Nezávislí pro obec a volnočas	SNK	1	080	1079	13.87	2
7101	541249	Vápenná	1	7	902	90	Sdružení nezávislých kandidátů - Vápenná 2010	SNK - Vápenná 2010	SNK	1	080	1221	15.69	3
7101	541249	Vápenná	1	8	903	90	Společně za zelenější a bezpečnější Vápennou	Spol. za zel. a bezp. Vápennou	SNK	1	080	253	3.25	0
7101	541249	Vápenná	1	9	166	166	"""STAROSTOVÉ A NEZÁVISLÍ"""	"""STAROSTOVÉ A NEZÁVISLÍ"""	"""STAN"""	1	166	890	11.44	2