OKRES	KODZASTUP	NAZEVZAST	COBVODU	POR_STR_HL	OSTRANA	VSTRANA	NAZEVCELK	ZKRATKAO30	ZKRATKAO8	POCSTR_SLO	SLOZENI	HLASY_STR	PROCHLSTR	MAND_STR
3201	553425	Domažlice	1	1	482	482	DOMAŽLICE A OKOLÍ o.s., ZMĚNA PRO DOMAŽLICE - sdružení DSZ a NK	DOMAŽLICE A OKOLÍ o.s.		2	080,715	2275	3.11	0
3201	553425	Domažlice	1	2	768	768	ANO 2011	ANO 2011	ANO	1	768	9834	13.45	3
3201	553425	Domažlice	1	3	53	53	Občanská demokratická strana	Občanská demokratická strana	ODS	1	053	8737	11.95	3
3201	553425	Domažlice	1	4	470	470	SDRUŽENÍ PRO MĚSTO DOMAŽLICE	SDRUŽENÍ PRO MĚSTO DOMAŽLICE		2	080,166	16751	22.92	5
3201	553425	Domažlice	1	5	7	7	Česká strana sociálně demokratická	Česká str.sociálně demokrat.	ČSSD	1	007	5970	8.16	2
3201	553425	Domažlice	1	6	47	47	Komunistická strana Čech a Moravy	Komunistická str.Čech a Moravy	KSČM	1	047	6851	9.37	2
3201	553425	Domažlice	1	7	1	1	Křesťanská a demokratická unie - Československá strana lidová	Křesť.demokr.unie-Čs.str.lid.	KDU-ČSL	1	001	7731	10.57	2
3201	553425	Domažlice	1	8	1114	1114	Svoboda a přímá demokracie - Tomio Okamura (SPD)	Svob.a př.dem.-T.Okamura (SPD)	SPD	1	1114	3222	4.4	0
3201	553425	Domažlice	1	9	720	720	Česká pirátská strana	Česká pirátská strana	Piráti	1	720	11705	16.01	4