OKRES	KODZASTUP	NAZEVZAST	COBVODU	POR_STR_HL	OSTRANA	VSTRANA	NAZEVCELK	ZKRATKAO30	ZKRATKAO8	POCSTR_SLO	SLOZENI	HLASY_STR	PROCHLSTR	MAND_STR
6102	587265	Jersín	1	1	805	80	Marie Kujínková, nezávislý kandidát	Marie Kujínková, NK	NK	1	080	47	44.33	0
6102	587265	Jersín	1	2	801	80	Luboš Štěpnička, nezávislý kandidát	Luboš Štěpnička, NK	NK	1	080	98	92.45	1
6102	587265	Jersín	1	3	806	80	František Novotný, nezávislý kandidát	František Novotný, NK	NK	1	080	28	26.41	0
6102	587265	Jersín	1	4	802	80	Luboš Čížek, nezávislý kandidát	Luboš Čížek, NK	NK	1	080	80	75.47	1
6102	587265	Jersín	1	5	803	80	Roman Jurek, nezávislý kandidát	Roman Jurek, NK	NK	1	080	35	33.01	0
6102	587265	Jersín	1	6	808	80	Dagmar Kytnarová, nezávislý kandidát	Dagmar Kytnarová, NK	NK	1	080	67	63.2	1
6102	587265	Jersín	1	7	804	80	Jindřich Solař, nezávislý kandidát	Jindřich Solař, NK	NK	1	080	53	50	1
6102	587265	Jersín	1	8	809	80	Jitka Kultánová, nezávislý kandidát	Jitka Kultánová, NK	NK	1	080	89	83.96	1
6102	587265	Jersín	1	9	807	80	Josef Jurek, nezávislý kandidát	Josef Jurek, NK	NK	1	080	33	31.13	0