OKRES	KODZASTUP	NAZEVZAST	COBVODU	POR_STR_HL	OSTRANA	VSTRANA	NAZEVCELK	ZKRATKAO30	ZKRATKAO8	POCSTR_SLO	SLOZENI	HLASY_STR	PROCHLSTR	MAND_STR
6103	561100	Lidmaň	1	1	802	80	Petr Jonák, nezávislý kandidát	Petr Jonák, NK	NK	1	080	94	108.04	1
6103	561100	Lidmaň	1	2	804	80	Jiří Zourek, nezávislý kandidát	Jiří Zourek, NK	NK	1	080	103	118.39	1
6103	561100	Lidmaň	1	3	806	80	Jaroslav Máca, nezávislý kandidát	Jaroslav Máca, NK	NK	1	080	77	88.5	1
6103	561100	Lidmaň	1	4	805	80	Josef Janů, nezávislý kandidát	Josef Janů, NK	NK	1	080	29	33.33	0
6103	561100	Lidmaň	1	5	807	80	Jiří Markvart, nezávislý kandidát	Jiří Markvart, NK	NK	1	080	88	101.14	1
6103	561100	Lidmaň	1	6	803	80	Karel Satrapa, nezávislý kandidát	Karel Satrapa, NK	NK	1	080	70	80.45	1
6103	561100	Lidmaň	1	7	808	80	Adolf Michek, nezávislý kandidát	Adolf Michek, NK	NK	1	080	69	79.31	1
6103	561100	Lidmaň	1	8	801	80	Jiří Chvála, nezávislý kandidát	Jiří Chvála, NK	NK	1	080	79	90.8	1