OKRES	KODZASTUP	NAZEVZAST	COBVODU	POR_STR_HL	OSTRANA	VSTRANA	NAZEVCELK	ZKRATKAO30	ZKRATKAO8	POCSTR_SLO	SLOZENI	HLASY_STR	PROCHLSTR	MAND_STR
7105	535532	Hanušovice	1	1	1	1	Křesťanská a demokratická unie - Československá strana lidová	Křesť.demokr.unie-Čs.str.lid.	KDU-ČSL	1	001	1349	13.5	1
7105	535532	Hanušovice	1	2	461	461	NEZÁVISLÁ VOLBA	NEZÁVISLÁ VOLBA		2	080,163	3756	27.57	4
7105	535532	Hanušovice	1	3	901	90	Hanušovičtí nezávislí	Hanušovičtí nezávislí	SNK	1	080	4219	30.96	5
7105	535532	Hanušovice	1	4	47	47	Komunistická strana Čech a Moravy	Komunistická str.Čech a Moravy	KSČM	1	047	1759	12.91	2
7105	535532	Hanušovice	1	5	7	7	Česká strana sociálně demokratická	Česká str.sociálně demokrat.	ČSSD	1	007	2540	18.64	3