OKRES	KODZASTUP	NAZEVZAST	COBVODU	POR_STR_HL	OSTRANA	VSTRANA	NAZEVCELK	ZKRATKAO30	ZKRATKAO8	POCSTR_SLO	SLOZENI	HLASY_STR	PROCHLSTR	MAND_STR
7102	540005	Lipinka	1	1	805	80	Lukáš Hübner, nezávislý kandidát	Lukáš Hübner, NK	NK	1	080	6	6.62	0
7102	540005	Lipinka	1	2	808	80	Ondřej Kreisel, nezávislý kandidát	Ondřej Kreisel, NK	NK	1	080	69	76.15	1
7102	540005	Lipinka	1	3	804	80	Radim Kauer, nezávislý kandidát	Radim Kauer, NK	NK	1	080	85	93.81	1
7102	540005	Lipinka	1	4	803	80	Mgr. Lenka Králová, nezávislý kandidát	Mgr. Lenka Králová, NK	NK	1	080	90	99.33	1
7102	540005	Lipinka	1	5	806	80	Mgr. Zdeňka Černá, nezávislý kandidát	Mgr. Zdeňka Černá, NK	NK	1	080	55	60.7	1
7102	540005	Lipinka	1	6	802	80	Pavel Procházka, nezávislý kandidát	Pavel Procházka, NK	NK	1	080	85	93.81	1
7102	540005	Lipinka	1	7	801	80	Jarmila Taláčková, nezávislý kandidát	Jarmila Taláčková, NK	NK	1	080	49	54.08	0
7102	540005	Lipinka	1	8	807	80	Miroslav Heža, nezávislý kandidát	Miroslav Heža, NK	NK	1	080	14	15.45	0