OKRES	KODZASTUP	NAZEVZAST	COBVODU	POR_STR_HL	OSTRANA	VSTRANA	NAZEVCELK	ZKRATKAO30	ZKRATKAO8	POCSTR_SLO	SLOZENI	HLASY_STR	PROCHLSTR	MAND_STR
5103	546631	Bílý Potok	1	1	901	90	Za spokojenější Bílý Potok	Za spokojenější Bílý Potok	SNK	1	080	616	22.34	2
5103	546631	Bílý Potok	1	2	475	475	Společně pro obec	Společně pro obec		2	080,703	791	28.69	3
5103	546631	Bílý Potok	1	3	902	90	Sdružení hasičů a občanů obce Bílý Potok	Sdružení hasičů a občanů B.P.	SNK	1	080	401	14.54	1
5103	546631	Bílý Potok	1	4	903	90	Sportovní klub Bílý Potok	Sportovní klub Bílý Potok	SNK	1	080	445	16.14	1
5103	546631	Bílý Potok	1	5	904	90	SNK - PRO ROZVOJ OBCE BÍLÝ POTOK	SNK-PRO ROZVOJ OBCE BÍLÝ POTOK	SNK	1	080	504	18.28	2