OKRES	KODZASTUP	NAZEVZAST	COBVODU	POR_STR_HL	OSTRANA	VSTRANA	NAZEVCELK	ZKRATKAO30	ZKRATKAO8	POCSTR_SLO	SLOZENI	HLASY_STR	PROCHLSTR	MAND_STR
6103	561819	Mysletín	1	1	802	80	Václav Krupka, nezávislý kandidát	Václav Krupka, NK	NK	1	080	34	70.83	0
6103	561819	Mysletín	1	2	806	80	Jaroslava Krejčová, nezávislý kandidát	Jaroslava Krejčová, NK	NK	1	080	38	79.16	1
6103	561819	Mysletín	1	3	804	80	Libor Kváš, nezávislý kandidát	Libor Kváš, NK	NK	1	080	43	89.58	1
6103	561819	Mysletín	1	4	805	80	Jindřich Kotlík, nezávislý kandidát	Jindřich Kotlík, NK	NK	1	080	51	106.25	1
6103	561819	Mysletín	1	5	807	80	Jaromír Vítek, nezávislý kandidát	Jaromír Vítek, NK	NK	1	080	35	72.91	1
6103	561819	Mysletín	1	6	808	80	Vratislav Koten, nezávislý kandidát	Vratislav Koten, NK	NK	1	080	43	89.58	1
6103	561819	Mysletín	1	7	801	80	Věra Trnková, nezávislý kandidát	Věra Trnková, NK	NK	1	080	45	93.75	1
6103	561819	Mysletín	1	8	803	80	Radka Slavíková, nezávislý kandidát	Radka Slavíková, NK	NK	1	080	47	97.91	1