OKRES	KODZASTUP	NAZEVZAST	COBVODU	POR_STR_HL	OSTRANA	VSTRANA	NAZEVCELK	ZKRATKAO30	ZKRATKAO8	POCSTR_SLO	SLOZENI	HLASY_STR	PROCHLSTR	MAND_STR
3101	544809	Ločenice	1	1	903	90	Sdružení nezávislých kandidátů obcí Ločenice a Nesměň	SNK obcí Ločenice a Nesměň	SNK	1	080	309	10.46	1
3101	544809	Ločenice	1	2	902	90	Sdružení nezávislých kandidátů	Sdruž.nezáv.kand.	SNK	1	080	734	24.84	2
3101	544809	Ločenice	1	3	905	90	Sdružení nezávislých kandidátů obce Nesměň č.2	SNK obce Nesměň č.2	SNK	1	080	316	10.69	1
3101	544809	Ločenice	1	4	904	90	Sdružení nezávislých kandidátů obce Nesměň č.1	SNK obce Nesměň č.1	SNK	1	080	422	14.28	1
3101	544809	Ločenice	1	5	901	90	Sdružení nezávislých kandidátů Obce Ločenice	SNK Obce Ločenice	SNK	1	080	1173	39.7	4