OKRES	KODZASTUP	NAZEVZAST	COBVODU	POR_STR_HL	OSTRANA	VSTRANA	NAZEVCELK	ZKRATKAO30	ZKRATKAO8	POCSTR_SLO	SLOZENI	HLASY_STR	PROCHLSTR	MAND_STR
3201	553913	Meclov	1	1	53	53	Občanská demokratická strana	Občanská demokratická strana	ODS	1	053	2510	36.35	6
3201	553913	Meclov	1	2	1	1	Křesťanská a demokratická unie - Československá strana lidová	Křesť.demokr.unie-Čs.str.lid.	KDU-ČSL	1	001	566	11.17	1
3201	553913	Meclov	1	3	411	411	Volba pro venkov a nezávislí kandidáti	Volba pro venkov a nez.kand.		2	080,113	1414	20.48	3
3201	553913	Meclov	1	4	7	7	Česká strana sociálně demokratická	Česká str.sociálně demokrat.	ČSSD	1	007	1373	19.88	3
3201	553913	Meclov	1	5	480	480	Nezávislí kandidáti + TOP 09	Nezáv.kand.+TOP 09		2	080,721	1041	15.07	2