OKRES	KODZASTUP	NAZEVZAST	COBVODU	POR_STR_HL	OSTRANA	VSTRANA	NAZEVCELK	ZKRATKAO30	ZKRATKAO8	POCSTR_SLO	SLOZENI	HLASY_STR	PROCHLSTR	MAND_STR
4204	566217	Hřivice	1	1	902	90	Sdružení nezávislých kandidátů Markvarec	Sdruž.nezáv.kand.Markvarec	SNKMARKV	1	080	429	12.05	1
4204	566217	Hřivice	1	2	905	90	Sdružení nezávislých kandidátů Touchovice	Sdruž.nezáv.kand.Touchovice	SNKTouch	1	080	900	25.28	3
4204	566217	Hřivice	1	3	904	90	Sdružení nezávislých kandidátů Hřivice a Touchovice	SNK Hřivice a Touchovice	SNK HaT	1	080	277	10.69	1
4204	566217	Hřivice	1	4	47	47	Komunistická strana Čech a Moravy	Komunistická str.Čech a Moravy	KSČM	1	047	453	12.72	1
4204	566217	Hřivice	1	5	801	80	MUDr. Zbyněk Brada, nezávislý kandidát	MUDr. Zbyněk Brada, NK	ZB,NK	1	080	184	56.85	0
4204	566217	Hřivice	1	6	903	90	Sdružení nezávislých kandidátů Hřivice	Sdruž.nezáv.kand.Hřivice	SNK Hřiv	1	080	308	9.51	1
4204	566217	Hřivice	1	7	906	90	Sdružení nezávislých kandidátů Obce Hřivice za zdravější obec	SNK Obce Hřivice za zdravější	SNKOHZZO	1	080	552	15.5	2
4204	566217	Hřivice	1	8	901	90	Sdružení nezávislých kandidátů Obce Hřivice-za obec krásnější	SNK Obce Hřivice-za obec krás.	SNKOHZOK	1	080	457	12.83	2