OKRES	KODZASTUP	NAZEVZAST	COBVODU	POR_STR_HL	OSTRANA	VSTRANA	NAZEVCELK	ZKRATKAO30	ZKRATKAO8	POCSTR_SLO	SLOZENI	HLASY_STR	PROCHLSTR	MAND_STR
6205	586251	Kelčany	1	1	808	80	Milena Kůřilová, nezávislý kandidát	Milena Kůřilová, NK	NK	1	080	91	96.07	1
6205	586251	Kelčany	1	2	801	80	Pavel Šnajdr, nezávislý kandidát	Pavel Šnajdr, NK	NK	1	080	77	81.29	1
6205	586251	Kelčany	1	3	809	80	Bc. Anežka Plintovičová, nezávislý kandidát	Bc. Anežka Plintovičová, NK	NK	1	080	57	60.18	0
6205	586251	Kelčany	1	4	802	80	Václav Šťastný, nezávislý kandidát	Václav Šťastný, NK	NK	1	080	60	63.34	1
6205	586251	Kelčany	1	5	807	80	JUDr. Alena Plintovičová, nezávislý kandidát	JUDr. Alena Plintovičová, NK	NK	1	080	47	49.62	0
6205	586251	Kelčany	1	6	804	80	Radim Konečný, nezávislý kandidát	Radim Konečný, NK	NK	1	080	92	97.13	1
6205	586251	Kelčany	1	7	806	80	Miroslava Zavrtálková, nezávislý kandidát	Miroslava Zavrtálková, NK	NK	1	080	73	77.07	1
6205	586251	Kelčany	1	8	805	80	Roman Šťastný, nezávislý kandidát	Roman Šťastný, NK	NK	1	080	74	78.12	1
6205	586251	Kelčany	1	9	803	80	Jindřich Medek, nezávislý kandidát	Jindřich Medek, NK	NK	1	080	92	97.13	1