OKRES	KODZASTUP	NAZEVZAST	COBVODU	POR_STR_HL	OSTRANA	VSTRANA	NAZEVCELK	ZKRATKAO30	ZKRATKAO8	POCSTR_SLO	SLOZENI	HLASY_STR	PROCHLSTR	MAND_STR
7204	585751	Slavičín	1	1	901	90	Sdružení nezávislých 2006	Sdruž.nezávislých 2006	SN2006	1	080	4311	8.23	2
7204	585751	Slavičín	1	2	1	1	Křesťanská a demokratická unie - Československá strana lidová	Křesť.demokr.unie-Čs.str.lid.	KDU-ČSL	1	001	11160	21.31	5
7204	585751	Slavičín	1	3	7	7	Česká strana sociálně demokratická	Česká str.sociálně demokrat.	ČSSD	1	007	12673	24.2	5
7204	585751	Slavičín	1	4	47	47	Komunistická strana Čech a Moravy	Komunistická str.Čech a Moravy	KSČM	1	047	5874	11.22	2
7204	585751	Slavičín	1	5	53	53	Občanská demokratická strana	Občanská demokratická strana	ODS	1	053	11502	21.97	5
7204	585751	Slavičín	1	6	614	614	"""Nezávislá volba pro Slavičín, Divnice, Hrádek a Nevšovou"""	"""Nezáv. volba pro S.,D.,H. a N"		2	102,172	3142	6	1
7204	585751	Slavičín	1	7	181	181	Nestraníci pro zdravé město	Nestraníci pro zdravé město	Nestran.	1	181	3686	7.04	1