OKRES	KODZASTUP	NAZEVZAST	COBVODU	POR_STR_HL	OSTRANA	VSTRANA	NAZEVCELK	ZKRATKAO30	ZKRATKAO8	POCSTR_SLO	SLOZENI	HLASY_STR	PROCHLSTR	MAND_STR
4206	567761	Ohníč	1	1	903	90	Sdružení nezávislých kandidátů	Sdružení nezávislých kandidátů	SNK	1	080	408	14.56	1
4206	567761	Ohníč	1	2	902	90	"Jsme tu pro Vás"""	"Jsme tu pro Vás"""	SNK	1	080	1118	39.91	4
4206	567761	Ohníč	1	3	47	47	Komunistická strana Čech a Moravy	Komunistická str.Čech a Moravy	KSČM	1	047	236	8.42	1
4206	567761	Ohníč	1	4	901	90	"Sdružení nově nezávislých kandidátů - pro rozvoj obcí Ohníč"""	"SNK - pro rozvoj obcí Ohníč"""	SNK	1	080	450	16.06	2
4206	567761	Ohníč	1	5	904	90	Sdružení pro rozvoj obce	Sdružení pro rozvoj obce	SNK	1	080	371	13.24	1
4206	567761	Ohníč	1	6	7	7	Česká strana sociálně demokratická	Česká str.sociálně demokrat.	ČSSD	1	007	218	7.78	0