OKRES	KODZASTUP	NAZEVZAST	COBVODU	POR_STR_HL	OSTRANA	VSTRANA	NAZEVCELK	ZKRATKAO30	ZKRATKAO8	POCSTR_SLO	SLOZENI	HLASY_STR	PROCHLSTR	MAND_STR
5303	574325	Gruna	1	1	807	80	Lubomír Zvejška, nezávislý kandidát	Lubomír Zvejška, NK	NK	1	080	80	109.16	1
5303	574325	Gruna	1	2	806	80	Zdeněk Prucek, nezávislý kandidát	Zdeněk Prucek, NK	NK	1	080	50	68.22	1
5303	574325	Gruna	1	3	804	80	Lubomír Smolík, nezávislý kandidát	Lubomír Smolík, NK	NK	1	080	61	83.23	1
5303	574325	Gruna	1	4	802	80	Alois Křivánek, nezávislý kandidát	Alois Křivánek, NK	NK	1	080	96	130.99	1
5303	574325	Gruna	1	5	808	80	Michal Jurníček, DiS., nezávislý kandidát	Michal Jurníček, DiS., NK	NK	1	080	25	34.11	0
5303	574325	Gruna	1	6	801	80	Milan Křivánek, nezávislý kandidát	Milan Křivánek, NK	NK	1	080	68	92.78	1
5303	574325	Gruna	1	7	805	80	David Cerman, nezávislý kandidát	David Cerman, NK	NK	1	080	59	80.5	1
5303	574325	Gruna	1	8	803	80	Kamil Šín, nezávislý kandidát	Kamil Šín, NK	NK	1	080	74	100.97	1