OKRES	KODZASTUP	NAZEVZAST	COBVODU	POR_STR_HL	OSTRANA	VSTRANA	NAZEVCELK	ZKRATKAO30	ZKRATKAO8	POCSTR_SLO	SLOZENI	HLASY_STR	PROCHLSTR	MAND_STR
6206	592994	Dražovice	1	1	1	1	Křesťanská a demokratická unie - Československá strana lidová	Křesť.demokr.unie-Čs.str.lid.	KDU-ČSL	1	001	2627	41.78	7
6206	592994	Dražovice	1	2	181	181	Nestraníci	Nestraníci	Nestran.	1	181	1455	23.14	4
6206	592994	Dražovice	1	3	901	90	DRAŽOVICE 2010	DRAŽOVICE 2010	SNK	1	080	632	18.84	1
6206	592994	Dražovice	1	4	7	7	Česká strana sociálně demokratická	Česká str.sociálně demokrat.	ČSSD	1	007	596	17.77	1
6206	592994	Dražovice	1	5	47	47	Komunistická strana Čech a Moravy	Komunistická str.Čech a Moravy	KSČM	1	047	977	21.19	2