OKRES	KODZASTUP	NAZEVZAST	COBVODU	POR_STR_HL	OSTRANA	VSTRANA	NAZEVCELK	ZKRATKAO30	ZKRATKAO8	POCSTR_SLO	SLOZENI	HLASY_STR	PROCHLSTR	MAND_STR
3102	545660	Omlenice	1	1	902	90	Sdružení nezávislých kandidátů I.	Sdruž.nezáv.kand.I.	SNK-902	1	080	374	21.77	2
3102	545660	Omlenice	1	2	801	80	Vladimír Kotva, nezávislý kandidát	Vladimír Kotva, NK	NK-801	1	080	29	15.19	0
3102	545660	Omlenice	1	3	903	90	Sdružení nezávislých kandidátů III.	Sdruž.nezáv.kand.III.	SNK-903	1	080	290	16.88	1
3102	545660	Omlenice	1	4	901	90	Sdružení nezávislých kandidátů II.	Sdruž.nezáv.kand.II.	SNK-901	1	080	1120	53.35	7
3102	545660	Omlenice	1	5	47	47	Komunistická strana Čech a Moravy	Komunistická str.Čech a Moravy	KSČM	1	047	286	18.73	1