OKRES	KODZASTUP	NAZEVZAST	COBVODU	POR_STR_HL	OSTRANA	VSTRANA	NAZEVCELK	ZKRATKAO30	ZKRATKAO8	POCSTR_SLO	SLOZENI	HLASY_STR	PROCHLSTR	MAND_STR
6104	590428	Cidlina	1	1	806	80	Iva Nováková, nezávislý kandidát	Iva Nováková, NK	NK	1	080	21	29.45	0
6104	590428	Cidlina	1	2	901	90	Sdružení občanů	Sdružení občanů	SNK	1	080	294	58.91	7
6104	590428	Cidlina	1	3	807	80	Bc. Ivana Buďová, DiS., nezávislý kandidát	Bc. Ivana Buďová, DiS., NK	NK	1	080	29	40.68	0
6104	590428	Cidlina	1	4	802	80	Ing. Miroslav Smetana, nezávislý kandidát	Ing. Miroslav Smetana, NK	NK	1	080	37	51.9	0
6104	590428	Cidlina	1	5	801	80	Vojtěch Kvapil, nezávislý kandidát	Vojtěch Kvapil, NK	NK	1	080	39	54.7	0
6104	590428	Cidlina	1	6	805	80	Hana Paznochtová, nezávislý kandidát	Hana Paznochtová, NK	NK	1	080	23	32.26	0
6104	590428	Cidlina	1	7	803	80	Eva Outolná, nezávislý kandidát	Eva Outolná, NK	NK	1	080	25	35.07	0
6104	590428	Cidlina	1	8	804	80	Ing. Michal Vecheta, nezávislý kandidát	Ing. Michal Vecheta, NK	NK	1	080	31	43.48	0