OKRES	KODZASTUP	NAZEVZAST	COBVODU	POR_STR_HL	OSTRANA	VSTRANA	NAZEVCELK	ZKRATKAO30	ZKRATKAO8	POCSTR_SLO	SLOZENI	HLASY_STR	PROCHLSTR	MAND_STR
4101	539074	Vojtanov	1	1	803	80	Jiří Mařík, nezávislý kandidát	Jiří Mařík, NK	NK	1	080	49	139.43	1
4101	539074	Vojtanov	1	2	807	80	Jiří Penkert, nezávislý kandidát	Jiří Penkert, NK	NK	1	080	34	96.74	1
4101	539074	Vojtanov	1	3	802	80	Pavel Križan, nezávislý kandidát	Pavel Križan, NK	NK	1	080	37	105.28	1
4101	539074	Vojtanov	1	4	806	80	Ljubo Fistr, nezávislý kandidát	Ljubo Fistr, NK	NK	1	080	27	76.82	1
4101	539074	Vojtanov	1	5	805	80	Lubomír Šustek, nezávislý kandidát	Lubomír Šustek, NK	NK	1	080	28	79.67	1
4101	539074	Vojtanov	1	6	804	80	Vladimír Chmelař, nezávislý kandidát	Vladimír Chmelař, NK	NK	1	080	29	82.52	1
4101	539074	Vojtanov	1	7	801	80	František Pravda, nezávislý kandidát	František Pravda, NK	NK	1	080	42	119.51	1