OKRES	KODZASTUP	NAZEVZAST	COBVODU	POR_STR_HL	OSTRANA	VSTRANA	NAZEVCELK	ZKRATKAO30	ZKRATKAO8	POCSTR_SLO	SLOZENI	HLASY_STR	PROCHLSTR	MAND_STR
5304	581011	Sudslava	1	1	806	80	Miroslav Syrový, nezávislý kandidát	Miroslav Syrový, NK	NK	1	080	70	109.13	1
5304	581011	Sudslava	1	2	804	80	Ing. Jiří Drábek, nezávislý kandidát	Ing. Jiří Drábek, NK	NK	1	080	64	99.77	1
5304	581011	Sudslava	1	3	801	80	Michal Kaplan, nezávislý kandidát	Michal Kaplan, NK	NK	1	080	69	107.57	1
5304	581011	Sudslava	1	4	803	80	Luboš Zeman, nezávislý kandidát	Luboš Zeman, NK	NK	1	080	61	95.1	1
5304	581011	Sudslava	1	5	805	80	Petr Buben, nezávislý kandidát	Petr Buben, NK	NK	1	080	67	104.45	1
5304	581011	Sudslava	1	6	807	80	Štěpánka Drábková, nezávislý kandidát	Štěpánka Drábková, NK	NK	1	080	63	98.21	1
5304	581011	Sudslava	1	7	802	80	Monika Padrtková, nezávislý kandidát	Monika Padrtková, NK	NK	1	080	55	85.74	1