OKRES	KODZASTUP	NAZEVZAST	COBVODU	POR_STR_HL	OSTRANA	VSTRANA	NAZEVCELK	ZKRATKAO30	ZKRATKAO8	POCSTR_SLO	SLOZENI	HLASY_STR	PROCHLSTR	MAND_STR
5303	578142	Janůvky	1	1	801	80	Marie Alexová, nezávislý kandidát	Marie Alexová, NK	NK	1	080	16	100.9	1
5303	578142	Janůvky	1	2	805	80	Zdeněk Rys, nezávislý kandidát	Zdeněk Rys, NK	NK	1	080	14	88.28	1
5303	578142	Janůvky	1	3	806	80	Jan Večeřa, nezávislý kandidát	Jan Večeřa, NK	NK	1	080	16	100.9	1
5303	578142	Janůvky	1	4	802	80	Ladislav Reibl, nezávislý kandidát	Ladislav Reibl, NK	NK	1	080	18	113.51	1
5303	578142	Janůvky	1	5	803	80	Oldřich Marek, nezávislý kandidát	Oldřich Marek, NK	NK	1	080	14	88.28	1
5303	578142	Janůvky	1	6	807	80	Petr Mach, nezávislý kandidát	Petr Mach, NK	NK	1	080	15	94.59	1
5303	578142	Janůvky	1	7	804	80	Ondřej Rádl, nezávislý kandidát	Ondřej Rádl, NK	NK	1	080	18	113.51	1