OKRES	KODZASTUP	NAZEVZAST	COBVODU	POR_STR_HL	OSTRANA	VSTRANA	NAZEVCELK	ZKRATKAO30	ZKRATKAO8	POCSTR_SLO	SLOZENI	HLASY_STR	PROCHLSTR	MAND_STR
7102	505587	Uničov	1	1	1	1	Křesťanská a demokratická unie - Československá strana lidová	Křesť.demokr.unie-Čs.str.lid.	KDU-ČSL	1	001	13516	20.02	4
7102	505587	Uničov	1	2	7	7	Česká strana sociálně demokratická	Česká str.sociálně demokrat.	ČSSD	1	007	5658	8.38	2
7102	505587	Uničov	1	3	53	53	Občanská demokratická strana	Občanská demokratická strana	ODS	1	053	22131	32.79	8
7102	505587	Uničov	1	4	768	768	ANO 2011	ANO 2011	ANO	1	768	13526	20.04	4
7102	505587	Uničov	1	5	1114	1114	Svoboda a přímá demokracie - Tomio Okamura (SPD)	Svob.a př.dem.-T.Okamura (SPD)	SPD	1	1114	5371	7.95	1
7102	505587	Uničov	1	6	47	47	Komunistická strana Čech a Moravy	Komunistická str.Čech a Moravy	KSČM	1	047	7283	10.79	2