OKRES	KODZASTUP	NAZEVZAST	COBVODU	POR_STR_HL	OSTRANA	VSTRANA	NAZEVCELK	ZKRATKAO30	ZKRATKAO8	POCSTR_SLO	SLOZENI	HLASY_STR	PROCHLSTR	MAND_STR
4207	568201	Řehlovice	1	1	47	47	Komunistická strana Čech a Moravy	Komunistická str.Čech a Moravy	KSČM	1	047	695	9.57	1
4207	568201	Řehlovice	1	2	902	90	Volba 2018	Volba 2018	SNK	1	080	971	13.37	2
4207	568201	Řehlovice	1	3	901	90	Sdružení nezávislých kandidátů I	Sdr. nezávislých kandidátů I	SNK	1	080	1830	25.2	4
4207	568201	Řehlovice	1	4	904	90	Šance 2018	Šance 2018	SNK	1	080	1654	22.78	3
4207	568201	Řehlovice	1	5	903	90	Sdružení nezávislých kandidátů II	SNK II	SNK	1	080	2110	29.06	5