OKRES	KODZASTUP	NAZEVZAST	COBVODU	POR_STR_HL	OSTRANA	VSTRANA	NAZEVCELK	ZKRATKAO30	ZKRATKAO8	POCSTR_SLO	SLOZENI	HLASY_STR	PROCHLSTR	MAND_STR
2110	539643	Řevnice	1	1	901	90	Řevnice pro budoucnost	SNK - Řevnice pro budoucnost	SNK-ŘPB	1	080	3119	14.7	2
2110	539643	Řevnice	1	2	53	53	Občanská demokratická strana (ODS)	Občanská demokratická strana	ODS	1	053	8309	39.18	7
2110	539643	Řevnice	1	3	47	47	Komunistická strana Čech a Moravy	Komunistická str.Čech a Moravy	KSČM	1	047	942	5.55	0
2110	539643	Řevnice	1	4	1	1	Křesťanská a demokratická unie - Československá strana lidová	Křesť.demokr.unie-Čs.str.lid.	KDU-ČSL	1	001	4736	22.33	3
2110	539643	Řevnice	1	5	902	90	Naše Řevnice	SNK - Naše Řevnice	SNK-NŘ	1	080	4100	19.33	3