OKRES	KODZASTUP	NAZEVZAST	COBVODU	POR_STR_HL	OSTRANA	VSTRANA	NAZEVCELK	ZKRATKAO30	ZKRATKAO8	POCSTR_SLO	SLOZENI	HLASY_STR	PROCHLSTR	MAND_STR
6103	549061	Věžná	1	1	803	80	Jiří Kotrba, nezávislý kandidát	Jiří Kotrba, NK	NK	1	080	45	88.23	1
6103	549061	Věžná	1	2	807	80	Ladislav Vlach, nezávislý kandidát	Ladislav Vlach, NK	NK	1	080	54	105.88	1
6103	549061	Věžná	1	3	809	80	Miloslava Zíková, nezávislý kandidát	Miloslava Zíková, NK	NK	1	080	46	90.19	1
6103	549061	Věžná	1	4	805	80	Pavel Martinec, nezávislý kandidát	Pavel Martinec, NK	NK	1	080	38	74.5	1
6103	549061	Věžná	1	5	806	80	Petr Pomazal, nezávislý kandidát	Petr Pomazal, NK	NK	1	080	12	23.52	0
6103	549061	Věžná	1	6	808	80	Miroslav Zíka, nezávislý kandidát	Miroslav Zíka, NK	NK	1	080	39	76.47	1
6103	549061	Věžná	1	7	804	80	Josef Mareš, nezávislý kandidát	Josef Mareš, NK	NK	1	080	46	90.19	1
6103	549061	Věžná	1	8	801	80	Jiří Janů, nezávislý kandidát	Jiří Janů, NK	NK	1	080	37	72.54	0
6103	549061	Věžná	1	9	802	80	Tomáš Kertis, nezávislý kandidát	Tomáš Kertis, NK	NK	1	080	40	78.43	1