OKRES	KODZASTUP	NAZEVZAST	COBVODU	POR_STR_HL	OSTRANA	VSTRANA	NAZEVCELK	ZKRATKAO30	ZKRATKAO8	POCSTR_SLO	SLOZENI	HLASY_STR	PROCHLSTR	MAND_STR
5201	530671	Pšánky	1	1	801	80	Miroslav Pour, nezávislý kandidát	Miroslav Pour, NK	NK	1	080	26	83.48	1
5201	530671	Pšánky	1	2	809	80	Martina Zubrová, nezávislý kandidát	Martina Zubrová, NK	NK	1	080	29	93.11	1
5201	530671	Pšánky	1	3	806	80	Vladislav Kloutvor, nezávislý kandidát	Vladislav Kloutvor, NK	NK	1	080	31	99.54	1
5201	530671	Pšánky	1	4	805	80	Lucie Kloutvorová, nezávislý kandidát	Lucie Kloutvorová, NK	NK	1	080	25	80.27	1
5201	530671	Pšánky	1	5	803	80	Václav Středa, nezávislý kandidát	Václav Středa, NK	NK	1	080	20	64.22	0
5201	530671	Pšánky	1	6	808	80	Miroslav Pour, nezávislý kandidát	Miroslav Pour, NK	NK	1	080	24	77.06	1
5201	530671	Pšánky	1	7	802	80	Marie Bezvodová, nezávislý kandidát	Marie Bezvodová, NK	NK	1	080	22	70.64	1
5201	530671	Pšánky	1	8	804	80	Josef Pražák, nezávislý kandidát	Josef Pražák, NK	NK	1	080	9	28.89	0
5201	530671	Pšánky	1	9	807	80	Martin Pavliš, nezávislý kandidát	Martin Pavliš, NK	NK	1	080	32	102.75	1