OKRES	KODZASTUP	NAZEVZAST	COBVODU	POR_STR_HL	OSTRANA	VSTRANA	NAZEVCELK	ZKRATKAO30	ZKRATKAO8	POCSTR_SLO	SLOZENI	HLASY_STR	PROCHLSTR	MAND_STR
6105	595705	Chlum-Korouhvice	1	1	803	80	Jiří Vondra, nezávislý kandidát	Jiří Vondra, NK	NK	1	080	15	49.34	0
6105	595705	Chlum-Korouhvice	1	2	806	80	Petr Jančík, nezávislý kandidát	Petr Jančík, NK	NK	1	080	22	72.36	1
6105	595705	Chlum-Korouhvice	1	3	808	80	Bc. Marek Šťastný, nezávislý kandidát	Bc. Marek Šťastný, NK	NK	1	080	15	49.34	0
6105	595705	Chlum-Korouhvice	1	4	809	80	Jarmil Jančík, nezávislý kandidát	Jarmil Jančík, NK	NK	1	080	18	59.21	1
6105	595705	Chlum-Korouhvice	1	5	802	80	Kamil Vondra, nezávislý kandidát	Kamil Vondra, NK	NK	1	080	23	75.65	1
6105	595705	Chlum-Korouhvice	1	6	801	80	Josef Vondra, nezávislý kandidát	Josef Vondra, NK	NK	1	080	6	19.73	0
6105	595705	Chlum-Korouhvice	1	7	805	80	Radka Slavíčková, nezávislý kandidát	Radka Slavíčková, NK	NK	1	080	20	65.78	1
6105	595705	Chlum-Korouhvice	1	8	804	80	Karel Jančík, nezávislý kandidát	Karel Jančík, NK	NK	1	080	15	49.34	0
6105	595705	Chlum-Korouhvice	1	9	807	80	František Šauer, nezávislý kandidát	František Šauer, NK	NK	1	080	18	59.21	1