OKRES	KODZASTUP	NAZEVZAST	COBVODU	POR_STR_HL	OSTRANA	VSTRANA	NAZEVCELK	ZKRATKAO30	ZKRATKAO8	POCSTR_SLO	SLOZENI	HLASY_STR	PROCHLSTR	MAND_STR
6203	584134	Vohančice	1	1	801	80	Veronika Slámová, nezávislý kandidát	Veronika Slámová, NK	NK	1	080	59	82.4	1
6203	584134	Vohančice	1	2	804	80	Pavel Kolíbal, nezávislý kandidát	Pavel Kolíbal, NK	NK	1	080	46	64.24	0
6203	584134	Vohančice	1	3	802	80	Pavla Poláčková, nezávislý kandidát	Pavla Poláčková, NK	NK	1	080	48	67.03	1
6203	584134	Vohančice	1	4	803	80	Martin Babák, nezávislý kandidát	Martin Babák, NK	NK	1	080	56	78.21	1
6203	584134	Vohančice	1	5	806	80	Milan Šejnoha, nezávislý kandidát	Milan Šejnoha, NK	NK	1	080	88	122.9	1
6203	584134	Vohančice	1	6	805	80	Roman Nejez, nezávislý kandidát	Roman Nejez, NK	NK	1	080	61	85.19	1