OKRES	KODZASTUP	NAZEVZAST	COBVODU	POR_STR_HL	OSTRANA	VSTRANA	NAZEVCELK	ZKRATKAO30	ZKRATKAO8	POCSTR_SLO	SLOZENI	HLASY_STR	PROCHLSTR	MAND_STR
6207	594113	Hostěradice	1	1	53	53	Občanská demokratická strana	Občanská demokratická strana	ODS	1	053	498	11.1	1
6207	594113	Hostěradice	1	2	47	47	Komunistická strana Čech a Moravy	Komunistická str.Čech a Moravy	KSČM	1	047	1525	34	3
6207	594113	Hostěradice	1	3	7	7	Česká strana sociálně demokratická	Česká str.sociálně demokrat.	ČSSD	1	007	882	19.66	2
6207	594113	Hostěradice	1	4	901	90	Sdružení nezávislých kandidátů Hasiči Hostěradice	SNK Hasiči Hostěradice	SNK	1	080	891	19.87	2
6207	594113	Hostěradice	1	5	1	1	Křesťanská a demokratická unie - Československá strana lidová	Křesť.demokr.unie-Čs.str.lid.	KDU-ČSL	1	001	688	15.34	1