OKRES	KODZASTUP	NAZEVZAST	COBVODU	POR_STR_HL	OSTRANA	VSTRANA	NAZEVCELK	ZKRATKAO30	ZKRATKAO8	POCSTR_SLO	SLOZENI	HLASY_STR	PROCHLSTR	MAND_STR
6207	594822	Strachotice	1	1	903	90	Nezávislí kandidáti pro rozvoj obce, kulturu a sport	Nez. kandidáti pro rozvoj obce	SNK	1	080	853	20.76	2
6207	594822	Strachotice	1	2	904	90	Sdružení nezávislých kandidátů Za naši obec	SNK Za naši obec	SNK-CELK	1	080	771	18.76	2
6207	594822	Strachotice	1	3	1	1	Křesťanská a demokratická unie - Československá strana lidová	Křesť.demokr.unie-Čs.str.lid.	KDU-ČSL	1	001	373	9.07	0
6207	594822	Strachotice	1	4	47	47	Komunistická strana Čech a Moravy	Komunistická str.Čech a Moravy	KSČM	1	047	143	3.91	0
6207	594822	Strachotice	1	5	902	90	Za zlepšení životního prostředí	Za zlepšení životního prostřed	SNK	1	080	749	18.23	2
6207	594822	Strachotice	1	6	7	7	Česká strana sociálně demokratická	Česká str.sociálně demokrat.	ČSSD	1	007	784	19.08	2
6207	594822	Strachotice	1	7	901	90	Sdružení žen pro naši obec	Sdružení žen pro naši obec	SNK	1	080	435	10.58	1