OKRES	KODZASTUP	NAZEVZAST	COBVODU	POR_STR_HL	OSTRANA	VSTRANA	NAZEVCELK	ZKRATKAO30	ZKRATKAO8	POCSTR_SLO	SLOZENI	HLASY_STR	PROCHLSTR	MAND_STR
7102	546976	Hraničné Petrovice	1	1	801	80	Pavla Kubíčková, nezávislý kandidát	Pavla Kubíčková, NK	NK	1	080	27	36.91	0
7102	546976	Hraničné Petrovice	1	2	803	80	Antonín Palůch, ml., nezávislý kandidát	Antonín Palůch, ml., NK	NK	1	080	25	34.17	0
7102	546976	Hraničné Petrovice	1	3	804	80	Lenka Palůchová, nezávislý kandidát	Lenka Palůchová, NK	NK	1	080	26	35.54	0
7102	546976	Hraničné Petrovice	1	4	470	470	NEZÁVISLÍ HRANIČNÉ PETROVICE	NEZÁVISLÍ HRANIČNÉ PETROVICE		2	080,166	377	73.63	7
7102	546976	Hraničné Petrovice	1	5	805	80	Josef Chrastina, nezávislý kandidát	Josef Chrastina, NK	NK	1	080	26	35.54	0
7102	546976	Hraničné Petrovice	1	6	802	80	Josef Kouřil, nezávislý kandidát	Josef Kouřil, NK	NK	1	080	31	42.38	0