OKRES	KODZASTUP	NAZEVZAST	COBVODU	POR_STR_HL	OSTRANA	VSTRANA	NAZEVCELK	ZKRATKAO30	ZKRATKAO8	POCSTR_SLO	SLOZENI	HLASY_STR	PROCHLSTR	MAND_STR
3105	550515	Stachy	1	1	902	90	"Sdružení nezávislých kandidátů ""Hasiči I"""	"Sdruž.nezáv.kand.""Hasiči I"""	SNK-Has.	1	080	424	5.29	0
3105	550515	Stachy	1	2	904	90	Nezávislé sdružení přátel sportu	Nezávislé sdružení přátel spor	SNK	1	080	921	11.49	2
3105	550515	Stachy	1	3	47	47	Komunistická strana Čech a Moravy	Komunistická str.Čech a Moravy	KSČM	1	047	874	10.9	2
3105	550515	Stachy	1	4	905	90	Sdružení pro změnu a zvýšení úrovně života obce	Sdruž.pro změnu a zvýš.úrovně	SNK	1	080	1169	14.59	2
3105	550515	Stachy	1	5	901	90	Nezávislé sdružení dobrovolných hasičů Stachy	Nezáv.sdruž.dobr.hasičů Stachy	SNK	1	080	649	8.1	1
3105	550515	Stachy	1	6	7	7	Česká strana sociálně demokratická	Česká str.sociálně demokrat.	ČSSD	1	007	110	20.59	0
3105	550515	Stachy	1	7	1	1	Křesťanská a demokratická unie - Československá strana lidová	Křesť.demokr.unie-Čs.str.lid.	KDU-ČSL	1	001	906	11.3	2
3105	550515	Stachy	1	8	906	90	NEZÁVISLÁ STRANA ZA ROZVOJ STAŠSKA	NEZ.STRANA ZA ROZVOJ STAŠSKA	SNK	1	080	1771	22.1	4
3105	550515	Stachy	1	9	903	90	Pro rozvoj obce Stachy	Pro rozvoj obce Stachy	SNK	1	080	1187	14.81	2