OKRES	KODZASTUP	NAZEVZAST	COBVODU	POR_STR_HL	OSTRANA	VSTRANA	NAZEVCELK	ZKRATKAO30	ZKRATKAO8	POCSTR_SLO	SLOZENI	HLASY_STR	PROCHLSTR	MAND_STR
3204	540269	Nová Ves	1	1	807	80	Jiří Drnec, nezávislý kandidát	Jiří Drnec, NK	NK	1	080	95	90.72	1
3204	540269	Nová Ves	1	2	803	80	František Zachatý, nezávislý kandidát	František Zachatý, NK	NK	1	080	83	79.26	1
3204	540269	Nová Ves	1	3	802	80	Miroslav Sedlák, nezávislý kandidát	Miroslav Sedlák, NK	NK	1	080	101	96.45	1
3204	540269	Nová Ves	1	4	801	80	Ivan Kraus, nezávislý kandidát	Ivan Kraus, NK	NK	1	080	94	89.76	1
3204	540269	Nová Ves	1	5	805	80	Michal Nedvěd, nezávislý kandidát	Michal Nedvěd, NK	NK	1	080	103	98.36	1
3204	540269	Nová Ves	1	6	808	80	Tomáš Matoušek, nezávislý kandidát	Tomáš Matoušek, NK	NK	1	080	69	65.89	0
3204	540269	Nová Ves	1	7	806	80	Aleš Drnec, nezávislý kandidát	Aleš Drnec, NK	NK	1	080	98	93.58	1
3204	540269	Nová Ves	1	8	804	80	Luboš Martínek, nezávislý kandidát	Luboš Martínek, NK	NK	1	080	90	85.94	1