OKRES	KODZASTUP	NAZEVZAST	COBVODU	POR_STR_HL	OSTRANA	VSTRANA	NAZEVCELK	ZKRATKAO30	ZKRATKAO8	POCSTR_SLO	SLOZENI	HLASY_STR	PROCHLSTR	MAND_STR
5303	578231	Koclířov	1	1	903	90	"Sdružení nezávislých kandidátů ""Pro Kocandu"""	"SNK ""Pro Kocandu"""	SNK	1	080	1329	24.59	4
5303	578231	Koclířov	1	2	902	90	SOUSEDÉ	SOUSEDÉ,SNK	SNK	1	080	1004	18.58	3
5303	578231	Koclířov	1	3	901	90	Sdružení nezávislých kandidátů Pohoda	SNK Pohoda	SNK	1	080	1113	20.59	3
5303	578231	Koclířov	1	4	47	47	Komunistická strana Čech a Moravy	Komunistická str.Čech a Moravy	KSČM	1	047	808	14.95	2
5303	578231	Koclířov	1	5	7	7	Česká strana sociálně demokratická	Česká str.sociálně demokrat.	ČSSD	1	007	1149	21.26	3