OKRES	KODZASTUP	NAZEVZAST	COBVODU	POR_STR_HL	OSTRANA	VSTRANA	NAZEVCELK	ZKRATKAO30	ZKRATKAO8	POCSTR_SLO	SLOZENI	HLASY_STR	PROCHLSTR	MAND_STR
7203	541648	Branky	1	1	904	90	SNK TJ Sokol Branky	SNK TJ Sokol Branky	SNK	1	080	1283	19.21	3
7203	541648	Branky	1	2	905	90	BRANEČTÍ OBČANÉ	BRANEČTÍ OBČANÉ	SNK	1	080	862	12.9	2
7203	541648	Branky	1	3	903	90	Sbor dobrovolných hasičů Branky	Sbor dobrovol. hasičů Branky	SNK	1	080	909	13.61	2
7203	541648	Branky	1	4	902	90	SPOLEK PRO OBNOVU ZÁMECKÉHO PARKU	SPOLEK PRO OBNOVU ZÁMEC. PARKU	SNK	1	080	1090	16.32	2
7203	541648	Branky	1	5	901	90	Nezávislí pro Branky	Nezávislí pro Branky	SNK	1	080	1789	26.78	4
7203	541648	Branky	1	6	47	47	Komunistická strana Čech a Moravy	Komunistická str.Čech a Moravy	KSČM	1	047	745	11.15	2