OKRES	KODZASTUP	NAZEVZAST	COBVODU	POR_STR_HL	OSTRANA	VSTRANA	NAZEVCELK	ZKRATKAO30	ZKRATKAO8	POCSTR_SLO	SLOZENI	HLASY_STR	PROCHLSTR	MAND_STR
2105	534391	Slavošov	1	1	806	80	Pavel Tomášek, nezávislý kandidát	Pavel Tomášek, NK	NK	1	080	51	81.88	1
2105	534391	Slavošov	1	2	801	80	Michaela Lhotková, nezávislý kandidát	Michaela Lhotková, NK	NK	1	080	29	46.55	0
2105	534391	Slavošov	1	3	803	80	Jaroslava Lhotková, nezávislý kandidát	Jaroslava Lhotková, NK	NK	1	080	29	46.55	0
2105	534391	Slavošov	1	4	901	90	Sdružení nezávislých kandidátů Slavošov	Sdruž.nezáv.kand.Slavošov	SNK-CELK	1	080	201	46.1	4
2105	534391	Slavošov	1	5	802	80	Drahuše Tomášková, nezávislý kandidát	Drahuše Tomášková, NK	NK	1	080	48	77.06	1
2105	534391	Slavošov	1	6	807	80	Jozef Šupolík, nezávislý kandidát	Jozef Šupolík, NK	NK	1	080	42	67.43	1
2105	534391	Slavošov	1	7	805	80	Milan Rajdl, nezávislý kandidát	Milan Rajdl, NK	NK	1	080	15	24.08	0
2105	534391	Slavošov	1	8	804	80	Pavel Sajfrt, nezávislý kandidát	Pavel Sajfrt, NK	NK	1	080	21	33.71	0