OKRES	KODZASTUP	NAZEVZAST	COBVODU	POR_STR_HL	OSTRANA	VSTRANA	NAZEVCELK	ZKRATKAO30	ZKRATKAO8	POCSTR_SLO	SLOZENI	HLASY_STR	PROCHLSTR	MAND_STR
7203	542814	Hutisko-Solanec	1	1	53	53	Občanská demokratická strana	Občanská demokratická strana	ODS	1	053	2392	18.63	3
7203	542814	Hutisko-Solanec	1	2	901	90	SDRUŽENÍ NEZÁVISLÝCH KANDIDÁTŮ	SDRUŽENÍ NEZÁVISLÝCH KANDIDÁTŮ	SNK	1	080	5129	39.94	6
7203	542814	Hutisko-Solanec	1	3	7	7	Česká strana sociálně demokratická	Česká str.sociálně demokrat.	ČSSD	1	007	1270	9.89	1
7203	542814	Hutisko-Solanec	1	4	902	90	Sdružení nezávislých kandidátů Za krásnější obec Hutisko-Solanec	SNK Za krásnější obec Hut-Sol.	SNK	1	080	1519	11.83	2
7203	542814	Hutisko-Solanec	1	5	1	1	Křesťanská a demokratická unie - Československá strana lidová	Křesť.demokr.unie-Čs.str.lid.	KDU-ČSL	1	001	2529	19.69	3