OKRES	KODZASTUP	NAZEVZAST	COBVODU	POR_STR_HL	OSTRANA	VSTRANA	NAZEVCELK	ZKRATKAO30	ZKRATKAO8	POCSTR_SLO	SLOZENI	HLASY_STR	PROCHLSTR	MAND_STR
4101	554499	Aš	1	1	7	7	Česká strana sociálně demokratická	Česká str.sociálně demokrat.	ČSSD	1	007	3780	7.43	1
4101	554499	Aš	1	2	53	53	Občanská demokratická strana	Občanská demokratická strana	ODS	1	053	3790	6.8	1
4101	554499	Aš	1	3	142	142	Strana Zdraví Sportu Prosperity	Str.Zdraví Sportu Prosperity	SZSP	1	142	3860	7.24	1
4101	554499	Aš	1	4	774	774	PRO Sport a Zdraví	PRO Sport a Zdraví	PRO	1	774	4644	9.13	2
4101	554499	Aš	1	5	47	47	Komunistická strana Čech a Moravy	Komunistická str.Čech a Moravy	KSČM	1	047	8119	14.58	4
4101	554499	Aš	1	6	792	792	Úsvit přímé demokracie	Úsvit přímé demokracie	Úsvit	1	792	358	1.84	0
4101	554499	Aš	1	7	112	112	HNUTÍ NEZÁVISLÝCH ZA HARMONICKÝ ROZVOJ OBCÍ A MĚST	HN.ZA HARM.ROZVOJ OBCÍ A MĚST	HNHRM	1	112	21019	37.75	10
4101	554499	Aš	1	8	1066	1066	Česká pirátská strana a Strana zelených	Koalice Piráti a SZ	Piráti+SZ	2	005,720	5531	9.93	2
4101	554499	Aš	1	9	721	721	TOP 09	TOP 09	TOP 09	1	721	4577	8.22	2