OKRES	KODZASTUP	NAZEVZAST	COBVODU	POR_STR_HL	OSTRANA	VSTRANA	NAZEVCELK	ZKRATKAO30	ZKRATKAO8	POCSTR_SLO	SLOZENI	HLASY_STR	PROCHLSTR	MAND_STR
3204	540421	Radkovice	1	1	801	80	Marie Bradová, nezávislý kandidát	Marie Bradová, NK	NK	1	080	28	56.32	0
3204	540421	Radkovice	1	2	807	80	Václav Heřman, nezávislý kandidát	Václav Heřman, NK	NK	1	080	32	64.36	1
3204	540421	Radkovice	1	3	804	80	Alena Bradová, nezávislý kandidát	Alena Bradová, NK	NK	1	080	33	66.37	1
3204	540421	Radkovice	1	4	802	80	Petr Kodl, nezávislý kandidát	Petr Kodl, NK	NK	1	080	44	88.5	1
3204	540421	Radkovice	1	5	809	80	Stanislav Kasl, nezávislý kandidát	Stanislav Kasl, NK	NK	1	080	38	76.43	1
3204	540421	Radkovice	1	6	805	80	Monika Kubátová, nezávislý kandidát	Monika Kubátová, NK	NK	1	080	54	108.62	1
3204	540421	Radkovice	1	7	808	80	Vladimír Kasl, nezávislý kandidát	Vladimír Kasl, NK	NK	1	080	46	92.52	1
3204	540421	Radkovice	1	8	806	80	Josef Kalčík, nezávislý kandidát	Josef Kalčík, NK	NK	1	080	41	82.47	1
3204	540421	Radkovice	1	9	803	80	Miroslav Duchek, nezávislý kandidát	Miroslav Duchek, NK	NK	1	080	32	64.36	0