OKRES	KODZASTUP	NAZEVZAST	COBVODU	POR_STR_HL	OSTRANA	VSTRANA	NAZEVCELK	ZKRATKAO30	ZKRATKAO8	POCSTR_SLO	SLOZENI	HLASY_STR	PROCHLSTR	MAND_STR
8104	599808	Příbor	1	1	7	7	Česká strana sociálně demokratická	Česká str.sociálně demokrat.	ČSSD	1	007	10062	14.25	3
8104	599808	Příbor	1	2	901	90	"Sdružení nezávislých kandidátů ""Příbor je náš domov"""	"SNK""Příbor je náš domov"""	SNK	1	080	14272	20.21	5
8104	599808	Příbor	1	3	1	1	Křesťanská a demokratická unie - Československá strana lidová	Křesť.demokr.unie-Čs.str.lid.	KDU-ČSL	1	001	9449	13.38	3
8104	599808	Příbor	1	4	53	53	Občanská demokratická strana	Občanská demokratická strana	ODS	1	053	21890	31.01	7
8104	599808	Příbor	1	5	47	47	Komunistická strana Čech a Moravy	Komunistická str.Čech a Moravy	KSČM	1	047	14915	21.12	5