OKRES	KODZASTUP	NAZEVZAST	COBVODU	POR_STR_HL	OSTRANA	VSTRANA	NAZEVCELK	ZKRATKAO30	ZKRATKAO8	POCSTR_SLO	SLOZENI	HLASY_STR	PROCHLSTR	MAND_STR
5301	572209	Řepníky	1	1	805	80	Dana Hyksová, nezávislý kandidát	Dana Hyksová, NK	NK	1	080	114	71.07	1
5301	572209	Řepníky	1	2	802	80	Jaroslav Prokop, nezávislý kandidát	Jaroslav Prokop, NK	NK	1	080	87	54.23	0
5301	572209	Řepníky	1	3	803	80	Ing. Stanislava Dostálová, nezávislý kandidát	Ing. Stanislava Dostálová, NK	NK	1	080	146	91.02	1
5301	572209	Řepníky	1	4	804	80	Miroslav Morávek, nezávislý kandidát	Miroslav Morávek, NK	NK	1	080	97	60.47	1
5301	572209	Řepníky	1	5	801	80	Ing. Jiří Chytil, nezávislý kandidát	Ing. Jiří Chytil, NK	NK	1	080	171	106.6	1
5301	572209	Řepníky	1	6	807	80	Martin Severa, nezávislý kandidát	Martin Severa, NK	NK	1	080	98	61.09	1
5301	572209	Řepníky	1	7	806	80	Libor Hladík, nezávislý kandidát	Libor Hladík, NK	NK	1	080	89	55.48	0