OKRES	KODZASTUP	NAZEVZAST	COBVODU	POR_STR_HL	OSTRANA	VSTRANA	NAZEVCELK	ZKRATKAO30	ZKRATKAO8	POCSTR_SLO	SLOZENI	HLASY_STR	PROCHLSTR	MAND_STR
2105	534668	Žleby	1	1	901	90	Sdružení nezávislých kandidátů	Sdruž.nezáv.kand.	SNK-CELK	1	080	1634	35.93	4
2105	534668	Žleby	1	2	801	80	Josef Vojáček, nezávislý kandidát	Josef Vojáček, NK	NK	1	080	115	27.82	0
2105	534668	Žleby	1	3	47	47	Komunistická strana Čech a Moravy	Komunistická str.Čech a Moravy	KSČM	1	047	1010	22.21	3
2105	534668	Žleby	1	4	7	7	Česká strana sociálně demokratická	Česká str.sociálně demokrat.	ČSSD	1	007	975	39.31	2
2105	534668	Žleby	1	5	53	53	Občanská demokratická strana	Občanská demokratická strana	ODS	1	053	813	24.58	2