OKRES	KODZASTUP	NAZEVZAST	COBVODU	POR_STR_HL	OSTRANA	VSTRANA	NAZEVCELK	ZKRATKAO30	ZKRATKAO8	POCSTR_SLO	SLOZENI	HLASY_STR	PROCHLSTR	MAND_STR
4207	568007	Chabařovice	1	1	7	7	Česká strana sociálně demokratická	Česká str.sociálně demokrat.	ČSSD	1	007	872	7.33	1
4207	568007	Chabařovice	1	2	53	53	Občanská demokratická strana	Občanská demokratická strana	ODS	1	053	2736	23.01	3
4207	568007	Chabařovice	1	3	129	129	SNK Evropští demokraté	SNK Evropští demokraté	SNK ED	1	129	4330	36.42	6
4207	568007	Chabařovice	1	4	47	47	Komunistická strana Čech a Moravy	Komunistická str.Čech a Moravy	KSČM	1	047	1858	15.63	2
4207	568007	Chabařovice	1	5	142	142	Sdružení pro zdraví, sport a prosperitu	Sdr.pro zdr.,sport a prosper.	SZSP	1	142	2090	17.58	3