OKRES	KODZASTUP	NAZEVZAST	COBVODU	POR_STR_HL	OSTRANA	VSTRANA	NAZEVCELK	ZKRATKAO30	ZKRATKAO8	POCSTR_SLO	SLOZENI	HLASY_STR	PROCHLSTR	MAND_STR
2109	538710	Řehenice	1	1	901	90	Sdružení nezávislých kandidátů CESTA Z MĚSTA	Sdruž.nezáv.kand.CESTA Z MĚSTA	SNK CZM	1	080	107	39.75	1
2109	538710	Řehenice	1	2	806	80	Miroslav Samek, nezávislý kandidát	Miroslav Samek, NK	NK	1	080	115	85.45	1
2109	538710	Řehenice	1	3	804	80	Zdeněk Kročák, nezávislý kandidát	Zdeněk Kročák, NK	NK	1	080	121	89.91	1
2109	538710	Řehenice	1	4	803	80	Josef Khek, nezávislý kandidát	Josef Khek, NK	NK	1	080	119	88.42	1
2109	538710	Řehenice	1	5	802	80	Martina Nováková, nezávislý kandidát	Martina Nováková, NK	NK	1	080	104	77.28	0
2109	538710	Řehenice	1	6	805	80	Norbert Newald, nezávislý kandidát	Norbert Newald, NK	NK	1	080	135	100.31	1
2109	538710	Řehenice	1	7	801	80	Pavel Zoula, nezávislý kandidát	Pavel Zoula, NK	NK	1	080	114	84.71	1
2109	538710	Řehenice	1	8	807	80	František Ondřich, nezávislý kandidát	František Ondřich, NK	NK	1	080	127	94.37	1