OKRES	KODZASTUP	NAZEVZAST	COBVODU	POR_STR_HL	OSTRANA	VSTRANA	NAZEVCELK	ZKRATKAO30	ZKRATKAO8	POCSTR_SLO	SLOZENI	HLASY_STR	PROCHLSTR	MAND_STR
5201	573621	Hvozdnice	1	1	901	90	Sdružení nezávislých kandidátů - Hvozdnice	SNK - Hvozdnice	SNK	1	080	474	66.47	6
5201	573621	Hvozdnice	1	2	803	80	Jan Špicar, nezávislý kandidát	Jan Špicar, NK	NK	1	080	54	53.01	0
5201	573621	Hvozdnice	1	3	804	80	Jiří Novotný, nezávislý kandidát	Jiří Novotný, NK	NK	1	080	50	49.08	0
5201	573621	Hvozdnice	1	4	801	80	Jiří Ceral, nezávislý kandidát	Jiří Ceral, NK	NK	1	080	73	71.66	1
5201	573621	Hvozdnice	1	5	802	80	David Pekáč, nezávislý kandidát	David Pekáč, NK	NK	1	080	62	60.86	0