OKRES	KODZASTUP	NAZEVZAST	COBVODU	POR_STR_HL	OSTRANA	VSTRANA	NAZEVCELK	ZKRATKAO30	ZKRATKAO8	POCSTR_SLO	SLOZENI	HLASY_STR	PROCHLSTR	MAND_STR
4103	560359	Habartov	1	1	88	88	NEZÁVISLÍ	NEZÁVISLÍ	NEZ	1	088	4797	19.3	4
4103	560359	Habartov	1	2	53	53	Občanská demokratická strana	Občanská demokratická strana	ODS	1	053	8430	33.92	8
4103	560359	Habartov	1	3	172	172	NEZÁVISLÍ DEMOKRATÉ (předseda V.Železný)	NEZ.DEMOKRATÉ(předs.V.Železný)	NEZ/DEM	1	172	1487	5.98	1
4103	560359	Habartov	1	4	7	7	Česká strana sociálně demokratická	Česká str.sociálně demokrat.	ČSSD	1	007	6065	24.4	5
4103	560359	Habartov	1	5	47	47	Komunistická strana Čech a Moravy	Komunistická str.Čech a Moravy	KSČM	1	047	4071	16.38	3