OKRES	KODZASTUP	NAZEVZAST	COBVODU	POR_STR_HL	OSTRANA	VSTRANA	NAZEVCELK	ZKRATKAO30	ZKRATKAO8	POCSTR_SLO	SLOZENI	HLASY_STR	PROCHLSTR	MAND_STR
6207	594873	Šanov	1	1	903	90	Prosperita	Prosperita	Prosperi	1	080	1089	13.81	2
6207	594873	Šanov	1	2	901	90	Za rozvoj Šanova	Za rozvoj Šanova	Za r.Šan	1	080	3142	39.85	6
6207	594873	Šanov	1	3	902	90	Nezávislé sdružení nezávislých kandidátů obce Šanova	Nez. sdr.nezávislých kand.Šan	Nez.sdr.	1	080	1191	15.1	2
6207	594873	Šanov	1	4	47	47	Komunistická strana Čech a Moravy	Komunistická str.Čech a Moravy	KSČM	1	047	1421	18.02	3
6207	594873	Šanov	1	5	7	7	Česká strana sociálně demokratická	Česká str.sociálně demokrat.	ČSSD	1	007	1041	14.14	2