OKRES	KODZASTUP	NAZEVZAST	COBVODU	POR_STR_HL	OSTRANA	VSTRANA	NAZEVCELK	ZKRATKAO30	ZKRATKAO8	POCSTR_SLO	SLOZENI	HLASY_STR	PROCHLSTR	MAND_STR
5202	572781	Cerekvice nad Bystřicí	1	1	906	90	Sdružení nezávislých kandidátů  Za obnovu venkova Cerekvice - Třebovětice	SNK  Za obnovu venkova C.-T.	SNK	1	080	241	17.6	0
5202	572781	Cerekvice nad Bystřicí	1	2	905	90	Sdružení nezávislých kandidátů   Klub šoférů	SNK  Klub šoférů	SNK	1	080	280	20.45	1
5202	572781	Cerekvice nad Bystřicí	1	3	902	90	Sdružení nezávislých kandidátů  Cerekvice nad Bystřicí a Třebovětice	SNK Cerekvice n/B aTřebovětice	SNK	1	080	1377	44.7	5
5202	572781	Cerekvice nad Bystřicí	1	4	901	90	Sdružení nezávislých kandidátů Třebovětice - Cerekvice	SNK Třebovětice-Cerekvice	SNK	1	080	720	23.37	2
5202	572781	Cerekvice nad Bystřicí	1	5	903	90	Sdružení nezávislých kandidátů   Obcí Cerekvice - Třebovětice	SNK Obcí Cerekvice-Třebovětice	SNK	1	080	263	19.21	1
5202	572781	Cerekvice nad Bystřicí	1	6	904	90	Sdružení nezávislých kandidátů   Pro obce Třebovětice - Cerekvice	SNK  Pro obce Třebov. a Cerek.	SNK	1	080	199	14.53	0