OKRES	KODZASTUP	NAZEVZAST	COBVODU	POR_STR_HL	OSTRANA	VSTRANA	NAZEVCELK	ZKRATKAO30	ZKRATKAO8	POCSTR_SLO	SLOZENI	HLASY_STR	PROCHLSTR	MAND_STR
3105	550167	Čkyně	1	1	714	714	Strana svobodných občanů	Strana svobodných občanů	Svobodní	1	714	1362	20.05	2
3105	550167	Čkyně	1	2	801	80	Ing. Jaroslav Tůma, nezávislý kandidát	Ing. Jaroslav Tůma, NK	NK	1	080	171	27.69	0
3105	550167	Čkyně	1	3	901	90	Sdružení nezávislých kandidátů Čkyně	SNK Čkyně	SNK	1	080	3722	54.79	7
3105	550167	Čkyně	1	4	483	483	Za kvalitnější život v obci	Za kvalitnější život v obci		2	080,724	594	10.68	1
3105	550167	Čkyně	1	5	902	90	Občanské sdružení za rozvoj Čkyňska	Obč. sdruž. za rozvoj Čkyňska	SNK	1	080	943	13.88	1