OKRES	KODZASTUP	NAZEVZAST	COBVODU	POR_STR_HL	OSTRANA	VSTRANA	NAZEVCELK	ZKRATKAO30	ZKRATKAO8	POCSTR_SLO	SLOZENI	HLASY_STR	PROCHLSTR	MAND_STR
2108	537951	Vlkov pod Oškobrhem	1	1	806	80	František Beitler, nezávislý kandidát	František Beitler, NK	NK	1	080	32	53.87	1
2108	537951	Vlkov pod Oškobrhem	1	2	801	80	František Poborský, nezávislý kandidát	František Poborský, NK	NK	1	080	26	43.77	0
2108	537951	Vlkov pod Oškobrhem	1	3	804	80	Kateřina Nevoralová, nezávislý kandidát	Kateřina Nevoralová, NK	NK	1	080	56	94.27	1
2108	537951	Vlkov pod Oškobrhem	1	4	803	80	Jan Ouředníček, nezávislý kandidát	Jan Ouředníček, NK	NK	1	080	29	48.82	0
2108	537951	Vlkov pod Oškobrhem	1	5	809	80	Eduard Baumgartner, nezávislý kandidát	Eduard Baumgartner, NK	NK	1	080	56	94.27	1
2108	537951	Vlkov pod Oškobrhem	1	6	808	80	Václav Fiala, nezávislý kandidát	Václav Fiala, NK	NK	1	080	36	60.6	1
2108	537951	Vlkov pod Oškobrhem	1	7	807	80	Tereza Šrámková, nezávislý kandidát	Tereza Šrámková, NK	NK	1	080	11	18.51	0
2108	537951	Vlkov pod Oškobrhem	1	8	802	80	Josef Ouředníček, nezávislý kandidát	Josef Ouředníček, NK	NK	1	080	9	15.15	0
2108	537951	Vlkov pod Oškobrhem	1	9	805	80	Vladimíra Bartůňková, nezávislý kandidát	Vladimíra Bartůňková, NK	NK	1	080	42	70.7	1