OKRES	KODZASTUP	NAZEVZAST	COBVODU	POR_STR_HL	OSTRANA	VSTRANA	NAZEVCELK	ZKRATKAO30	ZKRATKAO8	POCSTR_SLO	SLOZENI	HLASY_STR	PROCHLSTR	MAND_STR
3101	544485	Hluboká nad Vltavou	1	1	129	129	SNK Evropští demokraté	SNK Evropští demokraté	SNK ED	1	129	3763	10.59	2
3101	544485	Hluboká nad Vltavou	1	2	112	112	Hnutí nezávislých za harmonický rozvoj obcí a měst	Hn.za harm.rozvoj obcí a měst	HNHRM	1	112	3855	10.85	2
3101	544485	Hluboká nad Vltavou	1	3	47	47	Komunistická strana Čech a Moravy	Komunistická str.Čech a Moravy	KSČM	1	047	3841	10.81	2
3101	544485	Hluboká nad Vltavou	1	4	901	90	Aliance normálních občanů ANO 2006	Aliance norm. občanů ANO 2006	SNK-CELK	1	080	4019	11.31	2
3101	544485	Hluboká nad Vltavou	1	5	7	7	Česká strana sociálně demokratická	Česká str.sociálně demokrat.	ČSSD	1	007	3343	9.41	2
3101	544485	Hluboká nad Vltavou	1	6	53	53	Občanská demokratická strana	Občanská demokratická strana	ODS	1	053	12439	35.01	8
3101	544485	Hluboká nad Vltavou	1	7	1	1	Křesťanská a demokratická unie - Československá strana lidová	Křesť.demokr.unie-Čs.str.lid.	KDU-ČSL	1	001	4261	11.99	3