OKRES	KODZASTUP	NAZEVZAST	COBVODU	POR_STR_HL	OSTRANA	VSTRANA	NAZEVCELK	ZKRATKAO30	ZKRATKAO8	POCSTR_SLO	SLOZENI	HLASY_STR	PROCHLSTR	MAND_STR
8103	598917	Karviná	1	1	53	53	Občanská demokratická strana	Občanská demokratická strana	ODS	1	053	104177	20.38	9
8103	598917	Karviná	1	2	5	5	Strana zelených	Strana zelených	SZ	1	005	19286	3.77	0
8103	598917	Karviná	1	3	152	152	Národní strana	Národní strana	NS	1	152	3168	0.62	0
8103	598917	Karviná	1	4	7	7	Česká strana sociálně demokratická	Česká str.sociálně demokrat.	ČSSD	1	007	150058	29.36	13
8103	598917	Karviná	1	5	47	47	Komunistická strana Čech a Moravy	Komunistická str.Čech a Moravy	KSČM	1	047	170027	33.27	14
8103	598917	Karviná	1	6	172	172	NEZÁVISLÍ DEMOKRATÉ (předseda V.Železný)	NEZ.DEMOKRATÉ(předs.V.Železný)	NEZ/DEM	1	172	4282	0.83	0
8103	598917	Karviná	1	7	392	392	Sdružení Naše Karvinsko SNK Evropští demokraté a Coexistentia	Naše Karvinsko		2	072,080	34121	6.67	3
8103	598917	Karviná	1	8	1	1	Křesťanská a demokratická unie - Československá strana lidová	Křesť.demokr.unie-Čs.str.lid.	KDU-ČSL	1	001	25812	5.05	2