OKRES	KODZASTUP	NAZEVZAST	COBVODU	POR_STR_HL	OSTRANA	VSTRANA	NAZEVCELK	ZKRATKAO30	ZKRATKAO8	POCSTR_SLO	SLOZENI	HLASY_STR	PROCHLSTR	MAND_STR
7202	550752	Staré Město	1	1	1	1	Křesťanská a demokratická unie - Československá strana lidová	Křesť.demokr.unie-Čs.str.lid.	KDU-ČSL	1	001	15847	40.23	8
7202	550752	Staré Město	1	2	1430	1430	Staroměstské sdružení, Soukromníci a Svobodní	Starom. sdruž., Soukr. a Svob.	Svob+Soukrom+NK	3	080,714,716	4611	11.7	2
7202	550752	Staré Město	1	3	47	47	Komunistická strana Čech a Moravy	Komunistická str.Čech a Moravy	KSČM	1	047	1636	7.06	0
7202	550752	Staré Město	1	4	7	7	Česká strana sociálně demokratická	Česká str.sociálně demokrat.	ČSSD	1	007	1806	7.08	0
7202	550752	Staré Město	1	5	53	53	Občanská demokratická strana	Občanská demokratická strana	ODS	1	053	3228	8.19	1
7202	550752	Staré Město	1	6	166	166	STAROSTOVÉ A NEZÁVISLÍ	STAROSTOVÉ A NEZÁVISLÍ	STAN	1	166	12263	31.13	6