OKRES	KODZASTUP	NAZEVZAST	COBVODU	POR_STR_HL	OSTRANA	VSTRANA	NAZEVCELK	ZKRATKAO30	ZKRATKAO8	POCSTR_SLO	SLOZENI	HLASY_STR	PROCHLSTR	MAND_STR
4201	562351	Benešov nad Ploučnicí	1	1	53	53	Občanská demokratická strana	Občanská demokratická strana	ODS	1	053	5124	32.07	5
4201	562351	Benešov nad Ploučnicí	1	2	47	47	Komunistická strana Čech a Moravy	Komunistická str.Čech a Moravy	KSČM	1	047	2377	14.88	2
4201	562351	Benešov nad Ploučnicí	1	3	901	90	Sdružení nezávislých kandidátů Pro Bene	Sdruž.nezáv.kand.Pro Bene	SNKPB	1	080	3796	23.76	4
4201	562351	Benešov nad Ploučnicí	1	4	1	1	Křesťanská a demokratická unie - Československá strana lidová	Křesť.demokr.unie-Čs.str.lid.	KDU-ČSL	1	001	1310	8.2	1
4201	562351	Benešov nad Ploučnicí	1	5	7	7	Česká strana sociálně demokratická	Česká str.sociálně demokrat.	ČSSD	1	007	3367	21.07	3