OKRES	KODZASTUP	NAZEVZAST	COBVODU	POR_STR_HL	OSTRANA	VSTRANA	NAZEVCELK	ZKRATKAO30	ZKRATKAO8	POCSTR_SLO	SLOZENI	HLASY_STR	PROCHLSTR	MAND_STR
5203	574627	Vršovka	1	1	802	80	Jiří Teplý, nezávislý kandidát	Jiří Teplý, NK	NK	1	080	60	90.36	1
5203	574627	Vršovka	1	2	804	80	Aleš Sychrovský, nezávislý kandidát	Aleš Sychrovský, NK	NK	1	080	58	87.34	1
5203	574627	Vršovka	1	3	806	80	Ondřej Fábera, nezávislý kandidát	Ondřej Fábera, NK	NK	1	080	64	96.38	1
5203	574627	Vršovka	1	4	801	80	Miloš Řehák, nezávislý kandidát	Miloš Řehák, NK	NK	1	080	40	60.24	1
5203	574627	Vršovka	1	5	805	80	Libor Čečetka, nezávislý kandidát	Libor Čečetka, NK	NK	1	080	16	24.09	0
5203	574627	Vršovka	1	6	807	80	Leoš Přibyl, nezávislý kandidát	Leoš Přibyl, NK	NK	1	080	57	85.84	1
5203	574627	Vršovka	1	7	803	80	Petr Rydlo, nezávislý kandidát	Petr Rydlo, NK	NK	1	080	37	55.72	0