OKRES	KODZASTUP	NAZEVZAST	COBVODU	POR_STR_HL	OSTRANA	VSTRANA	NAZEVCELK	ZKRATKAO30	ZKRATKAO8	POCSTR_SLO	SLOZENI	HLASY_STR	PROCHLSTR	MAND_STR
5303	578169	Jarošov	1	1	804	80	Jaroslav Franc, nezávislý kandidát	Jaroslav Franc, NK	NK	1	080	66	77.77	1
5303	578169	Jarošov	1	2	807	80	Radek Nadrchal, nezávislý kandidát	Radek Nadrchal, NK	NK	1	080	50	58.92	0
5303	578169	Jarošov	1	3	802	80	Martina Horáková, nezávislý kandidát	Martina Horáková, NK	NK	1	080	70	82.49	1
5303	578169	Jarošov	1	4	803	80	Ing. Jan Šilar, nezávislý kandidát	Ing. Jan Šilar, NK	NK	1	080	61	71.88	1
5303	578169	Jarošov	1	5	806	80	Václav Lněnička, nezávislý kandidát	Václav Lněnička, NK	NK	1	080	69	81.31	1
5303	578169	Jarošov	1	6	1	1	Křesťanská a demokratická unie - Československá strana lidová	Křesť.demokr.unie-Čs.str.lid.	KDU-ČSL	1	001	173	50.96	2
5303	578169	Jarošov	1	7	801	80	Petr Lustyk, nezávislý kandidát	Petr Lustyk, NK	NK	1	080	65	76.59	1
5303	578169	Jarošov	1	8	805	80	Petr Stráník, nezávislý kandidát	Petr Stráník, NK	NK	1	080	40	47.13	0