OKRES	KODZASTUP	NAZEVZAST	COBVODU	POR_STR_HL	OSTRANA	VSTRANA	NAZEVCELK	ZKRATKAO30	ZKRATKAO8	POCSTR_SLO	SLOZENI	HLASY_STR	PROCHLSTR	MAND_STR
6105	596116	Měřín	1	1	902	90	PRO MĚSTYS MĚŘÍN	PRO MĚSTYS MĚŘÍN	SNK	1	080	1911	13.98	2
6105	596116	Měřín	1	2	7	7	Česká strana sociálně demokratická	Česká str.sociálně demokrat.	ČSSD	1	007	1351	9.88	1
6105	596116	Měřín	1	3	901	90	Občanské sdružení Rybáři Měřín	Občanské sdružení Rybáři Měřín	SNK	1	080	1205	8.81	1
6105	596116	Měřín	1	4	1	1	Křesťanská a demokratická unie - Československá strana lidová	Křesť.demokr.unie-Čs.str.lid.	KDU-ČSL	1	001	2589	18.94	3
6105	596116	Měřín	1	5	389	389	Občanská demokratická strana a nestraníci	ODS a nestraníci		2	053,080	3373	24.68	4
6105	596116	Měřín	1	6	903	90	Sdružení nezávislých kandidátů Měřín a Pustina	SNK Měřín a Pustina	SNK	1	080	3235	23.67	4