OKRES	KODZASTUP	NAZEVZAST	COBVODU	POR_STR_HL	OSTRANA	VSTRANA	NAZEVCELK	ZKRATKAO30	ZKRATKAO8	POCSTR_SLO	SLOZENI	HLASY_STR	PROCHLSTR	MAND_STR
5302	575526	Přepychy	1	1	803	80	Ladislav Slavík, nezávislý kandidát	Ladislav Slavík, NK	NK	1	080	44	89.27	1
5302	575526	Přepychy	1	2	808	80	František Vošoust, nezávislý kandidát	František Vošoust, NK	NK	1	080	23	46.66	0
5302	575526	Přepychy	1	3	806	80	Radek Pavelka, DiS., nezávislý kandidát	Radek Pavelka, DiS., NK	NK	1	080	43	87.24	1
5302	575526	Přepychy	1	4	801	80	Pavel Sirůček, nezávislý kandidát	Pavel Sirůček, NK	NK	1	080	45	91.3	1
5302	575526	Přepychy	1	5	805	80	Jan Havlík, nezávislý kandidát	Jan Havlík, NK	NK	1	080	54	109.56	1
5302	575526	Přepychy	1	6	802	80	Aleš Homola, nezávislý kandidát	Aleš Homola, NK	NK	1	080	24	48.69	1
5302	575526	Přepychy	1	7	807	80	Věra Horynová, nezávislý kandidát	Věra Horynová, NK	NK	1	080	18	36.52	0
5302	575526	Přepychy	1	8	804	80	Pavel Šimák, nezávislý kandidát	Pavel Šimák, NK	NK	1	080	43	87.24	1
5302	575526	Přepychy	1	9	809	80	Ing. Renata Špásová, nezávislý kandidát	Ing. Renata Špásová, NK	NK	1	080	51	103.47	1