OKRES	KODZASTUP	NAZEVZAST	COBVODU	POR_STR_HL	OSTRANA	VSTRANA	NAZEVCELK	ZKRATKAO30	ZKRATKAO8	POCSTR_SLO	SLOZENI	HLASY_STR	PROCHLSTR	MAND_STR
5202	573507	Stará Paka	1	1	901	90	Sbor dobrovolných hasičů	Sbor dobrovolných hasičů	SNK	1	080	1254	17.71	2
5202	573507	Stará Paka	1	2	1	1	Křesťanská a demokratická unie - Československá strana lidová	Křesť.demokr.unie-Čs.str.lid.	KDU-ČSL	1	001	849	11.99	1
5202	573507	Stará Paka	1	3	389	389	Sdružení Občanské demokratické strany a nezávislých kandidátů	Sdružení ODS, NK		2	053,080	2436	34.4	3
5202	573507	Stará Paka	1	4	902	90	TJ Sokol Stará Paka	TJ Sokol Stará Paka	SNK	1	080	1381	19.5	2
5202	573507	Stará Paka	1	5	47	47	Komunistická strana Čech a Moravy	Komunistická str.Čech a Moravy	KSČM	1	047	718	10.14	1
5202	573507	Stará Paka	1	6	7	7	Česká strana sociálně demokratická	Česká str.sociálně demokrat.	ČSSD	1	007	442	6.24	0