OKRES	KODZASTUP	NAZEVZAST	COBVODU	POR_STR_HL	OSTRANA	VSTRANA	NAZEVCELK	ZKRATKAO30	ZKRATKAO8	POCSTR_SLO	SLOZENI	HLASY_STR	PROCHLSTR	MAND_STR
6103	547549	Bohdalín	1	1	47	47	Komunistická strana Čech a Moravy	Komunistická str.Čech a Moravy	KSČM	1	047	60	66.35	1
6103	547549	Bohdalín	1	2	807	80	Michal Randl, nezávislý kandidát	Michal Randl, NK	NK	1	080	83	91.78	1
6103	547549	Bohdalín	1	3	805	80	Marie Strašíková, nezávislý kandidát	Marie Strašíková, NK	NK	1	080	56	61.92	0
6103	547549	Bohdalín	1	4	802	80	Jiří Vyhnal, nezávislý kandidát	Jiří Vyhnal, NK	NK	1	080	87	96.2	1
6103	547549	Bohdalín	1	5	806	80	Miloslav Soukal, nezávislý kandidát	Miloslav Soukal, NK	NK	1	080	74	81.83	1
6103	547549	Bohdalín	1	6	804	80	Zdeňka Böhmová, nezávislý kandidát	Zdeňka Böhmová, NK	NK	1	080	38	42.02	0
6103	547549	Bohdalín	1	7	803	80	Petr Hájek, nezávislý kandidát	Petr Hájek, NK	NK	1	080	83	91.78	1
6103	547549	Bohdalín	1	8	808	80	Josef Staněk, nezávislý kandidát	Josef Staněk, NK	NK	1	080	84	92.89	1
6103	547549	Bohdalín	1	9	801	80	Lenka Kotková, nezávislý kandidát	Lenka Kotková, NK	NK	1	080	68	75.19	1