OKRES	KODZASTUP	NAZEVZAST	COBVODU	POR_STR_HL	OSTRANA	VSTRANA	NAZEVCELK	ZKRATKAO30	ZKRATKAO8	POCSTR_SLO	SLOZENI	HLASY_STR	PROCHLSTR	MAND_STR
2104	533947	Žiželice	1	1	47	47	Komunistická strana Čech a Moravy	Komunistická str.Čech a Moravy	KSČM	1	047	925	15.17	1
2104	533947	Žiželice	1	2	1183	1183	Unie Hrdosti, Aktivity, Vlastenectví, Empatie a Lidskosti 2017	Unie H.A.V.E.L.17	Unie H.A.V.E.L.	1	1183	90	8.12	0
2104	533947	Žiželice	1	3	902	90	Sdružení nezávislých kandidátů 2018	Sdružení nezávisl.kand.2018	SNK	1	080	2519	41.32	5
2104	533947	Žiželice	1	4	1	1	Křesťanská a demokratická unie - Československá strana lidová	Křesť.demokr.unie-Čs.str.lid.	KDU-ČSL	1	001	247	44.57	0
2104	533947	Žiželice	1	5	901	90	Žiželicko 2018 - sdružení nezávislých kandidátů	Žiželicko 2018 - SNK	SNK	1	080	2314	37.96	5