OKRES	KODZASTUP	NAZEVZAST	COBVODU	POR_STR_HL	OSTRANA	VSTRANA	NAZEVCELK	ZKRATKAO30	ZKRATKAO8	POCSTR_SLO	SLOZENI	HLASY_STR	PROCHLSTR	MAND_STR
3201	554006	Nemanice	1	1	47	47	Komunistická strana Čech a Moravy	Komunistická str.Čech a Moravy	KSČM	1	047	155	23.01	1
3201	554006	Nemanice	1	2	802	80	Radoslav Maršalek, nezávislý kandidát	Radoslav Maršalek, NK	NK	1	080	21	15.58	0
3201	554006	Nemanice	1	3	801	80	Radek Talaš, nezávislý kandidát	Radek Talaš, NK	NK	1	080	18	13.36	0
3201	554006	Nemanice	1	4	806	80	Simon Manowicz, nezávislý kandidát	Simon Manowicz, NK	NK	1	080	18	13.36	0
3201	554006	Nemanice	1	5	803	80	Milada Křížová, nezávislý kandidát	Milada Křížová, NK	NK	1	080	14	10.39	0
3201	554006	Nemanice	1	6	804	80	Jana Brodská, nezávislý kandidát	Jana Brodská, NK	NK	1	080	21	15.58	0
3201	554006	Nemanice	1	7	805	80	Jan Talaš, nezávislý kandidát	Jan Talaš, NK	NK	1	080	20	14.84	0
3201	554006	Nemanice	1	8	902	90	Sdružení nezávislých kandidátů - Vše pro obec	Sdruž.nezáv.kand.-Vše pro obec	SNK-VPO	1	080	538	57.05	5
3201	554006	Nemanice	1	9	901	90	Naděje pro Vás a Vaše děti	SNK Naděje pro Vás a Vaše děti	SNK-NPVV	1	080	138	14.63	1