OKRES	KODZASTUP	NAZEVZAST	COBVODU	POR_STR_HL	OSTRANA	VSTRANA	NAZEVCELK	ZKRATKAO30	ZKRATKAO8	POCSTR_SLO	SLOZENI	HLASY_STR	PROCHLSTR	MAND_STR
2110	539686	Statenice	1	1	389	389	Sdružení Občanské demokratické strany a nezávislých kandidátů	Sdružení ODS a NK		2	053,080	1059	25.01	2
2110	539686	Statenice	1	2	901	90	PRO STATENICE A ČERNÝ VŮL	PRO STATENICE A ČERNÝ VŮL	SNK	1	080	715	16.88	2
2110	539686	Statenice	1	3	480	480	TOP	TOP		2	080,721	848	20.02	2
2110	539686	Statenice	1	4	902	90	Sdružení nezávislých kandidátů, pro Statenice a Černý Vůl, 2014	SNK, pro Statenice a Černý Vůl	SNK	1	080	651	15.37	1
2110	539686	Statenice	1	5	903	90	Sdružení pro rozvoj Statenic a Černého Vola	Sdružení pro rozvoj Statenic	SNK	1	080	961	22.69	2