OKRES	KODZASTUP	NAZEVZAST	COBVODU	POR_STR_HL	OSTRANA	VSTRANA	NAZEVCELK	ZKRATKAO30	ZKRATKAO8	POCSTR_SLO	SLOZENI	HLASY_STR	PROCHLSTR	MAND_STR
6101	573566	Bělá	1	1	807	80	Milan Tvrdík, nezávislý kandidát	Milan Tvrdík, NK	NK	1	080	113	98.38	1
6101	573566	Bělá	1	2	806	80	Pavel Lhoťan, nezávislý kandidát	Pavel Lhoťan, NK	NK	1	080	128	111.44	1
6101	573566	Bělá	1	3	808	80	Jiří Prchal, nezávislý kandidát	Jiří Prchal, NK	NK	1	080	105	91.41	1
6101	573566	Bělá	1	4	805	80	Zdeněk Kalhotka, nezávislý kandidát	Zdeněk Kalhotka, NK	NK	1	080	88	76.61	1
6101	573566	Bělá	1	5	801	80	Petr Flekal, nezávislý kandidát	Petr Flekal, NK	NK	1	080	119	103.6	1
6101	573566	Bělá	1	6	802	80	Pavel Černý, nezávislý kandidát	Pavel Černý, NK	NK	1	080	92	80.09	1
6101	573566	Bělá	1	7	803	80	Aleš Buchta, nezávislý kandidát	Aleš Buchta, NK	NK	1	080	86	74.87	1
6101	573566	Bělá	1	8	804	80	Ing. Eva Skalická, nezávislý kandidát	Ing. Eva Skalická, NK	NK	1	080	73	63.55	0