OKRES	KODZASTUP	NAZEVZAST	COBVODU	POR_STR_HL	OSTRANA	VSTRANA	NAZEVCELK	ZKRATKAO30	ZKRATKAO8	POCSTR_SLO	SLOZENI	HLASY_STR	PROCHLSTR	MAND_STR
3205	530271	Sedlec	1	1	801	80	Radek Knedlhans, nezávislý kandidát	Radek Knedlhans, NK	NK	1	080	30	78.65	1
3205	530271	Sedlec	1	2	808	80	Roman Dvořáček, nezávislý kandidát	Roman Dvořáček, NK	NK	1	080	31	81.27	1
3205	530271	Sedlec	1	3	804	80	Alena Čechová, nezávislý kandidát	Alena Čechová, NK	NK	1	080	35	91.76	1
3205	530271	Sedlec	1	4	806	80	Martin Řenč, nezávislý kandidát	Martin Řenč, NK	NK	1	080	39	102.24	1
3205	530271	Sedlec	1	5	803	80	Jan Kožíšek, nezávislý kandidát	Jan Kožíšek, NK	NK	1	080	36	94.38	1
3205	530271	Sedlec	1	6	802	80	Václav Knedlhans, nezávislý kandidát	Václav Knedlhans, NK	NK	1	080	29	76.02	1
3205	530271	Sedlec	1	7	807	80	Irena Kutějová, nezávislý kandidát	Irena Kutějová, NK	NK	1	080	40	104.86	1
3205	530271	Sedlec	1	8	805	80	Markéta Řenčová, nezávislý kandidát	Markéta Řenčová, NK	NK	1	080	27	70.78	0