OKRES	KODZASTUP	NAZEVZAST	COBVODU	POR_STR_HL	OSTRANA	VSTRANA	NAZEVCELK	ZKRATKAO30	ZKRATKAO8	POCSTR_SLO	SLOZENI	HLASY_STR	PROCHLSTR	MAND_STR
3105	550167	Čkyně	1	1	901	90	Občanské sdružení za rozvoj Čkyňska	Obč.sdr.za rozvoj Čkyňska	SNK	1	080	1817	21.67	2
3105	550167	Čkyně	1	2	724	724	Strana Práv Občanů ZEMANOVCI	Strana Práv Občanů ZEMANOVCI	SPOZ	1	724	273	11.94	0
3105	550167	Čkyně	1	3	53	53	Občanská demokratická strana	Občanská demokratická strana	ODS	1	053	1821	21.72	2
3105	550167	Čkyně	1	4	714	714	Strana svobodných občanů	Strana svobodných občanů	Svobodní	1	714	827	9.86	1
3105	550167	Čkyně	1	5	902	90	Sdružení nezávislých kandidátů Čkyně	Sdruž .nez. kand. Čkyně	SNK	1	080	3644	43.47	6