OKRES	KODZASTUP	NAZEVZAST	COBVODU	POR_STR_HL	OSTRANA	VSTRANA	NAZEVCELK	ZKRATKAO30	ZKRATKAO8	POCSTR_SLO	SLOZENI	HLASY_STR	PROCHLSTR	MAND_STR
3107	563170	Svrabov	1	1	804	80	Jitka Mrázková, nezávislý kandidát	Jitka Mrázková, NK	NK	1	080	27	89.57	1
3107	563170	Svrabov	1	2	801	80	Marie Pavlíková, nezávislý kandidát	Marie Pavlíková, NK	NK	1	080	28	92.89	1
3107	563170	Svrabov	1	3	809	80	Zdeněk Procházka, nezávislý kandidát	Zdeněk Procházka, NK	NK	1	080	0	0	0
3107	563170	Svrabov	1	4	806	80	Hana Švecová, nezávislý kandidát	Hana Švecová, NK	NK	1	080	20	66.35	1
3107	563170	Svrabov	1	5	807	80	Milada Bauerová, nezávislý kandidát	Milada Bauerová, NK	NK	1	080	29	96.2	1
3107	563170	Svrabov	1	6	808	80	Ladislav Krejčí, nezávislý kandidát	Ladislav Krejčí, NK	NK	1	080	30	99.52	1
3107	563170	Svrabov	1	7	803	80	František Kluzák, nezávislý kandidát	František Kluzák, NK	NK	1	080	17	56.39	0
3107	563170	Svrabov	1	8	805	80	Jaroslava Slabá, nezávislý kandidát	Jaroslava Slabá, NK	NK	1	080	31	102.84	1
3107	563170	Svrabov	1	9	802	80	Josef Kluzák, nezávislý kandidát	Josef Kluzák, NK	NK	1	080	29	96.2	1