OKRES	KODZASTUP	NAZEVZAST	COBVODU	POR_STR_HL	OSTRANA	VSTRANA	NAZEVCELK	ZKRATKAO30	ZKRATKAO8	POCSTR_SLO	SLOZENI	HLASY_STR	PROCHLSTR	MAND_STR
5302	575569	Rohoznice	1	1	804	80	LENKA PIŠTOROVÁ	LENKA PIŠTOROVÁ	NK	1	080			
5302	575569	Rohoznice	1	2	803	80	nezávislý kandidát VĚRA POKORNÁ	NK VĚRA POKORNÁ	NK	1	080			
5302	575569	Rohoznice	1	3	901	90	SDRUŽENÍ NEZÁVISLÝCH KANDIDÁTŮ - PRO OBČANY	SNK - PRO OBČANY	SNK	1	080			
5302	575569	Rohoznice	1	4	805	80	nezávislý kandidát RADOMÍR BENĚK ml.	NK RADOMÍR BENĚK ml.	NK	1	080			
5302	575569	Rohoznice	1	5	801	80	nezávislý kandidát JOSEF TOMÁŠEK - velitel JSDH a SDH	NK JOSEF TOMÁŠEK	NK	1	080			
5302	575569	Rohoznice	1	6	802	80	nezávislý kandidát RADOMÍR BENĚK st.	NK RADOMÍR BENĚK st.	NK	1	080			