OKRES	KODZASTUP	NAZEVZAST	COBVODU	POR_STR_HL	OSTRANA	VSTRANA	NAZEVCELK	ZKRATKAO30	ZKRATKAO8	POCSTR_SLO	SLOZENI	HLASY_STR	PROCHLSTR	MAND_STR
8102	598348	Krmelín	1	1	53	53	Občanská demokratická strana	Občanská demokratická strana	ODS	1	053	5229	34.47	6
8102	598348	Krmelín	1	2	901	90	Krmelín 2010	Krmelín 2010	Krmelín	1	080	3311	21.83	3
8102	598348	Krmelín	1	3	1	1	Křesťanská a demokratická unie - Československá strana lidová	Křesť.demokr.unie-Čs.str.lid.	KDU-ČSL	1	001	2496	16.45	2
8102	598348	Krmelín	1	4	47	47	Komunistická strana Čech a Moravy	Komunistická str.Čech a Moravy	KSČM	1	047	2059	13.57	2
8102	598348	Krmelín	1	5	7	7	Česká strana sociálně demokratická	Česká str.sociálně demokrat.	ČSSD	1	007	2071	13.65	2