OKRES	KODZASTUP	NAZEVZAST	COBVODU	POR_STR_HL	OSTRANA	VSTRANA	NAZEVCELK	ZKRATKAO30	ZKRATKAO8	POCSTR_SLO	SLOZENI	HLASY_STR	PROCHLSTR	MAND_STR
4204	566241	Chožov	1	1	902	90	PRO LEPŠÍ VENKOV	PRO LEPŠÍ VENKOV	SNK	1	080	377	17.65	1
4204	566241	Chožov	1	2	801	80	Vít Konečný, nezávislý kandidát	Vít Konečný, NK	NK	1	080	24	10.11	0
4204	566241	Chožov	1	3	7	7	Česká strana sociálně demokratická	Česká str.sociálně demokrat.	ČSSD	1	007	499	23.37	2
4204	566241	Chožov	1	4	901	90	SDRUŽENÍ NEZÁVISLÝCH KANDIDÁTŮ OBCÍ CHOŽOV, MNICHOVSKÉHO TÝNCE, TŘTĚNA	SNK OBCÍ CHOŽOV, M.TÝNCE, TŘTĚ	SNK	1	080	411	19.25	2
4204	566241	Chožov	1	5	903	90	"""Za obec krásnější"""	"""Za obec krásnější"""	SNK	1	080	824	38.59	4