OKRES	KODZASTUP	NAZEVZAST	COBVODU	POR_STR_HL	OSTRANA	VSTRANA	NAZEVCELK	ZKRATKAO30	ZKRATKAO8	POCSTR_SLO	SLOZENI	HLASY_STR	PROCHLSTR	MAND_STR
6101	569321	Přibyslav	1	1	902	90	NEZÁVISLÍ PRO PŘIBYSLAV	NEZÁVISLÍ PRO PŘIBYSLAV	SNK	1	080	4159	17.52	3
6101	569321	Přibyslav	1	2	47	47	Komunistická strana Čech a Moravy	Komunistická str.Čech a Moravy	KSČM	1	047	2339	9.85	1
6101	569321	Přibyslav	1	3	901	90	Sdružení nezávislých kandidátů Přibyslav	Sdruž.nezáv.kand.Přibyslav	SNK	1	080	3456	14.56	2
6101	569321	Přibyslav	1	4	1	1	Křesťanská a demokratická unie - Československá strana lidová	Křesť.demokr.unie-Čs.str.lid.	KDU-ČSL	1	001	3673	15.47	2
6101	569321	Přibyslav	1	5	7	7	Česká strana sociálně demokratická	Česká str.sociálně demokrat.	ČSSD	1	007	4249	17.9	3
6101	569321	Přibyslav	1	6	53	53	Občanská demokratická strana	Občanská demokratická strana	ODS	1	053	5860	24.68	4