OKRES	KODZASTUP	NAZEVZAST	COBVODU	POR_STR_HL	OSTRANA	VSTRANA	NAZEVCELK	ZKRATKAO30	ZKRATKAO8	POCSTR_SLO	SLOZENI	HLASY_STR	PROCHLSTR	MAND_STR
6202	551031	Brno-sever	1	1	7	7	Česká strana sociálně demokratická	Česká str.sociálně demokrat.	ČSSD	1	007	118152	24.01	8
6202	551031	Brno-sever	1	2	1	1	Křesťanská a demokratická unie - Československá strana lidová	Křesť.demokr.unie-Čs.str.lid.	KDU-ČSL	1	001	55127	10.88	4
6202	551031	Brno-sever	1	3	172	172	NEZÁVISLÍ DEMOKRATÉ (předseda V.Železný)	NEZ.DEMOKRATÉ(předs.V.Železný)	NEZ/DEM	1	172	5779	1.17	0
6202	551031	Brno-sever	1	4	458	458	Společně pro Brno-sever: Strana zelených, Sdružení nestraníků a Brno 2006	Sp.pro Br.-sev.:SZ,SN a B2006		3	005,080,158	99908	19.72	7
6202	551031	Brno-sever	1	5	53	53	Občanská demokratická strana	Občanská demokratická strana	ODS	1	053	178673	35.28	13
6202	551031	Brno-sever	1	6	47	47	Komunistická strana Čech a Moravy	Komunistická str.Čech a Moravy	KSČM	1	047	48764	9.62	3