OKRES	KODZASTUP	NAZEVZAST	COBVODU	POR_STR_HL	OSTRANA	VSTRANA	NAZEVCELK	ZKRATKAO30	ZKRATKAO8	POCSTR_SLO	SLOZENI	HLASY_STR	PROCHLSTR	MAND_STR
6203	584126	Viničné Šumice	1	1	166	166	STAROSTOVÉ A NEZÁVISLÍ	STAROSTOVÉ A NEZÁVISLÍ	STAN	1	166	347	10.97	0
6203	584126	Viničné Šumice	1	2	901	90	Sdružení nezávislých kandidátů - Tělocvičná jednota Sokol Viničné Šumice	Sdr. nez. kandidátů-TJ Sokol	SNK	1	080	2648	55.85	6
6203	584126	Viničné Šumice	1	3	355	355	Křesťanská a demokratická unie-Československá strana lidová a nestraníci	KDU-ČSL a nestraníci		2	001,080	511	10.77	1
6203	584126	Viničné Šumice	1	4	903	90	Sdružení nezávislých kandidátů-Sbor dobrovolných hasičů Viničné Šumice	SNK-Sbor dobrovolných hasičů	SNK	1	080	579	12.21	1
6203	584126	Viničné Šumice	1	5	902	90	Sdružení nezávislých kandidátů - Naše obec	SNK - Naše obec	SNK	1	080	656	13.83	1