OKRES	KODZASTUP	NAZEVZAST	COBVODU	POR_STR_HL	OSTRANA	VSTRANA	NAZEVCELK	ZKRATKAO30	ZKRATKAO8	POCSTR_SLO	SLOZENI	HLASY_STR	PROCHLSTR	MAND_STR
7202	592269	Kněžpole	1	1	47	47	Komunistická strana Čech a Moravy	Komunistická str.Čech a Moravy	KSČM	1	047	720	17.76	1
7202	592269	Kněžpole	1	2	768	768	ANO 2011	ANO 2011	ANO 2011	1	768	1702	33.59	4
7202	592269	Kněžpole	1	3	901	90	"""NEZÁVISLÍ KNĚŽPOLE"""	"""NEZÁVISLÍ KNĚŽPOLE"""	SNK	1	080	2043	26.88	4
7202	592269	Kněžpole	1	4	1	1	Křesťanská a demokratická unie - Československá strana lidová	Křesť.demokr.unie-Čs.str.lid.	KDU-ČSL	1	001	2055	27.03	4
7202	592269	Kněžpole	1	5	7	7	Česká strana sociálně demokratická	Česká str.sociálně demokrat.	ČSSD	1	007	1080	16.39	2