OKRES	KODZASTUP	NAZEVZAST	COBVODU	POR_STR_HL	OSTRANA	VSTRANA	NAZEVCELK	ZKRATKAO30	ZKRATKAO8	POCSTR_SLO	SLOZENI	HLASY_STR	PROCHLSTR	MAND_STR
6103	549061	Věžná	1	1	801	80	Miroslav Zíka, nezávislý kandidát	Miroslav Zíka, NK	NK	1	080	33	57.03	0
6103	549061	Věžná	1	2	805	80	Jan Zíka, nezávislý kandidát	Jan Zíka, NK	NK	1	080	42	72.59	1
6103	549061	Věžná	1	3	802	80	Tomáš Kertis, nezávislý kandidát	Tomáš Kertis, NK	NK	1	080	47	81.23	1
6103	549061	Věžná	1	4	808	80	Jiří Kotrba, nezávislý kandidát	Jiří Kotrba, NK	NK	1	080	45	77.77	1
6103	549061	Věžná	1	5	809	80	Josef Mareš, nezávislý kandidát	Josef Mareš, NK	NK	1	080	50	86.41	1
6103	549061	Věžná	1	6	804	80	Jiří Dušek, nezávislý kandidát	Jiří Dušek, NK	NK	1	080	41	70.86	1
6103	549061	Věžná	1	7	803	80	Pavel Martinec, nezávislý kandidát	Pavel Martinec, NK	NK	1	080	49	84.69	1
6103	549061	Věžná	1	8	807	80	Ladislav Vlach, nezávislý kandidát	Ladislav Vlach, NK	NK	1	080	58	100.24	1
6103	549061	Věžná	1	9	806	80	Martin Svadba, nezávislý kandidát	Martin Svadba, NK	NK	1	080	40	69.13	0