OKRES	KODZASTUP	NAZEVZAST	COBVODU	POR_STR_HL	OSTRANA	VSTRANA	NAZEVCELK	ZKRATKAO30	ZKRATKAO8	POCSTR_SLO	SLOZENI	HLASY_STR	PROCHLSTR	MAND_STR
3207	541664	Záchlumí	1	1	801	80	Radka Křížová, nezávislý kandidát	NK	NK	1	080	90	71.11	1
3207	541664	Záchlumí	1	2	802	80	Radek Vašíček, nezávislý kandidát	NK	NK	1	080	54	42.66	0
3207	541664	Záchlumí	1	3	804	80	Jaroslav Kadlec, nezávislý kandidát	NK	NK	1	080	60	47.41	0
3207	541664	Záchlumí	1	4	806	80	František Štrobl, nezávislý kandidát	NK	NK	1	080	89	70.32	1
3207	541664	Záchlumí	1	5	803	80	Petr Kříž, nezávislý kandidát	NK	NK	1	080	94	74.27	1
3207	541664	Záchlumí	1	6	808	80	Vladimír Vácha, nezávislý kandidát	NK	NK	1	080	87	68.74	0
3207	541664	Záchlumí	1	7	7	7	Česká strana sociálně demokratická	Česká str.sociálně demokrat.	ČSSD	1	007	476	47.01	5
3207	541664	Záchlumí	1	8	807	80	Dana Váchová, nezávislý kandidát	NK	NK	1	080	112	88.49	1
3207	541664	Záchlumí	1	9	805	80	Josef Kozár, nezávislý kandidát	NK	NK	1	080	77	60.84	0