OKRES	KODZASTUP	NAZEVZAST	COBVODU	POR_STR_HL	OSTRANA	VSTRANA	NAZEVCELK	ZKRATKAO30	ZKRATKAO8	POCSTR_SLO	SLOZENI	HLASY_STR	PROCHLSTR	MAND_STR
5302	572845	Lány u Dašic	1	1	804	80	Petr Jordák, nezávislý kandidát	Petr Jordák, NK	NK	1	080	35	84.13	1
5302	572845	Lány u Dašic	1	2	803	80	Břetislav Dašek, nezávislý kandidát	Břetislav Dašek, NK	NK	1	080	40	96.15	1
5302	572845	Lány u Dašic	1	3	802	80	Josef Blažek, nezávislý kandidát	Josef Blažek, NK	NK	1	080	40	96.15	1
5302	572845	Lány u Dašic	1	4	801	80	Václav Malínský, nezávislý kandidát	Václav Malínský, NK	NK	1	080	54	129.8	1
5302	572845	Lány u Dašic	1	5	805	80	Jiří Kosina, nezávislý kandidát	Jiří Kosina, NK	NK	1	080	39	93.75	1