OKRES	KODZASTUP	NAZEVZAST	COBVODU	POR_STR_HL	OSTRANA	VSTRANA	NAZEVCELK	ZKRATKAO30	ZKRATKAO8	POCSTR_SLO	SLOZENI	HLASY_STR	PROCHLSTR	MAND_STR
3106	598909	Skály	1	1	807	80	Ing. Věra Havlanová, nezávislý kandidát	Ing. Věra Havlanová, NK	NK	1	080	44	92.3	1
3106	598909	Skály	1	2	808	80	Vlastimil Maroušek, nezávislý kandidát	Vlastimil Maroušek, NK	NK	1	080	37	77.62	1
3106	598909	Skály	1	3	801	80	Jitka Tesařová, nezávislý kandidát	Jitka Tesařová, NK	NK	1	080	48	100.69	1
3106	598909	Skály	1	4	806	80	David Perták, nezávislý kandidát	David Perták, NK	NK	1	080	34	71.32	1
3106	598909	Skály	1	5	802	80	Andrea Maroušková, nezávislý kandidát	Andrea Maroušková, NK	NK	1	080	15	31.46	0
3106	598909	Skály	1	6	804	80	Pavel Dunovský, nezávislý kandidát	Pavel Dunovský, NK	NK	1	080	23	48.25	0
3106	598909	Skály	1	7	803	80	Josef Uhlík, nezávislý kandidát	Josef Uhlík, NK	NK	1	080	32	67.13	1
3106	598909	Skály	1	8	805	80	František Regál, nezávislý kandidát	František Regál, NK	NK	1	080	23	48.25	0
3106	598909	Skály	1	9	809	80	Jiří Kroupa, nezávislý kandidát	Jiří Kroupa, NK	NK	1	080	30	62.93	1