OKRES	KODZASTUP	NAZEVZAST	COBVODU	POR_STR_HL	OSTRANA	VSTRANA	NAZEVCELK	ZKRATKAO30	ZKRATKAO8	POCSTR_SLO	SLOZENI	HLASY_STR	PROCHLSTR	MAND_STR
4101	554642	Mariánské Lázně	1	1	102	102	Unie svobody - Demokratická unie	Unie svobody-Demokratická unie	US-DEU	1	102	3574	6.12	1
4101	554642	Mariánské Lázně	1	2	901	90	Změna pro Mariánské Lázně	Změna pro Mariánské Lázně	ZPML	1	080	12488	16.29	3
4101	554642	Mariánské Lázně	1	3	7	7	Česká strana sociálně demokratická	Česká str.sociálně demokrat.	ČSSD	1	007	10362	13.51	3
4101	554642	Mariánské Lázně	1	4	53	53	Občanská demokratická strana	Občanská demokratická strana	ODS	1	053	20450	26.68	6
4101	554642	Mariánské Lázně	1	5	88	88	NEZÁVISLÍ	NEZÁVISLÍ	NEZ	1	088	11355	14.81	3
4101	554642	Mariánské Lázně	1	6	47	47	Komunistická strana Čech a Moravy	Komunistická str.Čech a Moravy	KSČM	1	047	7175	9.36	2
4101	554642	Mariánské Lázně	1	7	278	278	SNK Evropští demokraté a Volba pro město	SNK Evr. dem. a Vol. pro město		2	113,129	6581	8.58	2
4101	554642	Mariánské Lázně	1	8	1	1	Křesťanská a demokratická unie - Československá strana lidová	Křesť.demokr.unie-Čs.str.lid.	KDU-ČSL	1	001	4659	6.07	1