OKRES	KODZASTUP	NAZEVZAST	COBVODU	POR_STR_HL	OSTRANA	VSTRANA	NAZEVCELK	ZKRATKAO30	ZKRATKAO8	POCSTR_SLO	SLOZENI	HLASY_STR	PROCHLSTR	MAND_STR
6105	595683	Horní Rožínka	1	1	805	80	Václav Hřebíček, nezávislý kandidát	Václav Hřebíček, NK	NK	1	080	39	105.4	1
6105	595683	Horní Rožínka	1	2	801	80	Anna Střešňáková, nezávislý kandidát	Anna Střešňáková, NK	NK	1	080	30	81.08	1
6105	595683	Horní Rožínka	1	3	804	80	Josef Fendrych, nezávislý kandidát	Josef Fendrych, NK	NK	1	080	16	43.24	0
6105	595683	Horní Rožínka	1	4	806	80	Ing. Luboš Vetešník, nezávislý kandidát	Ing. Luboš Vetešník, NK	NK	1	080	38	102.7	1
6105	595683	Horní Rožínka	1	5	803	80	Jiří Hofman, nezávislý kandidát	Jiří Hofman, NK	NK	1	080	33	89.18	1
6105	595683	Horní Rožínka	1	6	802	80	Miroslav Nykoliv, nezávislý kandidát	Miroslav Nykoliv, NK	NK	1	080	29	78.37	1