OKRES	KODZASTUP	NAZEVZAST	COBVODU	POR_STR_HL	OSTRANA	VSTRANA	NAZEVCELK	ZKRATKAO30	ZKRATKAO8	POCSTR_SLO	SLOZENI	HLASY_STR	PROCHLSTR	MAND_STR
6101	569241	Pavlov	1	1	802	80	Pavla Sedláková, nezávislý kandidát	Pavla Sedláková, NK	NK	1	080	25	35.71	0
6101	569241	Pavlov	1	2	805	80	Josef Pavelka, nezávislý kandidát	Josef Pavelka, NK	NK	1	080	72	102.85	1
6101	569241	Pavlov	1	3	807	80	Alžběta Hrůzová, nezávislý kandidát	Alžběta Hrůzová, NK	NK	1	080	26	37.14	0
6101	569241	Pavlov	1	4	806	80	Roman Svoboda, nezávislý kandidát	Roman Svoboda, NK	NK	1	080	61	87.14	1
6101	569241	Pavlov	1	5	801	80	Roman Krecl, nezávislý kandidát	Roman Krecl, NK	NK	1	080	71	101.42	1
6101	569241	Pavlov	1	6	803	80	Ladislav Jahoda, nezávislý kandidát	Ladislav Jahoda, NK	NK	1	080	7	10	0
6101	569241	Pavlov	1	7	804	80	Zdeněk Pavelka, nezávislý kandidát	Zdeněk Pavelka, NK	NK	1	080	34	48.57	1
6101	569241	Pavlov	1	8	809	80	Václava Tvrdíková, nezávislý kandidát	Václava Tvrdíková, NK	NK	1	080	48	68.57	1
6101	569241	Pavlov	1	9	808	80	Martin Uher, nezávislý kandidát	Martin Uher, NK	NK	1	080	6	8.57	0