OKRES	KODZASTUP	NAZEVZAST	COBVODU	POR_STR_HL	OSTRANA	VSTRANA	NAZEVCELK	ZKRATKAO30	ZKRATKAO8	POCSTR_SLO	SLOZENI	HLASY_STR	PROCHLSTR	MAND_STR
5104	577685	Vyskeř	1	1	801	80	Petr Matuška, nezávislý kandidát	Petr Matuška, NK	NK	1	080	16	7.33	0
5104	577685	Vyskeř	1	2	802	80	STRANA SVOBODNÝCH OBČANŮ, nezávislý kandidát	STRANA SVOBODNÝCH OBČANŮ, NK	NK	1	080	52	23.84	0
5104	577685	Vyskeř	1	3	803	80	ROMAN MALÍK, nezávislý kandidát	ROMAN MALÍK, NK	NK	1	080	30	13.75	0
5104	577685	Vyskeř	1	4	901	90	Občané pro obec Vyskeř	Občané pro obec Vyskeř	SNK	1	080	481	24.5	2
5104	577685	Vyskeř	1	5	902	90	Sokol a ČČK Vyskeř	Sokol a ČČK Vyskeř	SNK	1	080	1384	70.5	7