OKRES	KODZASTUP	NAZEVZAST	COBVODU	POR_STR_HL	OSTRANA	VSTRANA	NAZEVCELK	ZKRATKAO30	ZKRATKAO8	POCSTR_SLO	SLOZENI	HLASY_STR	PROCHLSTR	MAND_STR
2112	542504	Třeboc	1	1	805	80	JIŘÍ SUTTR, nezávislý kandidát	JIŘÍ SUTTR, NK	NK	1	080	53	71.81	1
2112	542504	Třeboc	1	2	803	80	LENKA KOVÁČOVÁ, nezávislý kandidát	LENKA KOVÁČOVÁ, NK	NK	1	080	29	39.29	0
2112	542504	Třeboc	1	3	807	80	PETR FRIC, nezávislý kandidát	PETR FRIC, NK	NK	1	080	51	69.1	1
2112	542504	Třeboc	1	4	802	80	Jana Majerová, nezávislý kandidát	Jana Majerová, NK	NK	1	080	24	32.52	0
2112	542504	Třeboc	1	5	801	80	TOMÁŠ MAJER, nezávislý kandidát	TOMÁŠ MAJER, NK	NK	1	080	20	27.1	0
2112	542504	Třeboc	1	6	804	80	KAREL RAIS, nezávislý kandidát	KAREL RAIS, NK	NK	1	080	64	86.72	1
2112	542504	Třeboc	1	7	808	80	ONDŘEJ HÁJEK, nezávislý kandidát	ONDŘEJ HÁJEK, NK	NK	1	080	63	85.36	1
2112	542504	Třeboc	1	8	806	80	PAVEL MORAVEC, nezávislý kandidát	PAVEL MORAVEC, NK	NK	1	080	65	88.07	1