OKRES	KODZASTUP	NAZEVZAST	COBVODU	POR_STR_HL	OSTRANA	VSTRANA	NAZEVCELK	ZKRATKAO30	ZKRATKAO8	POCSTR_SLO	SLOZENI	HLASY_STR	PROCHLSTR	MAND_STR
7103	549967	Hačky	1	1	804	80	Ladislav Chmelík, nezávislý kandidát	Ladislav Chmelík, NK	NK	1	080	30	46.35	0
7103	549967	Hačky	1	2	801	80	Miroslav Žítek, nezávislý kandidát	Miroslav Žítek, NK	NK	1	080	54	83.44	1
7103	549967	Hačky	1	3	1	1	Křesťanská a demokratická unie - Československá strana lidová	Křesť.demokr.unie-Čs.str.lid.	KDU-ČSL	1	001	194	74.94	4
7103	549967	Hačky	1	4	901	90	"Sdružení nezávislých kandidátů -Hnutí za obec:""S Vámi pro Vás"""	"SNK-Hnutí za obec:""S Vámi .."""	SNK-CELK	1	080	99	50.99	2
7103	549967	Hačky	1	5	803	80	Martin Drapl, nezávislý kandidát	Martin Drapl, NK	NK	1	080	42	64.9	0
7103	549967	Hačky	1	6	802	80	Václav Kyba, nezávislý kandidát	Václav Kyba, NK	NK	1	080	34	52.53	0