OKRES	KODZASTUP	NAZEVZAST	COBVODU	POR_STR_HL	OSTRANA	VSTRANA	NAZEVCELK	ZKRATKAO30	ZKRATKAO8	POCSTR_SLO	SLOZENI	HLASY_STR	PROCHLSTR	MAND_STR
5304	579963	Bučina	1	1	805	80	Michaela Šrajerová, nezávislý kandidát	Michaela Šrajerová, NK	NK	1	080	78	69.37	1
5304	579963	Bučina	1	2	801	80	Miroslav Voříšek, nezávislý kandidát	Miroslav Voříšek, NK	NK	1	080	118	104.95	1
5304	579963	Bučina	1	3	804	80	Václav Ludvíček, nezávislý kandidát	Václav Ludvíček, NK	NK	1	080	76	67.59	1
5304	579963	Bučina	1	4	806	80	Jaromír Kabrhel, nezávislý kandidát	Jaromír Kabrhel, NK	NK	1	080	88	78.27	1
5304	579963	Bučina	1	5	807	80	Miroslav Kazda, nezávislý kandidát	Miroslav Kazda, NK	NK	1	080	99	88.05	1
5304	579963	Bučina	1	6	803	80	Jaroslav Teplý, nezávislý kandidát	Jaroslav Teplý, NK	NK	1	080	111	98.72	1
5304	579963	Bučina	1	7	802	80	Lenka Prokšová, nezávislý kandidát	Lenka Prokšová, NK	NK	1	080	73	64.93	0
5304	579963	Bučina	1	8	808	80	Jiří Sekanina, nezávislý kandidát	Jiří Sekanina, NK	NK	1	080	39	34.68	0
5304	579963	Bučina	1	9	809	80	Petr Voříšek, nezávislý kandidát	Petr Voříšek, NK	NK	1	080	105	93.39	1