OKRES	KODZASTUP	NAZEVZAST	COBVODU	POR_STR_HL	OSTRANA	VSTRANA	NAZEVCELK	ZKRATKAO30	ZKRATKAO8	POCSTR_SLO	SLOZENI	HLASY_STR	PROCHLSTR	MAND_STR
4101	554693	Nebanice	1	1	804	80	Jan Vlach, nezávislý kandidát	Jan Vlach, NK	NK	1	080	13	10.04	0
4101	554693	Nebanice	1	2	901	90	Sdružení nezávislých kandidátů	Sdruž.nezáv.kand.	SNK	1	080	661	72.95	7
4101	554693	Nebanice	1	3	801	80	Alena Bukovická, nezávislý kandidát	Alena Bukovická, NK	NK	1	080	93	71.85	0
4101	554693	Nebanice	1	4	802	80	Milan Buga, nezávislý kandidát	Milan Buga, NK	NK	1	080	32	24.72	0
4101	554693	Nebanice	1	5	803	80	Jitka Vlachová, nezávislý kandidát	Jitka Vlachová, NK	NK	1	080	38	29.35	0
4101	554693	Nebanice	1	6	805	80	Miloslav Šimáček, nezávislý kandidát	Miloslav Šimáček, NK	NK	1	080	69	53.31	0