OKRES	KODZASTUP	NAZEVZAST	COBVODU	POR_STR_HL	OSTRANA	VSTRANA	NAZEVCELK	ZKRATKAO30	ZKRATKAO8	POCSTR_SLO	SLOZENI	HLASY_STR	PROCHLSTR	MAND_STR
6102	587583	Nevcehle	1	1	807	80	Petr Krejčí, nezávislý kandidát	Petr Krejčí, NK	NK	1	080	80	92.71	1
6102	587583	Nevcehle	1	2	804	80	Jiří Poukar, nezávislý kandidát	Jiří Poukar, NK	NK	1	080	87	100.82	1
6102	587583	Nevcehle	1	3	801	80	Milan Novotný, nezávislý kandidát	Milan Novotný, NK	NK	1	080	87	100.82	1
6102	587583	Nevcehle	1	4	808	80	Jitka Soukupová, nezávislý kandidát	Jitka Soukupová, NK	NK	1	080	71	82.28	1
6102	587583	Nevcehle	1	5	803	80	Libor Hák, nezávislý kandidát	Libor Hák, NK	NK	1	080	90	104.3	1
6102	587583	Nevcehle	1	6	806	80	Luboš Pelej, nezávislý kandidát	Luboš Pelej, NK	NK	1	080	85	98.5	1
6102	587583	Nevcehle	1	7	802	80	Jiří Lupač, nezávislý kandidát	Jiří Lupač, NK	NK	1	080	41	47.51	0
6102	587583	Nevcehle	1	8	805	80	Václav Poukar, nezávislý kandidát	Václav Poukar, NK	NK	1	080	63	73.01	1