OKRES	KODZASTUP	NAZEVZAST	COBVODU	POR_STR_HL	OSTRANA	VSTRANA	NAZEVCELK	ZKRATKAO30	ZKRATKAO8	POCSTR_SLO	SLOZENI	HLASY_STR	PROCHLSTR	MAND_STR
3101	544591	Chrášťany	1	1	902	90	Sdružení nezávislých kandidátů pro rozvoj obce	SNK pro rozvoj obce	SNK	1	080	682	17.95	2
3101	544591	Chrášťany	1	2	47	47	Komunistická strana Čech a Moravy	Komunistická str.Čech a Moravy	KSČM	1	047	874	16.87	2
3101	544591	Chrášťany	1	3	801	80	Stanislav Hubáček, nezávislý kandidát	Stanislav Hubáček, NK	NK	1	080	62	17.95	0
3101	544591	Chrášťany	1	4	901	90	Sdružení nezávislých kandidátů	Sdružení nezávislých kandidátů	SNK	1	080	2198	42.43	7
3101	544591	Chrášťany	1	5	1	1	Křesťanská a demokratická unie - Československá strana lidová	Křesť.demokr.unie-Čs.str.lid.	KDU-ČSL	1	001	1364	28.21	4