3101	545368	Žabovřesky	1	3	902	90	Sdružení nezávislých kandidátů Žabovřesky 1	SNK Žabovřesky 1	SNK	1	080	702	51.13	4
3101	545376	Žár	1	1	902	90	Za rozvoj obce - hasiči	Za rozvoj obce - hasiči	SNK	1	080	508	44.91	3
3101	545376	Žár	1	2	901	90	"""Sahoř"""	"""Sahoř"""	SNK	1	080	623	55.08	4
3101	545384	Žimutice	1	1	902	90	Nezávislí kandidáti II	Nezávislí kandidáti II	SNK	1	080	1212	37.67	5
3101	545384	Žimutice	1	2	901	90	Nezávislí kandidáti I	Nezávislí kandidáti I	SNK	1	080	2235	69.47	10
3101	549371	Dražíč	1	1	901	90	PRO VŠECHNY	PRO VŠECHNY	SNK	1	080	657	97.91	7
3101	549371	Dražíč	1	2	801	80	Milan Suchan, nezávislý kandidát	Milan Suchan, NK	NK	1	080	14	14.6	0
3101	551490	Branišov	1	1	902	90	SJEDNOCENÍ	SJEDNOCENÍ	SNK	1	080	341	33.13	2
3101	551490	Branišov	1	2	901	90	Občané Branišova	Občané Branišova	SNK	1	080	688	66.86	5
3101	551503	Čížkrajice	1	1	801	80	Petr Bedlán, nezávislý kandidát	Petr Bedlán, NK	NK	1	080	34	36.04	0
3101	551503	Čížkrajice	1	2	901	90	Nezávislí kandidáti	Nezávislí kandidáti	SNK	1	080	431	50.76	5
3101	551503	Čížkrajice	1	3	902	90	Sdružení žen	Sdružení žen	SNK	1	080	384	45.22	4
3101	598593	Heřmaň	1	1	805	80	Ing. Miroslava Machová, nezávislý kandidát	Ing. Miroslava Machová, NK	NK	1	080	28	34.44	0
3101	598593	Heřmaň	1	2	803	80	Ing. Jana Veselá, nezávislý kandidát	Ing. Jana Veselá, NK	NK	1	080	73	89.8	1
3101	598593	Heřmaň	1	3	802	80	František Fišer, nezávislý kandidát	František Fišer, NK	NK	1	080	37	45.51	0
3101	598593	Heřmaň	1	4	806	80	Jan Šuster, nezávislý kandidát	Jan Šuster, NK	NK	1	080	70	86.11	1
3101	598593	Heřmaň	1	5	809	80	Vojtěch Veselý, nezávislý kandidát	Vojtěch Veselý, NK	NK	1	080	51	62.74	0
3101	598593	Heřmaň	1	6	804	80	Ing. Lukáš Veselý, nezávislý kandidát	Ing. Lukáš Veselý, NK	NK	1	080	53	65.2	1
3101	598593	Heřmaň	1	7	807	80	Josef Milota, nezávislý kandidát	Josef Milota, NK	NK	1	080	58	71.35	1
3101	598593	Heřmaň	1	8	810	80	Iva Bestajovská, nezávislý kandidát	Iva Bestajovská, NK	NK	1	080	58	71.35	1
3101	598593	Heřmaň	1	9	808	80	Josef Šuster, nezávislý kandidát	Josef Šuster, NK	NK	1	080	66	81.19	1
3101	598593	Heřmaň	1	10	801	80	Ing. Václav Pexa, nezávislý kandidát	Ing. Václav Pexa, NK	NK	1	080	75	92.26	1
3101	598607	Hlincová Hora	1	1	901	90	Sdružení nezávislých kandidátů pro Hlincovou Horu	SNK pro Hlincovou Horu	SNK	1	080	606	100	7
3101	598615	Modrá Hůrka	1	1	901	90	SDRUŽENÍ MODRÁ HŮRKA A POŘEŽÁNKY	SDRUŽ. MODRÁ HŮRKA A POŘEŽÁNKY	SNK	1	080	229	87.73	5
3101	598615	Modrá Hůrka	1	2	902	90	STABILITA	STABILITA	SNK	1	080	32	15.32	0
3101	598976	Čenkov u Bechyně	1	1	801	80	Iva Ambrožová, nezávislý kandidát	Iva Ambrožová, NK	NK	1	080	12	43.52	0
3101	598976	Čenkov u Bechyně	1	2	805	80	Monika Jerhotová, nezávislý kandidát	Monika Jerhotová, NK	NK	1	080	23	83.41	1
3101	598976	Čenkov u Bechyně	1	3	803	80	Martina Jiříčková, nezávislý kandidát	Martina Jiříčková, NK	NK	1	080	33	119.68	1
3101	598976	Čenkov u Bechyně	1	4	804	80	František Suchan, nezávislý kandidát	František Suchan, NK	NK	1	080	22	79.79	1
3101	598976	Čenkov u Bechyně	1	5	802	80	Ing. Romana Hrušková, nezávislý kandidát	Ing. Romana Hrušková, NK	NK	1	080	21	76.16	1
3101	598976	Čenkov u Bechyně	1	6	806	80	Ing. Marie Tomanová, nezávislý kandidát I	Ing. Marie Tomanová, NK I	NK	1	080	29	105.18	1
3101	598976	Čenkov u Bechyně	1	7	807	80	Ing. Marie Tomanová, nezávislý kandidát II	Ing. Marie Tomanová, NK II	NK	1	080	31	112.43	1
3101	598976	Čenkov u Bechyně	1	8	808	80	Ing. Jana Říhová, nezávislý kandidát	Ing. Jana Říhová, NK	NK	1	080	22	79.79	1
3101	599778	Závraty	1	1	901	90	Nezávislí kandidáti pro obec Závraty	NK pro obec Závraty	SNK	1	080	110	100	7