OKRES	KODZASTUP	NAZEVZAST	COBVODU	POR_STR_HL	OSTRANA	VSTRANA	NAZEVCELK	ZKRATKAO30	ZKRATKAO8	POCSTR_SLO	SLOZENI	HLASY_STR	PROCHLSTR	MAND_STR
6105	595977	Kundratice	1	1	803	80	Miroslav Sysel, nezávislý kandidát	Miroslav Sysel, NK	NK	1	080	46	80.5	1
6105	595977	Kundratice	1	2	801	80	Stanislav Bajer, nezávislý kandidát	Stanislav Bajer, NK	NK	1	080	60	105	1
6105	595977	Kundratice	1	3	807	80	František Kudláč, nezávislý kandidát	František Kudláč, NK	NK	1	080	66	115.5	1
6105	595977	Kundratice	1	4	802	80	Iva Šotnerová, nezávislý kandidát	Iva Šotnerová, NK	NK	1	080	53	92.75	1
6105	595977	Kundratice	1	5	805	80	Jaromír Kopáček, nezávislý kandidát	Jaromír Kopáček, NK	NK	1	080	54	94.5	1
6105	595977	Kundratice	1	6	806	80	Roman Mička, nezávislý kandidát	Roman Mička, NK	NK	1	080	57	99.75	1
6105	595977	Kundratice	1	7	804	80	Bohuslava Rösslerová, nezávislý kandidát	Bohuslava Rösslerová, NK	NK	1	080	64	112	1