OKRES	KODZASTUP	NAZEVZAST	COBVODU	POR_STR_HL	OSTRANA	VSTRANA	NAZEVCELK	ZKRATKAO30	ZKRATKAO8	POCSTR_SLO	SLOZENI	HLASY_STR	PROCHLSTR	MAND_STR
7105	526169	Branná	1	1	901	90	Nezávislí z Branné	Nezávislí z Branné	SNK	1	080	158	14.79	1
7105	526169	Branná	1	2	902	90	Sdružení nezávislých kandidátů BRANNÁ I.	SNK BRANNÁ I.	SNK	1	080	225	21.06	2
7105	526169	Branná	1	3	1	1	Křesťanská a demokratická unie - Československá strana lidová	Křesť.demokr.unie-Čs.str.lid.	KDU-ČSL	1	001	302	28.27	2
7105	526169	Branná	1	4	904	90	SDRUŽENÍ NEZÁVISLÝCH KANDIDÁTŮ BRANNÁ 2018+	SNK BRANNÁ 2018+	SNK	1	080	174	16.29	1
7105	526169	Branná	1	5	903	90	Sdružení nezávislých kandidátů BRANNÁ II.	SNK BRANNÁ II.	SNK	1	080	209	19.56	1