OKRES	KODZASTUP	NAZEVZAST	COBVODU	POR_STR_HL	OSTRANA	VSTRANA	NAZEVCELK	ZKRATKAO30	ZKRATKAO8	POCSTR_SLO	SLOZENI	HLASY_STR	PROCHLSTR	MAND_STR
2101	529621	Divišov	1	1	902	90	HASIČI PRO LIDI	HASIČI PRO LIDI	SNK	1	080	2320	23.51	4
2101	529621	Divišov	1	2	158	158	"""Sdružení nestraníků"""	"""Sdružení nestraníků"""	SN	1	158	696	9.62	1
2101	529621	Divišov	1	3	7	7	Česká strana sociálně demokratická	Česká str.sociálně demokrat.	ČSSD	1	007	961	9.74	1
2101	529621	Divišov	1	4	901	90	Sdružení nezávislých kandidátů Divišova a okolí	SNK Divišova a okolí	SNK	1	080	4880	49.46	8
2101	529621	Divišov	1	5	1	1	Křesťanská a demokratická unie - Československá strana lidová	Křesť.demokr.unie-Čs.str.lid.	KDU-ČSL	1	001	1008	17.02	1