OKRES	KODZASTUP	NAZEVZAST	COBVODU	POR_STR_HL	OSTRANA	VSTRANA	NAZEVCELK	ZKRATKAO30	ZKRATKAO8	POCSTR_SLO	SLOZENI	HLASY_STR	PROCHLSTR	MAND_STR
7203	542784	Huslenky	1	1	721	721	TOP 09	TOP 09	TOP 09	1	721	2395	18.17	3
7203	542784	Huslenky	1	2	901	90	Sdružení pro rozvoj obce	Sdružení pro rozvoj obce	SNK	1	080	1654	13.44	2
7203	542784	Huslenky	1	3	7	7	Česká strana sociálně demokratická	Česká str.sociálně demokrat.	ČSSD	1	007	689	5.22	0
7203	542784	Huslenky	1	4	470	470	PRO ROZVOJ OBCE HUSLENKY	PRO ROZVOJ OBCE HUSLENKY	NA	2	080,166	6491	49.26	8
7203	542784	Huslenky	1	5	1	1	Křesťanská a demokratická unie - Československá strana lidová	Křesť.demokr.unie-Čs.str.lid.	KDU-ČSL	1	001	1948	14.78	2