OKRES	KODZASTUP	NAZEVZAST	COBVODU	POR_STR_HL	OSTRANA	VSTRANA	NAZEVCELK	ZKRATKAO30	ZKRATKAO8	POCSTR_SLO	SLOZENI	HLASY_STR	PROCHLSTR	MAND_STR
5205	548847	Zdobín	1	1	801	80	Nezávislý kandidát Luděk Zívr	NK Luděk Zívr	NK	1	080	56	146.81	1
5205	548847	Zdobín	1	2	806	80	Nezávislý kandidát Michal Nosek	NK Michal Nosek	NK	1	080	50	131.08	1
5205	548847	Zdobín	1	3	804	80	Nezávislý kandidát Jana Horáčková	NK Jana Horáčková	NK	1	080	27	70.78	1
5205	548847	Zdobín	1	4	805	80	Nezávislý kandidát Ivana Tučková	NK Ivana Tučková	NK	1	080	40	104.86	1
5205	548847	Zdobín	1	5	807	80	Nezávislý kandidát Miroslav Janeček	NK Miroslav Janeček	NK	1	080	37	97	1
5205	548847	Zdobín	1	6	803	80	Nezávislý kandidát Martin Mikeš	NK Martin Mikeš	NK	1	080	30	78.65	1
5205	548847	Zdobín	1	7	802	80	Nezávislý kandidát Vítězslav Mikeš	NK Vítězslav Mikeš	NK	1	080	27	70.78	1