OKRES	KODZASTUP	NAZEVZAST	COBVODU	POR_STR_HL	OSTRANA	VSTRANA	NAZEVCELK	ZKRATKAO30	ZKRATKAO8	POCSTR_SLO	SLOZENI	HLASY_STR	PROCHLSTR	MAND_STR
5101	562297	Žandov	1	1	475	475	Sdružení nezávislých kandidátů	Sdružení nezávislých kandidátů		2	080,703	5172	59.01	10
5101	562297	Žandov	1	2	801	80	FRANTIŠEK KALETUS, DiS., nezávislý kandidát	FRANTIŠEK KALETUS, DiS., NK	NK	1	080	90	15.4	0
5101	562297	Žandov	1	3	901	90	"""Nespokojení občané"""	"""Nespokojení občané"""	SNK	1	080	1370	23.44	2
5101	562297	Žandov	1	4	7	7	Česká strana sociálně demokratická	Česká str.sociálně demokrat.	ČSSD	1	007	936	10.68	1
5101	562297	Žandov	1	5	47	47	Komunistická strana Čech a Moravy	Komunistická str.Čech a Moravy	KSČM	1	047	1196	13.64	2