OKRES	KODZASTUP	NAZEVZAST	COBVODU	POR_STR_HL	OSTRANA	VSTRANA	NAZEVCELK	ZKRATKAO30	ZKRATKAO8	POCSTR_SLO	SLOZENI	HLASY_STR	PROCHLSTR	MAND_STR
4101	554740	Plesná	1	1	47	47	Komunistická strana Čech a Moravy	Komunistická str.Čech a Moravy	KSČM	1	047	927	16.04	2
4101	554740	Plesná	1	2	724	724	Strana Práv Občanů ZEMANOVCI	Strana Práv Občanů ZEMANOVCI	SPOZ	1	724	1333	23.07	2
4101	554740	Plesná	1	3	902	90	Sdružení nezávislých kandidátů města Plesná	Sdruž.nezáv.kand. města Plesná	SNK	1	080	897	15.52	1
4101	554740	Plesná	1	4	901	90	SDRUŽENÍ PRO PLESNOU 2010	SDRUŽENÍ PRO PLESNOU 2010	SNK	1	080	1726	29.88	3
4101	554740	Plesná	1	5	7	7	Česká strana sociálně demokratická	Česká str.sociálně demokrat.	ČSSD	1	007	893	15.46	1