OKRES	KODZASTUP	NAZEVZAST	COBVODU	POR_STR_HL	OSTRANA	VSTRANA	NAZEVCELK	ZKRATKAO30	ZKRATKAO8	POCSTR_SLO	SLOZENI	HLASY_STR	PROCHLSTR	MAND_STR
6203	549908	Újezd u Tišnova	1	1	803	80	Jaromír Pokorný, nezávislý kandidát	Jaromír Pokorný, NK	NK	1	080	40	65.11	0
6203	549908	Újezd u Tišnova	1	2	809	80	Ing. Ivan Sklenář, nezávislý kandidát	Ing. Ivan Sklenář, NK	NK	1	080	53	86.27	1
6203	549908	Újezd u Tišnova	1	3	802	80	Ing. Lukáš Pohanka, nezávislý kandidát	Ing. Lukáš Pohanka, NK	NK	1	080	36	58.6	0
6203	549908	Újezd u Tišnova	1	4	808	80	Ing. Josef Pohanka, nezávislý kandidát	Ing. Josef Pohanka, NK	NK	1	080	56	91.16	1
6203	549908	Újezd u Tišnova	1	5	806	80	Zdeňka Dvořáková, nezávislý kandidát	Zdeňka Dvořáková, NK	NK	1	080	51	83.02	1
6203	549908	Újezd u Tišnova	1	6	801	80	Petr Jakeš, nezávislý kandidát	Petr Jakeš, NK	NK	1	080	47	76.51	1
6203	549908	Újezd u Tišnova	1	7	804	80	Roman Polnický, nezávislý kandidát	Roman Polnický, NK	NK	1	080	48	78.13	1
6203	549908	Újezd u Tišnova	1	8	805	80	Alena Kapešová, nezávislý kandidát	Alena Kapešová, NK	NK	1	080	47	76.51	1
6203	549908	Újezd u Tišnova	1	9	807	80	Jana Borovková, nezávislý kandidát	Jana Borovková, NK	NK	1	080	52	84.65	1