OKRES	KODZASTUP	NAZEVZAST	COBVODU	POR_STR_HL	OSTRANA	VSTRANA	NAZEVCELK	ZKRATKAO30	ZKRATKAO8	POCSTR_SLO	SLOZENI	HLASY_STR	PROCHLSTR	MAND_STR
5203	574171	Křinice	1	1	901	90	Sdružení nezávislých kandidátů za existenci Křinic	SNK za existenci Křinic	SNK-CELK	1	080	912	78.35	7
5203	574171	Křinice	1	2	804	80	Josef Rosa, nezávislý kandidát	Josef Rosa, NK	NK	1	080	32	19.24	0
5203	574171	Křinice	1	3	801	80	Martin Šleis, nezávislý kandidát	Martin Šleis, NK	NK	1	080	121	72.76	0
5203	574171	Křinice	1	4	803	80	Petr Zítka, nezávislý kandidát	Petr Zítka, NK	NK	1	080	69	41.49	0
5203	574171	Křinice	1	5	802	80	Iveta Zítková, nezávislý kandidát	Iveta Zítková, NK	NK	1	080	30	18.04	0