OKRES	KODZASTUP	NAZEVZAST	COBVODU	POR_STR_HL	OSTRANA	VSTRANA	NAZEVCELK	ZKRATKAO30	ZKRATKAO8	POCSTR_SLO	SLOZENI	HLASY_STR	PROCHLSTR	MAND_STR
8106	599549	Klimkovice	1	1	901	90	Občané Klimkovic	Občané Klimkovic	SNK	1	080	5946	24.09	4
8106	599549	Klimkovice	1	2	523	523	Společně pro Klimkovice - Sdružení nezávislých kandidátů, Občanské demokratické strany a TOP09	Společně pro Klimkovice		3	053,080,721	6495	26.31	5
8106	599549	Klimkovice	1	3	47	47	Komunistická strana Čech a Moravy	Komunistická str.Čech a Moravy	KSČM	1	047	1863	7.54	1
8106	599549	Klimkovice	1	4	355	355	SDRUŽENÍ KDU-ČSL A NEZÁVISLÍ KANDIDÁTI	SDRUŽENÍ KDU-ČSL A NK		2	001,080	3842	15.56	2
8106	599549	Klimkovice	1	5	7	7	Česká strana sociálně demokratická	Česká str.sociálně demokrat.	ČSSD	1	007	6532	26.46	5