OKRES	KODZASTUP	NAZEVZAST	COBVODU	POR_STR_HL	OSTRANA	VSTRANA	NAZEVCELK	ZKRATKAO30	ZKRATKAO8	POCSTR_SLO	SLOZENI	HLASY_STR	PROCHLSTR	MAND_STR
7103	589896	Plumlov	1	1	53	53	Občanská demokratická strana	Občanská demokratická strana	ODS	1	053	4570	29.14	4
7103	589896	Plumlov	1	2	129	129	SNK Evropští demokraté	SNK Evropští demokraté	SNK ED	1	129	2858	19.53	3
7103	589896	Plumlov	1	3	7	7	Česká strana sociálně demokratická	Česká str.sociálně demokrat.	ČSSD	1	007	2629	16.76	2
7103	589896	Plumlov	1	4	47	47	Komunistická strana Čech a Moravy	Komunistická str.Čech a Moravy	KSČM	1	047	1938	12.36	2
7103	589896	Plumlov	1	5	1	1	Křesťanská a demokratická unie - Československá strana lidová	Křesť.demokr.unie-Čs.str.lid.	KDU-ČSL	1	001	3683	23.49	4