OKRES	KODZASTUP	NAZEVZAST	COBVODU	POR_STR_HL	OSTRANA	VSTRANA	NAZEVCELK	ZKRATKAO30	ZKRATKAO8	POCSTR_SLO	SLOZENI	HLASY_STR	PROCHLSTR	MAND_STR
3201	553654	Holýšov	1	1	53	53	Občanská demokratická strana	Občanská demokratická strana	ODS	1	053	7042	30.16	5
3201	553654	Holýšov	1	2	103	103	Strana pro otevřenou společnost	Str.pro otevřenou společnost	SOS	1	103	8998	38.53	6
3201	553654	Holýšov	1	3	47	47	Komunistická strana Čech a Moravy	Komunistická str.Čech a Moravy	KSČM	1	047	3209	13.74	2
3201	553654	Holýšov	1	4	689	689	Suverenita - blok Jany Bobošíkové, strana zdravého rozumu a Demokratická strana zelených	Koalice Suveren. a DSZ		2	137,715	1013	7.23	0
3201	553654	Holýšov	1	5	7	7	Česká strana sociálně demokratická	Česká str.sociálně demokrat.	ČSSD	1	007	3086	13.21	2