OKRES	KODZASTUP	NAZEVZAST	COBVODU	POR_STR_HL	OSTRANA	VSTRANA	NAZEVCELK	ZKRATKAO30	ZKRATKAO8	POCSTR_SLO	SLOZENI	HLASY_STR	PROCHLSTR	MAND_STR
6103	548511	Pacov	1	1	903	90	Nezávislí kandidáti pro Pacovsko	Nezáv. kandidáti pro Pacovsko	SNK	1	080	3742	15.38	2
6103	548511	Pacov	1	2	901	90	Nezávislí Pacova	Nezávislí Pacova	SNK	1	080	2317	9.52	1
6103	548511	Pacov	1	3	902	90	Sdružení pro rozvoj a prosperitu Pacovska	Sdr. pro rozvoj a prosperitu P	SNK	1	080	11919	49	8
6103	548511	Pacov	1	4	47	47	Komunistická strana Čech a Moravy	Komunistická str.Čech a Moravy	KSČM	1	047	1415	7.27	1
6103	548511	Pacov	1	5	53	53	Občanská demokratická strana	Občanská demokratická strana	ODS	1	053	2071	8.51	1
6103	548511	Pacov	1	6	1	1	Křesťanská a demokratická unie - Československá strana lidová	Křesť.demokr.unie-Čs.str.lid.	KDU-ČSL	1	001	2858	11.75	2