OKRES	KODZASTUP	NAZEVZAST	COBVODU	POR_STR_HL	OSTRANA	VSTRANA	NAZEVCELK	ZKRATKAO30	ZKRATKAO8	POCSTR_SLO	SLOZENI	HLASY_STR	PROCHLSTR	MAND_STR
5204	548791	Chlístov	1	1	802	80	Stanislav Novotný, nezávislý kandidát	Stanislav Novotný, NK	NK	1	080	46	99.38	1
5204	548791	Chlístov	1	2	807	80	Václav Kašpar, nezávislý kandidát	Václav Kašpar, NK	NK	1	080	25	54.01	0
5204	548791	Chlístov	1	3	808	80	Roman Valášek, nezávislý kandidát	Roman Valášek, NK	NK	1	080	44	95.06	1
5204	548791	Chlístov	1	4	805	80	Václav Slavík, nezávislý kandidát	Václav Slavík, NK	NK	1	080	39	84.25	1
5204	548791	Chlístov	1	5	806	80	Renata Holečková, nezávislý kandidát	Renata Holečková, NK	NK	1	080	40	86.41	1
5204	548791	Chlístov	1	6	803	80	Jana Štěpánová, nezávislý kandidát	Jana Štěpánová, NK	NK	1	080	25	54.01	0
5204	548791	Chlístov	1	7	801	80	Petr Hynek, nezávislý kandidát	Petr Hynek, NK	NK	1	080	33	71.29	1
5204	548791	Chlístov	1	8	809	80	Veronika Nováková, nezávislý kandidát	Veronika Nováková, NK	NK	1	080	34	73.45	1
5204	548791	Chlístov	1	9	804	80	Adam Novotný, nezávislý kandidát	Adam Novotný, NK	NK	1	080	38	82.09	1