OKRES	KODZASTUP	NAZEVZAST	COBVODU	POR_STR_HL	OSTRANA	VSTRANA	NAZEVCELK	ZKRATKAO30	ZKRATKAO8	POCSTR_SLO	SLOZENI	HLASY_STR	PROCHLSTR	MAND_STR
2103	571601	Libovice	1	1	804	80	Miroslav PEJŠEK, nezávislý kandidát	Miroslav PEJŠEK, NK	NK	1	080	117	88.15	1
2103	571601	Libovice	1	2	803	80	Ing. Petr OLÁH, nezávislý kandidát	Ing. Petr OLÁH, NK	NK	1	080	66	49.73	0
2103	571601	Libovice	1	3	802	80	Stanislava TRAPPOVÁ, nezávislý kandidát	Stanislava TRAPPOVÁ, NK	NK	1	080	111	83.63	1
2103	571601	Libovice	1	4	808	80	Magda CURTISOVÁ, nezávislý kandidát	Magda CURTISOVÁ, NK	NK	1	080	114	85.89	1
2103	571601	Libovice	1	5	809	80	Miloš HORA, nezávislý kandidát	Miloš HORA, NK	NK	1	080	116	87.4	1
2103	571601	Libovice	1	6	806	80	Otto JELÍNEK, nezávislý kandidát	Otto JELÍNEK, NK	NK	1	080	90	67.81	1
2103	571601	Libovice	1	7	807	80	Petr IBL, nezávislý kandidát	Petr IBL, NK	NK	1	080	139	104.73	1
2103	571601	Libovice	1	8	801	80	Václav MINAŘÍK, nezávislý kandidát	Václav MINAŘÍK, NK	NK	1	080	65	48.97	0
2103	571601	Libovice	1	9	805	80	Anna URBANOVÁ, nezávislý kandidát	Anna URBANOVÁ, NK	NK	1	080	111	83.63	1