OKRES	KODZASTUP	NAZEVZAST	COBVODU	POR_STR_HL	OSTRANA	VSTRANA	NAZEVCELK	ZKRATKAO30	ZKRATKAO8	POCSTR_SLO	SLOZENI	HLASY_STR	PROCHLSTR	MAND_STR
6206	593214	Křenovice	1	1	53	53	Občanská demokratická strana	Občanská demokratická strana	ODS	1	053	2268	24.05	3
6206	593214	Křenovice	1	2	449	449	Sdružení nezávislých	Sdružení nezávislých		2	080,129	2557	27.11	3
6206	593214	Křenovice	1	3	1	1	Křesťanská a demokratická unie - Československá strana lidová	Křesť.demokr.unie-Čs.str.lid.	KDU-ČSL	1	001	1995	21.15	2
6206	593214	Křenovice	1	4	47	47	Komunistická strana Čech a Moravy	Komunistická str.Čech a Moravy	KSČM	1	047	1031	10.93	1
6206	593214	Křenovice	1	5	7	7	Česká strana sociálně demokratická	Česká str.sociálně demokrat.	ČSSD	1	007	1579	16.74	2