OKRES	KODZASTUP	NAZEVZAST	COBVODU	POR_STR_HL	OSTRANA	VSTRANA	NAZEVCELK	ZKRATKAO30	ZKRATKAO8	POCSTR_SLO	SLOZENI	HLASY_STR	PROCHLSTR	MAND_STR
3202	556921	Petrovice u Sušice	1	1	801	80	Ferdinand Kopačka, nezávislý kandidát	Ferdinand Kopačka, NK	NK	1	080	131	136.77	1
3202	556921	Petrovice u Sušice	1	2	802	80	Stanislav Valvoda, nezávislý kandidát	Stanislav Valvoda, NK	NK	1	080	155	161.83	1
3202	556921	Petrovice u Sušice	1	3	803	80	Luboš Vítovec, nezávislý kandidát	Luboš Vítovec, NK	NK	1	080	126	131.55	1
3202	556921	Petrovice u Sušice	1	4	806	80	Jiří Bejvl, nezávislý kandidát	Jiří Bejvl, NK	NK	1	080	158	164.96	1
3202	556921	Petrovice u Sušice	1	5	804	80	Karel Melich, nezávislý kandidát	Karel Melich, NK	NK	1	080	137	143.03	1
3202	556921	Petrovice u Sušice	1	6	805	80	Karel Ruda, nezávislý kandidát	Karel Ruda, NK	NK	1	080	155	161.83	1