OKRES	KODZASTUP	NAZEVZAST	COBVODU	POR_STR_HL	OSTRANA	VSTRANA	NAZEVCELK	ZKRATKAO30	ZKRATKAO8	POCSTR_SLO	SLOZENI	HLASY_STR	PROCHLSTR	MAND_STR
7103	590070	Stražisko	1	1	1	1	Křesťanská a demokratická unie - Československá strana lidová	Křesť.demokr.unie-Čs.str.lid.	KDU-ČSL	1	001	324	15.24	1
7103	590070	Stražisko	1	2	7	7	Česká strana sociálně demokratická	Česká str.sociálně demokrat.	ČSSD	1	007	396	23.95	2
7103	590070	Stražisko	1	3	902	90	Sdružení nezávislých kandidátů Nezávislí za rozvoj obce	SNK Nezávislí za rozvoj obce	SNK-CELK	1	080	539	32.61	2
7103	590070	Stražisko	1	4	901	90	Sdružení nezávislých kandidátů	Sdruž.nezáv.kand.	SNK-CELK	1	080	784	36.89	4
7103	590070	Stražisko	1	5	47	47	Komunistická strana Čech a Moravy	Komunistická str.Čech a Moravy	KSČM	1	047	82	17.36	0