OKRES	KODZASTUP	NAZEVZAST	COBVODU	POR_STR_HL	OSTRANA	VSTRANA	NAZEVCELK	ZKRATKAO30	ZKRATKAO8	POCSTR_SLO	SLOZENI	HLASY_STR	PROCHLSTR	MAND_STR
3105	550558	Svatá Maří	1	1	905	90	SPORTOVNÍ KLUB SVATÁ MAŘÍ	SNK SPORTOVNÍ KLUB SVATÁ MAŘÍ	SNK	1	080	698	47.07	2
3105	550558	Svatá Maří	1	2	902	90	Sbor dobrovolných hasičů Smrčná	Sbor dobr. hasičů Smrčná	SNK	1	080	283	10.6	1
3105	550558	Svatá Maří	1	3	903	90	ŽENY A HASIČI ŠTÍTKOV	ŽENY A HASIČI ŠTÍTKOV	SNK	1	080	330	12.36	1
3105	550558	Svatá Maří	1	4	901	90	SDH Svatá Maří	SDH Svatá Maří	SNK	1	080	1020	38.21	4
3105	550558	Svatá Maří	1	5	904	90	ŽENY SVATÁ MAŘÍ	ŽENY SVATÁ MAŘÍ	SNK	1	080	338	12.66	1