OKRES	KODZASTUP	NAZEVZAST	COBVODU	POR_STR_HL	OSTRANA	VSTRANA	NAZEVCELK	ZKRATKAO30	ZKRATKAO8	POCSTR_SLO	SLOZENI	HLASY_STR	PROCHLSTR	MAND_STR
4101	554499	Aš	1	1	7	7	Česká strana sociálně demokratická	Česká str.sociálně demokrat.	ČSSD	1	007	1216	2.71	0
4101	554499	Aš	1	2	112	112	HNUTÍ NEZÁVISLÝCH ZA HARMONICKÝ ROZVOJ OBCÍ A MĚST	HN.ZA HARM.ROZVOJ OBCÍ A MĚST	HNHRM	1	112	24837	43.47	11
4101	554499	Aš	1	3	785	785	PRO Zdraví a Sport	PRO Zdraví a Sport	PRO Zdraví	1	785	5363	10.79	2
4101	554499	Aš	1	4	47	47	Komunistická strana Čech a Moravy	Komunistická str.Čech a Moravy	KSČM	1	047	6198	10.84	2
4101	554499	Aš	1	5	1118	1118	VOK - Volba pro Karlovarský kraj	VOK-Volba pro Karlovarský kraj	VOK	1	1118	8844	15.47	4
4101	554499	Aš	1	6	1066	1066	Koalice České pirátské strany a Strany zelených	Koalice Piráti a Zelení	Piráti+SZ	2	005,720	6748	11.81	3
4101	554499	Aš	1	7	53	53	Občanská demokratická strana	Občanská demokratická strana	ODS	1	053	3926	6.87	1