OKRES	KODZASTUP	NAZEVZAST	COBVODU	POR_STR_HL	OSTRANA	VSTRANA	NAZEVCELK	ZKRATKAO30	ZKRATKAO8	POCSTR_SLO	SLOZENI	HLASY_STR	PROCHLSTR	MAND_STR
7105	569381	Mírov	1	1	902	90	Naše obec I. - OBECNÍ OBROZENÍ	Naše obec I. - OBECNÍ OBROZENÍ	SNK	1	080	125	18.39	0
7105	569381	Mírov	1	2	802	80	Nezávislý kandidát Ing. Pavla Vohralíková	Pavla Vohralíková, NK	NK	1	080	126	74.17	1
7105	569381	Mírov	1	3	901	90	Sdružení nezávislých kandidátů  PRO MÍROV	Sdruž.nezáv.kand.PRO MÍROV	SNK	1	080	630	52.98	5
7105	569381	Mírov	1	4	801	80	Nezávislý kandidát Mgr. Vladimír Poledníček	Vladimír Poledníček, NK	NK	1	080	75	44.15	0
7105	569381	Mírov	1	5	903	90	Naše obec II. - SELSKÝ ROZUM	Naše obec II. - SELSKÝ ROZUM	SNK	1	080	233	27.43	1