OKRES	KODZASTUP	NAZEVZAST	COBVODU	POR_STR_HL	OSTRANA	VSTRANA	NAZEVCELK	ZKRATKAO30	ZKRATKAO8	POCSTR_SLO	SLOZENI	HLASY_STR	PROCHLSTR	MAND_STR
5101	514161	Luka	1	1	901	90	ZA OBEC KRÁSNĚJŠÍ	ZA OBEC KRÁSNĚJŠÍ	SNK	1	080	199	73.43	5
5101	514161	Luka	1	2	803	80	Veronika Kadeřávková, nezávislý kandidát	Veronika Kadeřávková, NK	NK	1	080	19	35.05	0
5101	514161	Luka	1	3	804	80	Pavel Hloušek, nezávislý kandidát	Pavel Hloušek, NK	NK	1	080	18	33.21	0
5101	514161	Luka	1	4	801	80	Josef Říha, nezávislý kandidát	Josef Říha, NK	NK	1	080	14	25.83	0
5101	514161	Luka	1	5	802	80	Vendula Pešková, nezávislý kandidát	Vendula Pešková, NK	NK	1	080	21	38.74	0