OKRES	KODZASTUP	NAZEVZAST	COBVODU	POR_STR_HL	OSTRANA	VSTRANA	NAZEVCELK	ZKRATKAO30	ZKRATKAO8	POCSTR_SLO	SLOZENI	HLASY_STR	PROCHLSTR	MAND_STR
6104	591254	Nové Syrovice	1	1	1	1	Křesťanská a demokratická unie - Československá strana lidová	Křesť.demokr.unie-Čs.str.lid.	KDU-ČSL	1	001	269	7.27	0
6104	591254	Nové Syrovice	1	2	901	90	Sdružení nezávislých kandidátů	Sdruž.nezáv.kand.	SNK-CELK	1	080	4114	59.35	10
6104	591254	Nové Syrovice	1	3	7	7	Česká strana sociálně demokratická	Česká str.sociálně demokrat.	ČSSD	1	007	400	5.77	1
6104	591254	Nové Syrovice	1	4	53	53	Občanská demokratická strana	Občanská demokratická strana	ODS	1	053	624	9	1
6104	591254	Nové Syrovice	1	5	47	47	Komunistická strana Čech a Moravy	Komunistická str.Čech a Moravy	KSČM	1	047	1524	21.98	3