OKRES	KODZASTUP	NAZEVZAST	COBVODU	POR_STR_HL	OSTRANA	VSTRANA	NAZEVCELK	ZKRATKAO30	ZKRATKAO8	POCSTR_SLO	SLOZENI	HLASY_STR	PROCHLSTR	MAND_STR
2105	531111	Bernardov	1	1	805	80	NEZÁVISLÝ KANDIDÁT LUBOMÍR KOUDELKA	NEZ. KANDIDÁT LUBOMÍR KOUDELKA	NK	1	080	76	90.04	1
2105	531111	Bernardov	1	2	804	80	Milan Rohlíček	Milan Rohlíček	NK	1	080	88	104.26	1
2105	531111	Bernardov	1	3	802	80	NEZÁVISLÝ KANDIDÁT Mgr. JAN PAVEL	NEZ. KANDIDÁT Mgr. JAN PAVEL	NK	1	080	72	85.3	1
2105	531111	Bernardov	1	4	806	80	DAŇKOVÁ HELENA-NEZÁVISLÝ KANDIDÁT	DAŇKOVÁ HELENA-NEZ. KANDIDÁT	NK	1	080	52	61.61	0
2105	531111	Bernardov	1	5	803	80	Nezávislý kandidát Zdeněk Krejčík	Nez. kandidát Zdeněk Krejčík	NK	1	080	72	85.3	1
2105	531111	Bernardov	1	6	801	80	Nezávislý kandidát Jaroslav Váša	Nez. kandidát Jaroslav Váša	NK	1	080	62	73.45	1