OKRES	KODZASTUP	NAZEVZAST	COBVODU	POR_STR_HL	OSTRANA	VSTRANA	NAZEVCELK	ZKRATKAO30	ZKRATKAO8	POCSTR_SLO	SLOZENI	HLASY_STR	PROCHLSTR	MAND_STR
5301	572241	Skuteč	1	1	53	53	Občanská demokratická strana	Občanská demokratická strana	ODS	1	053	9958	26.55	5
5301	572241	Skuteč	1	2	1	1	Křesťanská a demokratická unie - Československá strana lidová	Křesť.demokr.unie-Čs.str.lid.	KDU-ČSL	1	001	10746	28.66	6
5301	572241	Skuteč	1	3	901	90	Nezávislí - pro město a okolí	Nezávislí-pro město a ok., SNK	SNK	1	080	4611	12.29	2
5301	572241	Skuteč	1	4	47	47	Komunistická strana Čech a Moravy	Komunistická str.Čech a Moravy	KSČM	1	047	6631	17.68	3
5301	572241	Skuteč	1	5	7	7	Česká strana sociálně demokratická	Česká str.sociálně demokrat.	ČSSD	1	007	5548	14.79	3