OKRES	KODZASTUP	NAZEVZAST	COBVODU	POR_STR_HL	OSTRANA	VSTRANA	NAZEVCELK	ZKRATKAO30	ZKRATKAO8	POCSTR_SLO	SLOZENI	HLASY_STR	PROCHLSTR	MAND_STR
3207	541559	Kočov	1	1	901	90	Za Kočov krásnější 1	Za Kočov krásnější 1	SNK	1	080	211	35.58	3
3207	541559	Kočov	1	2	805	80	Tereza Šichevičová, nezávislý kandidát	Tereza Šichevičová, NK	NK	1	080	27	31.87	0
3207	541559	Kočov	1	3	803	80	Daniel Nosek, nezávislý kandidát	Daniel Nosek, NK	NK	1	080	29	34.23	0
3207	541559	Kočov	1	4	902	90	Za Kočov krásnější 2	Za Kočov krásnější 2	SNK	1	080	244	41.14	4
3207	541559	Kočov	1	5	802	80	Martina Nosková, nezávislý kandidát	Martina Nosková, NK	NK	1	080	28	33.05	0
3207	541559	Kočov	1	6	804	80	Iveta Šichevičová, nezávislý kandidát	Iveta Šichevičová, NK	NK	1	080	28	33.05	0
3207	541559	Kočov	1	7	801	80	Michaela Šichevičová, nezávislý kandidát	Michaela Šichevičová, NK	NK	1	080	26	30.69	0