OKRES	KODZASTUP	NAZEVZAST	COBVODU	POR_STR_HL	OSTRANA	VSTRANA	NAZEVCELK	ZKRATKAO30	ZKRATKAO8	POCSTR_SLO	SLOZENI	HLASY_STR	PROCHLSTR	MAND_STR
7103	589624	Konice	1	1	7	7	Česká strana sociálně demokratická	Česká str.sociálně demokrat.	ČSSD	1	007	2496	14.28	2
7103	589624	Konice	1	2	901	90	"Sdružení nezávislých kandidátů ""Sdružení nezávislých kandidátů Petrova cechu"""	"SNK ""Sdr.nez.kand.""Petrova c."""	SNK-CELK	1	080	547	3.13	0
7103	589624	Konice	1	3	47	47	Komunistická strana Čech a Moravy	Komunistická str.Čech a Moravy	KSČM	1	047	2354	13.47	2
7103	589624	Konice	1	4	53	53	Občanská demokratická strana	Občanská demokr. strana	ODS	1	053	5096	29.16	5
7103	589624	Konice	1	5	461	461	Sdružení NV, NK-Společně pro Konici	Sdružení NV, NK-Spol. pro Koni		2	080,163	2376	13.59	2
7103	589624	Konice	1	6	1	1	Křesťanská a demokratická unie - Československá strana lidová	Křesť.demokr.unie-Čs.str.lid.	KDU-ČSL	1	001	2499	14.3	2
7103	589624	Konice	1	7	449	449	Sdružení SNK ED, NK-Sdružení za zdravé město	Sdružení SNK ED, NK-Sdr. zdr.m		2	080,129	2106	12.05	2