OKRES	KODZASTUP	NAZEVZAST	COBVODU	POR_STR_HL	OSTRANA	VSTRANA	NAZEVCELK	ZKRATKAO30	ZKRATKAO8	POCSTR_SLO	SLOZENI	HLASY_STR	PROCHLSTR	MAND_STR
6101	548413	Jilem	1	1	804	80	Václav Šiška, nezávislý kandidát	Václav Šiška, NK	NK	1	080	40	67.46	1
6101	548413	Jilem	1	2	806	80	Milan Klement, nezávislý kandidát	Milan Klement, NK	NK	1	080	62	104.57	1
6101	548413	Jilem	1	3	807	80	Radek Kubát, nezávislý kandidát	Radek Kubát, NK	NK	1	080	57	96.14	1
6101	548413	Jilem	1	4	802	80	Richard Smetáček, nezávislý kandidát	Richard Smetáček, NK	NK	1	080	42	70.84	1
6101	548413	Jilem	1	5	808	80	Pavel Bělohlávek, nezávislý kandidát	Pavel Bělohlávek, NK	NK	1	080	23	38.79	0
6101	548413	Jilem	1	6	801	80	Ladislav Klement, nezávislý kandidát	Ladislav Klement, NK	NK	1	080	57	96.14	1
6101	548413	Jilem	1	7	805	80	Karel Hospodka, nezávislý kandidát	Karel Hospodka, NK	NK	1	080	45	75.9	1
6101	548413	Jilem	1	8	803	80	Jaromír Rasocha, nezávislý kandidát	Jaromír Rasocha, NK	NK	1	080	52	87.71	1
6101	548413	Jilem	1	9	53	53	Občanská demokratická strana	Občanská demokratická strana	ODS	1	053	37	62.4	0