OKRES	KODZASTUP	NAZEVZAST	COBVODU	POR_STR_HL	OSTRANA	VSTRANA	NAZEVCELK	ZKRATKAO30	ZKRATKAO8	POCSTR_SLO	SLOZENI	HLASY_STR	PROCHLSTR	MAND_STR
6206	593320	Milešovice	1	1	158	158	"""Sdružení nestraníků"""	"""Sdružení nestraníků"""	SN	1	158	157	6.95	0
6206	593320	Milešovice	1	2	53	53	Občanská demokratická strana	Občanská demokratická strana	ODS	1	053	902	34.24	3
6206	593320	Milešovice	1	3	902	90	Sdružení nezávislých kandidátů II.	Sdruž.nezáv.kand. II.	SNK II	1	080	183	6.94	0
6206	593320	Milešovice	1	4	903	90	Sdružení nezávislých kandidátů pro sport a kulturu	Sdruž.nezáv.kand. pro sport	SNK PSK	1	080	379	14.38	1
6206	593320	Milešovice	1	5	901	90	Sdružení nezávislých kandidátů I.	Sdruž.nezáv.kand. I.	SNK I	1	080	356	13.51	1
6206	593320	Milešovice	1	6	7	7	Česká strana sociálně demokratická	Česká str.sociálně demokrat.	ČSSD	1	007	657	24.94	2