OKRES	KODZASTUP	NAZEVZAST	COBVODU	POR_STR_HL	OSTRANA	VSTRANA	NAZEVCELK	ZKRATKAO30	ZKRATKAO8	POCSTR_SLO	SLOZENI	HLASY_STR	PROCHLSTR	MAND_STR
7102	501476	Dlouhá Loučka	1	1	53	53	Občanská demokratická strana	Občanská demokratická strana	ODS	1	053	1841	16.89	2
7102	501476	Dlouhá Loučka	1	2	47	47	Komunistická strana Čech a Moravy	Komunistická str.Čech a Moravy	KSČM	1	047	1900	17.43	3
7102	501476	Dlouhá Loučka	1	3	88	88	NEZÁVISLÍ	NEZÁVISLÍ	NEZ	1	088	4386	40.25	6
7102	501476	Dlouhá Loučka	1	4	7	7	Česká strana sociálně demokratická	Česká str.sociálně demokrat.	ČSSD	1	007	1291	14.81	2
7102	501476	Dlouhá Loučka	1	5	1	1	Křesťanská a demokratická unie - Československá strana lidová	Křesť.demokr.unie-Čs.str.lid.	KDU-ČSL	1	001	1478	13.56	2