OKRES	KODZASTUP	NAZEVZAST	COBVODU	POR_STR_HL	OSTRANA	VSTRANA	NAZEVCELK	ZKRATKAO30	ZKRATKAO8	POCSTR_SLO	SLOZENI	HLASY_STR	PROCHLSTR	MAND_STR
7104	514055	Kojetín	1	1	47	47	Komunistická strana Čech a Moravy	Komunistická str.Čech a Moravy	KSČM	1	047	5247	15.46	3
7104	514055	Kojetín	1	2	7	7	Česká strana sociálně demokratická	Česká str.sociálně demokrat.	ČSSD	1	007	6523	19.22	4
7104	514055	Kojetín	1	3	901	90	KOJETÍN 2014	KOJETÍN 2014	SNK	1	080	12325	36.33	8
7104	514055	Kojetín	1	4	1	1	Křesťanská a demokratická unie - Československá strana lidová	Křesť.demokr.unie-Čs.str.lid.	KDU-ČSL	1	001	5679	16.73	4
7104	514055	Kojetín	1	5	53	53	Občanská demokratická strana	Občanská demokratická strana	ODS	1	053	4151	12.23	2