OKRES	KODZASTUP	NAZEVZAST	COBVODU	POR_STR_HL	OSTRANA	VSTRANA	NAZEVCELK	ZKRATKAO30	ZKRATKAO8	POCSTR_SLO	SLOZENI	HLASY_STR	PROCHLSTR	MAND_STR
3107	560669	Skrýchov u Malšic	1	1	802	80	Petr Mejdrech, nezávislý kandidát	Petr Mejdrech, NK	NK	1	080	45	87.25	1
3107	560669	Skrýchov u Malšic	1	2	807	80	Lukáš Kazda, nezávislý kandidát	Lukáš Kazda, NK	NK	1	080	38	73.68	1
3107	560669	Skrýchov u Malšic	1	3	809	80	Josef Kupka, nezávislý kandidát	Josef Kupka, NK	NK	1	080	42	81.44	1
3107	560669	Skrýchov u Malšic	1	4	805	80	Josef Jírovec, nezávislý kandidát	Josef Jírovec, NK	NK	1	080	58	112.46	1
3107	560669	Skrýchov u Malšic	1	5	808	80	Karel Kupka, nezávislý kandidát	Karel Kupka, NK	NK	1	080	37	71.74	1
3107	560669	Skrýchov u Malšic	1	6	801	80	Jan Žirovnický, nezávislý kandidát	Jan Žirovnický, NK	NK	1	080	29	56.23	0
3107	560669	Skrýchov u Malšic	1	7	804	80	František Bárta, nezávislý kandidát	František Bárta, NK	NK	1	080	50	96.95	1
3107	560669	Skrýchov u Malšic	1	8	806	80	Tomáš Petříček, nezávislý kandidát	Tomáš Petříček, NK	NK	1	080	29	56.23	0
3107	560669	Skrýchov u Malšic	1	9	803	80	Pavel Čechtický, nezávislý kandidát	Pavel Čechtický, NK	NK	1	080	33	63.98	1