OKRES	KODZASTUP	NAZEVZAST	COBVODU	POR_STR_HL	OSTRANA	VSTRANA	NAZEVCELK	ZKRATKAO30	ZKRATKAO8	POCSTR_SLO	SLOZENI	HLASY_STR	PROCHLSTR	MAND_STR
3205	558885	Horní Bříza	1	1	47	47	Komunistická strana Čech a Moravy	Komunistická str.Čech a Moravy	KSČM	1	047	2956	10.13	2
3205	558885	Horní Bříza	1	2	902	90	SNK - MĚSTO LIDEM	Sdružení nezávislých kandidátů	SNK	1	080	6879	23.59	5
3205	558885	Horní Bříza	1	3	721	721	TOP 09	TOP 09	TOP 09	1	721	2623	8.99	2
3205	558885	Horní Bříza	1	4	7	7	Česká strana sociálně demokratická	Česká str.sociálně demokrat.	ČSSD	1	007	2427	8.32	1
3205	558885	Horní Bříza	1	5	901	90	Sdružení nezávislých kandidátů Hornobřízští občané	Sdružení nezávislých kandidátů	SNK	1	080	14275	48.95	11