OKRES	KODZASTUP	NAZEVZAST	COBVODU	POR_STR_HL	OSTRANA	VSTRANA	NAZEVCELK	ZKRATKAO30	ZKRATKAO8	POCSTR_SLO	SLOZENI	HLASY_STR	PROCHLSTR	MAND_STR
2111	564664	Bukovany	1	1	806	80	Jaroslav Slavík, nezávislý kandidát	Jaroslav Slavík, NK	JSNK	1	080	30	60.72	1
2111	564664	Bukovany	1	2	803	80	Václav Opička, nezávislý kandidát	Václav Opička, NK	VONK	1	080	39	78.94	1
2111	564664	Bukovany	1	3	807	80	Jaroslav Slavík, nezávislý kandidát	Jaroslav Slavík, NK	JSLNK	1	080	10	20.24	0
2111	564664	Bukovany	1	4	802	80	Richard Černý, nezávislý kandidát	Richard Černý, NK	RČNK	1	080	12	24.29	0
2111	564664	Bukovany	1	5	804	80	Jiří Macoun, nezávislý kandidát	Jiří Macoun, NK	JMNK	1	080	51	103.23	1
2111	564664	Bukovany	1	6	805	80	Lubor Vopat, nezávislý kandidát	Lubor Vopat, NK	LVNK	1	080	38	76.92	1
2111	564664	Bukovany	1	7	801	80	David Kaiser, nezávislý kandidát	David Kaiser, NK	DKNK	1	080	38	76.92	1
2111	564664	Bukovany	1	8	808	80	Josef Kavka, nezávislý kandidát	Josef Kavka, NK	JKNK	1	080	29	58.7	0