OKRES	KODZASTUP	NAZEVZAST	COBVODU	POR_STR_HL	OSTRANA	VSTRANA	NAZEVCELK	ZKRATKAO30	ZKRATKAO8	POCSTR_SLO	SLOZENI	HLASY_STR	PROCHLSTR	MAND_STR
5201	569836	Barchov	1	1	808	80	Jan Rez, nezávislý kandidát	Jan Rez, NK	NK	1	080	60	65.52	1
5201	569836	Barchov	1	2	802	80	Martin Kalman, nezávislý kandidát	Martin Kalman, NK	NK	1	080	75	81.9	1
5201	569836	Barchov	1	3	805	80	Mgr. Radka Rohlíková, nezávislý kandidát	Mgr. Radka Rohlíková, NK	NK	1	080	97	105.92	1
5201	569836	Barchov	1	4	801	80	Miloslav Tomeš, nezávislý kandidát	Miloslav Tomeš, NK	NK	1	080	85	92.82	1
5201	569836	Barchov	1	5	804	80	Mgr. Ladislav Vlachý, nezávislý kandidát	Mgr. Ladislav Vlachý, NK	NK	1	080	89	97.19	1
5201	569836	Barchov	1	6	807	80	Miroslav Novotný, nezávislý kandidát	Miroslav Novotný, NK	NK	1	080	54	58.97	0
5201	569836	Barchov	1	7	803	80	Roman Miške, nezávislý kandidát	Roman Miške, NK	NK	1	080	91	99.37	1
5201	569836	Barchov	1	8	806	80	Martin Hanuš, nezávislý kandidát	Martin Hanuš, NK	NK	1	080	90	98.28	1