OKRES	KODZASTUP	NAZEVZAST	COBVODU	POR_STR_HL	OSTRANA	VSTRANA	NAZEVCELK	ZKRATKAO30	ZKRATKAO8	POCSTR_SLO	SLOZENI	HLASY_STR	PROCHLSTR	MAND_STR
4204	566951	Výškov	1	1	904	90	SDRUŽENÍ NEZÁVISLÝCH KANDIDÁTŮ VÝŠKOV, ROZVODNA, POČERADY	SNK VÝŠKOV,ROZVODNA,POČERADY	SNK	1	080			
4204	566951	Výškov	1	2	902	90	Pro rozvoj obcí Výškov a Počerady	Pro rozvoj obcí Výškov a Počer	SNK	1	080			
4204	566951	Výškov	1	3	901	90	Jsme PRO! Výškov, Rozvodnu a Počerady	Jsme PRO! Výškov, Rozv a Počer	SNK	1	080			
4204	566951	Výškov	1	4	905	90	Sdružení nezávislých kandidátů VrP	SNK VrP	SNK	1	080			
4204	566951	Výškov	1	5	903	90	SDRUŽENÍ NEZÁVISLÝCH KANDIDÁTŮ VÝŠKOV, ROZVODNA A POČERADY	SNK VÝŠKOV, ROZVOD A POČERADY	SNK	1	080			