OKRES	KODZASTUP	NAZEVZAST	COBVODU	POR_STR_HL	OSTRANA	VSTRANA	NAZEVCELK	ZKRATKAO30	ZKRATKAO8	POCSTR_SLO	SLOZENI	HLASY_STR	PROCHLSTR	MAND_STR
6101	569534	Stříbrné Hory	1	1	802	80	Václav Daniel, nezávislý kandidát	Václav Daniel, NK	NK	1	080	148	105.28	1
6101	569534	Stříbrné Hory	1	2	806	80	Miloslav Petr, nezávislý kandidát	Miloslav Petr, NK	NK	1	080	137	97.45	1
6101	569534	Stříbrné Hory	1	3	7	7	Česká strana sociálně demokratická	Česká str.sociálně demokrat.	ČSSD	1	007	48	17.07	0
6101	569534	Stříbrné Hory	1	4	801	80	Marcela Bartoníčková, nezávislý kandidát	Marcela Bartoníčková, NK	NK	1	080	72	51.21	1
6101	569534	Stříbrné Hory	1	5	807	80	Bohuslav Zych, nezávislý kandidát	Bohuslav Zych, NK	NK	1	080	140	99.59	1
6101	569534	Stříbrné Hory	1	6	805	80	Stanislav Cvik, nezávislý kandidát	Stanislav Cvik, NK	NK	1	080	40	28.45	0
6101	569534	Stříbrné Hory	1	7	804	80	Martina Sommerová, nezávislý kandidát	Martina Sommerová, NK	NK	1	080	51	36.28	0
6101	569534	Stříbrné Hory	1	8	803	80	Miroslav Tomas, nezávislý kandidát	Miroslav Tomas, NK	NK	1	080	130	92.47	1
6101	569534	Stříbrné Hory	1	9	1	1	Křesťanská a demokratická unie - Československá strana lidová	Křesť.demokr.unie-Čs.str.lid.	KDU-ČSL	1	001	218	77.54	2