OKRES	KODZASTUP	NAZEVZAST	COBVODU	POR_STR_HL	OSTRANA	VSTRANA	NAZEVCELK	ZKRATKAO30	ZKRATKAO8	POCSTR_SLO	SLOZENI	HLASY_STR	PROCHLSTR	MAND_STR
2103	532657	Malíkovice	1	1	803	80	František Trojan, nezávislý kandidát	František Trojan, NK	NK-3	1	080	120	86.68	1
2103	532657	Malíkovice	1	2	802	80	Jaroslav ČERNÝ, nezávislý kandidát	Jaroslav ČERNÝ, NK	NK-2	1	080	12	8.66	0
2103	532657	Malíkovice	1	3	801	80	Lucie Slapničková, nezávislý kandidát	Lucie Slapničková, NK	NK-1	1	080	95	68.62	0
2103	532657	Malíkovice	1	4	805	80	Vlasta Šteňuková, nezávislý kandidát	Vlasta Šteňuková, NK	NK-5	1	080	100	72.23	1
2103	532657	Malíkovice	1	5	47	47	KOMUNISTICKÁ STRANA ČECH A MORAVY	KOM.STRANA ČECH A MORAVY	KSČM	1	047	567	58.51	5
2103	532657	Malíkovice	1	6	804	80	Monika Kostřábová, nezávislý kandidát	Monika Kostřábová, NK	NK-4	1	080	75	54.17	0