OKRES	KODZASTUP	NAZEVZAST	COBVODU	POR_STR_HL	OSTRANA	VSTRANA	NAZEVCELK	ZKRATKAO30	ZKRATKAO8	POCSTR_SLO	SLOZENI	HLASY_STR	PROCHLSTR	MAND_STR
5103	564095	Hrádek nad Nisou	1	1	53	53	Občanská demokratická strana	Občanská demokratická strana	ODS	1	053	6371	10.49	2
5103	564095	Hrádek nad Nisou	1	2	103	103	Strana pro otevřenou společnost	Str.pro otevřenou společnost	SOS	1	103	1734	3.76	0
5103	564095	Hrádek nad Nisou	1	3	47	47	Komunistická strana Čech a Moravy	Komunistická str.Čech a Moravy	KSČM	1	047	6872	11.32	3
5103	564095	Hrádek nad Nisou	1	4	7	7	Česká strana sociálně demokratická	Česká str.sociálně demokrat.	ČSSD	1	007	8797	14.49	4
5103	564095	Hrádek nad Nisou	1	5	901	90	HRÁDEK POTŘEBUJE ZMĚNY !	HRÁDEK POTŘEBUJE ZMĚNY !	SNK	1	080	36834	60.7	16
5103	564095	Hrádek nad Nisou	1	6	801	80	JURA SCHEIBE - zastupování národnostních menšin v zastupitelských orgánech,zapojení menšin do činnosti ve prospěch města	JURA SCHEIBE, NK	NK	1	080	72	2.96	0