OKRES	KODZASTUP	NAZEVZAST	COBVODU	POR_STR_HL	OSTRANA	VSTRANA	NAZEVCELK	ZKRATKAO30	ZKRATKAO8	POCSTR_SLO	SLOZENI	HLASY_STR	PROCHLSTR	MAND_STR
3103	562769	Jilem	1	1	801	80	Jana Nováková, nezávislý kandidát	Jana Nováková, NK	NK	1	080	50	72.01	1
3103	562769	Jilem	1	2	802	80	Zdeňka Němcová, nezávislý kandidát	Zdeňka Němcová, NK	NK	1	080	36	51.85	0
3103	562769	Jilem	1	3	804	80	Jitka Zlatušková, nezávislý kandidát	Jitka Zlatušková, NK	NK	1	080	55	79.21	1
3103	562769	Jilem	1	4	808	80	Aleš Andraško, nezávislý kandidát	Aleš Andraško, NK	NK	1	080	64	92.18	1
3103	562769	Jilem	1	5	805	80	Kateřina Zlatušková, nezávislý kandidát	Kateřina Zlatušková, NK	NK	1	080	31	44.65	0
3103	562769	Jilem	1	6	807	80	Jaroslav Šlesinger, nezávislý kandidát	Jaroslav Šlesinger, NK	NK	1	080	62	89.3	1
3103	562769	Jilem	1	7	809	80	Jindřich Novák, nezávislý kandidát	Jindřich Novák, NK	NK	1	080	70	100.82	1
3103	562769	Jilem	1	8	803	80	Jaroslav Křížek, nezávislý kandidát	Jaroslav Křížek, NK	NK	1	080	54	77.77	1
3103	562769	Jilem	1	9	806	80	Jiří Tůma, nezávislý kandidát	Jiří Tůma, NK	NK	1	080	64	92.18	1