OKRES	KODZASTUP	NAZEVZAST	COBVODU	POR_STR_HL	OSTRANA	VSTRANA	NAZEVCELK	ZKRATKAO30	ZKRATKAO8	POCSTR_SLO	SLOZENI	HLASY_STR	PROCHLSTR	MAND_STR
7104	517101	Potštát	1	1	902	90	Sdružení nezávislých kandidátů pro spravedlnost a rozvoj Potštátska	Sdruž.nezáv.kand.pro spr.	SNK	1	080	907	13.73	1
7104	517101	Potštát	1	2	47	47	Komunistická strana Čech a Moravy	Komunistická str.Čech a Moravy	KSČM	1	047	1077	16.31	2
7104	517101	Potštát	1	3	53	53	Občanská demokratická strana	Občanská demokratická strana	ODS	1	053	2238	33.89	4
7104	517101	Potštát	1	4	901	90	",,Sdružení potštátských nezávislých-volby 2006"""	Sdruž.potštát.nez.-volby 2006	SPN	1	080	1339	20.27	2
7104	517101	Potštát	1	5	7	7	Česká strana sociálně demokratická	Česká str.sociálně demokrat.	ČSSD	1	007	1042	17.35	2