OKRES	KODZASTUP	NAZEVZAST	COBVODU	POR_STR_HL	OSTRANA	VSTRANA	NAZEVCELK	ZKRATKAO30	ZKRATKAO8	POCSTR_SLO	SLOZENI	HLASY_STR	PROCHLSTR	MAND_STR
2109	538329	Klíčany	1	1	806	80	Václav Nováček, nezávislý kandidát	Václav Nováček, NK	NK VN	1	080	57	88.66	1
2109	538329	Klíčany	1	2	804	80	Miroslav Gašpar, nezávislý kandidát	Miroslav Gašpar, NK	NK MG	1	080	49	76.22	1
2109	538329	Klíčany	1	3	801	80	Vlasta Strnadová, nezávislý kandidát	Vlasta Strnadová, NK	NK VS	1	080	68	105.77	1
2109	538329	Klíčany	1	4	807	80	Jan Netřebský, nezávislý kandidát	Jan Netřebský, NK	NK JN	1	080	80	124.44	1
2109	538329	Klíčany	1	5	802	80	Ondřej Bačina, nezávislý kandidát	Ondřej Bačina, NK	NK OB	1	080	72	112	1
2109	538329	Klíčany	1	6	805	80	Petr Hejsek, nezávislý kandidát	Petr Hejsek, NK	NK PH	1	080	52	80.88	1
2109	538329	Klíčany	1	7	803	80	Marcela Bílá, nezávislý kandidát	Marcela Bílá, NK	NK MB	1	080	72	112	1