OKRES	KODZASTUP	NAZEVZAST	COBVODU	POR_STR_HL	OSTRANA	VSTRANA	NAZEVCELK	ZKRATKAO30	ZKRATKAO8	POCSTR_SLO	SLOZENI	HLASY_STR	PROCHLSTR	MAND_STR
5201	570711	Radíkovice	1	1	805	80	Josef Mejstřík, nezávislý kandidát	Josef Mejstřík, NK	NK	1	080	39	95.45	1
5201	570711	Radíkovice	1	2	807	80	Martin Vondráček, nezávislý kandidát	Martin Vondráček, NK	NK	1	080	41	100.34	1
5201	570711	Radíkovice	1	3	801	80	Zdeněk Donát, nezávislý kandidát	Zdeněk Donát, NK	NK	1	080	37	90.55	1
5201	570711	Radíkovice	1	4	803	80	Zdeněk Hepner, nezávislý kandidát	Zdeněk Hepner, NK	NK	1	080	44	107.69	1
5201	570711	Radíkovice	1	5	802	80	Zdeňka Nováková, nezávislý kandidát	Zdeňka Nováková, NK	NK	1	080	42	102.79	1
5201	570711	Radíkovice	1	6	804	80	Radovan Jíra, nezávislý kandidát	Radovan Jíra, NK	NK	1	080	38	93	1
5201	570711	Radíkovice	1	7	806	80	Roman Valena, nezávislý kandidát	Roman Valena, NK	NK	1	080	45	110.13	1