OKRES	KODZASTUP	NAZEVZAST	COBVODU	POR_STR_HL	OSTRANA	VSTRANA	NAZEVCELK	ZKRATKAO30	ZKRATKAO8	POCSTR_SLO	SLOZENI	HLASY_STR	PROCHLSTR	MAND_STR
2109	538311	Klecany	1	1	901	90	SDRUŽENÍ NEZÁVISLÝCH KANDIDÁTŮ KLECANY 2018	SDRUŽ.NEZÁV.KAND. KLECANY 2018	SNK	1	080	1518	8.44	1
2109	538311	Klecany	1	2	470	470	SDRUŽENÍ NEZÁVISLÝCH KANDIDÁTŮ A POLITICKÉHO HNUTÍ STAROSTOVÉ A NEZÁVISLÍ	SDR.NEZ.KAND. A POL.HNUTÍ STAN		2	080,166	5856	32.58	5
2109	538311	Klecany	1	3	53	53	Občanská demokratická strana	Občanská demokratická strana	ODS	1	053	6251	34.78	6
2109	538311	Klecany	1	4	47	47	Komunistická strana Čech a Moravy	Komunistická str.Čech a Moravy	KSČM	1	047	893	4.96	0
2109	538311	Klecany	1	5	902	90	ŽIJEME V KLECANECH	ŽIJEME V KLECANECH	SNK	1	080	3451	19.2	3