OKRES	KODZASTUP	NAZEVZAST	COBVODU	POR_STR_HL	OSTRANA	VSTRANA	NAZEVCELK	ZKRATKAO30	ZKRATKAO8	POCSTR_SLO	SLOZENI	HLASY_STR	PROCHLSTR	MAND_STR
6203	583839	Říčany	1	1	902	90	"Sdružení nezávislých kandidátů ""Za Říčany krásnější"""	"SNK ""Za Říčany krásnější"""	SNK	1	080	2728	26.79	4
6203	583839	Říčany	1	2	7	7	Česká strana sociálně demokratická	Česká str.sociálně demokrat.	ČSSD	1	007	1831	17.98	2
6203	583839	Říčany	1	3	355	355	KŘESŤANSKÁ A DEMOKRATICKÁ UNIE - ČESKOSLOVENSKÁ STRANA LIDOVÁ A NESTRANÍCI	KDU-ČSL A NESTRANÍCI		2	001,080	3799	37.31	6
6203	583839	Říčany	1	4	47	47	Komunistická strana Čech a Moravy	Komunistická str.Čech a Moravy	KSČM	1	047	1208	11.86	1
6203	583839	Říčany	1	5	901	90	"Sdružení nezávislých kandidátů ""Občanů Říčan"""	"SNK ""Občanů Říčan"""	SNK	1	080	614	8.71	0