OKRES	KODZASTUP	NAZEVZAST	COBVODU	POR_STR_HL	OSTRANA	VSTRANA	NAZEVCELK	ZKRATKAO30	ZKRATKAO8	POCSTR_SLO	SLOZENI	HLASY_STR	PROCHLSTR	MAND_STR
2101	599361	Strojetice	1	1	805	80	Vladimír Toman, nezávislý kandidát	Vladimír Toman, NK	NK	1	080	36	118.86	1
2101	599361	Strojetice	1	2	804	80	Josef Holada, nezávislý kandidát	Josef Holada, NK	NK	1	080	45	148.58	1
2101	599361	Strojetice	1	3	801	80	Lukáš Vaňáč, nezávislý kandidát	Lukáš Vaňáč, NK	NK	1	080	19	62.73	1
2101	599361	Strojetice	1	4	803	80	Daniel Humeš, nezávislý kandidát	Daniel Humeš, NK	NK	1	080	22	72.64	1
2101	599361	Strojetice	1	5	806	80	Roman Málek, nezávislý kandidát	Roman Málek, NK	NK	1	080	29	95.75	1
2101	599361	Strojetice	1	6	807	80	Pavel Málek, nezávislý kandidát	Pavel Málek, NK	NK	1	080	34	112.26	1
2101	599361	Strojetice	1	7	802	80	Petr Jakl, nezávislý kandidát	Petr Jakl, NK	NK	1	080	27	89.15	1