OKRES	KODZASTUP	NAZEVZAST	COBVODU	POR_STR_HL	OSTRANA	VSTRANA	NAZEVCELK	ZKRATKAO30	ZKRATKAO8	POCSTR_SLO	SLOZENI	HLASY_STR	PROCHLSTR	MAND_STR
6103	509418	Bořetín	1	1	803	80	Pavel Lukš, nezávislý kandidát	Pavel Lukš, NK	NK	1	080	38	111.11	1
6103	509418	Bořetín	1	2	801	80	Jakub Trčka, nezávislý kandidát	Jakub Trčka, NK	NK	1	080	34	99.41	1
6103	509418	Bořetín	1	3	805	80	Karel Uhlík, nezávislý kandidát	Karel Uhlík, NK	NK	1	080	27	78.94	1
6103	509418	Bořetín	1	4	804	80	Iveta Koukalová, nezávislý kandidát	Iveta Koukalová, NK	NK	1	080	36	105.26	1
6103	509418	Bořetín	1	5	802	80	Stanislav Koukal, nezávislý kandidát	Stanislav Koukal, NK	NK	1	080	36	105.26	1