OKRES	KODZASTUP	NAZEVZAST	COBVODU	POR_STR_HL	OSTRANA	VSTRANA	NAZEVCELK	ZKRATKAO30	ZKRATKAO8	POCSTR_SLO	SLOZENI	HLASY_STR	PROCHLSTR	MAND_STR
6201	581372	Boskovice	1	1	47	47	Komunistická strana Čech a Moravy	Komunistická str.Čech a Moravy	KSČM	1	047	13097	13.49	4
6201	581372	Boskovice	1	2	449	449	Sdružení SNK Evropští demokraté a Sportovci pro Boskovice	Sdružení SNK ED a Sportovci		2	080,129	11016	11.34	3
6201	581372	Boskovice	1	3	1	1	Křesťanská a demokratická unie - Československá strana lidová	Křesť.demokr.unie-Čs.str.lid.	KDU-ČSL	1	001	14900	15.34	4
6201	581372	Boskovice	1	4	901	90	"Sdružení nezávislých kandidátů  ""PROSPERITA BOSKOVIC"""	"SNK ""PROSPERITA BOSKOVIC"""	SNKPROS	1	080	7404	7.62	2
6201	581372	Boskovice	1	5	53	53	Občanská demokratická strana	Občanská demokratická strana	ODS	1	053	21571	22.22	7
6201	581372	Boskovice	1	6	172	172	NEZÁVISLÍ DEMOKRATÉ (předseda V.Železný)	NEZ.DEMOKRATÉ(předs.V.Železný)	NEZ/DEM	1	172	2404	2.47	0
6201	581372	Boskovice	1	7	158	158	"""Sdružení nestraníků""-Společně pro Boskovice"	"""Sdružení nestraníků"""	SN	1	158	5598	5.76	1
6201	581372	Boskovice	1	8	126	126	Nestraníci pro Moravu-Změna pro Boskovice	Nestraníci pro Moravu	NPM	1	126	6268	6.7	2
6201	581372	Boskovice	1	9	7	7	Česká strana sociálně demokratická	Česká str.sociálně demokrat.	ČSSD	1	007	14816	15.26	4