OKRES	KODZASTUP	NAZEVZAST	COBVODU	POR_STR_HL	OSTRANA	VSTRANA	NAZEVCELK	ZKRATKAO30	ZKRATKAO8	POCSTR_SLO	SLOZENI	HLASY_STR	PROCHLSTR	MAND_STR
7201	589217	Zlobice	1	1	508	508	Republika  pro Zlobice a Bojanovice	Rep. pro Zlobice a Bojanovice		2	080,1002	403	9.71	1
7201	589217	Zlobice	1	2	47	47	Komunistická strana Čech a Moravy	Komunistická str.Čech a Moravy	KSČM	1	047	558	13.45	2
7201	589217	Zlobice	1	3	7	7	Česká strana sociálně demokratická	Česká str.sociálně demokrat.	ČSSD	1	007	508	12.24	2
7201	589217	Zlobice	1	4	902	90	"""Zlobice a Bojanovice společně"""	"""Zlobice a Bojanovice spol."""	SNK	1	080	1229	29.63	5
7201	589217	Zlobice	1	5	901	90	NEZÁVISLÍ - sdružení nezávislých kandidátů	NEZÁVISLÍ - sdruž.nez.kand.	SNK	1	080	1449	34.94	5