OKRES	KODZASTUP	NAZEVZAST	COBVODU	POR_STR_HL	OSTRANA	VSTRANA	NAZEVCELK	ZKRATKAO30	ZKRATKAO8	POCSTR_SLO	SLOZENI	HLASY_STR	PROCHLSTR	MAND_STR
2104	533581	Plaňany	1	1	7	7	Česká strana sociálně demokratická	Česká str.sociálně demokrat.	ČSSD	1	007	323	8.84	0
2104	533581	Plaňany	1	2	901	90	PLAŇANŠTÍ AUTODOPRAVCI	PLAŇANŠTÍ AUTODOPRAVCI	SNK	1	080	368	6.71	0
2104	533581	Plaňany	1	3	167	167	FAIR PLAY - HNPD, Hnutí na podporu dobrovolných hasičů a dalších dobrovolníků	FAIR PLAY - HNPD	HNPD	1	167	2175	39.69	4
2104	533581	Plaňany	1	4	387	387	Sdružení Komunistická strana Čech a Moravy a nezávislí kandidáti	Sdružení KSČM, NK		2	047,080	495	9.03	1
2104	533581	Plaňany	1	5	902	90	Sdružení pro sport a mládež	Sdružení pro sport a mládež	SNK	1	080	957	17.46	2
2104	533581	Plaňany	1	6	470	470	PLAŇAŇÁCI	PLAŇAŇÁCI		2	080,166	1161	21.18	2