OKRES	KODZASTUP	NAZEVZAST	COBVODU	POR_STR_HL	OSTRANA	VSTRANA	NAZEVCELK	ZKRATKAO30	ZKRATKAO8	POCSTR_SLO	SLOZENI	HLASY_STR	PROCHLSTR	MAND_STR
5302	575372	Mikulovice	1	1	801	80	Luboš Linhart, nezávislý kandidát	Luboš Linhart, NK	NK	1	080	81	25.85	0
5302	575372	Mikulovice	1	2	902	90	Sdružení nezávislých kandidátů Mikulovice, Blato pro občany II	SNK Mikulovice,Blato pro ob.II	SNK	1	080	1372	72.97	5
5302	575372	Mikulovice	1	3	802	80	Ing. Miloš Hrubý, nezávislý kandidát	Ing. Miloš Hrubý, NK	NK	1	080	126	40.21	0
5302	575372	Mikulovice	1	4	901	90	Sdružení nezávislých kandidátů Mikulovice, Blato pro občany I.	SNK Mikulovice,Blato pro ob.I.	SNK	1	080	1126	59.89	4
5302	575372	Mikulovice	1	5	803	80	František Dvořák, nezávislý kandidát	František Dvořák, NK	NK	1	080	115	36.7	0