OKRES	KODZASTUP	NAZEVZAST	COBVODU	POR_STR_HL	OSTRANA	VSTRANA	NAZEVCELK	ZKRATKAO30	ZKRATKAO8	POCSTR_SLO	SLOZENI	HLASY_STR	PROCHLSTR	MAND_STR
4102	555398	Nová Role	1	1	112	112	HNUTÍ NEZÁVISLÝCH ZA HARMONICKÝ ROZVOJ OBCÍ A MĚST	HN.ZA HARM.ROZVOJ OBCÍ A MĚST	HNHRM	1	112	2648	11.36	2
4102	555398	Nová Role	1	2	7	7	Česká strana sociálně demokratická	Česká str.sociálně demokrat.	ČSSD	1	007	1491	6.39	1
4102	555398	Nová Role	1	3	470	470	VOLBA PRO NOVOU ROLI, MEZIROLÍ, JIMLÍKOV - ZA OBCE KRÁSNĚJŠÍ	VOLBA PRO N.R.,M.,J.-ZA O. KR.		2	080,166	7693	33.01	6
4102	555398	Nová Role	1	4	389	389	ODS a nezávislí Nová Role	ODS a nezávislí Nová Role		2	053,080	3860	16.56	3
4102	555398	Nová Role	1	5	47	47	Komunistická strana Čech a Moravy	Komunistická str.Čech a Moravy	KSČM	1	047	860	3.69	0
4102	555398	Nová Role	1	6	768	768	ANO 2011	ANO 2011	ANO	1	768	3519	15.1	2
4102	555398	Nová Role	1	7	902	90	Sdružení nezávislých kandidátů Nová Role - Mezirolí	SNK Nová Role - Mezirolí	SNK	1	080	2166	9.29	1
4102	555398	Nová Role	1	8	901	90	Sdružení nezávislých kandidátů Naše Mezirolí	SNK Naše Mezirolí	SNK	1	080	1064	4.56	0